question,answer,question_type,filename
"What are the different age groups that make up the target population for MCH care, and what percentage of the total population do they constitute, according to the given context?","{'age_groups': ['15 - 49 years', 'under 15', 'under 5', 'under 3', 'infants'], 'percentage': ['21%', '4.5%', '47%', '18%', '12%', '4%']}",multi-hop reasoning,Maternal_Child_Healthcare.pdf
"Considering the high prevalence of FGM in certain regions, such as Somalia, Egypt, Sudan, Uganda, Congo, and Ethiopia, and the fact that it is a gross violation of human rights, how can we effectively reduce the practice of FGM and ensure that women have access to modern health services, such as regular access to modern health services, adequate management of complications of pregnancy, and prevention of maternal illness and death, while also addressing the underlying social and cultural factors that contribute to the practice of FGM?","To effectively reduce the practice of FGM and ensure that women have access to modern health services, a multi-faceted approach is necessary. This can include education and awareness campaigns to address the underlying social and cultural factors that contribute to the practice of FGM, as well as providing alternative rites of passage that do not involve FGM. Additionally, providing access to family planning, antenatal care, and skilled obstetrical care can help reduce the risk of complications during pregnancy and childbirth. It is also important to engage with community leaders and religious leaders to advocate for the abandonment of FGM and to provide support to women who have undergone FGM. Furthermore, laws and policies that prohibit FGM and protect the rights of women and girls can also be implemented. Moreover, providing economic and social empowerment opportunities to women can also help in reducing the practice of FGM. Finally, it's important to monitor and evaluate the progress towards the elimination of FGM and adjust the strategies accordingly.",multi-hop reasoning,Maternal_Child_Healthcare.pdf
"What are the factors that contribute to the high prevalence of FGM in certain African countries, and how can family planning services and education help reduce the incidence of FGM and unwanted pregnancies, thereby reducing abortion-related morbidity and mortality, especially among adolescents and single women, given the cultural and socio-economic risk factors that limit access to contraception and information, and what are the strategies that can be employed to combat these challenges?","The high prevalence of FGM in certain African countries can be attributed to cultural and religious beliefs, socio-economic factors, and lack of access to relevant information and contraception. To address these challenges, family planning services and education can play a crucial role in reducing the incidence of FGM and unwanted pregnancies. Strategies such as improving access to contraception, providing education and counseling, and changing abortion laws can help combat the challenges. Additionally, addressing cultural and socio-economic risk factors, such as myths and taboos surrounding contraception, and providing support for high-risk groups, such as adolescents and single women, can also help reduce abortion-related morbidity and mortality.",multi-hop reasoning,Maternal_Child_Healthcare.pdf
"Considering the high prevalence of FGM in Somalia, Egypt, Sudan, Uganda, Congo, and Ethiopia, and the fact that it is a gross violation of human rights, how can the reduction of FGM be made a top priority of policy, and what are the problems associated with FGM that need to be addressed in order to ensure maternal and child health care?","The reduction of FGM can be made a top priority of policy by implementing effective methods of delivering maternal health services, such as providing access to modern health services, skilled obstetrical care, and adequate management of complications during pregnancy. The problems associated with FGM that need to be addressed include pain, emotional scars, rejection for marriage, infection, haemorrhage, acute anaemia, retention of urine, injury to urethra, anus, rectum and vaginal wall, chronic pelvic sepsis leading to infertility, mutilation during marriage, and obstructed labour. Additionally, addressing the underlying cultural and societal factors that contribute to the practice of FGM is crucial in reducing its prevalence and ensuring maternal and child health care.",multi-hop reasoning,Maternal_Child_Healthcare.pdf
"What are the factors that contribute to the effectiveness of family planning programs, and how can they be addressed in a way that ensures accessibility, acceptability, and sustainability, while also considering the varying needs of different populations and the potential risks and benefits of different contraceptive methods?","Factors that contribute to the effectiveness of family planning programs include access to services, provision of services in both public and private health facilities and through community-based distribution networks, contraceptive diversity, counseling by trained healthcare providers, strategic management, collaboration with the private sector, and effective information, education, and communication. To ensure accessibility, acceptability, and sustainability, family planning programs must consider the varying needs of different populations and the potential risks and benefits of different contraceptive methods. This can be achieved through careful counseling of users by family planning providers, education and awareness campaigns, and collaboration with community-based organizations and healthcare providers. Additionally, it is important to ensure that contraceptive methods are available and accessible to all, including vulnerable populations, and that they are provided with appropriate training and support to effectively use these methods.",multi-hop reasoning,Maternal_Child_Healthcare.pdf
"What are the factors that contribute to unsafe abortion, and how do they relate to the leading causes of maternal mortality, and how does the legal status of abortion impact access to safe abortion care, and what are the differences in access to safe abortion care between developed and developing countries, and how does the lack of access to contraception and reproductive health information contribute to the high rates of unsafe abortion in developing countries?","Unsafe abortion is a major public health problem in developing countries, where 250 times more women die due to unsafe abortion compared to developed countries. The leading causes of maternal mortality are hemorrhage, infection, unsafe abortion, and eclampsia. Unsafe abortion can be caused by demographic risk factors such as young age, high parity, and lack of access to contraception and reproductive health information. In many developing countries, young boys and girls have less access to relevant information about reproductive health, and less or no access to contraception, leading to high rates of unsafe abortion. The legal status of abortion also impacts access to safe abortion care, with 25% of the world population living in countries where induced abortion is prohibited except to save the life of the pregnant woman or without explicit exception. In contrast, 40% of the world population lives in countries where induced abortion is permitted on request of the woman, with many countries having gestational age limits. Elective abortion care has significant differences among countries, with some countries considering socio-medical factors or adverse social conditions as indicators for induced abortion. In developed countries, access to safe abortion care is more readily available, while in developing countries, lack of access to safe abortion care is a major problem, leading to high rates of unsafe abortion.",multi-hop reasoning,Maternal_Child_Healthcare.pdf
"How can trained birth attendants in developing countries effectively prevent and manage postpartum sepsis and other maternal infections, given the prevalence of preventable predisposing factors, the high risk of infection during childbirth, and the importance of early detection and timely use of antibiotics?","Trained birth attendants in developing countries can effectively prevent and manage postpartum sepsis and other maternal infections by following proper hygiene practices, minimizing interventions during delivery, providing 'clean delivery' kits, referring women with pre-term prolonged rupture of membranes or prolonged labor to a referral-level facility, using prophylactic antibiotics, transferring women with prolonged labor to a referral-level facility, evacuating retained placental fragments promptly, educating women and their families to recognize early signs of sepsis and seek medical care, and scheduling timely postpartum visits. Additionally, addressing predisposing factors such as anemia, malaria, goiter, and malnutrition through proper antenatal care and management during delivery can also help reduce the risk of infection.",multi-hop reasoning,Maternal_Child_Healthcare.pdf
"What are the possible consequences of untreated pre-eclampsia, and how can they be prevented or managed in resource-poor settings with limited access to healthcare services?","Untreated pre-eclampsia can lead to serious complications, including eclampsia, which is characterized by very high blood pressure, convulsions, and possible cerebral hemorrhage. Eclampsia can result in fatalities for both the mother and the baby. Preventing and managing pre-eclampsia and eclampsia in resource-poor settings requires community education to improve knowledge of the danger signs, training of healthcare providers to take accurate blood pressure measurements and interpret results, and the use of urine dipsticks to screen for protein in the urine. It also requires a continuum of services from prenatal care through routine and emergency care around the time of delivery, as well as expedited delivery, to prevent fatalities.",multi-hop reasoning,Maternal_Child_Healthcare.pdf
"What are the factors that contribute to the high maternal mortality ratio in developing countries, and how does it impact the health and socio-economic well-being of mothers, children, families, and communities? What measures can be taken to address these issues and reduce the maternal mortality ratio in these regions?","The high maternal mortality ratio in developing countries is attributed to various factors, including poverty, lack of access to healthcare services, poor nutrition, gender discrimination, and unsafe abortions. These factors not only endanger the life of the mother but also have a significant impact on the health and well-being of children, families, and communities. To address these issues, measures such as improving access to healthcare services, promoting gender equality, and investing in nutrition and family planning programs can be taken. Additionally, educating communities about the importance of maternal health and the danger signs during pregnancy and childbirth can help reduce the maternal mortality ratio in these regions.",multi-hop reasoning,Maternal_Child_Healthcare.pdf
"What organization collaborated with the Ethiopian Public Health Initiative to help the author prepare the lecture notes, and what was the funding source for the project?","The Carter Centre collaborated with the Ethiopian Public Health Initiative to help the author prepare the lecture notes, and the project was funded under USAID Cooperative Agreement No. 663-A-00-00-0358-00.",multi-hop reasoning,Maternal_Child_Healthcare.pdf
"What are the limitations of the permission granted for printing or photocopying the lecture notes, and what are the consequences of violating these limitations?","The permission granted for printing or photocopying the lecture notes is limited to educational, not-for-profit use by health care workers, students, or faculty. This means that the material cannot be sold or distributed on a commercial basis, and any copies made must retain all author credits and copyright notices included in the original document. Violating these limitations could result in copyright infringement, which may lead to legal consequences such as fines, damages, or criminal charges.",multi-hop reasoning,Maternal_Child_Healthcare.pdf
"What are the topics that the lecture note emphasizes for health officers, public health nursing, clinical nursing, and midwifery students, excluding topics focused on diploma programs, and how did the author prioritize the selection of topics considering the limited time allocated for the course and the importance of the topics for future practice?","The lecture note emphasizes topics such as MMR, PNM, abortion, family planning, ANC, anemia for health officers, public health nursing, clinical nursing, and midwifery students. The author prioritized the selection of topics by considering the time allocated for the course, which is only 2 credit hours, and the importance of the topics for future practice. The author also gave less emphasis on topics focused on diploma programs and selected issues that are not given much emphasis in Gyn-Obs and pediatric attachments in relation to MCH care.",multi-hop reasoning,Maternal_Child_Healthcare.pdf
"How can maternal sepsis be prevented in low-resource settings where access to clean water and sanitation is limited, and poverty is prevalent?","To prevent maternal sepsis in low-resource settings, it is crucial to improve access to clean water and sanitation, promote proper hygiene practices, and provide adequate training to birth attendants and community health workers. This can be achieved through initiatives such as installing boreholes and latrines, providing soap, disinfectants, and sterile razor blades, and educating women and their families about the importance of clean delivery practices. Additionally, implementing programs that address poverty and malnutrition can help reduce the risk of maternal sepsis. Furthermore, scheduling timely postpartum visits and ensuring early detection and timely use of antibiotics for postpartum sepsis can also help reduce the risk of mortality or long-term sequelae.",multi-hop reasoning,Maternal_Child_Healthcare.pdf
"What is the name of the organization that Mesfin Addisse collaborated with to produce the lecture notes, and what is the name of the project that funded the production of the notes?","The organization that Mesfin Addisse collaborated with to produce the lecture notes is the Ethiopia Public Health Training Initiative, The Carter Center, the Ethiopia Ministry of Health, and the Ethiopia Ministry of Education. The project that funded the production of the notes is the USAID Cooperative Agreement No. 663-A-00-00-0358-00.",multi-hop reasoning,Maternal_Child_Healthcare.pdf
"What are the possible interventions that can be implemented to reduce the risk of obstructed labour in developing countries, considering the challenges of poverty, poor healthcare, and lack of access to timely operative deliveries, and how can health workers in antenatal clinics play a role in preventing and managing obstructed labour?","To reduce the risk of obstructed labour in developing countries, health workers in antenatal clinics can play a crucial role in early detection and referral of women who are at risk of prolonged or obstructed labour. They can use tools such as the partograph to monitor the progress of labour and identify cases that require prompt intervention. Additionally, promoting health education and awareness about the importance of timely prenatal care, abstinence before marriage, and faithfulness to one partner can help prevent teenage pregnancy, which is a significant risk factor for obstructed labour. Furthermore, addressing poverty and improving access to healthcare services, including operative deliveries and emergency obstetric care, is essential in reducing maternal and fetal mortality due to obstructed labour. This can be achieved through increased investment in health infrastructure, training of healthcare providers, and implementation of sound policies at the national level.",multi-hop reasoning,Maternal_Child_Healthcare.pdf
"Considering the factors that affect the selection of contraceptive methods, such as effectiveness, acceptability, interference with sexual activity, availability, side effects, and reversibility, and the importance of counseling and access to services, how does the use of barrier methods compare to other contraceptive methods in terms of their benefits and risks, and what are the implications for family planning programs?","Barrier methods, while not as effective as other methods in preventing pregnancy, provide an important non-contraceptive benefit by protecting against HIV infection and sexually transmitted diseases. The use of barrier methods compared to other contraceptive methods depends on various factors such as individual circumstances, medical condition, and lifestyle. For example, the IUD is associated with pelvic inflammatory disease, mainly in women who are at risk of developing sexually transmitted diseases. In contrast, hormonal methods like the pill have a higher risk of side effects such as blood clots and stroke. The benefits and risks of each method must be carefully weighed, and counseling by family planning providers can help reduce the risks. Family planning programs should provide a range of methods to meet varying family planning needs throughout the life cycle and for both women and men, and access to services should be available in both public and private health facilities and through community-based distribution networks. Effective information, education, and communication are also essential to increase contraceptive prevalence and improve maternal and child health outcomes.",multi-hop reasoning,Maternal_Child_Healthcare.pdf
"What are the names of the members of the Department of Community Health, GCMS, who reviewed the lecture notes and provided feedback, and what were their roles in the department?","[{'name': 'Mesfin Addisse', 'role': 'Lecturer and Coordinator of the Maternal and Child Health course'}, {'name': 'Tesfaye Tadesse', 'role': 'Senior Lecturer and Head of the Department of Community Health'}, {'name': 'Aster Tesfaye', 'role': 'Lecturer and Coordinator of the Maternal and Child Health course'}, {'name': 'Yonas Tadesse', 'role': 'Lecturer and Coordinator of the Maternal and Child Health course'}]",multi-hop reasoning,Maternal_Child_Healthcare.pdf
"What are the factors that contribute to the disparity in maternal mortality rates between developing and industrial countries, and how does poverty play a role in this disparity?","The disparity in maternal mortality rates between developing and industrial countries can be attributed to several factors, including poverty, lack of access to healthcare, poor nutrition, gender discrimination, and poor health infrastructure. Poverty plays a significant role in this disparity as it limits access to healthcare services, skilled birth attendants, and emergency obstetric care, which are crucial in preventing maternal deaths. Additionally, poverty can lead to malnutrition, which increases the risk of complications during pregnancy and childbirth. Furthermore, gender discrimination in some societies can limit women's access to healthcare, leading to higher maternal mortality rates. The lack of health infrastructure in developing countries, such as adequate hospitals, clinics, and trained healthcare providers, also contributes to the high maternal mortality rates. All these factors are interconnected and exacerbate the impact of poverty on maternal health, resulting in a higher maternal mortality rate in developing countries.",multi-hop reasoning,Maternal_Child_Healthcare.pdf
"Who are the individuals or groups that the author of the text would like to extend their gratitude to for their contributions to the development of the Maternal and Child Health Care services, and what are the specific contributions that these individuals or groups made, according to the text?","The author of the text would like to extend their gratitude to Ms. Carla Gale, the resident Technical Adviser for the Carter Center, and Ato Aklilu Mulugeta for facilitating the helping hand in the development of the Maternal and Child Health Care services. Additionally, the author would like to thank members of the Department of Community Health, GC MS, for reviewing the note and providing valuable and constructive comments.",multi-hop reasoning,Maternal_Child_Healthcare.pdf
"What are the limitations of the lecture notes in addressing certain topics related to maternal and child health care, and what are the implications of these limitations for health care workers, students, or faculty in Ethiopia?","The lecture notes, while intended for health care workers, students, or faculty, have limitations in addressing certain topics related to maternal and child health care, such as child abuse, sexual violence, and disability. These limitations are due to the time constraints of the course and the focus on selected topics such as MMR, PNM, abortion, family planning, and anemia. The implications of these limitations are that health care workers, students, or faculty in Ethiopia may not have access to comprehensive information on all aspects of maternal and child health care, which could impact the quality of care they provide to patients.",multi-hop reasoning,Maternal_Child_Healthcare.pdf
"Considering the importance of MCH care and the factors that affect the health of mothers and children, how can the objectives of the MCH programs be achieved through the promotion of community participation and involvement, manpower training and research, and seeking resources from the government and non-governmental organizations, while addressing the major causes of maternal mortality and preventable problems, and ensuring access to modern health care services and education for women in developing countries like Ethiopia?","The objectives of the MCH programs can be achieved by first understanding the importance and role of MCH care and the factors that affect the health of mothers and children. This can be done through in-service training capability and implementing a training program to develop and upgrade the skills and knowledge of health workers. Additionally, promoting community participation and involvement as an essential component of the MCH program can be done by engaging the participation of agricultural extension workers and the Ethiopian Nutrition Institute in the promotion of the production and utilization of supplementary feeding mixes. Seeking resources from the government and non-governmental organizations can help expand services and improve access to modern health care services and education for women in developing countries like Ethiopia. Addressing the major causes of maternal mortality and preventable problems such as poor sanitary environment, poor housing, unsafe and inadequate water, adverse social and physical environment, and lack of access to health services can also be achieved through community participation and involvement, manpower training and research, and seeking resources. By addressing these factors and improving access to health care services and education, the objectives of the MCH programs can be achieved.",multi-hop reasoning,Maternal_Child_Healthcare.pdf
"Considering the socio-economic development of a country, poor agricultural development, poor sanitary environment, poor housing, unsafe and inadequate water, adverse social and physical environment, lack of access to modern health care services, and poor education of women, how can MCH care help to improve the health and well-being of mothers and children in developing countries like Ethiopia, and what are the potential challenges in implementing MCH care programs in such contexts?","MCH care can help improve the health and well-being of mothers and children in developing countries like Ethiopia by providing access to essential health services, such as antenatal care, skilled birth attendance, and postnatal care, which can help reduce maternal and infant mortality rates. Additionally, MCH care can provide nutrition education and support to mothers, helping to address malnutrition and stunting, which are prevalent in many developing countries. However, implementing MCH care programs in such contexts can be challenging due to factors such as limited access to healthcare services, lack of trained healthcare workers, cultural barriers, and limited resources. Addressing these challenges requires a comprehensive approach that includes increasing access to healthcare services, improving education and training for healthcare workers, promoting community engagement and participation, and mobilizing resources from government and non-governmental organizations.",multi-hop reasoning,Maternal_Child_Healthcare.pdf
