question,answer,question_type,filename
"What are the factors that contribute to the high maternal mortality ratio in Sub-Saharan Africa and South Asia, and how does it impact the health and well-being of women?","The factors that contribute to the high maternal mortality ratio in Sub-Saharan Africa and South Asia include lack of access to education, poor access to healthcare, low social status of women, and political commitment. These factors lead to a high number of maternal deaths, which impacts the health and well-being of women in these regions. The magnitude of maternal deaths in these regions is very high, with material mortality ratios (maternal deaths per 100,000 live births) may be as much as 200 times higher than those in industrial countries.",conditional,Maternal_Child_Healthcare.pdf
"What are the predisposing factors for ante partum haemorrhage, considering the impact of age, multiple pregnancy, and uterus conditions?","The predisposing factors for ante partum haemorrhage include placenta praevia, common in multiparity, increases with age, scarred uterus, and multiple pregnancy.",conditional,Maternal_Child_Healthcare.pdf
"What is the significance of health education in reducing maternal and child morbidity and mortality, and how can it be integrated into MCH care?","Health education is vital in MCH care as it helps to promote healthy practices and prevent harmful ones, ultimately reducing maternal and child morbidity and mortality. It can be integrated into MCH care through various means such as training health workers, providing educational materials, and engaging with communities to promote behavior change.",conditional,Maternal_Child_Healthcare.pdf
"What are the potential consequences of severe hepatitis during pregnancy, particularly regarding premature labor, liver failure, and severe hemorrhage?","Severe hepatitis during pregnancy can lead to various complications, including premature labor, liver failure, and severe hemorrhage, which can have serious consequences for both the mother and the baby.",conditional,Maternal_Child_Healthcare.pdf
"What are the problems that women with VVF encounter, and how do they affect their social and personal lives?","Women with VVF encounter various problems, including social ostracism, rejection by their husbands, self-loathing, and serious health complications such as urinary tract infections, kidney damage, and reproductive organ damage. These problems can significantly impact their quality of life and make it difficult for them to lead a normal life.",conditional,Maternal_Child_Healthcare.pdf
"What factors increase the risk of puerperal sepsis, which can be fatal if not detected and treated promptly, besides prolonged labor and use of unclean instruments?","The risk of puerperal sepsis is increased by factors such as delivering at home with poor sterile procedures, untrained assistance during delivery, multiple vaginal examinations, prolonged labor, prolonged rupture of membranes, use of instruments during delivery, trauma, caesarean section in case of a ruptured uterus, pre-existing genital or reproductive tract infections.",conditional,Maternal_Child_Healthcare.pdf
"What is the most popular method of contraception in China, considering the regional variations and factors affecting method acceptance?","The most popular method of contraception in China is the IUD, although there are regional variations in method acceptance, with the pill being popular in Northern Africa and female sterilization in Latin America. Factors such as effectiveness, acceptability, interference with sexual activity, availability, side effects, and reversibility play a role in method selection, and couples must choose the method that best suits them.",conditional,Maternal_Child_Healthcare.pdf
"How does contraceptive use affect maternal mortality ratio considering the risks of pregnancy, childbirth, and unsafe abortion?","Increasing contraceptive prevalence could, in theory, lead to an increase in the maternal mortality ratio, even though the maternal mortality rate and lifetime risk of maternal mortality decline, as first births, which are riskier, will increase as a proportion of all births.",conditional,Maternal_Child_Healthcare.pdf
What role can agricultural extension workers play in addressing malnutrition among mothers and children through the promotion of supplementary feeding mixes?,"Agricultural extension workers can play a crucial role in promoting the production and utilization of supplementary feeding mixes, which can help to address malnutrition among mothers and children.",conditional,Maternal_Child_Healthcare.pdf
"What factors contribute to the high maternal mortality rate in developing countries, and how does it impact women's health and well-being?","The high maternal mortality rate in developing countries is attributed to various factors, including lack of access to education, family planning, and healthcare services, as well as low social status of women, political commitment, and access to income and resources. This not only leads to preventable deaths but also results in acute and chronic illnesses during pregnancy, delivery, and postpartum period, severely impacting women's health and well-being.",conditional,Maternal_Child_Healthcare.pdf
What is the significance of social marketing in expanding access to family planning services and reducing maternal and infant mortality?,"Social marketing plays a crucial role in promoting family planning services, increasing awareness of their benefits, and reducing maternal and infant mortality by improving access to contraceptives and family planning education, thereby empowering individuals to make informed choices about their reproductive health.",conditional,Maternal_Child_Healthcare.pdf
"What are the objectives of WHO in relation to MCH care, considering the interventions available, cultural attitudes and practices, and the impact on the health of mothers, children, families, communities, and the country as a whole?","The objectives of WHO in relation to MCH care are to reduce maternal morbidity and mortality due to pregnancy and childbirth, reduce morbidity and mortality due to unsafe abortion, reduce perinatal and neonatal morbidity and mortality, promote reproductive health awareness for young children, increase knowledge of reproductive biology and promote responsible behavior of adolescents regarding contraception, safe sex, and prevention of sexually transmitted infections, reduce the levels of unwanted pregnancies in all women of reproductive age, reduce the incidence and prevalence of sexually transmitted infections, reduce the incidence and prevalence of cervical cancer, reduce female genital mutilation, and reduce domestic and sexual violence and ensure proper management of the victims.",conditional,Maternal_Child_Healthcare.pdf
"What are the potential risks associated with anemia during pregnancy, especially in regions where malaria is prevalent?","Anemia during pregnancy can lead to severe anemia, congestive heart failure, and haemorrhage, and the risk is higher in areas where malaria is common.",conditional,Maternal_Child_Healthcare.pdf
"What are the socio-economic and environmental factors that affect the health of mothers and children, and how do they impact maternal mortality and child health?","The socio-economic and environmental factors that affect the health of mothers and children include poor sanitation, poor housing, unsafe water, poor agricultural development, lack of access to health services, lack of education, and poor nutrition. These factors can increase maternal mortality and child mortality, as well as lead to malnutrition, stunted growth, and increased risk of infection and haemorrhage. Additionally, lack of access to modern healthcare services and poor education of women can further exacerbate these issues.",conditional,Maternal_Child_Healthcare.pdf
What dual purpose do plant roots serve concerning soil nutrients and stability?,"Plant roots serve a dual purpose by absorbing water and nutrients from the soil, which is vital for the plant's growth, and providing stability by anchoring the plant in the ground.",conditional,Maternal_Child_Healthcare.pdf
What are the reasons why maternal and child health care is important?,"Maternal and child health care is important because it helps to reduce maternal and infant mortality rates, prevent complications during pregnancy and childbirth, and ensure that children have a healthy start in life. Additionally, good maternal and child health care can help to prevent the transmission of diseases such as HIV from mother to child, and can also help to promote gender equality by empowering women to make informed decisions about their reproductive health.",conditional,Maternal_Child_Healthcare.pdf
"What are the factors that contribute to the high maternal mortality rate in developing countries, and how does it impact the health and well-being of mothers, children, and communities?","The high maternal mortality rate in developing countries is attributed to various factors, including socio-economic development, poor agricultural development, poor sanitation and housing, lack of access to health services, and poor education. These factors not only result in maternal deaths but also have a broader impact on the health and well-being of mothers, children, and communities. For instance, malnourished women are more likely to have obstructed labor, and lack of access to modern healthcare services increases the risk of infection and haemorrhage. Moreover, poor education of women denies them the role they can play in decision-making, which further exacerbates the problem. Therefore, addressing these factors is crucial to reducing maternal mortality and improving the overall health and well-being of mothers, children, and communities in developing countries.",conditional,Maternal_Child_Healthcare.pdf
"What is the most preferred method of preventing unplanned pregnancies globally, and how does it compare regionally?","Female sterilization is the most common method of contraception worldwide, accounting for approximately half of all contraceptive use. However, there are regional variations in method acceptance, with the IUD being the most popular in China, the pill in Northern Africa, and female sterilization in Latin America. Additionally, traditional methods still account for over 10% of users.",conditional,Maternal_Child_Healthcare.pdf
"What role does community education play in preventing eclampsia, a condition that can lead to serious health complications and even death, particularly among young and primipara women in rural areas with limited access to healthcare services?","Community education can play a vital role in preventing eclampsia by improving knowledge of the danger signs of severe pre-eclampsia and the importance of seeking immediate medical care in case of convulsions. This can help reduce the risk of eclampsia, which can prognoses to eclampsia, the severe form",conditional,Maternal_Child_Healthcare.pdf
"What proportion of the population consists of mothers and children, and what are the justifications for prioritizing their healthcare?","Mothers and children make up over 2/3 of the population. Women in reproductive age (15 – 49) constitute 21%, pregnant women, 4.5%, children under 5, 47%, children under 3, 18%, and infants, 4%. The justifications for prioritizing their healthcare include high maternal mortality rates, poor prenatal care, risks associated with unwanted pregnancies, impact on women's productivity and socio-economic development, prevalence of infectious diseases, nutritional problems, and the association between maternal complications and perinatal deaths.",conditional,Maternal_Child_Healthcare.pdf
"What measures can be taken to combat AIDS in developing countries, considering the current state of poverty, healthcare, and cultural issues?","Increased understanding of the magnitude of the epidemic and its local and global dimensions, promotion of action and sound policy at a national level, health education, and addressing specific problems such as religious and cultural issues.",conditional,Maternal_Child_Healthcare.pdf
What's the global toll of pregnancy-related deaths among women annually?,"An estimated 500,000 women die each year due to pregnancy-related complications worldwide.",compress,Maternal_Child_Healthcare.pdf
How can FPC be made accessible in resource-poor settings?,Family planning choices can be made available in a resource-poor setting by provision of basic non-clinical contraceptives that require minimal skill and can be handled by community-based providers with appropriate training.,compress,Maternal_Child_Healthcare.pdf
What are the risks associated with abortion?,"Women seek abortion when pregnancy occurs in circumstances such as severe hardship, insufficient income, or intense socio-economic deprivation. Culture and religion can also prevent using contraception or value fertility.",compress,Maternal_Child_Healthcare.pdf
What's the link between mom's death and newborns'?,Maternal mortality is related to the health and deaths of seven million newborns who die annually as a result of material health problems.,compress,Maternal_Child_Healthcare.pdf
What are the psychological and social issues that can arise from an unplanned pregnancy?,"Unwanted pregnancy can cause rejection of the infant, baby battering, baby dumping, and infanticide.",compress,Maternal_Child_Healthcare.pdf
What's the connection between gender bias and maternal deaths?,Gender discrimination can affect access to health services and increase the risk of maternal mortality.,compress,Maternal_Child_Healthcare.pdf
What's the point of family life education during abortion procedures?,"To increase control over their reproductive role, especially for adolescents, married women, and single mothers.",compress,Maternal_Child_Healthcare.pdf
What's the impact of social & medical factors on abortion?,"Socio-medical factors, such as a threat to the woman's health or foetal conditions, can justify termination of pregnancy in some countries, while in others, induced abortion is prohibited except to save the life of the pregnant woman or without explicit exception.",compress,Maternal_Child_Healthcare.pdf
"What services does the MCH program in Ethiopia offer, according to the text?","Some of the services provided under the MCH program in Ethiopia include family planning services, antenatal care service, delivery care service, postnatal care service, and school health services.",compress,Maternal_Child_Healthcare.pdf
What's causing the delay in labour?,"Cephalo-pelvic disproportion, abnormal lie, and problems due to the mother, the presenting part, or the foetus.",compress,Maternal_Child_Healthcare.pdf
What's the significance of community involvement in MCH programs?,"Community participation is essential in MCH activities because it helps to increase awareness and promote behavior change, and it also helps to ensure that MCH services are tailored to the specific needs of the community.",compress,Maternal_Child_Healthcare.pdf
What's the effect of malaria on pregnancy?,"Malaria during pregnancy can cause severe anemia, spontaneous abortion, preterm labor, stillbirth, and low birth weight.",compress,Maternal_Child_Healthcare.pdf
What's the extent of repairs at the Ethiopian Fistula hospital?,"The Fistula hospital in Ethiopia has done 15,000 repairs in about 25 years.",compress,Maternal_Child_Healthcare.pdf
What's the private sector's part in family planning?,The private sector can be an effective means of reaching many more people with family planning services and information.,compress,Maternal_Child_Healthcare.pdf
What predisposes abruptio placenta?,"The predisposing factors for abruptio placenta include common in patients with hypertension, trauma, injuries to abdomen, excessively hard work, and emotional trauma.",compress,Maternal_Child_Healthcare.pdf
What's the point of the note for Community Health according to the text?,The purpose of the note that the author took parts of for the Department of Community Health was to provide an overview of maternal and child health care.,compress,Maternal_Child_Healthcare.pdf
What's the extent of FGM in Uganda and Congo?,5-10%,compress,Maternal_Child_Healthcare.pdf
What's the scope of the lecture notes?,"Yes, the author had to limit the topics due to the limited time allocated for the course, so some important topics such as ARI in children, child abuse, sexual violence, etc. are not included in the lecture notes but are supposed to be covered by assignments and group discussion.",compress,Maternal_Child_Healthcare.pdf
What's the top factor in maternal deaths in developing countries?,"Induced abortion is the leading cause of maternal mortality in developing countries, ranging from 15-50%.",compress,Maternal_Child_Healthcare.pdf
What's needed to update abortion laws in developing countries?,"Developing countries, with the exception of China, Cuba, Vietnam, India, and Singapore, have restrictive laws. In Africa, 7 countries permit abortion for reasons other than danger to a mother’s life.",compress,Maternal_Child_Healthcare.pdf
What's the best way to improve MCH services in developing countries?,"MCH services can be expanded in developing countries by seeking resources from governments and non-governmental organizations, developing in-service training capabilities, and promoting community participation and involvement.",compress,Maternal_Child_Healthcare.pdf
"What's FGM, and why does it happen?","Female genital mutilation (FGM) is the practice of removing part or all of the external female genitalia, typically performed as a cultural or religious requirement to ensure chastity until marriage or to initiate a girl into womanhood.",compress,Maternal_Child_Healthcare.pdf
What topics does the table of contents list under maternal health?,"Some of the topics covered in the text related to maternal health include maternal mortality, factors affecting health status of mothers, and maternal health services.",compress,Maternal_Child_Healthcare.pdf
What's the meaning of peri-natal mortality?,"Peri-natal mortality refers to the death of a woman during pregnancy, childbirth, or within 42 days of termination of pregnancy.",compress,Maternal_Child_Healthcare.pdf
Who can get Family Planning Services?,"Any person male or female who can conceive or cause conception, regardless of age or marital status, is eligible for family planning services, including family planning counseling and advice.",compress,Maternal_Child_Healthcare.pdf
How can MCH in Ethiopia be enhanced?,"MCH services can be improved in Ethiopia by providing services at a cost commensurate with the financial, material, and manpower resources of the country, initiating, developing, and coordinating operational and other relevant research in MCH, and engaging the participation of agricultural extension workers and the Ethiopian Nutrition Institute in the promotion of the production and utilization of supplementary feeding mixes.",compress,Maternal_Child_Healthcare.pdf
What's the most common VVF cause?,"The most common cause of VVF is obstructed labor, which is often due to chronic malnutrition or untreated infections in childhood and adolescence, or among women experiencing their first pregnancy at a young age, prior to complete pelvic growth.",compress,Maternal_Child_Healthcare.pdf
How common is FGM in Egypt?,94% (reported in 1998),compress,Maternal_Child_Healthcare.pdf
What's the goal of Ethiopia's MCH program?,"The specific objectives of the MCH program in Ethiopia are to provide primary health care services, extend integrated MCH services into rural areas, prevent malnutrition and infection among mothers and children through education in health and nutrition, promote the use of safe water, sanitation, and immunization, promote supply and effective FP programmes, and initiate, develop, and coordinate operational and other relevant research in MCH.",compress,Maternal_Child_Healthcare.pdf
How prevalent is FGM in Sudan?,80%,compress,Maternal_Child_Healthcare.pdf
What's the role of TTBA & CHWs in maternal health?,"TTBA and CHWs play a crucial role in the delivery of maternal health services, especially in areas where access to modern health services is limited. They provide essential healthcare services, including family planning, ante-natal care, and delivery, and can help prevent and manage complications during pregnancy and childbirth.",compress,Maternal_Child_Healthcare.pdf
How common is FGM in Somalia?,100%,compress,Maternal_Child_Healthcare.pdf
What are the potential complications of a long labour?,"Postpartum haemorrhage, infection, and long-term sequelae such as vesico-vaginal fistula.",compress,Maternal_Child_Healthcare.pdf
What's the deal with MCH in Ethiopia?,"Some of the strategies of the MCH program in Ethiopia include improving access to MCH services, strengthening health systems, and increasing community participation.",compress,Maternal_Child_Healthcare.pdf
What's the distance between Earth and its satellite?,"The maternal mortality rate in Ethiopia is 500-700 per 100,000.",compress,Maternal_Child_Healthcare.pdf
What's the extent of FGM in Ethiopia?,80-90%,compress,Maternal_Child_Healthcare.pdf
What's the biggest threat to moms in developing countries?,"Obstructed labor, which is often caused by FGM.",compress,Maternal_Child_Healthcare.pdf
What's puerperal sepsis?,Puerperal sepsis is a serious problem that occurs following long and complicated deliveries and is rare in uncomplicated spontaneous delivery. It is also common after unsafe abortion.,compress,Maternal_Child_Healthcare.pdf
How does maternal mortality compare in developed and developing countries?,"Maternal mortality shows a greater disparity between developed and non-developed countries than most other health indicators, reflecting the ecology of poverty and the lack of access to essential healthcare services in developing countries.",compress,Maternal_Child_Healthcare.pdf
What's the significance of counseling in planning families?,"Counseling is important in family planning as it helps couples to select the method that is best for them, and it can further reduce the risks associated with contraceptive methods.",compress,Maternal_Child_Healthcare.pdf
"How does the lack of access to adequate healthcare services and trained healthcare providers in rural areas, as well as cultural and societal factors, contribute to the high prevalence of vesico-vaginal fistula (VVF) and hypertensive disorders of pregnancy in sub-Saharan Africa, and what steps can be taken to address these issues?","The lack of access to adequate healthcare services and trained healthcare providers in rural areas, as well as cultural and societal factors, contribute to the high prevalence of vesico-vaginal fistula (VVF) and hypertensive disorders of pregnancy in sub-Saharan Africa. To address these issues, steps can be taken such as providing access to prenatal care, training healthcare providers in the detection and management of hypertensive disorders of pregnancy, and promoting community education and awareness to reduce cultural and societal barriers to seeking care. Additionally, addressing malnutrition and infections in childhood and adolescence, and promoting delayed marriage and first pregnancy can also help reduce the incidence of VVF. Furthermore, providing access to obstetric fistula repair services and supporting women who have suffered from VVF can also help reduce the negative impact of this condition on their lives.",multi-hop reasoning,Maternal_Child_Healthcare.pdf
"What specific topics were emphasized in the lecture notes, and how were they selected, and what was the reason for their selection?","The lecture notes emphasized topics such as MMR, PNM, abortion, family planning, ANC, and anemia, as they were considered very relevant for the future practice of health officers and were not given much emphasis in Gyn-Obs and pediatric attachments in relation to MCH Care. The selection of these topics was also influenced by the limited time allocated for the course, and the author's desire to prioritize issues that were not covered in diploma programs. Additionally, the author took notes from their student days, books, journals, WHO manuals, bulletins, and from colleagues in the Department of Community Health, and also considered assignments and group discussions to cover other important topics such as ARI in children, child abuse, sexual violence, etc.",multi-hop reasoning,Maternal_Child_Healthcare.pdf
"What factors increase the likelihood of unsafe abortion, and how do socio-economic status, lack of access to healthcare, and cultural factors play a role in this issue, particularly among young girls and women in developing countries?","Unsafe abortion is more likely to occur among young girls and women in developing countries due to various factors, including socio-economic status, lack of access to healthcare, and cultural factors. Young girls may be more likely to engage in risky sexual behavior due to a lack of access to contraception and reproductive health information, leading to unintended pregnancies. Unmarried girls, students, and dropouts may also be more likely to experience unsafe abortions due to societal stigma and a lack of support. Additionally, cultural factors may lead to a lack of awareness about safe abortion practices, and lack of access to healthcare may result in women seeking unsafe and illegal abortions. All these factors combined increase the risk of unsafe abortion, which can lead to severe health complications and even death.",multi-hop reasoning,Maternal_Child_Healthcare.pdf
