question,answer,question_type,filename
What is the percentage of women in Ethiopia and other African and Asian countries who have access to family planning services?,Less than 10% of women in Ethiopia and many countries in Africa and Asia have access to family planning services.,simple,Maternal_Child_Healthcare.pdf
What is the importance of prenatal risk screening and early detection and referral of women for whom labour is not progressing at a normal rate?,To prevent maternal mortality and morbidity associated with obstructed labour and prolonged labour.,simple,Maternal_Child_Healthcare.pdf
What is the prevalence of vesico-vaginal fistula (VVF) in sub-Saharan Africa?,The prevalence of vesico-vaginal fistula (VVF) is particularly high in sub-Saharan Africa.,simple,Maternal_Child_Healthcare.pdf
What are some factors that influence women's access to and control of income and resources?,"Women's income, access to household resources, and power to make decisions influence their ability to seek and utilize health services.",simple,Maternal_Child_Healthcare.pdf
What is the leading cause of death among women of reproductive age in most developing countries?,Maternal mortality is the leading cause of death among women of reproductive age in most developing countries.,simple,Maternal_Child_Healthcare.pdf
How does the type of abortion (spontaneous or induced) and the care received determine whether the abortion is safe or unsafe?,"The type of abortion and the care received determine whether the abortion is safe or unsafe, as spontaneous abortion can occur in 10-15% of known or suspected pregnancies, but is less fatal than unsafely induced abortion because mothers tend to seek healthcare institution for spontaneous abortion.",simple,Maternal_Child_Healthcare.pdf
What are some of the barriers to accessing maternal and child healthcare services in developing countries?,"Women often lack access to relevant information, trained providers, and supplies, emergency transport, and other essential services. Cultural attitudes and practices also impede women's use of services that are available.",simple,Maternal_Child_Healthcare.pdf
What are some of the complications associated with childbirth in developing countries?,"Ante partum haemorrhage, eclampsia, and other complications are associated with large numbers of perinatal deaths each year in developing countries, plus considerable suffering and poor growth and development for those infants who survive.",simple,Maternal_Child_Healthcare.pdf
What is the impact of maternal mortality on fetal and perinatal health?,"The large majority of pregnancies that end in a maternal death also result in fetal or perinatal death. Among infants who survive the death of the mother, fewer than 10 percent live beyond their first birthday.",simple,Maternal_Child_Healthcare.pdf
What is the expected major cause of maternal mortality in a few years time?,AIDS,simple,Maternal_Child_Healthcare.pdf
"What is the importance of educating trained birth attendants, women, their families, and community health workers to recognize the early signs of sepsis and seek medical care?","Educating trained birth attendants, women, their families, and community health workers to recognize the early signs of sepsis and seek medical care is important because it can be lifesaving and reduce the risk of mortality or long-term sequelae.",simple,Maternal_Child_Healthcare.pdf
What is the role of prenatal care in reducing maternal and infant mortality?,Prenatal care can help identify potential complications early on and prevent them from becoming life-threatening for both the mother and the baby. It also helps to ensure that women receive appropriate nutrition and health education during pregnancy.,simple,Maternal_Child_Healthcare.pdf
What is the importance of addressing the factors that influence maternal mortality and morbidity?,"It is important to address the factors that influence maternal mortality and morbidity, as women need to be physically, mentally, and socially healthy to fulfill their reproductive duty safely and efficiently and to be a contributing member of their community.",simple,Maternal_Child_Healthcare.pdf
"What is the status of women in many developing countries, and how does it affect their health and well-being?","Women in many developing countries have a low social status, which leads to a greater burden of conjugal, maternal, domestic, and professional responsibilities, exposing them to physically demanding activities that can negatively impact their health.",simple,Maternal_Child_Healthcare.pdf
"What is the importance of MCH care in the welfare of the family, community, and country?","MCH care is important in the welfare of the family, community, and country because it helps to reduce maternal, perinatal, infant, and childhood mortality and morbidity, promotes reproductive health and the physical and psychosocial development of the child and adolescent, and increases knowledge of reproductive biology and responsible behavior of adolescents regarding contraception, safe sex, and prevention of sexually transmitted infections.",simple,Maternal_Child_Healthcare.pdf
What is the magnitude of Acquired Immuno Deficiency Syndrome (AIDS) during pregnancy?,"AIDS is becoming a serious threat during pregnancy, especially in sub-Saharan Africa and other developing countries, with 3 million infected women and a 25-40% chance of passing on HIV in the womb or at birth.",simple,Maternal_Child_Healthcare.pdf
What is the role of early detection and timely use of antibiotics in preventing postpartum sepsis?,Early detection and timely use of antibiotics in preventing postpartum sepsis can be lifesaving and reduce the risk of mortality or long-term sequelae.,simple,Maternal_Child_Healthcare.pdf
What is the magnitude of maternal deaths in developing countries compared to industrial countries?,"In Sub-Saharan Africa and South Asia, the material mortality ratio is 200 times higher than in industrial countries, with one in every 21 women in Africa dying of complications of pregnancy, delivery, or abortion, compared to one in every 10,000 in Northern Europe.",simple,Maternal_Child_Healthcare.pdf
What is the leading cause of maternal mortality in developing countries?,"Maternal mortality is an adverse outcome of many pregnancies, and most pregnant women in developing countries receive insufficient or no prenatal care and deliver without help from appropriately trained healthcare providers.",simple,Maternal_Child_Healthcare.pdf
How can Family Planning Services help in reducing Maternal and Child Mortality?,"Family Planning Services can help in reducing maternal and child mortality by:

1. Preventing maternal mortality by reducing exposure to pregnancy and therefore to risks associated with pregnancy and childbirth in the event of wanted births
2. Preventing pregnancy and abortion when pregnancy is unwanted
3. Reducing too early, too late, too close too many pregnancies
4. Reducing risk of unwanted pregnancies and illicit abortion
5. Improving family welfare
6. Increasing sustainable growth and decreasing dependency ratio.",simple,Maternal_Child_Healthcare.pdf
What is the importance of early detection and timely use of antibiotics for postpartum sepsis?,"Early detection and timely use of antibiotics for postpartum sepsis reduces the risk of mortality or long-term sequelae. Educating trained birth attendants, women, their families, and community health workers to recognize the early signs of sepsis and seek medical care may be lifesaving.",simple,Maternal_Child_Healthcare.pdf
What is the role of Community-Based Distribution Services (CBD) in Family Planning Services?,"Community-Based Distribution Services (CBD) are expected to provide family planning services, including family planning counseling and advice, to rural and urban communities.",simple,Maternal_Child_Healthcare.pdf
What are the consequences of sexually transmitted diseases and pelvic infections during pregnancy?,"Sexually transmitted diseases and pelvic infections during pregnancy can result in tubal scarring leading to infertility, ectopic pregnancy, spontaneous abortion, and congenital anomalies such as blindness and mental retardation.",simple,Maternal_Child_Healthcare.pdf
How does the use of contraceptives affect the risk of death once pregnant?,Contraceptive use has no direct effect on the risk of death once pregnant.,simple,Maternal_Child_Healthcare.pdf
What are the long-term consequences of poor maternal and child health?,"Children whose earliest years are faced by hunger or disease or whose minds are not stimulated by appropriate interaction with adults and their environment will experience grave and negative consequences throughout their lives, and so does society as they would be less contributory members.",simple,Maternal_Child_Healthcare.pdf
How can the referral system be revised and improved in MCH care?,"The referral system in MCH care can be revised and improved by ensuring that health workers are trained to recognize and manage obstetric complications, providing transportation and communication systems to facilitate referral, and establishing a functional referral system that ensures that women are referred to the appropriate level of care.",simple,Maternal_Child_Healthcare.pdf
What is the difference in maternal mortality between developed and developing countries?,"The maternal mortality rate in Western Europe a century ago was less than in most developing countries, including Ethiopia, highlighting the disparity in maternal mortality between developed and developing countries.",simple,Maternal_Child_Healthcare.pdf
What are the major health problems of mothers and children in developing countries?,"The major health problems of mothers and children in developing countries include maternal mortality, infant mortality, malnutrition, and preventable diseases such as malaria and diarrhea.",simple,Maternal_Child_Healthcare.pdf
How can prolonged labour be detected and referred for higher-level care?,Use of the partograph to monitor the progress of labour and cervical assessment on a four-hourly basis.,simple,Maternal_Child_Healthcare.pdf
What is the worst consequence of childbirth vesico-vaginal fistula (VVF)?,Holes that develop between the vagina and urinary tract and/or rectum.,simple,Maternal_Child_Healthcare.pdf
What are the reasons for the high spread of AIDS during pregnancy?,"The high spread of AIDS during pregnancy is due to poverty, poor health care, poor availability of drugs for protection of immunity and increasing survival immunity, crowding, and malnutrition, which further lowers immunity for common diseases like waterborne infections.",simple,Maternal_Child_Healthcare.pdf
How can health workers in antenatal clinics prevent maternal mortality?,"By being alert and monitoring patients, especially young, short-statured primipara women coming from rural areas where health services are scarce.",simple,Maternal_Child_Healthcare.pdf
"What are the two main objectives of Maternal and Child Health Care programs in terms of addressing women's health, children's health, and societal well-being?","The two main objectives of Maternal and Child Health Care programs are to improve the health and well-being of mothers and children, and to promote the long-term health and productivity of society by addressing the root causes of maternal and child mortality and morbidity.",conditional,Maternal_Child_Healthcare.pdf
"What are some of the risks associated with poor maternal health, and how do they affect women's productivity, families' welfare, and socio-economic development?","Poor maternal health hurts women's productivity, their families' welfare, and socio-economic development. Large numbers of women suffer severe chronic illnesses that can be exacerbated by pregnancy and the mother's weakened immune system. Infectious diseases like malaria are more prevalent in pregnant women than in non-pregnant women, and many women suffer pregnancy-related disabilities like uterine prolapse long after delivery due to early marriage and childbearing and high fertility.",conditional,Maternal_Child_Healthcare.pdf
"What is the primary cause of death among reproductive-age women in many developing countries, considering the availability of contraceptives and its effectiveness in preventing pregnancy and mortality?","Abortion is the major cause of death among reproductive-age women in many developing countries, despite the availability of contraceptives, which can prevent unwanted pregnancies and reduce mortality rates. However, the effectiveness of contraceptives in preventing pregnancy and mortality can be impacted by factors such as method choice, accessibility, and proper use.",conditional,Maternal_Child_Healthcare.pdf
What is the significance of promptly removing placental fragments after childbirth in preventing maternal mortality and long-term health issues?,"Promptly removing placental fragments after childbirth is crucial in preventing maternal mortality and long-term health issues because it reduces the risk of infection, which can lead to severe complications and even death. Early detection and timely use of antibiotics can also help prevent postpartum sepsis, which is a leading cause of maternal mortality. Additionally, it helps to prevent other complications such as retained placenta, which can cause severe bleeding, infection, and damage to the uterus, leading to long-term health issues.",conditional,Maternal_Child_Healthcare.pdf
"How is maternal mortality affected by a mother's previous health and nutritional status, and what are the major causes of maternal mortality in developing countries?","The mother's previous health and nutritional status can increase the risk of complications during pregnancy and childbirth, which can affect maternal mortality. The major causes of maternal mortality in developing countries include hemorrhage, infection, hypertensive disorders of pregnancy, obstructed labor, and unsafe abortion.",conditional,Maternal_Child_Healthcare.pdf
What are the common age groups for high-risk groups for complicated abortion?,"Adolescents, supported by many studies in different countries.",conditional,Maternal_Child_Healthcare.pdf
What factors should be considered when selecting contraceptive methods for community-based distribution programs to effectively promote family planning?,"Effective family planning programs consider factors such as method effectiveness, acceptability, availability, side effects, reversibility, and counseling to select appropriate contraceptive methods for community-based distribution. Couples must choose the method that suits them best, and access to services, contraceptive diversity, strategic management, collaboration with the private sector, and effective information, education, and communication are essential for success.",conditional,Maternal_Child_Healthcare.pdf
"What are the potential risks associated with frequent pregnancies regarding maternal and infant health, particularly in developing countries?","Frequent pregnancies increase the risk of maternal and infant death, with a higher likelihood of complications such as hemorrhage, infection, hypertensive disorders, obstructed labor, and unsafe abortion, particularly in developing countries where access to healthcare and nutrition may be limited. According to the World Health Organization, the maternal mortality ratio in developing countries is significantly higher than in industrialized countries, with a lifetime risk of maternal death that is 200 times higher. Adolescent pregnancy and poverty also contribute to the increased risk of maternal and infant mortality.",conditional,Maternal_Child_Healthcare.pdf
"What are the challenges faced by women in accessing MCH services, considering the cultural attitudes and practices that impede women's use of services, lack of access to healthcare services in rural areas, and lack of knowledge about available services?","The challenges faced by women in accessing MCH services include cultural attitudes and practices that impede women's use of services, lack of access to healthcare services in rural areas, and lack of knowledge about available services.",conditional,Maternal_Child_Healthcare.pdf
What is the lifetime risk of maternal death for women in Africa compared to industrial countries?,"The lifetime risk of maternal death for women in Africa is one in 22, compared to one in 1,687 in industrial countries.",conditional,Maternal_Child_Healthcare.pdf
"What are the five primary causes of maternal mortality in developing countries, which account for 99% of maternal deaths, and how do they relate to poverty, gender discrimination, and access to health services?","The five primary causes of maternal mortality in developing countries are haemorrhage, infection, hypertensive disorders of pregnancy, obstructed labor, and abortion. These causes are intertwined with poverty, gender discrimination, and access to health services, as they are often exacerbated by lack of access to proper healthcare, gender inequality, and poverty.",conditional,Maternal_Child_Healthcare.pdf
"What predisposing factors increase the likelihood of postpartum hemorrhage, and how can proper antenatal care, management during delivery, and timely interventions reduce the risk?","Postpartum hemorrhage can be predisposed by atonic uterus, history of previous postpartum hemorrhage, high parity, multiple pregnancy, anemia, prolonged labor, and trauma. Proper antenatal care, management during delivery, and timely interventions such as manual removal of the placenta within an hour of delivery can help reduce the risk of postpartum hemorrhage.",conditional,Maternal_Child_Healthcare.pdf
What is the relationship between socioeconomic status and the incidence of hepatitis A during pregnancy?,"Women of low socioeconomic status (SES) are more susceptible to hepatitis A during pregnancy due to poor hygienic conditions, and the incidence increases two times during pregnancy.",conditional,Maternal_Child_Healthcare.pdf
What are the potential consequences of untreated pre-eclampsia during pregnancy?,"Untreated pre-eclampsia can lead to eclampsia, which has a poor outcome, with between 5 and 17 percent of eclampsia victims dying, and those who survive may suffer paralysis, blindness, or chronic hypertension and kidney damage.",conditional,Maternal_Child_Healthcare.pdf
What are the different categories of abortion care and the factors leading to unsafe abortion?,"There are four categories of abortion care: emergency, elective, therapeutic, and unsafe. Elective abortion care has gestational age limits that vary among countries, and unsafe abortion is terminated by untrained and unskilled persons, resulting in a high risk of death and complications. Demographic risk factors for unsafe abortion include young age, high parity, and lack of access to relevant information and contraception.",conditional,Maternal_Child_Healthcare.pdf
"What are some reasons why poverty is related to AIDS and death, particularly regarding maternal mortality, considering factors such as healthcare, drug availability, crowding, malnutrition, and access to operative delivery?","Poor healthcare, poor availability of drugs for immunity protection, crowding, malnutrition, and lack of access to timely operative delivery are some reasons why poverty is related to AIDS and death, particularly maternal mortality.",conditional,Maternal_Child_Healthcare.pdf
"What factors, including nutritional status, cultural attitudes, and access to healthcare, contribute to low birth weight in infants?","Low birth weight in infants can be caused by a variety of factors, including poor maternal nutritional status due to early marriage, high workload, and limited access to nutritious food. Cultural attitudes and practices can also hinder women's access to essential services, such as emergency transport and trained healthcare providers. Additionally, a lack of access to relevant information and supplies can contribute to low birth weight.",conditional,Maternal_Child_Healthcare.pdf
"What are the four primary objectives of Family Planning Services in Ethiopia, regarding maternal and child health, fertility, and contraception?","The four primary objectives of Family Planning Services in Ethiopia are to limit family size, space children adequately, decrease maternal and child morbidity and mortality from unwanted pregnancies, and help infertile couples have children.",conditional,Maternal_Child_Healthcare.pdf
What are the differences between elective and emergency abortion care regarding the reasons for termination and the level of urgency?,"Elective abortion care is performed for social or medical reasons, while emergency abortion care is performed when the pregnancy poses an immediate threat to the woman's health, requiring immediate attention.",conditional,Maternal_Child_Healthcare.pdf
"What strategies can be implemented to reduce abortion-related mortality, considering the impact of family planning services, education, counseling, and legal frameworks?","Improving family planning services, education, and counseling can significantly reduce abortion-related mortality. Chile and Mexico's efforts to increase contraceptive prevalence rate (CPR) resulted in a 42% decrease in abortion-related mortality. Additionally, addressing socio-economic and cultural risk factors, such as providing sex education and counseling, can help reduce unwanted pregnancies and the need for abortion. Furthermore, changes in abortion laws and policies can also impact abortion-related mortality.",conditional,Maternal_Child_Healthcare.pdf
What are the reasons behind the high rate of unsafe abortion among young girls in Africa?,"Young girls in Africa often experience complications from unsafe abortion due to ignorance, fear, and denying pregnancy symptoms until they become unmistakable, leading to advanced pregnancy and complicated abortion.",conditional,Maternal_Child_Healthcare.pdf
"What are the possible consequences of complicated abortion, and how can it be prevented through education, counseling, and family planning?","Complicated abortion can result in maternal mortality and morbidity, and can be prevented through education, counseling, and access to family planning services. Strategies to combat abortion-related morbidity and mortality include improving family planning services, educating women about contraception and reproductive health, and providing counseling and support for women who have had abortions. Additionally, addressing socio-economic and cultural risk factors, such as poverty and lack of access to healthcare, can also help prevent complicated abortions.",conditional,Maternal_Child_Healthcare.pdf
What is the dual purpose of plant roots in soil nutrients and stability?,"Plant roots serve a dual purpose by absorbing water and nutrients from the soil, which is vital for the plant's growth, and providing stability by anchoring the plant in the ground.",conditional,Maternal_Child_Healthcare.pdf
"What factors should couples prioritize when choosing a contraceptive method, considering various methods' clinical effectiveness, ease of use, availability, side effects, and reversibility, and how do these factors vary across different regions and populations?","Couples should consider factors such as effectiveness, acceptability, interference with sexual activity, availability, side effects, and reversibility when selecting a contraceptive method, and these factors may vary in importance across different regions and populations, with some prioritizing ease of use and others prioritizing long-term effectiveness.",conditional,Maternal_Child_Healthcare.pdf
"What factors hinder women's access to education, and how does education impact women's reproductive health and behavior?","Women's access to education is hindered by factors such as poverty, cultural beliefs, and lack of resources. Education has a significant impact on women's reproductive health and behavior, as it influences their ability to make informed decisions about their health, family planning, and childbearing. Educated women are more likely to have better health outcomes, fewer and spaced pregnancies, and higher economic and social status.",conditional,Maternal_Child_Healthcare.pdf
"What steps can be taken to reduce the risk of sepsis during the postpartum period, considering factors such as scheduling timely visits, proper hygiene, and adequate training for birth attendants?","To prevent sepsis during the postpartum period, it is crucial to schedule timely visits, maintain proper hygiene, and provide adequate training for birth attendants. This includes ensuring clean delivery practices, minimizing vaginal examinations, and referring women with pre-term prolonged rupture of membranes or prolonged labor to a referral-level facility. Additionally, using prophylactic antibiotics following pre-labour rupture of membranes and evacuating retained placental fragments promptly can help reduce the risk of sepsis. Educating trained birth attendants, women, their families, and community health workers to recognize the early signs of sepsis and seek medical care may also be lifesaving.",conditional,Maternal_Child_Healthcare.pdf
