question,answer,tokens_present,document
What is the title of the publication mentioned in the text?,"The title of the publication mentioned in the text is ""Academy of ICT Essentials for Government Leaders.""","['Academy', 'of', 'ICT', 'Essentials', 'for', 'Government', 'Leaders']",Information_Security.pdf
What is the purpose of the Academy of ICT Essentials for Government Leaders module series?,"The purpose of the Academy of ICT Essentials for Government Leaders module series is to develop familiarity with the substantive issues related to ICTD from both a policy and technology perspective for policymakers, government officials, and managers in the public sector.","['ICTD', 'policymakers', 'government officials', 'managers', 'public sector']",Information_Security.pdf
Who is the target audience for the module series?,"The target audience for the module series includes policymakers at the national and local government level responsible for ICT policymaking, government officials responsible for the development and implementation of ICT-based applications, and managers in the public sector seeking to employ ICT tools for project management.","['policymakers', 'government officials', 'managers', 'ICT', 'project management']",Information_Security.pdf
What is the focus of the module series?,"The module series focuses on developing a good understanding of what current digital technology is capable of achieving and where technology is headed, and what this implies for policymaking.","['understanding', 'digital', 'technology', 'policymaking']",Information_Security.pdf
"What is the significance of the ""digital economy"" in today's world?","The ""digital economy"" is characterized by a shift from the production of goods to the creation of ideas, underscoring the growing, if not already central, role being played by information and communication technologies (ICTs) in the economy, in particular, and in society as a whole.","['digital', 'economy', 'shift', 'production', 'goods', 'creation', 'ideas', 'information', 'communication', 'technologies', 'ICTs', 'economy', 'society']",Information_Security.pdf
What are some of the difficulties that governments face in formulating ICT policy?,Governments face difficulties in formulating ICT policy due to unfamiliarity with a rapidly changing technology landscape and the competencies needed to harness ICTs for national development.,"['unfamiliarity', 'rapidly', 'changing', 'technology', 'landscape', 'competencies', 'harness', 'ICTs', 'national', 'development']",Information_Security.pdf
What is the role of the Asian and Pacific Training Centre for Information and Communication Technology for Development (APCICT) in developing the module series?,"The Asian and Pacific Training Centre for Information and Communication Technology for Development (APCICT) has developed the module series to provide a good understanding of what the current digital technology is capable of achieving and where technology is headed, and what this implies for policymaking.","['APCICT', 'module', 'series', 'digital', 'technology', 'policymaking']",Information_Security.pdf
What is the license under which the publication is available?,"The publication is available under a Creative Commons license, specifically the Creative Commons Attribution 3.0 IGO license.","['Creative Commons', 'Attribution 3.0 IGO']",Information_Security.pdf
Who should be contacted for correspondence regarding the report?,Correspondence concerning the report should be addressed to apcict@un.org.,['apcict@un.org'],Information_Security.pdf
What is the purpose of the Academy of ICT Essentials for Government Leaders module series?,"The purpose of the Academy of ICT Essentials for Government Leaders module series is to provide a good understanding of what the current digital technology is capable of achieving and where technology is headed, and what this implies for policymaking.","['provide', 'good', 'understanding', 'digital', 'technology', 'capable', 'achieving', 'headed', 'implies', 'policymaking']",Information_Security.pdf
Who is the target audience for the module series?,"The module series is designed for government leaders, policymakers, and other stakeholders who are interested in leveraging the potential of ICTs for development.","['government leaders', 'policymakers', 'stakeholders', 'ICTs', 'development']",Information_Security.pdf
What topics are covered in the module series?,"The module series covers a range of topics related to ICT and development, including information security and privacy, cybersecurity, data governance, and digital transformation.","['information security', 'cybersecurity', 'data governance', 'digital transformation']",Information_Security.pdf
How are the modules designed?,"The modules are designed to be standalone and linked together, with each module containing case studies and exercises to help deepen understanding of key concepts.","['standalone', 'linked', 'case', 'studies', 'exercises', 'key', 'concepts']",Information_Security.pdf
What is the long-term objective of the module series?,The long-term objective of the module series is to make the modules a coherent course that can be certified.,"['coherent', 'course', 'certified']",Information_Security.pdf
How can readers access the module series?,"The module series is available in print format and as an online distance learning platform, the APCICT Virtual Academy, which features virtual classrooms with trainers’ presentations in video format and PowerPoint presentations of the module.","['available', 'online', 'virtual', 'classrooms', 'video', 'PowerPoint', 'module']",Information_Security.pdf
Who prepared the Academy of ICT Essentials for Government Leaders: Information Security and Privacy module?,"The Academy of ICT Essentials for Government Leaders: Information Security and Privacy module was prepared by Freddy Tan, under the overall guidance of Kiyoung Ko, Director of Asian and Pacific Training Centre for Information and Communication Technology for Development (APCICT).","['Freddy Tan', 'Kiyoung Ko', 'APCICT']",Information_Security.pdf
What are the learning outcomes of the Information Security and Privacy module?,"The learning outcomes of the Information Security and Privacy module include understanding the concept of information security, privacy, and related concepts, identifying threats to information security, assessing existing information security policy in terms of international standards of information security and privacy protection, and formulating or making recommendations regarding information security policy that would be appropriate to their own context.","['information security', 'privacy', 'threats', 'policy', 'standards', 'protection', 'recommendations']",Information_Security.pdf
What is the significance of the module's coverage of standards of information security and privacy protection used by some countries and international organizations?,The module's coverage of standards of information security and privacy protection used by some countries and international organizations provides an overview of best practices and helps users understand the importance of aligning their own policies and practices with international standards.,"['standards', 'information', 'security', 'privacy', 'protection', 'countries', 'international', 'organizations', 'best', 'practices', 'policies']",Information_Security.pdf
Who reviewed and provided inputs to the Information Security and Privacy module?,"The Information Security and Privacy module benefited from substantive comments of participants to the Consultative Meeting on Capacity Building for Digital Development, held on 27-28 November 2019, in Incheon, and additional reviews and inputs were provided by the International Telecommunications Union (ITU) and the Information and Communications Technology and Disaster Risk Reduction Division (IDD) of ESCAP.","['ITU', 'ESCAP', 'Incheon', 'November', '2019']",Information_Security.pdf
What is the purpose of formulating information security policies?,The purpose of formulating information security policies is to provide a framework for protecting an organization's information assets from various threats and vulnerabilities.,"['framework', 'protecting', 'organization', 'information', 'assets', 'threats', 'vulnerabilities']",Information_Security.pdf
What are the different aspects of information security?,"The different aspects of information security include technical, administrative, and physical controls, as well as risk management and compliance with laws and regulations.","['technical', 'administrative', 'physical', 'risk management', 'compliance', 'laws', 'regulations']",Information_Security.pdf
What is the National Cybersecurity Strategy?,The National Cybersecurity Strategy is a comprehensive plan that outlines the roles and responsibilities of various stakeholders in protecting a nation's information infrastructure from cyber threats.,"['National', 'Cybersecurity', 'Strategy']",Information_Security.pdf
What is the difference between external and internal threats to information security?,"External threats to information security come from outside the organization, such as hackers, cybercriminals, and nation-state actors, while internal threats come from within the organization, such as employees, contractors, or other insiders.","['external', 'internal', 'threats', 'information', 'security']",Information_Security.pdf
What is the role of a CSIRT in information security?,"A CSIRT (Computer Security Incident Response Team) plays a crucial role in responding to and managing information security incidents, such as cyber attacks or data breaches.","['CSIRT', 'Computer Security Incident Response Team', 'cyber attacks', 'data breaches']",Information_Security.pdf
What is the difference between a CSIRT and a CERT?,"A CSIRT (Computer Security Incident Response Team) is a team that responds to and manages information security incidents, while a CERT (Computer Emergency Response Team) is a team that provides emergency response services to organizations in the event of a cyber attack or other information security incident.","['CSIRT', 'CERT', 'team', 'incident', 'response', 'security']",Information_Security.pdf
What is the importance of conducting a privacy impact assessment?,"Conducting a privacy impact assessment is important because it helps organizations identify and mitigate potential privacy risks associated with the collection, use, and sharing of personal data.","['important', 'privacy risks', 'personal data']",Information_Security.pdf
What is the difference between a risk assessment and a risk analysis?,"A risk assessment identifies potential risks and evaluates their likelihood and impact, while a risk analysis provides a detailed examination of the risk and recommends measures to mitigate or manage it.","['risk', 'assessment', 'analysis']",Information_Security.pdf
What is the role of international cooperation in information security?,"International cooperation is essential in information security because it allows countries to share information, coordinate efforts, and develop common standards and policies to address global cyber threats.","['International', 'cooperation', 'information', 'security', 'countries', 'share', 'coordinate', 'develop', 'common', 'standards', 'policies', 'global', 'cyber', 'threats']",Information_Security.pdf
What is the difference between a security policy and a security procedure?,"A security policy outlines an organization's approach to protecting its information assets, while a security procedure provides specific steps and guidelines for implementing the policy.","['security policy', 'security procedure']",Information_Security.pdf
What is the focus of the module discussed in the text?,"The module discussed in the text focuses on Information Security, which is a part of Cyber Security.","['Information Security', 'Cyber Security']",Information_Security.pdf
What is the definition of information in the field of Information Security?,"In the field of Information Security, information is defined as an ""asset""; it is something that has value and should therefore be protected.",,Information_Security.pdf
What is the difference between information assets and tangible assets?,"Information assets are radically different from tangible assets. While tangible assets have a physical existence and can be seen and touched, information assets are intangible and cannot be seen or touched. Information assets are also more vulnerable to various kinds of risks.","['information assets', 'tangible assets', 'intangible', 'risks']",Information_Security.pdf
What are some examples of criminal and recreational hacking mentioned in the text?,"The text mentions the following examples of criminal and recreational hacking:

* Global websites suffering DDoS attacks
* World's biggest source of spam email shut down
* The United Kingdom's biggest ever cyber fraud
* United States of America's State Farm accounts compromised in credential stuffing attack
* Islamic Republic of Iran: The Stuxnet worm marks a new era of cyberwar
* WannaCry cyber-attack cost the NHS £92m as 19,000 appointments cancelled
* RSA hit by advanced persistent threat attacks",,Information_Security.pdf
"What is the importance of information security for individuals, organizations, and nations?","Information security is crucial for individuals, organizations, and nations as it helps protect against cyber-intrusions, cyber-terrorism, cyber-crime, and other forms of cyber attacks that can cause significant harm and financial loss.","['information', 'security', 'protect', 'cyber-intrusions', 'cyber-terrorism', 'cyber-crime', 'cyber attacks', 'harm', 'financial', 'loss']",Information_Security.pdf
What is the role of governments in ensuring information security?,Governments have an important role to play in ensuring information security by expanding the information-communication infrastructure and establishing systems to protect against information security threats.,"['governments', 'information', 'security', 'infrastructure', 'systems', 'threats']",Information_Security.pdf
What are some areas where information security is particularly important?,"Information security is particularly important in areas such as finance, healthcare, government, and defense, where sensitive information is frequently accessed and transmitted.","['finance', 'healthcare', 'government', 'defense']",Information_Security.pdf
What is the purpose of ISO/IEC 27001:2005?,"ISO/IEC 27001:2005 is an international standard that provides a framework for implementing an Information Security Management System (ISMS) to protect sensitive information from unauthorized access, use, disclosure, disruption, modification, or destruction.","['ISO/IEC', '27001:2005', 'Information Security Management System', 'ISMS']",Information_Security.pdf
What is the difference between information security and cybersecurity?,"Information security is a broader term that encompasses the protection of all types of information, including physical and digital information, while cybersecurity specifically focuses on protecting digital information and systems from cyber threats.","['information', 'security', 'cybersecurity', 'digital', 'physical']",Information_Security.pdf
What is the importance of awareness and training in information security?,Awareness and training are essential components of information security as they help individuals and organizations understand the risks associated with information security and learn how to protect themselves from potential threats.,"['awareness', 'training', 'information', 'security', 'risks', 'protect']",Information_Security.pdf
What is the growing consensus regarding information?,"The growing consensus is that information needs to be protected, and its value is considered more important than the media holding the information.","['information', 'protected', 'value', 'media']",Information_Security.pdf
What is the difference between information assets and tangible assets?,"Information assets are intangible, can be easily reproduced, and their value increases when combined and processed. Tangible assets, on the other hand, have a physical form, and their value is reduced when reproduced.","['intangible', 'tangible']",Information_Security.pdf
What are the risks associated with information assets?,"The risks associated with information assets include unauthorized access, unauthorized use, destruction of information systems through computer viruses, and others.","['unauthorized access', 'unauthorized use', 'computer viruses', 'others']",Information_Security.pdf
What is information security?,"Information security is the preservation of confidentiality, integrity, and availability of information, which involves preventing or reducing the probability of unauthorized/inappropriate access, use, disclosure, disruption, deletion/destruction, corruption, modification, inspection, recording, or devaluation.","['information', 'security', 'preservation', 'confidentiality', 'integrity', 'availability', 'unauthorized', 'access', 'use', 'disclosure', 'disruption', 'deletion', 'destruction', 'corruption', 'modification', 'inspection', 'recording', 'devaluation']",Information_Security.pdf
What is the primary focus of information security?,"The primary focus of information security is the balanced protection of the confidentiality, integrity, and availability of data (also known as the CIA triad) while maintaining a focus on efficient policy implementation, all without hampering organization productivity.","['confidentiality', 'integrity', 'availability', 'CIA triad']",Information_Security.pdf
What is the difference between information security and cybersecurity?,"Cybersecurity includes not only information security but also digital infrastructure security, such as Supervisory Control and Data Acquisition (SCADA) systems and Internet-of-Things (IoT) systems, which goes beyond the protection of valuable information.","['cybersecurity', 'information security', 'digital infrastructure security', 'Supervisory Control and Data Acquisition', 'Internet-of-Things']",Information_Security.pdf
What are the 4Rs of information security?,"The 4Rs of information security are Right Information, Right People, Right Time, and Right Form.","['Right', 'Information', 'Right', 'People', 'Right', 'Time', 'Right', 'Form']",Information_Security.pdf
How can information assets be protected?,"Information assets can be protected by implementing measures such as access control, encryption, backups, and network security.","['access', 'control', 'encryption', 'backups', 'network', 'security']",Information_Security.pdf
What is the importance of information security in today's world?,"Information security is crucial in today's world, as it helps protect sensitive information from unauthorized access, use, or theft, which can result in financial loss, reputational damage, legal liability, and other negative consequences.","['crucial', 'financial loss', 'reputational damage', 'legal liability', 'negative consequences']",Information_Security.pdf
What are some common threats to information security?,"Some common threats to information security include phishing attacks, malware, ransomware, denial-of-service attacks, and insider threats.","['phishing', 'malware', 'ransomware', 'denial-of-service', 'insider threats']",Information_Security.pdf
What is the main difference between Cyber Security and Information Security?,"Cyber Security includes not only information security but also digital infrastructure security, such as Supervisory Control and Data Acquisition (SCADA) systems and Internet-of-Things (IoT) systems, which goes beyond the protection of valuable information.","['Cyber Security', 'Information Security', 'digital infrastructure security', 'Supervisory Control and Data Acquisition', 'Internet-of-Things']",Information_Security.pdf
What are the 4Rs of Information Security?,"The 4Rs of Information Security are Right Information, Right People, Right Time, and Right Form.","['Right', 'Information', 'Right', 'People', 'Right', 'Time', 'Right', 'Form']",Information_Security.pdf
"What does ""Right Information"" refer to?","""Right Information"" refers to the accuracy and completeness of information, which guarantees the integrity of information.","['accuracy', 'completeness', 'integrity']",Information_Security.pdf
"What does ""Right People"" mean?","""Right People"" means that information is available only to authorized individuals, which guarantees confidentiality.","['Right People', 'authorized individuals', 'confidentiality']",Information_Security.pdf
"What does ""Right Time"" refer to?","""Right Time"" refers to the accessibility of information and its usability upon demand by an authorized entity, which guarantees availability.","['Right Time', 'accessibility', 'usability', 'availability']",Information_Security.pdf
"What does ""Right Form"" refer to?","""Right Form"" refers to providing information in the right format.","['Right', 'Form', 'format']",Information_Security.pdf
What is risk management in the context of information security?,"Risk management in the context of information security is the process of identifying, assessing, and mitigating risks to information assets.","['risk management', 'information security', 'identifying', 'assessing', 'mitigating', 'risks', 'information assets']",Information_Security.pdf
What is the formula for risk?,"The formula for risk is Risk = ∫(Asset Value, Threats, Vulnerabilities).","['Risk', '=', '∫', 'Asset', 'Value', 'Threats', 'Vulnerabilities']",Information_Security.pdf
What are the four methods of risk management?,"The four methods of risk management are risk reduction (risk mitigation), risk acceptance, risk transference, and risk avoidance.","['risk reduction', 'risk mitigation', 'risk acceptance', 'risk transference', 'risk avoidance']",Information_Security.pdf
What is the purpose of a cost-effectiveness analysis in risk management?,"The purpose of a cost-effectiveness analysis in risk management is to determine the most cost-effective method of risk reduction, acceptance, transference, or avoidance.","['cost-effectiveness', 'risk', 'reduction', 'acceptance', 'transference', 'avoidance']",Information_Security.pdf
What is the name of the standard for information security management systems published by the International Organization for Standardization and International Electrotechnical Commission (ISO/IEC)?,The standard for information security management systems published by the International Organization for Standardization and International Electrotechnical Commission (ISO/IEC) is ISO/IEC 27001.,"['ISO', 'IEC', '27001']",Information_Security.pdf
What is the focus of ISO/IEC 27001?,"The focus of ISO/IEC 27001 is on administrative security, with an emphasis on documentation, operation audit, and the observance of policy/guideline and law.","['administrative security', 'documentation', 'operation audit', 'policy/guideline', 'law']",Information_Security.pdf
What is the main focus of CISA?,"The main focus of CISA is on audit activities and controls on information systems, with a strong emphasis on the role of auditors and the performance of the audit process.","['CISA', 'audit', 'information systems', 'auditors', 'audit process']",Information_Security.pdf
What is the main focus of CISSP?,"The main focus of CISSP is on technical security, with an emphasis on software development, identity and access management, communications and network security, and operations security.","['technical security', 'software development', 'identity and access management', 'communications', 'network security', 'operations security']",Information_Security.pdf
What are the four methods of information security?,"The four methods of information security are administrative, physical, technical, and legal.","['administrative', 'physical', 'technical', 'legal']",Information_Security.pdf
What is the difference between ISO/IEC 27001 and CISA?,"ISO/IEC 27001 focuses on administrative security, while CISA focuses on audit activities and controls on information systems.","['ISO', 'CISA']",Information_Security.pdf
What is the difference between CISA and CISSP?,"CISA focuses on audit activities and controls on information systems, while CISSP focuses on technical security.","['CISA', 'CISSP', 'audit', 'controls', 'information systems', 'technical', 'security']",Information_Security.pdf
What is the importance of information security awareness?,"Information security awareness is important because it helps to protect the organization's information assets from unauthorized access, use, disclosure, disruption, modification, or destruction.","['important', 'information', 'security', 'awareness', 'protect', 'organization', 'information assets', 'unauthorized', 'access', 'use', 'disclosure', 'disruption', 'modification', 'destruction']",Information_Security.pdf
What are some examples of information security measures in the administrative domain?,"Examples of information security measures in the administrative domain include the formulation of an information security policy, the construction and operation of an information security organization, human resources management, and physical security management.","['information security policy', 'information security organization', 'human resources management', 'physical security management']",Information_Security.pdf
What are some examples of information security measures in the physical domain?,"Examples of information security measures in the physical domain include physical and environmental security, asset security, and protection of information assets.","['physical', 'environmental', 'asset', 'protection', 'information']",Information_Security.pdf
