question,answer,tokens_present,document
What are some examples of information security measures in the technical domain?,"Examples of information security measures in the technical domain include cryptography, communications security, operations security, and identity and access management.","['cryptography', 'communications security', 'operations security', 'identity and access management']",Information_Security.pdf
What are the three information security domains?,"The three information security domains are administrative, physical, and technical.","['administrative', 'physical', 'technical']",Information_Security.pdf
What is hacking?,Hacking is the act of gaining unauthorized access to a computer or computer network to obtain or modify information.,"['hacking', 'access', 'computer', 'network', 'obtain', 'modify', 'information']",Information_Security.pdf
What are the different types of hacking?,"Hacking can be classified into recreational, criminal, or political hacking, depending on the purpose of the attack.","['recreational', 'criminal', 'political']",Information_Security.pdf
What is a Denial-of-Service (DoS) attack?,"A DoS attack causes an action upon a computer or networked device that results in other processes, resources, or activities floundering and failing to respond adequately.","['DoS', 'attack', 'computer', 'networked', 'device', 'processes', 'resources', 'activities', 'floundering', 'failing', 'respond', 'adequately']",Information_Security.pdf
What is a Distributed Denial-of-Service (DDoS) attack?,"A DDoS attack is a DoS attack that is launched from multiple sources, making it more difficult to defend against.","['DDoS', 'DoS', 'attack', 'launched', 'sources', 'defend']",Information_Security.pdf
What was the JPMorgan Chase Bank hack in 2014?,The JPMorgan Chase Bank hack in 2014 was a cyber attack that exposed over 80 million user accounts to hackers.,"['JPMorgan Chase Bank', 'hack', '2014', 'cyber attack', 'user accounts', 'hackers']",Information_Security.pdf
What is spam?,"Spam is a bulk, unsolicited, commercial electronic message delivered through an information communication service, such as email.","['spam', 'bulk', 'unsolicited', 'commercial', 'electronic', 'message', 'email']",Information_Security.pdf
What was the major DDoS attack in October 2016?,"The major DDoS attack in October 2016 was a cyber attack that disrupted several websites, including Twitter, Netflix, PayPal, Pinterest, and the PlayStation Network.","['cyber attack', 'Twitter', 'Netflix', 'PayPal', 'Pinterest', 'PlayStation Network']",Information_Security.pdf
How did the hackers behind the October 2016 DDoS attack compromise endpoint IoT devices?,"The hackers behind the October 2016 DDoS attack compromised 20,000 endpoint IoT devices and transformed them into a botnet to flood traffic to DNS hosting provider Dyn.","['compromised', 'IoT', 'botnet', 'DNS', 'Dyn']",Information_Security.pdf
What is the purpose of social engineering in cyber attacks?,"Social engineering is used in cyber attacks to manipulate individuals into divulging confidential or sensitive information, or to trick them into performing actions that facilitate unauthorized access to systems, data, or financial resources.","['social engineering', 'cyber attacks', 'manipulate', 'divulging', 'sensitive information', 'trick', 'unauthorized access', 'systems', 'data', 'financial resources']",Information_Security.pdf
What was the size of the attack mentioned in the first case study?,The attack measured close to 1 Tbps.,['1 Tbps'],Information_Security.pdf
What was the method used by the group behind the attack to compromise endpoint IoT devices?,They used a botnet to flood traffic to DNS hosting provider Dyn.,"['botnet', 'DNS', 'flood']",Information_Security.pdf
What is phishing?,"Phishing is the use of email or messages to obtain sensitive information such as usernames, passwords, and credit card details by using a trustworthy entity.","['Phishing', 'email', 'messages', 'sensitive', 'information', 'usernames', 'passwords', 'credit card', 'trustworthy', 'entity']",Information_Security.pdf
What was the estimated amount of fraud prevented in the UK after three men were convicted of launching sophisticated phishing scams?,£59m worth of fraud was prevented.,['£59m'],Information_Security.pdf
"How many phishing pages were analyzed by the Met Police Central e-Crime Unit (PCeU), the Serious Organized Crime Agency, and the US Secret Service?","They analyzed 2,600 phishing pages that mimicked banking websites.","['2,600']",Information_Security.pdf
What was the estimated amount of money raked in by the fraudsters in the UK's biggest ever cyber scam?,They raked in up to £2million a week.,['£2million'],Information_Security.pdf
What was the name of the botnet that generated billions of emails per day promoting unlicensed online pharmacies and cut-price impotence pills?,The Rustock botnet.,['Rustock'],Information_Security.pdf
What was the method used by Microsoft to shut down the Rustock botnet?,"Microsoft, backed by US Marshals, seized servers that it was estimated covertly controlled almost a million Windows PCs.","['Microsoft', 'seized', 'servers']",Information_Security.pdf
What is credential stuffing?,Credential stuffing is a type of cyberattack where stolen account credentials are used to gain unauthorized access to user accounts through large-scale automated login requests directed against a web application.,"['credential', 'stuffing']",Information_Security.pdf
"What percentage of users reuse the same username/password combination across multiple sites, according to a survey?","81% of users have reused a password across two or more sites, and 25% of users use the same password across a majority of their accounts.","['81%', '25%']",Information_Security.pdf
What is malicious code?,"Malicious code refers to programs that cause damage to a system when executed. Examples include viruses, worms, and Trojan horses.","['malicious', 'code', 'viruses', 'worms', 'Trojan', 'horses']",Information_Security.pdf
What is a computer virus?,"A computer virus is a computer program or programming code that damages computer systems and data by replicating itself by initiating copying to another program, computer boot sector, or document.","['computer', 'virus']",Information_Security.pdf
What is a worm?,"A worm is a self-replicating virus that does not alter files but resides in active memory, using parts of an operating system that are automatic and usually invisible to the user. Their uncontrolled replication consumes system resources, slowing or halting other tasks.","['worm', 'self-replicating', 'virus', 'active', 'memory', 'operating', 'system', 'resources', 'slowing', 'halting']",Information_Security.pdf
What is a Trojan horse?,A Trojan horse is a program that appears to be useful and/or harmless but really has a malicious function such as unloading hidden programs or command scripts that make a system vulnerable to encroachment.,"['Trojan horse', 'program', 'malicious', 'function', 'unloading', 'hidden', 'command', 'scripts', 'system', 'vulnerable', 'encroachment']",Information_Security.pdf
What was the Stuxnet worm designed to target?,"The Stuxnet worm was designed to target Siemens Simatic WinCC SCADA systems, which are used in various facilities to manage pipelines, nuclear plants, and various utility and manufacturing equipment.",['Siemens Simatic WinCC SCADA systems'],Information_Security.pdf
What was the estimated cost of the WannaCry cyber-attack to the NHS?,"The estimated cost of the WannaCry cyber-attack to the NHS was £92m, with 19,000 appointments cancelled.",['£92m'],Information_Security.pdf
What is an advanced persistent threat (APT)?,"An advanced persistent threat (APT) is a network attack in which an unauthorized person gains access to a network and stays there undetected for a long period of time, with the intention of stealing data rather than causing damage to the network or organization.","['advanced', 'persistent', 'threat', 'network', 'attack', 'unauthorized', 'access', 'undetected', 'long period', 'intention', 'stealing', 'data']",Information_Security.pdf
How does an APT attacker typically gain access to a network?,"An APT attacker often uses ""spear fishing,"" a type of social engineering, to gain access to the network through legitimate means, and then establishes a ""back door.""","['spear fishing', 'social engineering', 'back door']",Information_Security.pdf
What is the purpose of a back door in an APT attack?,"The purpose of a back door in an APT attack is to allow the attacker to move laterally across the network, installing more back doors and gathering valid user credentials (especially administrative ones).","['back door', 'APT attack', 'attacker', 'network', 'back doors', 'user credentials', 'administrative']",Information_Security.pdf
Which sector is most targeted by APT attacks?,"APT attacks target organizations in sectors with high-value information, such as national defense, manufacturing, and the financial industry.","['APT', 'national defense', 'manufacturing', 'financial industry']",Information_Security.pdf
What is an advanced persistent threat (APT)?,"An advanced persistent threat (APT) is a type of attack where an attacker gains access to a network through legitimate means and establishes a backdoor to install malware and move laterally across the network, remaining hidden in plain sight. (Source: 7 Rosencrance, L. (2020, August 27). What is advanced persistent threat? SearchSecurity. https://searchsecurity.techtarget.com/definition/advanced-persistent-threat-APT)","['advanced', 'persistent', 'threat', 'APT']",Information_Security.pdf
What was the impact of the WannaCry cyber-attack on the NHS?,"The WannaCry cyber-attack cost the NHS £92m, with 19,000 appointments cancelled and £72m spent on cleanup and upgrades to its IT systems. (Source: The Telegraph; WannaCry cyber-attack cost the NHS £92m as 19,000 appointments cancelled, https://www.telegraph.co.uk/technology/2018/10/11/wannacry-cyber-attack-cost-nhs-92m-19000-appointments-cancelled)","['£92m', '19,000', '£72m']",Information_Security.pdf
What is two-factor authentication?,"Two-factor authentication is a security method that uses a key fob or token to provide a randomized code that a user must enter in addition to their username and password to authenticate and gain access to a site or application. (Source: RSA hit by advanced persistent threat attacks, http://www.computerweekly.com/Articles/2011/03/18/245974/RSA-hit-by-advanced-persistent-threat-attacks.htm)","['two-factor authentication', 'key fob', 'token', 'randomized code', 'username', 'password']",Information_Security.pdf
What was the result of the RSA SecurID hack?,"The RSA SecurID hack resulted in the theft of information related to RSA’s SecurID two-factor authentication products, which could potentially be used to reduce the effectiveness of a current two-factor authentication implementation as part of a broader attack. (Source: RSA hit by advanced persistent threat attacks, http://www.computerweekly.com/Articles/2011/03/18/245974/RSA-hit-by-advanced-persistent-threat-attacks.htm)","['theft', 'two-factor', 'authentication', 'attack']",Information_Security.pdf
What is a backdoor?,"A backdoor is a way for an attacker to bypass security measures and gain unauthorized access to a computer system or network. (Source: 7 Rosencrance, L. (2020, August 27). What is advanced persistent threat? SearchSecurity. https://searchsecurity.techtarget.com/definition/advanced-persistent-threat-APT)","['backdoor', 'security', 'measures', 'access', 'computer', 'system', 'network']",Information_Security.pdf
What is spear phishing?,"Spear phishing is a type of social engineering attack where an attacker targets a specific individual or group with a tailored message or email that appears to be from a trusted source, in order to trick the recipient into divulging sensitive information or installing malware. (Source: 7 Rosencrance, L. (2020, August 27). What is advanced persistent threat? SearchSecurity. https://searchsecurity.techtarget.com/definition/advanced-persistent-threat-APT)","['spear phishing', 'social engineering', 'attack', 'trusted source', 'sensitive information', 'malware']",Information_Security.pdf
What is the purpose of security awareness training for employees?,"Security awareness training for employees helps to eradicate risky behaviors that could potentially lead to cyber breaches. (Source: 2.3. Types of Internal Attacks, Disgruntled employees/contractors)","['security', 'awareness', 'training', 'employees', 'risky', 'behaviors', 'cyber', 'breaches']",Information_Security.pdf
What is a ghost infrastructure?,"A ghost infrastructure refers to a set of bogus utilities and malware that an attacker installs on a compromised network, which remains hidden in plain sight and allows the attacker to maintain access to the network. (Source: 7 Rosencrance, L. (2020, August 27). What is advanced persistent threat? SearchSecurity. https://searchsecurity.techtarget.com/definition/advanced-persistent-threat-APT)","['ghost', 'infrastructure', 'bogus', 'malware', 'compromised', 'network', 'attacker', 'hidden', 'plain', 'sight', 'maintain', 'access']",Information_Security.pdf
"What can rogue employees do to an organization's network, systems, and data?","Rogue employees, especially those with knowledge of and access to networks, data centers, and admin accounts, can cause serious damage to an organization's network, systems, and data.","['rogue employees', 'network', 'systems', 'data']",Information_Security.pdf
"What is security awareness training for employees, and what does it help to eradicate?","Security awareness training for employees helps to eradicate risky behaviors that could potentially lead to cyber breaches. It addresses threats such as phishing emails, ransomware, and social engineering scams via the telephone, text message, or social media channels.","['security', 'awareness', 'training', 'employees', 'risky', 'behaviors', 'cyber', 'breaches', 'phishing', 'ransomware', 'social', 'engineering', 'scams', 'telephone', 'text', 'message', 'social', 'media', 'channels']",Information_Security.pdf
"What is social engineering, and what does it refer to?","Social engineering refers to a set of techniques used to manipulate people into divulging confidential information. It is similar to a confidence trick or simple fraud, but the term typically applies to trickery for information gathering or computer system access.","['social engineering', 'confidential information', 'manipulate', 'trickery', 'information gathering', 'computer system access']",Information_Security.pdf
"What is threat trend analysis, and what is its purpose?","Threat trend analysis is an important activity in safeguarding information security. It refers to the search for patterns in security threats over time to identify ways in which such patterns change and develop, veer to new directions, or shift. Its purpose is to anticipate likely or possible threats and prepare the appropriate responses to these threats.","['threat', 'trend', 'analysis', 'security', 'patterns', 'anticipate', 'responses']",Information_Security.pdf
Name some organizations that perform information security threat trend analysis and share security threat trend reports.,"Some organizations that perform information security threat trend analysis and share security threat trend reports include FireEye, IBM, Microsoft, Symantec, and Verizon.","['FireEye', 'IBM', 'Microsoft', 'Symantec', 'Verizon']",Information_Security.pdf
What are some trends in information security threats that have been reported?,"Some trends in information security threats that have been reported include the automation of attack tools, the use of polymorphic tools, and the use of anti-forensic techniques to mask or hide the nature of attack tools.","['automation', 'polymorphic', 'anti-forensic']",Information_Security.pdf
What are some attack tools that are difficult to detect?,"Some attack tools that are difficult to detect include those that use new attack patterns that are not detected by existing detection tools, and those that use common protocols like HTTP, making it difficult to distinguish them from legitimate network traffic.","['new attack patterns', 'HTTP', 'legitimate network traffic']",Information_Security.pdf
"What is the MSN Messenger worm, and how does it work?","The MSN Messenger worm is a worm that infects the MSN Messenger Instant-Messaging (IM) client. It sends a file designed to infect systems to contacts from the infected user’s address book, after first issuing a warning that they are about to receive a file. The worm mimics the behavior of a real IM user, which is alarming.","['MSN Messenger', 'worm', 'infects', 'IM', 'client', 'sends', 'file', 'infect', 'systems', 'contacts', 'address book', 'warning', 'receive', 'file', 'mimics', 'behavior', 'real', 'IM', 'user', 'alarming']",Information_Security.pdf
"What is the Computer Emergency Response Team Coordination Center (CERT/CC), and what does it do?",The Computer Emergency Response Team Coordination Center (CERT/CC) is a team that coordinates the response to computer security incidents. It collects and correlates information about security threats and provides incident profiles to help organizations prepare for potential threats.,"['Computer', 'Emergency', 'Response', 'Team', 'Coordination', 'Center', 'security', 'incidents', 'threats', 'profiles', 'organizations', 'potential']",Information_Security.pdf
Why is it difficult for administrators to keep up to date with patches?,"It is difficult for administrators to keep up to date with patches because the number of newly discovered vulnerabilities in software products that are reported to the CERT/CC doubles every year, making it challenging for administrators to keep up with patches. Intruders know this and take advantage of it.","['It', 'is', 'difficult', 'for', 'administrators', 'to', 'keep', 'up', 'with', 'patches', 'because', 'the', 'number', 'of', 'newly', 'discovered', 'vulnerabilities', 'in', 'software', 'products', 'that', 'are', 'reported', 'to', 'the', 'CERT/CC', 'doubles', 'every', 'year', 'making', 'it', 'challenging', 'for', 'administrators', 'to', 'keep', 'up', 'with', 'patches', 'Intruders', 'know', 'this', 'and', 'take', 'advantage', 'of', 'it']",Information_Security.pdf
What is the main concern of the article?,The main concern of the article is the increasing threat of cyber attacks and the importance of governing internet use to prevent them.,"['increasing', 'threat', 'cyber', 'attacks', 'governing', 'internet', 'use', 'prevent']",Information_Security.pdf
What is the purpose of the Computer Emergency Response Team Coordination Center (CERT/CC)?,The purpose of the Computer Emergency Response Team Coordination Center (CERT/CC) is to coordinate the response to computer security incidents and provide information and guidance on how to protect against them.,"['coordinate', 'response', 'computer', 'security', 'incidents', 'information', 'guidance', 'protect']",Information_Security.pdf
What is a zero-day attack?,"A zero-day attack is a computer threat that exploits a vulnerability in software that has not yet been discovered by administrators, making it difficult to patch or protect against.","['zero-day attack', 'computer threat', 'vulnerability', 'software', 'administrators', 'patch', 'protect']",Information_Security.pdf
What is the difference between recreational hacking and criminal hacking?,"Recreational hacking is unauthorized modification of programs and data simply to satisfy the hacker’s curiosity, while criminal hacking is used in fraud or espionage.","['recreational', 'hacking', 'criminal', 'fraud', 'espionage']",Information_Security.pdf
What is the trend in data breach volumes?,"According to Figure 4 in the text, data breach volumes have been increasing over time.",['increasing'],Information_Security.pdf
"What is the purpose of Zbot, a malware package?","The purpose of Zbot is financial gain—stealing online credentials such as FTP, e-mail, online banking, and other online passwords.","['financial gain', 'stealing', 'online credentials', 'FTP', 'e-mail', 'online banking', 'other online passwords']",Information_Security.pdf
What is the definition of infrastructure attacks?,"Infrastructure attacks are attacks that broadly affect key components of the Internet, resulting in compromise of sensitive information, spread of misinformation, and significant diversion of resources from other tasks.","['Infrastructure', 'attacks', 'Internet', 'compromise', 'sensitive', 'information', 'spread', 'misinformation', 'significant', 'diversion', 'resources', 'tasks']",Information_Security.pdf
What is the difference between hacking and cyberterrorism?,"Hacking is unauthorized access to a computer or computer network to obtain or modify information without legal authorization, while cyberterrorism is the use of the Internet to carry out acts of terrorism, such as hacking into critical infrastructure or spreading propaganda.","['hacking', 'cyberterrorism', 'Internet', 'computer', 'computer network', 'legal authorization', 'infrastructure', 'propaganda']",Information_Security.pdf
"What is the role of the Internet in cyberterrorism, cyberpolitics, and cyberwarfare?","The Internet has become a tool for influencing foreign policy and poses a major threat to national security in the realms of cyberterrorism, cyberpolitics, and cyberwarfare.","['The Internet', 'cyberterrorism', 'cyberpolitics', 'cyberwarfare', 'tool', 'foreign policy', 'threat', 'national security']",Information_Security.pdf
What is the significance of the increasing trend of hacking groups targeting major sites with national interest and holding highly sensitive information?,The increasing trend of hacking groups targeting major sites with national interest and holding highly sensitive information poses a significant threat to national security and highlights the need for increased measures to protect against cyber attacks.,"['significant', 'threat', 'national security', 'cyber attacks']",Information_Security.pdf
"What is the main purpose of cybercrime, according to the text?","The main purpose of cybercrime is now money, slander, and destruction, whereas it used to be perpetrated out of curiosity or for self-satisfaction.","['money', 'slander', 'destruction', 'curiosity', 'self-satisfaction']",Information_Security.pdf
"What is cybercrime, according to the text?","Cybercrime is the deliberate destruction, disruption, or distortion of digital data or information flows for political, economic, religious, or ideological reasons.","['cybercrime', 'deliberate', 'destruction', 'disruption', 'distortion', 'digital', 'data', 'information', 'flows', 'political', 'economic', 'religious', 'ideological']",Information_Security.pdf
"What are the most common types of cybercrime, according to the text?","The most common types of cybercrime include hacking, DoS, malicious code, and social engineering.","['hacking', 'DoS', 'malicious code', 'social engineering']",Information_Security.pdf
"What is the purpose of the PTF ITU SPAM toolkit, according to the text?","The purpose of the PTF ITU SPAM toolkit is to help policy planners, regulators, and companies adjust policy and recover confidence in e-mail.","['policy', 'planners', 'regulators', 'companies', 'adjust', 'recover', 'confidence', 'e-mail']",Information_Security.pdf
"What is the role of the Attorney General's Office of the Republic of Indonesia in combating cybercrime, according to the text?","The Attorney General's Office of the Republic of Indonesia is institutionally strengthening and revitalizing the institution by preparing, designing, and formulating a Cybercrime Task Force, which will consist of prosecutors who specifically have knowledge, abilities, skills, and expertise in handling cybercrime cases.","['strengthening', 'revitalizing', 'preparing', 'designing', 'formulating', 'Cybercrime', 'Task', 'Force', 'prosecutors', 'knowledge', 'abilities', 'skills', 'expertise', 'handling', 'cybercrime', 'cases']",Information_Security.pdf
"What are the three special units that the Cybercrime Task Force will consist of, according to the text?","The three special units that the Cybercrime Task Force will consist of are: First, Computer Related Crime Unit, assigned to handle criminal cases that utilize computers or information technology facilities as a means of committing crimes; Second, Crimes Against Computer Unit, assigned to handle crimes aimed at computers and information technology; and Third, Cooperation and Secretariat Unit, providing support in handling cases and cooperation both nationally and internationally.","['First', 'Second', 'Third']",Information_Security.pdf
"What is the price range for general non-financial institution login credentials on the dark web, according to the text?",The price range for general non-financial institution login credentials on the dark web is between $1 and $110.,"['$1', '$110']",Information_Security.pdf
"What is the price range for online payment services login information, such as Paypal, on the dark web, according to the text?","The price range for online payment services login information, such as Paypal, on the dark web is between $20 and $200.","['$20', '$200']",Information_Security.pdf
"What is the price range for medical records on the dark web, according to the text?","The price range for medical records on the dark web is between $1 and $1,000.","['$1', '$1,000']",Information_Security.pdf
