question,answer,tokens_present,document
What was the impact of the 1997 Asian Financial Crisis on Singapore's economy?,"The 1997 Asian Financial Crisis provided further impetus for reform in Singapore, as the economy was driven into a brief recession in 1998, and the associated rapid depreciation of many regional currencies worsened Singapore's cost competitiveness further.","['recession', 'cost competitiveness']",Immigration_in_Singapore.pdf
What was the significance of the Committee on Singapore's Competitiveness's report in shaping Singapore's future economic strategies?,"The Committee on Singapore's Competitiveness's report in 1998 played a significant role in shaping Singapore's future economic strategies, as it declared that Singapore should become a knowledge economy and attract global talent to fill skill and capability gaps in the resident labor force, build connections between Singapore and global knowledge nodes, and transform Singapore from being a passive recipient of foreign investment to an active exporter of capital, talent, and capabilities to the region and the globe.","['Singapore', 'knowledge economy', 'global talent', 'skill', 'capability', 'labor force', 'foreign investment', 'capital', 'talent', 'capabilities', 'region', 'globe']",Immigration_in_Singapore.pdf
What was the fertility rate of Singapore in the 1950s?,The fertility rate of Singapore in the 1950s was one of the highest in the world.,"['one', 'highest', 'world']",Immigration_in_Singapore.pdf
What was the fertility rate of Singapore by the late 1970s?,The fertility rate of Singapore by the late 1970s was less than replacement fertility.,"['less', 'than', 'replacement', 'fertility']",Immigration_in_Singapore.pdf
What was the main reason for the decline in fertility rate in Singapore?,"The main reason for the decline in fertility rate in Singapore was the government's efforts to encourage marriage and procreation, particularly among higher-educated couples.","[""government's efforts"", 'marriage', 'procreation', 'higher-educated couples']",Immigration_in_Singapore.pdf
What was the focus of the Prime Minister's speech in 1997?,"The focus of the Prime Minister's speech in 1997 was on outlining the government's plans for ""Gathering Talent,"" stating that Singapore needed intellectual capital to be a successful knowledge-based economy.","['Gathering Talent', 'intellectual capital', 'knowledge-based economy']",Immigration_in_Singapore.pdf
"What was the goal of the ""Gathering Talent"" initiative?","The goal of the ""Gathering Talent"" initiative was to attract and recruit highly skilled workers globally.","['attract', 'recruit', 'highly skilled', 'workers', 'globally']",Immigration_in_Singapore.pdf
What was the name of the committee established in 1998 to attract and recruit highly skilled workers?,The name of the committee established in 1998 to attract and recruit highly skilled workers was the Singapore Talent and Recruitment (STAR) committee.,['STAR'],Immigration_in_Singapore.pdf
"What was the purpose of the ""Global Schoolhouse"" project?","The purpose of the ""Global Schoolhouse"" project was to make Singapore a hub for international universities and to attract high-potential students to study in Singapore.","['Singapore', 'hub', 'international', 'universities', 'study']",Immigration_in_Singapore.pdf
What was the size of the non-resident labor force in 2008?,"The non-resident labor force in 2008 was more than one million workers, comprising more than one-third (34.41%) of the total workforce.","['more than one million', '34.41%']",Immigration_in_Singapore.pdf
What was the reason for the growth of the non-resident workforce in Singapore?,"The growth of the non-resident workforce in Singapore was due to the government's efforts to attract and recruit highly skilled workers globally, as well as the lack of any explicit policy of assimilation and policy ambivalence toward foreign workers more generally.","[""government's efforts"", 'highly skilled workers', 'lack of explicit policy', 'assimilation', 'policy ambivalence', 'foreign workers']",Immigration_in_Singapore.pdf
What was the trend in the proportion of foreign-born population in Singapore from 1960 to the 1990s?,The proportion of foreign-born population in Singapore gradually declined and plateaued from 1960 to the 1990s.,"['declined', 'plateaued']",Immigration_in_Singapore.pdf
What was the reason for the decline in the proportion of foreign-born population in Singapore during the period?,The decline was due to the lack of any explicit policy of assimilation and policy ambivalence toward foreign workers.,"['lack', 'assimilation', 'policy', 'ambivalence', 'foreign workers']",Immigration_in_Singapore.pdf
What happened to the proportion of foreign-born population in Singapore in the 1990s?,The proportion of foreign-born population in Singapore started to rapidly and continuously rise in the 1990s.,"['rapidly', 'rise']",Immigration_in_Singapore.pdf
How many persons were granted permanent resident status in Singapore in 2007?,"In 2007, 63,627 persons were granted permanent resident status in Singapore.","['63,627']",Immigration_in_Singapore.pdf
How many persons were granted Singapore citizenship in 2007?,"In 2007, 17,334 persons were granted Singapore citizenship.","['17,334']",Immigration_in_Singapore.pdf
What is the assumption regarding the majority of those granted permanent resident status in Singapore?,"It is assumed that the majority of those granted permanent resident status are selected from the high-skilled, economically active migrant worker population.","['high-skilled', 'economically active', 'migrant worker']",Immigration_in_Singapore.pdf
What is the difference in employment rates and wages between permanent residents and Singapore citizens?,Permanent residents have higher employment rates and wages compared to Singapore citizens.,"['permanent residents', 'Singapore citizens']",Immigration_in_Singapore.pdf
What is the percentage of migrants in the total population of Singapore?,"The percentage of migrants in the total population of Singapore has been steadily increasing, from 13.4% in 1960 to 33.8% in 2017.",['33.8%'],Immigration_in_Singapore.pdf
What is the demographic characteristic that is considered in naturalization policy in Singapore?,"Naturalization policy in Singapore considers the demographic characteristics of the applicant, such as their ethnic and/or cultural origins, in addition to their skills.","['ethnic', 'cultural', 'origins']",Immigration_in_Singapore.pdf
What is the concern raised in Parliament about the longer-term social effects of having large numbers of “Non-Traditional Source” workers in Singapore?,The concern raised in Parliament is that the presence of large numbers of “Non-Traditional Source” workers in Singapore for extended periods may have negative social effects on the society.,"['negative', 'social', 'effects']",Immigration_in_Singapore.pdf
What was the purpose of introducing the S Pass system in Singapore?,The S Pass system was introduced to manage medium-skilled foreign workers who fell short of the high-skilled threshold but were still needed for the economy.,"['introduce', 'manage', 'medium-skilled', 'foreign', 'workers', 'economy']",Immigration_in_Singapore.pdf
How did the foreign worker levy and dependency ratio ceiling change over time in Singapore?,"The foreign worker levy and dependency ratio ceiling were continually adjusted to calibrate the flow of and demand for low-skilled workers, while the approval criteria for high-skilled workers' Employment Passes were adjusted to ensure that incoming workers filled positions that required skills that were relatively rare in the resident population.","['calibrate', 'low-skilled', 'high-skilled', 'Employment Passes', 'resident population']",Immigration_in_Singapore.pdf
What was the reason for the rapid growth of the non-resident workforce in Singapore during the late 2000s?,"The rapid growth of the non-resident workforce in Singapore during the late 2000s was largely driven by the substantial expansion of the foreign workforce, which was needed to support the economy's growth.","['substantial', 'expansion', 'foreign', 'workforce', 'economy', 'growth']",Immigration_in_Singapore.pdf
What was the concern regarding low-skilled foreign workers in Singapore?,"The concern regarding low-skilled foreign workers in Singapore was that they were experiencing wage suppression from the ready availability of Work Permit holders, who were generally willing to work for lower effective wages than citizens.","['wage suppression', 'Work Permit holders', 'lower effective wages', 'citizens']",Immigration_in_Singapore.pdf
What was the concern regarding high-skilled foreign workers in Singapore?,"The concern regarding high-skilled foreign workers in Singapore was that the rapid growth in migrant high-skilled workers led to keen competition for Professional, Managerial, Executive, and Technical (PMET) jobs, which were demanded by an increasingly well-educated Singapore citizen workforce.","['rapid', 'growth', 'high-skilled', 'foreign', 'workers', 'competition', 'PMET', 'jobs', 'increasingly', 'well-educated', 'Singapore', 'citizen', 'workforce']",Immigration_in_Singapore.pdf
How did the number of Employment Pass holders change in the two years after the global financial crisis?,"The number of Employment Pass holders expanded by around 30,000 per year in the two years after the global financial crisis, which was a number two and a half times larger than the entire cohort each year of graduating university-educated residents.","['30,000', 'two years', 'global financial crisis']",Immigration_in_Singapore.pdf
What was the impact of the rapid growth of the non-resident workforce on Singapore's resident workforce?,"The rapid growth of the non-resident workforce in Singapore led to concerns that Singapore citizen low-wage workers were experiencing wage suppression, and that high-skilled foreign workers were competing with citizens for PMET jobs.","['wage suppression', 'competing with citizens for PMET jobs']",Immigration_in_Singapore.pdf
What was the government's response to the population backlash against foreign workers in Singapore?,"The government's response to the population backlash against foreign workers in Singapore was to adjust policies to accommodate sectoral challenges or opportunities, such as adjusting the foreign worker levy and dependency ratio ceiling, and introducing the S Pass system for medium-skilled workers.","['adjust', 'policies', 'accommodate', 'sectoral', 'challenges', 'opportunities', 'foreign', 'worker', 'levy', 'dependency', 'ratio', 'ceiling', 'introducing', 'S', 'Pass', 'system', 'medium-skilled', 'workers']",Immigration_in_Singapore.pdf
What was the purpose of the Foreign Talent strategy in Singapore?,The purpose of the Foreign Talent strategy in Singapore was to attract high-skilled workers who were needed for the economy's growth and to target them for long-term assimilation.,"['attract', 'high-skilled', 'workers', 'needed', ""economy's"", 'growth', 'target', 'long-term', 'assimilation']",Immigration_in_Singapore.pdf
What was the percentage of voter share that the ruling party received in the 2011 general election?,"The ruling party received 60.14% of the voter share in the 2011 general election, which was a significant decrease from the 66.6% they received in 2006.",['60.14%'],Immigration_in_Singapore.pdf
What was the main reason for the tightening of foreign worker policy in Singapore?,"The main reason for the tightening of foreign worker policy was the growing discontent among Singapore citizens towards the increasing number of foreign workers in the country, which was perceived to be contributing to wage suppression, higher expectations from employers, discrimination against Singapore citizens, and underemployment for high-skilled citizens.","['growing discontent', 'increasing number', 'foreign workers', 'Singapore citizens', 'wage suppression', 'higher expectations', 'discrimination', 'underemployment', 'high-skilled citizens']",Immigration_in_Singapore.pdf
What was the projected total population of Singapore by 2030 according to the White Paper on Population?,"According to the White Paper on Population, the projected total population of Singapore by 2030 was 6.9 million, supplemented by a non-resident population of 2.9 million to 3.1 million and an increase in new citizenship and permanent residents granted.",['6.9 million'],Immigration_in_Singapore.pdf
What was the result of the government's tightening of the Employment Pass scheme in 2012?,"The tightening of the Employment Pass scheme in 2012 resulted in a significant decrease in the number of Employment Pass holders, from around 30,000 per year to around 20,000 per year.","['decrease', '30,000', '20,000']",Immigration_in_Singapore.pdf
What was the reason for the increase in foreign worker levy in 2011-2013?,The foreign worker levy was increased in 2011-2013 to discourage employers from hiring too many foreign workers and to encourage them to hire more local workers instead.,"['discourage', 'hire', 'foreign workers', 'local workers']",Immigration_in_Singapore.pdf
What was the impact of the government's measures to tighten foreign worker policy on the growth of the non-resident workforce in Singapore?,"The growth of the non-resident workforce in Singapore plateaued in the mid-2010s, rising from 1.044 million workers in 2009 to around 1.415 million in 2016, while assimilation into the resident workforce slowed down significantly.","['plateaued', 'rising', '1.044 million', '1.415 million', '2009', '2016', 'slowed down']",Immigration_in_Singapore.pdf
How did the Ministry of Manpower (MOM) revise its Employment Pass scheme in 2012?,"The MOM revised its Employment Pass scheme in 2012 by tightening its eligibility requirements, including increasing the qualifying salaries of the P2 Pass and Q1 Pass, and raising the bar for older applicants to qualify for the Q1 Pass.","['tightening', 'eligibility', 'requirements', 'increasing', 'qualifying', 'salaries', 'raising', 'bar', 'older', 'applicants', 'qualify']",Immigration_in_Singapore.pdf
"What was the reason for the protest attended by 5,000 people in opposition to the White Paper on Population?","The protest was attended by 5,000 people in opposition to the White Paper on Population because the public perceived that the paper's proposals would lead to an increase in the number of foreign workers in Singapore, which would negatively impact the job market and the quality of life for Singaporeans.","['negatively', 'impact', 'Singaporeans']",Immigration_in_Singapore.pdf
What was the outcome of the government's efforts to disassociate population policy from the White Paper?,"The government's efforts to disassociate population policy from the White Paper were successful, as the White Paper was subsequently accepted by Parliament, but the government took steps to distance itself from the paper's proposals and to emphasize that population policy would be determined by the needs of the economy and society.","['successful', 'accepted', 'distancing', 'proposals', 'emphasize', 'needs', 'economy', 'society']",Immigration_in_Singapore.pdf
How did the government's measures to tighten foreign worker policy affect the number of new citizen and permanent resident grants?,"The government's measures to tighten foreign worker policy resulted in a significant decrease in the number of new citizen and permanent resident grants, slowing down to an average of about 20,000 and 30,000 per year, respectively.","['decrease', '20,000', '30,000']",Immigration_in_Singapore.pdf
What was the approximate number of foreign workers in Singapore in 2009?,The number of foreign workers in Singapore in 2009 was around 1.044 million.,['1.044 million'],Immigration_in_Singapore.pdf
What was the approximate number of foreign workers in Singapore in 2016?,The number of foreign workers in Singapore in 2016 was around 1.415 million.,['1.415 million'],Immigration_in_Singapore.pdf
What was the reason for the slowdown in assimilation into the resident workforce in Singapore?,"The slowdown in assimilation into the resident workforce in Singapore was due to measures to slow or halt foreign workforce growth, as well as a reduction in inflows of foreign students.","['slowdown', 'assimilation', 'resident', 'workforce', 'Singapore', 'measures', 'foreign', 'workforce', 'growth', 'reduction', 'inflows', 'foreign', 'students']",Immigration_in_Singapore.pdf
How many foreign students were admitted to Singapore in 2008?,"In 2008, 100,000 foreign students were admitted to Singapore.","['100,000']",Immigration_in_Singapore.pdf
How many foreign students were admitted to Singapore in 2012?,"In 2012, 84,000 foreign students were admitted to Singapore.","['84,000']",Immigration_in_Singapore.pdf
What is the main source of migrant inflow into Singapore?,The main source of migrant inflow into Singapore is foreign workers.,['foreign workers'],Immigration_in_Singapore.pdf
What is tripartism in the context of labor force policy in Singapore?,"Tripartism in the context of labor force policy in Singapore refers to the cooperative role of the government, employers, and labor unions in sustaining employment, business growth, and wage growth.","['Tripartism', 'government', 'employers', 'labor unions', 'employment', 'business growth', 'wage growth']",Immigration_in_Singapore.pdf
What is the role of the Economic Development Board in Singapore's immigration policy?,The Economic Development Board in Singapore is responsible for engaging foreign investors and multinational enterprises and prioritizing their needs in terms of labor market reforms and foreign manpower.,"['Economic Development Board', 'Singapore', 'labor market', 'foreign manpower']",Immigration_in_Singapore.pdf
What is the approach to managing foreign labor in Singapore?,"The approach to managing foreign labor in Singapore differs substantially by the skill level of migrants. Low-skilled migrants are viewed as temporary guest workers and are subject to strict conditions, while skilled foreigners are encouraged to bring their families and have a path to permanent residency or citizenship.","['temporary', 'guest', 'workers', 'strict', 'conditions', 'skilled', 'foreigners', 'families', 'permanent', 'residency', 'citizenship']",Immigration_in_Singapore.pdf
What is the rationale behind Singapore's immigration policy?,"The rationale behind Singapore's immigration policy is to maintain economic competitiveness and growth, fill labor shortages, and provide care services within the household, while also addressing demographic considerations such as low fertility and an aging population.","['maintain', 'economic', 'competitiveness', 'growth', 'fill', 'labor', 'shortages', 'provide', 'care', 'services', 'household', 'addressing', 'demographic', 'considerations', 'low', 'fertility', 'aging', 'population']",Immigration_in_Singapore.pdf
What is the percentage of low-skilled migrants in Singapore's foreign workforce according to Figure 3?,"According to Figure 3, low-skilled migrants in the form of Work Permit (WP) holders comprise around 50% of Singapore's foreign workforce.",['50%'],Immigration_in_Singapore.pdf
What is the purpose of the dependency ratio ceiling for employers in Singapore?,"The purpose of the dependency ratio ceiling is to limit the number of foreign workers that an employer can hire, in order to preserve resident jobs and promote complementarity between resident workers and foreign workers.","['limit', 'foreign workers', 'resident jobs', 'complementarity']",Immigration_in_Singapore.pdf
What is the qualifying salary criteria for S Pass holders in Singapore?,"The qualifying salary criteria for S Pass holders is set at more than S$3,000 but less than S$5,000, with a degree or diploma, and relevant work experience.","['S$3,000', 'S$5,000']",Immigration_in_Singapore.pdf
What is the main rationale behind the mechanisms to regulate the supply of low-skilled foreign workers in Singapore?,"The main rationale is to balance the need to supplement the labor force to sustain economic growth while keeping production costs reasonable, and at the same time to avoid excessive reliance on foreign workers.","['balance', 'supplement', 'labor force', 'economic growth', 'production costs', 'foreign workers']",Immigration_in_Singapore.pdf
How does the foreign worker levy vary in Singapore?,"The foreign worker levy varies by sector, source country, and skill level of the migrant.","['The', 'foreign', 'worker', 'levy', 'varies']",Immigration_in_Singapore.pdf
What is the objective of the qualifying wage criteria for S Pass holders?,The objective of the qualifying wage criteria for S Pass holders is to ensure that Employment Pass (EP) and S Pass holders are comparable in quality to the top one-third of local PMET and APT workforce respectively.,"['Ensure', 'quality', 'top', 'one-third', 'local', 'PMET', 'APT', 'workforce']",Immigration_in_Singapore.pdf
What is the percentage of foreign domestic helpers in Singapore's foreign workforce from 2009 to 2021?,Foreign domestic helpers accounted for around 15% to 20% of Singapore's foreign workforce from 2009 to 2021.,"['15%', '20%']",Immigration_in_Singapore.pdf
What is the purpose of the Work Permit (WP) scheme in Singapore?,"The Work Permit (WP) scheme is designed to allow foreign workers from approved source countries to work for a specified employer in certain sectors, such as construction, manufacturing, marine shipyard, process or the services sector.","['Work', 'Permit', 'scheme', 'Singapore', 'foreign', 'workers', 'approved', 'source', 'countries', 'specified', 'employer', 'sectors']",Immigration_in_Singapore.pdf
How has the Singapore government actively used the foreign worker levy and the dependency ratio ceiling in the past 30 years?,"The Singapore government has actively used both the foreign worker levy and the dependency ratio ceiling to achieve longer-term policy aims, as well as to manage the short-term flow of labor in response to economic cycles and other events.","['The', 'Singapore', 'government', 'has', 'actively', 'used', 'both', 'the', 'foreign', 'worker', 'levy', 'and', 'the', 'dependency', 'ratio', 'ceiling', 'to', 'achieve', 'longer-term', 'policy', 'aims', 'as', 'well', 'as', 'to', 'manage', 'the', 'short-term', 'flow', 'of', 'labor', 'in', 'response', 'to', 'economic', 'cycles', 'and', 'other', 'events']",Immigration_in_Singapore.pdf
What is the name of the framework that regulates the hiring of low-skilled and medium-skilled temporary foreign workers in Singapore?,The framework that regulates the hiring of low-skilled and medium-skilled temporary foreign workers in Singapore is known as the Work Permit (WP) and S Pass scheme.,"['Work Permit', 'S Pass']",Immigration_in_Singapore.pdf
What has the Singapore government done to manage the short-term flow of labor in response to economic cycles and other events?,"The Singapore government has actively used both the foreign worker levy and the dependency ratio ceiling to achieve longer-term policy aims, as well as to manage the short-term flow of labor in response to economic cycles and other events.","['The', 'Singapore', 'government', 'has', 'actively', 'used', 'both', 'the', 'foreign', 'worker', 'levy', 'and', 'the', 'dependency', 'ratio', 'ceiling', 'to', 'achieve', 'longer-term', 'policy', 'aims', 'as', 'well', 'as', 'to', 'manage', 'the', 'short-term', 'flow', 'of', 'labor', 'in', 'response', 'to', 'economic', 'cycles', 'and', 'other', 'events']",Immigration_in_Singapore.pdf
What is the purpose of the Foreign Maid Scheme in Singapore?,The Foreign Maid Scheme was introduced in 1978 to facilitate the hiring of domestic workers from regional countries beyond Malaysia to provide live-in domestic help as a means to ensure affordable child care and elder care to encourage female residents to enter the labor force.,"['To', 'facilitate', 'domestic', 'workers', 'regional', 'countries', 'beyond', 'Malaysia', 'live-in', 'domestic', 'help', 'affordable', 'child', 'care', 'elder', 'care', 'encourage', 'female', 'residents', 'labor', 'force']",Immigration_in_Singapore.pdf
What are the requirements for foreign domestic workers (FDWs) in Singapore?,"FDWs must be female, between the ages of 23 to 50, have a minimum of 8 years of formal education, and be from an approved source country or region. They must also meet age, nationality, and education requirements to quality for a Work Permit.","['female', '23', '50', '8', 'approved', 'source', 'country', 'region', 'Work', 'Permit']",Immigration_in_Singapore.pdf
What are the requirements for employers who wish to hire an FDW in Singapore?,"Employers must be 21 years and above and be financially solvent. They are also required to pay a monthly levy, with concessionary rates available to older employers as well as those with disabilities, as well as employers residing with young children, older parents/grandparents, and/or disabled family members.","['21', 'financially solvent', 'monthly levy', 'concessionary rates', 'older employers', 'disabled', 'young children', 'older parents/grandparents', 'disabled family members']",Immigration_in_Singapore.pdf
What is the purpose of the Employment Pass (EP) in Singapore?,"The EP is meant for foreign professionals, managers, and executives and is granted for a period of two years in the first instance, and thereafter is subjected to renewal on a three-year basis. The policy objective for managing the EP qualifying salary is to maintain the quality of EP holders to be comparable to the upper one-third of resident workers in the same skill category.","['The', 'EP', 'is', 'meant', 'for', 'foreign', 'professionals', 'managers', 'and', 'executives']",Immigration_in_Singapore.pdf
