question,answer,tokens_present,document
What are the criteria governing the issuance of the EP in Singapore?,"Employers must demonstrate that they posted the job offer on the official online job portal approved by the Singapore government and have fairly considered residents for the role, before they are eligible to apply for the EP.","['Employers', 'must', 'demonstrate', 'posted', 'job', 'offer', 'official', 'online', 'job', 'portal', 'approved', 'Singapore', 'government', 'fairly', 'considered', 'residents', 'role', 'eligible', 'apply', 'EP']",Immigration_in_Singapore.pdf
Can EP holders bring their family members into Singapore?,"Yes, EP holders who earn at least S$6,000 are allowed to bring their family members into Singapore under a dependent’s Pass.",['Yes'],Immigration_in_Singapore.pdf
Is there a quota on the number of EPs that can be granted in Singapore?,"No, there is no quota on the number of EPs that can be granted in Singapore.",['No'],Immigration_in_Singapore.pdf
Can EP holders change employers freely in Singapore?,"No, EP holders cannot change employers freely in Singapore.",['No'],Immigration_in_Singapore.pdf
What is the purpose of the dependency ratio ceiling in Singapore?,"The dependency ratio ceiling is used to manage the short-term flow of labor in response to economic cycles and other events, and to achieve longer-term policy aims. It is lowered in selected sectors to reduce Singapore’s reliance on foreign workers.","['dependency ratio ceiling', 'Singapore', 'foreign workers']",Immigration_in_Singapore.pdf
