question,answer,tokens_present,document
"What is the main issue that inhibits the mitigation of vulnerabilities in the ""DFS over telecom"" ecosystem?","The main issue that inhibits the mitigation of vulnerabilities in the ""DFS over telecom"" ecosystem is a misalignment of interests and misplaced liability between the telecom and financial regulators.","['misalignment', 'interests', 'misplaced', 'liability', 'telecom', 'financial', 'regulators']",Technical_Report
"What is the role of ITU-T Study Group 11 in mitigating the vulnerabilities in the ""DFS over telecom"" ecosystem?",ITU-T Study Group 11 could develop technical guidelines for the baseline security measures for each category (3G/4G/5G) to ensure a more secure interconnection environment and encourage the industry to develop more secure solutions.,"['ITU-T', 'Study Group 11', 'baseline security measures', 'interconnection environment', 'secure solutions']",Technical_Report
"What is the significance of educating telecom and financial services regulators on the vulnerabilities that plague the ""DFS over telecom"" ecosystem?","Educating telecom and financial services regulators on the vulnerabilities that plague the ""DFS over telecom"" ecosystem is significant because it raises awareness of the existence of these vulnerabilities and the need for mitigation measures, which can lead to the implementation of regulations and measures to secure the ecosystem.","['significance', 'vulnerabilities', 'DFS', 'telecom', 'financial', 'regulators', 'awareness', 'mitigation', 'regulations', 'secure']",Technical_Report
"What is the potential impact of not mitigating the vulnerabilities in the ""DFS over telecom"" ecosystem?","The potential impact of not mitigating the vulnerabilities in the ""DFS over telecom"" ecosystem is significant, as it can lead to continued fraud and theft","['significant', 'continued', 'fraud', 'theft']",Technical_Report
What is the difference between MT-SMS and MO-SMS?,"MT-SMS stands for Mobile Terminated SMS, which is sent from a telecom operator to a mobile device, while MO-SMS stands for Mobile Originated SMS, which is sent from a mobile device to a telecom operator.","['MT-SMS', 'MO-SMS']",Technical_Report
"What is social engineering, and how is it used in the USSD attack described in clause 6.3?","Social engineering is the use of psychological manipulation to trick individuals into divulging confidential information or performing actions that can be exploited by attackers. In the USSD attack described in clause 6.3, the attacker impersonates the DFS provider and sends a USSD message to the victim, tricking them into entering their account number and PIN, which can then be used to take over the victim's account.","['Social engineering', 'psychological manipulation', 'trick', 'confidential information', 'USSD message', 'account number', 'PIN', 'take over']",Technical_Report
"What is the main security vulnerability in the SS7 network, according to clause 7?","The main security vulnerability in the SS7 network, according to clause 7, is the use of outdated protocols, such as the SS7 protocol, which has been around since the 1980s and has known vulnerabilities that have not been addressed in newer versions of the protocol, such as Diameter.","['outdated protocols', 'SS7 protocol', 'known vulnerabilities', 'Diameter']",Technical_Report
"How can an attacker locate a target subscriber using the location tracking vulnerability, according to clause 8?","An attacker can locate a target subscriber using the location tracking vulnerability, according to clause 8, by exploiting the fact that mobile networks need to efficiently route messages to subscribers, and therefore the home network knows where to send messages to contact any given subscriber.","['exploiting', 'mobile', 'networks', 'home', 'send', 'messages', 'contact']",Technical_Report
"What is the name of the protocol used for signaling in 4G-LTE networks, according to clause 7?","The name of the protocol used for signaling in 4G-LTE networks, according to clause 7, is Diameter.",['Diameter'],Technical_Report
How much does it cost to create a basic MITM system that can intercept cellular communications?,"Creating a basic MITM system that can intercept cellular communications can cost as little as $500, using open-source software and hardware that can be purchased on e-commerce platforms.",['$500'],Technical_Report
"What is the SS7 network, and why is it vulnerable to attacks?","The SS7 network is a global network used by mobile operators to communicate with each other and exchange information. It is vulnerable to attacks because it was previously considered a ""walled garden"" that could only be accessed by licensed mobile operators, but now, other non-licensed entities have gained access to the network, and it can be exploited by hackers who can gain unauthorized access to the network and exploit cellular vulnerabilities.","['SS7 network', 'global network', 'mobile operators', 'licensed mobile operators', 'non-licensed entities', 'hackers', 'unauthorized access', 'cellular vulnerabilities']",Technical_Report
"What is the cellular attack kill chain, and what information does an attacker need to obtain to execute each step in the kill chain?","The cellular attack kill chain is a series of steps an attacker must take to gain access to sensitive data and execute attacks such as online account takeover. An attacker needs to obtain information such as the victim's phone number, location, and authentication data to execute each step in the kill chain.","['cellular attack kill chain', 'attacker', 'sensitive data', 'online account takeover', ""victim's phone number"", 'location', 'authentication data']",Technical_Report
What is the significance of the fact that the encryption used in cellular communications can be cracked?,"The fact that the encryption used in cellular communications can be cracked means that an attacker can intercept and decrypt cellular communications, including calls, SMS, and HTTP traffic, which can lead to theft of sensitive information and execution of cellular attacks.","['The fact that', 'can be cracked', 'means that', 'an attacker can', 'intercept and decrypt', 'cellular communications', 'including calls', 'SMS', 'HTTP traffic', 'which can lead to', 'theft of sensitive information', 'execution of cellular attacks']",Technical_Report
What is the purpose of rerouting the victim's calls and SMS in the cellular attack kill chain?,"Rerouting the victim's calls and SMS allows the attacker to intercept and manipulate the victim's communication, enabling the attacker to perform MITM attacks and steal sensitive information.","['intercept', 'manipulate', 'MITM', 'sensitive information']",Technical_Report
What is the simplest attack to execute and scale an attack using USSD?,"The simplest attack to execute and scale an attack using USSD is phishing, where the attacker sends a fraudulent USSD message to the user, spoofing the identity of the financial service provider, and luring the user to divulge sensitive information such as account number and PIN code.","['phishing', 'USSD', 'fraudulent', 'sensitive information', 'account number', 'PIN code']",Technical_Report
How can an attacker cause denial of service (DoS) for selected subscribers or a network-wide outage using SS7?,"An attacker can cause denial of service (DoS) for selected subscribers or a network-wide outage using SS7 by sending an update location message with an out-of-network serving address, deleting a subscriber's record from the serving visitor location register (VLR), or performing each attack in scale (automatically for a range of IMSIs).",['No'],Technical_Report
"What is SIM card swap, and how does it allow an attacker to take over a victim's account?","SIM card swap is a type of attack where an attacker social engineers the mobile carrier to issue them a SIM card belonging to the victim, by impersonating the victim at a point of service, and claiming that they have lost the original SIM card. Once in possession of the cloned SIM, the attacker can access the DFS provider's USSD menu and reset the PIN of the account, allowing them to log in to the account and transfer funds out.","['SIM', 'card', 'swap', 'attacker', 'victim', 'mobile', 'carrier', 'social', 'engineer', 'issue', 'cloned', 'DFS', 'provider', 'USSD', 'menu', 'reset', 'PIN', 'account', 'transfer', 'funds']",Technical_Report
What is the difference between a DoS attack and a DDoS attack?,A DoS (denial of service) attack is an attack that floods a network or system with traffic in an attempt to make it unavailable to users. A DDoS (distributed denial of service) attack is a type of DoS attack that uses multiple compromised systems to flood a targeted network or system with traffic.,"['DoS', 'DDoS', 'floods', 'network', 'system', 'traffic', 'unavailable', 'compromised', 'targeted']",Technical_Report
What is the focus of the document FS.11?,"The document FS.11 focuses on SS7 interconnect security monitoring guidelines, providing strategies for mobile operators to monitor SS7 traffic and detect potential attacks.","['SS7', 'interconnect', 'security', 'monitoring', 'guidelines']",Technical_Report
What is the focus of the document IR.82?,"The document IR.82 outlines general security measures for SS7 security, including SMS specific security measures and many SS7 stack related security measures.","['The document IR.82 outlines general security measures for SS7 security', 'including SMS specific security measures', 'many SS7 stack related security measures']",Technical_Report
What is the focus of the document IR.88?,"The document IR.88 outlines LTE interconnect (roaming) security measures, covering aspects such as routing attacks, DoS, location tracking, and other types of diameter-based interconnection attacks.","['LTE', 'interconnect', 'roaming', 'security', 'measures', 'routing', 'attacks', 'DoS', 'location', 'tracking', 'diameter-based', 'interconnection', 'attacks']",Technical_Report
"What is the reason for the lack of implementation of mitigation strategies among mobile operators, according to the article?","The reason for the lack of implementation of mitigation strategies among mobile operators, according to the article, is that mobile operators have not really addressed the issue of SS7 telecom vulnerabilities.",['not really addressed'],Technical_Report
What is the significance of the SS7 protocol in the telecommunications industry?,"The SS7 protocol is a critical component of the telecommunications industry, as it provides the signaling and control infrastructure for public switched telephone networks (PSTNs) and mobile networks. It is used for a variety of purposes, including call setup, call teardown, and call management.","['SS7', 'protocol', 'telecommunications', 'industry', 'signal', 'control', 'infrastructure', 'public', 'switched', 'telephone', 'networks', 'mobile', 'call', 'setup', 'teardown', 'management']",Technical_Report
What is the importance of implementing best of breed authentication and encryption mechanisms for DFS providers?,"Implementing best of breed authentication and encryption mechanisms for DFS providers is important to protect users' personal information and prevent fraudulent transactions. It also helps to build trust and confidence in the DFS service, which is essential for its success.","['implementing', 'authentication', 'encryption', 'mechanisms', 'protect', 'users', 'personal', 'information', 'prevent', 'fraudulent', 'transactions', 'build', 'trust', 'confidence', 'success']",Technical_Report
What is the purpose of the DFS provider ascertaining the location of the account holder's phone and the IMEI of the phone performing the transaction?,"The purpose of the DFS provider ascertaining the location of the account holder's phone and the IMEI of the phone performing the transaction is to detect and mitigate interception of MO-USSD transactions. By comparing the location of the phone performing the current transaction to the last reported location of the phone, the DFS provider can identify any abrupt changes in network location, which may indicate that the phone has been compromised. Additionally, by checking the IMEI of the phone performing the transaction, the DFS provider can ensure that it matches the IMEI of the account holder's phone, which helps to prevent fraudulent transactions.","['detect', 'mitigate', 'interception', 'MO-USSD', 'transaction', 'location', 'phone', 'IMEI', 'compromised', 'fraudulent']",Technical_Report
"What is the purpose of the DFS provider blocking the account pending account verification procedures, for example, via a voice call or an agent?","The purpose of the DFS provider blocking the account pending account verification procedures is to prevent fraudulent transactions and protect the security of the account holder's information. By blocking the account, the DFS provider can ensure that no further transactions can be performed until the account holder has","[""The purpose of the DFS provider blocking the account pending account verification procedures is to prevent fraudulent transactions and protect the security of the account holder's information. By blocking the account, the DFS provider can ensure that no further transactions can be performed until the account holder has""]",Technical_Report