question,answer,tokens_present,document
How long should written off loan accounts for which claims have been lodged with DICGC but are pending for settlement be maintained?,Written off loan accounts for which claims have been lodged with DICGC but are pending for settlement should be maintained for a period of 5 years from the date of settlement of the claim.,['5 years'],Policy_Document.pdf
How long should non-DICGC loans (General Category) that have been fully written off be maintained?,Non-DICGC loans (General Category) that have been fully written off should be maintained for a period of 5 years from the date of closure.,['5 years'],Policy_Document.pdf
What is the minimum period for which written off loan accounts for which DICGC claims have already been settled and adjusted to the loan accounts should be maintained?,"Written off loan accounts for which DICGC claims have already been settled and adjusted to the loan accounts should be maintained for a period of not less than 5 years from the date of closure of account, of the current calendar year.",['5 years'],Policy_Document.pdf
What is the minimum retention period for written off loan accounts for which claims have been lodged with DICGC but are pending for settlement?,The minimum retention period for written off loan accounts for which claims have been lodged with DICGC but are pending for settlement is 5 years from the date of settlement of the claim.,['5 years'],Policy_Document.pdf
How long should non-DICGC loans (General Category) that have been fully written off be maintained?,Non-DICGC loans (General Category) that have been fully written off should be maintained for a period of not less than 5 years from the date of closure of the account.,['5 years'],Policy_Document.pdf
What is the retention period for records of Government transactions?,"Records of Government transactions should be preserved as per guidelines for each scheme. Scrolls relating to Government transactions should be preserved for a period not less than 5 years immediately preceding the current calendar year, and consolidation sheets should be preserved for a period not less than 3 years preceding the current calendar year.","['5 years', '3 years']",Policy_Document.pdf
Can records be destroyed without permission from the competent authority?,"No, records should not be destroyed without permission from the competent authority.",['No'],Policy_Document.pdf
Who is the competent authority for granting approval for destruction of old records?,"The competent authority for granting approval for destruction of old records is the Zonal Office for branches/offices under Zonal Office, and the HO GA Department for Zonal Offices/HO Departments.","['Zonal Office', 'HO GA Department']",Policy_Document.pdf
What is the retention period for the Register of Members?,The retention period for the Register of Members is permanent.,['permanent'],Policy_Document.pdf
"How long should Provident Fund Registers, Provident Fund Loan Ledgers, and Provident Fund General Ledgers be maintained?","Provident Fund Registers, Provident Fund Loan Ledgers, and Provident Fund General Ledgers should be maintained permanently.",['permanently'],Policy_Document.pdf
What is the retention period for records relating to transactions which are in dispute?,Records relating to transactions which are in dispute should be maintained permanently.,['permanently'],Policy_Document.pdf
How long should Premises and properties files and records be maintained?,Premises and properties files and records should be maintained permanently.,['permanently'],Policy_Document.pdf
What is the retention period for Account opening forms of Current and Savings Bank and other Accounts with copy of proof of identity and address and other documents?,Account opening forms of Current and Savings Bank and other Accounts with copy of proof of identity and address and other documents should be maintained permanently.,['permanently'],Policy_Document.pdf
What is the retention period for records related to permanent premises and properties?,27 years,['27 years'],Policy_Document.pdf
"What is the retention period for records related to loans, cash credits, and overdrafts?",28 years,['28 years'],Policy_Document.pdf
What is the retention period for records related to powers of attorney?,29 years,['29 years'],Policy_Document.pdf
What is the retention period for account opening forms and other account-related documents?,30 years,['30 years'],Policy_Document.pdf
What is the retention period for leave record registers?,31 years,['31 years'],Policy_Document.pdf
What is the retention period for memorandum of letters of lockers and specimen signature cards?,32 years,['32 years'],Policy_Document.pdf
What is the retention period for safe deposit locker registers and agreements?,33 years,['33 years'],Policy_Document.pdf
What is the retention period for key registers?,34 years,['34 years'],Policy_Document.pdf
What is the retention period for general ledgers?,35 years,['35 years'],Policy_Document.pdf
What is the retention period for specimen signature files or books?,36 years,['36 years'],Policy_Document.pdf
What is the retention period for confidential files and files relating to industrial disputes and writ petitions?,37 years,['37 years'],Policy_Document.pdf
What is the retention period for H.O. circulars?,38 years,['38 years'],Policy_Document.pdf
What is the retention period for claims files?,39 years,"['39', 'years']",Policy_Document.pdf
What is the retention period for head office correspondence?,40 years,['40 years'],Policy_Document.pdf
What is the retention period for sundry assets files?,41 years,['41 years'],Policy_Document.pdf
What is the retention period for credit information books?,42 years,['42 years'],Policy_Document.pdf
What is the retention period for office order books?,43 years,['43 years'],Policy_Document.pdf
What is the retention period for furniture files?,44 years,['44 years'],Policy_Document.pdf
What is the retention period for indemnity bonds?,45 years,['45 years'],Policy_Document.pdf
What is the retention period for ATM card/debit card issue registers/applications?,46 years,['46 years'],Policy_Document.pdf
"What is the retention period for default account intimation for funds transfer, utility payment in respect of tele-internet banking registers/applications?",47 years,['47 years'],Policy_Document.pdf
What is the retention period for acknowledgement for receipt of PIN/password/user ID?,48 years,['48 years'],Policy_Document.pdf
What is the retention period for vendor agreements/third-party agreements?,49 years,['49 years'],Policy_Document.pdf
What is the retention period for pre-migration data backup (physical)?,50 years,['50 years'],Policy_Document.pdf
What is the retention period for user identification registers?,51 years,['51 years'],Policy_Document.pdf
What is the retention period for registers indicating records held in electronic form?,52 years,['52 years'],Policy_Document.pdf
What is the retention period for disputed transaction records?,53 years,['53 years'],Policy_Document.pdf
What is the retention period for FEDAI circulars?,54 years,['54 years'],Policy_Document.pdf
What is the retention period for international division circulars?,55 years,['55 years'],Policy_Document.pdf
What is the retention period for specimen signatures of foreign bank officials?,56 years,['56 years'],Policy_Document.pdf
What is the retention period for booklet supplied by RBI to identify the names of the parties blacklisted and necessary amendments?,57 years,['57 years'],Policy_Document.pdf
What is the retention period for claim application on account of deceased non-resident (ordinary)/non-resident (external)/FCNR (B) account holders?,58 years,['58 years'],Policy_Document.pdf
What is the retention period for records pertaining to unpaid export bills along with correspondence and GR Form?,59 years,['59 years'],Policy_Document.pdf
What is the retention period for REPO registers?,60 years,['60 years'],Policy_Document.pdf
What is the retention period for EM registers?,61 years,['61 years'],Policy_Document.pdf
What is the retention period for jewel appraiser’s file?,62 years,['62 years'],Policy_Document.pdf
What is the minimum period for which banks must preserve their records?,"Not less than 10 years for certain records, and not less than 8 years for other records.","['10 years', '8 years']",Policy_Document.pdf
What are the records that must be preserved for not less than 10 years?,"Records related to cash transactions, remittance registers, cable transfer orders, mail transfer orders, cash receipts and payment books, and all records relating to series of cash transactions integrally connected to each other.","['cash', 'transactions', 'remittance', 'cable', 'mail', 'cash receipts', 'payment books', 'records']",Policy_Document.pdf
What are the records that must be preserved for not less than 8 years?,"Day book and supplementary, subsidiary ledgers, overdraft registers, loans, advances and cash credit registers, sundry small balances, general accounts, sundry assets, records of sale and purchase contracts, register of shares received, summary of liabilities by guarantees and indemnity, and ledgers for forward exchange contracts.","['Day book', 'subsidiary ledgers', 'overdraft registers', 'loans', 'advances', 'cash credit registers', 'sundry small balances', 'general accounts', 'sundry assets', 'records of sale and purchase contracts', 'register of shares received', 'summary of liabilities by guarantees and indemnity', 'ledgers for forward exchange contracts']",Policy_Document.pdf
What is the purpose of preserving these records?,"To maintain a record of all financial transactions and activities, and to facilitate auditing and monitoring by regulatory authorities.","['To', 'maintain', 'record', 'financial', 'transactions', 'activities', 'facilitate', 'auditing', 'monitoring', 'regulatory', 'authorities']",Policy_Document.pdf
What are the consequences of not preserving these records?,Banks may face penalties and legal consequences for non-compliance with regulatory requirements.,"['penalties', 'legal', 'consequences']",Policy_Document.pdf
Can banks destroy these records after the prescribed period?,"Yes, banks can destroy these records after the prescribed period, but they must ensure that they have been properly preserved and archived before destruction.",['Yes'],Policy_Document.pdf
How must banks preserve these records?,"Banks must preserve these records in a secure and accessible manner, such as in a fireproof safe or a secure digital storage device.","['secure', 'accessible', 'fireproof', 'digital', 'storage', 'device']",Policy_Document.pdf
Who is responsible for ensuring compliance with record-keeping requirements?,The management of the bank is responsible for ensuring compliance with record-keeping requirements.,"['The', 'management', 'of', 'the', 'bank', 'is', 'responsible', 'for', 'ensuring', 'compliance', 'with', 'record-keeping', 'requirements']",Policy_Document.pdf
Can banks outsource their record-keeping requirements to third-party vendors?,"Yes, banks can outsource their record-keeping requirements to third-party vendors, but they must ensure that the vendors have adequate security measures in place to protect the records.",['Yes'],Policy_Document.pdf
How often must banks review their record-keeping procedures?,Banks must review their record-keeping procedures regularly to ensure that they are in compliance with regulatory requirements and to identify any areas for improvement.,['regularly'],Policy_Document.pdf
What is the minimum retention period for records related to uncleared bills?,Not less than 5 years.,"['Not', 'less', 'than', '5', 'years']",Policy_Document.pdf
What is the retention period for records related to closed accounts?,Not less than 5 years.,"['Not', 'less', 'than', '5', 'years']",Policy_Document.pdf
How long should bankers' files be preserved?,Permanent until arrangement is in force.,['Permanent'],Policy_Document.pdf
What is the retention period for inspection/audit reports?,Not less than 5 years.,"['Not', 'less', 'than', '5', 'years']",Policy_Document.pdf
How long should general files be preserved?,Not less than 5 years.,"['Not', 'less', 'than', '5', 'years']",Policy_Document.pdf
What is the retention period for records related to letters of credit?,Not less than 5 years.,"['Not', 'less', 'than', '5', 'years']",Policy_Document.pdf
How long should brokers' contracts file be preserved?,Not less than 5 years.,"['Not', 'less', 'than', '5', 'years']",Policy_Document.pdf
What is the retention period for records related to safe custody receipts?,Not less than 5 years.,"['Not', 'less', 'than', '5', 'years']",Policy_Document.pdf
How long should service charges/commission files be preserved?,Not less than 5 years.,"['Not', 'less', 'than', '5', 'years']",Policy_Document.pdf
What is the retention period for general letter correspondence?,"Not less than 5 years.

I hope these question-answer pairs are helpful! Let me know if you need any more assistance.","['Not', 'less', 'than', '5', 'years']",Policy_Document.pdf
"What is the minimum retention period for the following documents:

1. Files of rejected loan proposals?
2. Application forms for closed loans?
3. Bill realization letters received from collecting Bankers/Branches?
4. Acknowledgements?
5. V.P. Receipts files?
6. NOSTRO A/c. /Position Register?
7. Confirmations for Telegrams?
8. Purchase/Sale Note?
9. Reconciliation sheets?
10. GR/SBF/EP/PP/SOFTEX Form Register/System generated Hard Copy?
",The purpose of the Mid-year review is to assess the progress of the branch's operations and identify areas that require improvement.,,Policy_Document.pdf
What is the purpose of the Mid-year review?,The minimum retention period for Salary bills of teachers is not less than 3 years.,"['not', 'less', '3', 'years']",Policy_Document.pdf
What is the minimum retention period for Salary bills of teachers?,The purpose of the Concurrent Auditor’s Report is to provide an independent assessment of the branch's operations and identify any risks or weaknesses in internal controls.,[],Policy_Document.pdf
What is the purpose of the Concurrent Auditor’s Report?,The minimum retention period for the Book of Shares lodged for transfer is not less than 3 years.,"['not', 'less', 'than']",Policy_Document.pdf
What is the minimum retention period for the Book of Shares lodged for transfer?,The purpose of the Drawing Power Register is to maintain a record of the branch's drawing power and ensure that it is within the approved limits.,[],Policy_Document.pdf
What is the purpose of the Drawing Power Register?,The minimum retention period for the Sub-Daybook is not less than 3 years.,"['not', 'less', 'than']",Policy_Document.pdf
What is the minimum retention period for the Sub-Daybook?,The purpose of the LFAR - Review Report is to assess the branch's compliance with the Large Exposure Framework and identify any risks or weaknesses in the branch's risk management practices.,[],Policy_Document.pdf
What is the purpose of the LFAR - Review Report?,The minimum retention period for the Press copy books is not less than 3 years.,"['not', 'less', 'than']",Policy_Document.pdf
What is the minimum retention period for the Press copy books?,The purpose of the Salary Book is to maintain a record of the branch's salary payments to its employees.,[],Policy_Document.pdf
What is the purpose of the Salary Book?,The minimum retention period for the GR/SBF/EP/PP/SOFTEX Form Register/System generated Hard Copy is not less than 3 years.,"['not', 'less', 'than']",Policy_Document.pdf