question,answer,tokens_present,document
What is the purpose of maintaining records in a bank?,"The purpose of maintaining records in a bank is to have a reference for various purposes like verification by internal auditors, inspectors, officials, and external statutory bodies like RBI, SEBI, etc. Records are also required for verifying old transactions, processes, or events, and in case of any complaint or information sought by any citizen of India under RTI Act.","['maintaining', 'records', 'bank', 'verification', 'internal', 'auditors', 'inspectors', 'officials', 'external', 'statutory', 'bodies', 'RTI', 'Act']",Policy_Document.pdf
What are the general guidelines for handling and retaining records in a bank?,"The general guidelines for handling and retaining records in a bank include serially entering all books and registers in a register of current-cum-old records, with separate openings for each section. The serial number and section number must be indicated on the cover of each book or file for easy identification. Employees handling records must be responsible for their custody during the day time, while overnight, all current records must remain under lock and key in the custody of the respective section in-charge.","['serially', 'separate', 'easy', 'custody', 'overnight', 'lock', 'key', 'custody', 'respective', 'in-charge']",Policy_Document.pdf
What is the procedure for transferring old records to a record room or warehouse?,"The procedure for transferring old records to a record room or warehouse includes intimating the concerned zonal office that the records are ready for transfer/shifting, entering the request in the Old Record Control Register, and sending a photocopy of the perforated sheets duly marked with the Zone Control Number to the concerned Record Room/Warehouse.","['intimating', 'entering', 'sending']",Policy_Document.pdf
How should records be kept to protect them against fire hazards?,"Records should be kept in a manner that prevents them from deteriorating and are easily traceable for reference. Books and files must be handled carefully to keep them intact, and loose pages must be immediately replaced in the proper order. Important records should be kept in a strong room overnight, and in case of inadequacy of space, they may be kept in fire-resistant steel cabinets outside the strong room.","['Records', 'should', 'kept', 'manner', 'prevents', 'deteriorating', 'traceable', 'reference', 'books', 'files', 'handled', 'carefully', 'intact', 'loose', 'pages', 'immediately', 'replaced', 'proper', 'order', 'important', 'records', 'strong', 'room', 'overnight', 'inadequacy', 'space', 'fire-resistant', 'steel', 'cabinets', 'outside', 'strong', 'room']",Policy_Document.pdf
What documents should be kept in the strong room overnight?,"Documents that should be kept in the strong room overnight include account opening forms, locked loose leaf binders of specimen signatures, articles in safe custody, and records pertaining to articles in safe custody, G.P. Notes, Shares, etc.","['account opening forms', 'locked loose leaf binders', 'articles in safe custody', 'records pertaining to articles in safe custody', 'G.P. Notes', 'Shares', 'etc']",Policy_Document.pdf
"What should be done with loan documents, securities, papers, ledgers, etc.?","Loan documents, securities, papers, ledgers, etc. should be kept in safe receptacles.","['should', 'be', 'kept', 'in', 'safe', 'receptacles']",Policy_Document.pdf
What is the purpose of earmarking space for a Record Section in branches?,"The purpose of earmarking space for a Record Section in branches is to have a dedicated area for storing and handling records, which helps in maintaining their confidentiality and easy accessibility.","['dedicated', 'area', 'storing', 'handling', 'records', 'confidentiality', 'accessibility']",Policy_Document.pdf
Can branches have a Record Room by acquiring space on rent?,"Yes, branches can have a Record Room by acquiring sufficient space on rent after examining the space available vis-a-vis business growth at such branches.",['Yes'],Policy_Document.pdf
What should be done with records that are no longer required?,Records that are no longer required should be disposed of as per the bank's record retention policy.,"['dispose of', 'record retention policy']",Policy_Document.pdf
Who is responsible for the custody of records during the day time?,Employees handling records are responsible for their custody during the day time.,"['Employees', 'handling', 'records', 'responsible', 'custody', 'day', 'time']",Policy_Document.pdf
What should be done with the locked loose leaf binder of specimen signatures?,The locked loose leaf binder of specimen signatures must be placed in the strong room.,"['must', 'placed', 'strong', 'room']",Policy_Document.pdf
Where should articles in safe custody be kept?,Articles in safe custody must be kept in the strong room.,['strong room'],Policy_Document.pdf
What should be retained as permanent records in the strong room?,"The records pertaining to articles in safe custody, or G.P. Notes, Shares, etc. must be retained as permanent records in the strong room.","['G.P. Notes', 'Shares', 'safe custody']",Policy_Document.pdf
"How should ledgers, registers, and documents be kept?","All ledgers, registers, and documents should be kept in safe receptacles.",['safe receptacles'],Policy_Document.pdf
What should be kept in fire-proof safe/cabinet?,"All loan documents, securities, papers, ledgers, etc. relating to loans and advances, all account opening forms, balance books, copies of latest half-yearly returns, current loan files of big borrowers, all vouchers for last six months, and if possible, all ledgers of deposit accounts should be kept in fire-proof safe/cabinet and kept in the strong room, where available.","['all', 'loan', 'documents', 'securities', 'papers', 'ledgers', 'account', 'opening', 'forms', 'balance', 'books', 'copies', 'latest', 'half-yearly', 'returns', 'current', 'loan', 'files', 'big', 'borrowers', 'all', 'vouchers', 'last', 'six', 'months', 'ledgers', 'deposit', 'accounts']",Policy_Document.pdf
"What should be done in case of destruction of records due to fire, inundation, flood, earthquake, or any other Act of God?","A list has to be made in respect of the items that are missing and an endorsement has to be made on the register stating that the record Item No. are destroyed by fire, inundation, earthquake, etc.","['fire', 'inundation', 'flood', 'earthquake', 'Act of God']",Policy_Document.pdf
How should files be maintained?,"Files should not be permitted to become over bulky and when 150 pages have been filed, new files should be started. Completed books and files must be properly labeled with the dates of commencement and completion and the latter date entered in the register of current-cum-old records.","['files', 'should', 'not', 'be', 'permitted', 'to', 'become', 'over', 'bulky', 'and', 'when', '150', 'pages', 'have', 'been', 'filed', 'new', 'files', 'should', 'be', 'started', '.', 'Completed', 'books', 'and', 'files', 'must', 'be', 'properly', 'labeled', 'with', 'the', 'dates', 'of', 'commencement', 'and', 'completion', 'and', 'the', 'latter', 'date', 'entered', 'in', 'the', 'register', 'of', 'current-cum-old', 'records']",Policy_Document.pdf
Who is responsible for the custody of old records?,"Old records will remain in the custody of an official, not below the rank of a special assistant, but the handling, thereof, will be entrusted to a daftri, who should work under the supervision of the said official.","['an official', 'a special assistant', 'a daftri']",Policy_Document.pdf
What should be done immediately on receipt of a completed book/file?,"Immediately on receipt of a completed book/file, it will be entered in the relevant columns of current-cum-old register of records in which separate pages will be used for entering files relating to the various sections and different books.","['Immediately', 'completed', 'book', 'file']",Policy_Document.pdf
"What should be done to destroy white ants, mildew, or dry rot in bank records?","Steps should be taken by chemical treatment to destroy any white ant, which may appear in bank's records, immediately, and mildew or dry rot, must be treated at once.","['white ant', 'mildew', 'dry rot', 'chemical treatment', 'immediately']",Policy_Document.pdf
What are the records that incumbents/in-charges are advised not to destroy?,The records that incumbents/in-charges are advised not to destroy are those needed for reconciliation of inter-branch transaction entries for the period up to which Reconciliation Department has not completed reconciliation work.,"['reconciliation', 'inter-branch', 'transaction', 'entries', 'period', 'reconciliation work']",Policy_Document.pdf
What are the vouchers that are sorted into cash payment and other vouchers?,"The vouchers that are sorted into cash payment and other vouchers are cash payment vouchers, clearing vouchers, transfer vouchers, and payment vouchers.","['cash payment vouchers', 'clearing vouchers', 'transfer vouchers', 'payment vouchers']",Policy_Document.pdf
How are cash payment vouchers arranged and sealed?,"Cash payment vouchers are arranged in the order of their entries in the cash book, stitched and sealed at the left-hand top corner. The date and the number of vouchers in each bundle are recorded on its cover, as well as in the voucher register.","['stitched', 'sealed']",Policy_Document.pdf
Who checks the contents of each bundle of cash payment vouchers with the cash book?,"The incumbent in-charge or officer checks the contents of each bundle of cash payment vouchers with the cash book, authenticates the correctness of the date and the number of vouchers given on its cover, and signs in the voucher register for its receipt.","['The', 'incumbent', 'in-charge', 'or', 'officer']",Policy_Document.pdf
"How are vouchers, other than cash payment vouchers, sorted and sealed?","Vouchers, other than cash payment vouchers, are sorted, tallied, stitched and sealed. They are numbered serially and the date and the total number of vouchers in each bundle are recorded on its cover, as well as in the voucher register.","['sorted', 'tally', 'stitched', 'sealed', 'numbered', 'date', 'total', 'bundle', 'cover', 'voucher', 'register']",Policy_Document.pdf
Who is responsible for the custody of cash payment and other vouchers?,The officials responsible for the custody of cash payment and other vouchers are the incumbents/in-charges.,"['incumbents', 'in-charges']",Policy_Document.pdf
How are vouchers taken out of custody for checking?,"Vouchers are taken out of custody on the requisition of a checking official, who will acknowledge their receipt in the registers kept for this purpose.","['Vouchers', 'taken', 'custody', 'requisition', 'checking', 'official', 'receipt', 'registers']",Policy_Document.pdf
What is done when a cheque or voucher is summoned to be produced in court?,"When a cheque or voucher is summoned to be produced in court, a true copy/photo copy thereof, duly attested by the incumbent in-charge, will be substituted for it in the relative bundle, and a remark to the effect that the original has been produced in court, being given on the copy.","['summoned', 'produced', 'court', 'true', 'copy', 'photo', 'attested', 'incumbent', 'in-charge', 'remark', 'effect', 'original', 'produced', 'court']",Policy_Document.pdf
How are banks' records maintained?,Banks' records are maintained duly catalogued and indexed.,"['duly', 'catalogued', 'indexed']",Policy_Document.pdf
What is the purpose of preserving and destroying bank's records?,"The purpose of preserving and destroying bank's records is to assess, monitor and control the risks, explain the nature and purpose of each transaction, observe all statutory and regulatory obligations, and maintain customer confidentiality.","['risks', 'transaction', 'statutory', 'regulatory', 'customer', 'confidentiality']",Policy_Document.pdf
What is the purpose of maintaining records in the banking industry?,"The purpose of maintaining records in the banking industry is to ensure that data is available in a form suitable for the purpose for which it is required and is available to authorized individuals, including RBI inspectors and internal/external auditors, on a timely basis.","['ensure', 'available', 'suitable', 'required', 'authorized', 'individuals', 'timely']",Policy_Document.pdf
What is the requirement for record retention in the banking industry?,"The requirement for record retention in the banking industry is to retain records for a period specified by the Bank, based on the requirement, and to ensure that the records are easily accessible, as and when required.","['retain', 'records', 'period', 'Bank', 'requirement', 'accessible']",Policy_Document.pdf
What is the significance of an audit trail in the banking industry?,"An audit trail is essential in the banking industry as it provides a record of all transactions, including financial statements, and allows for the tracking and verification of data.","['audit trail', 'banking industry', 'record', 'transactions', 'financial statements', 'tracking', 'verification', 'data']",Policy_Document.pdf
What is the purpose of management information in the banking industry?,"Management information in the banking industry is used to provide the management with information at prescribed intervals/periodicity, which discloses financial statements, analysis of significant assets and liabilities, and other relevant information.","['management', 'information', 'banking', 'industry', 'financial', 'statements', 'analysis', 'assets', 'liabilities']",Policy_Document.pdf
What is the purpose of transactional data in the banking industry?,"Transactional data in the banking industry is used to capture data for each transaction, including transaction type, purpose, originator, authorizer, counter-parties, amount/currency, relevant dates, interest/exchange rates, fees/commissions, collateral taken/given, subordination/guarantees, and other transaction specific characteristics.","['transactional', 'data', 'banking', 'industry', 'transaction', 'type', 'purpose', 'originator', 'authorizer', 'counter-parties', 'amount', 'currency', 'relevant', 'dates', 'interest', 'exchange', 'rates', 'fees', 'commissions', 'collateral', 'subordination', 'guarantees']",Policy_Document.pdf
How does the Bank ensure authenticity of electronic documents?,The Bank ensures authenticity of electronic documents by following the instructions contained in the IT Act 2000 and the rules framed thereunder from time to time for authentication of records by digital signatures or any other method of authentication approved by the Bank.,"['The Bank', 'IT Act 2000', 'digital signatures', 'authentication']",Policy_Document.pdf
What is the requirement for record media in the banking industry?,"The requirement for record media in the banking industry is to use a media that allows for the conversion of records from paper to non-paper form, and to ensure that the converted format becomes the prime record.","['non-paper form', 'prime record']",Policy_Document.pdf
What is the purpose of record retention periods in the banking industry?,"The purpose of record retention periods in the banking industry is to ensure compliance with statutory and regulatory requirements, satisfaction of the needs of RBI inspectors to have access to certain records, and satisfaction of the needs of internal and external auditors to have access to certain records.","['compliance', 'statutory', 'regulatory', 'RBI', 'inspectors', 'internal', 'external', 'auditors', 'records']",Policy_Document.pdf
What is the significance of exception reports of limit breaches in the banking industry?,"Exception reports of limit breaches in the banking industry are significant as they provide information on breaches of limits, allowing for corrective action to be taken to prevent further breaches.","['significant', 'breaches', 'limits', 'corrective', 'action']",Policy_Document.pdf
What is the purpose of maturity analysis in the banking industry?,"Maturity analysis in the banking industry is used to analyze the maturity of assets and liabilities, allowing for effective risk management and planning.","['maturity', 'analysis', 'banking', 'industry', 'risk', 'management', 'planning']",Policy_Document.pdf
What are the different formats that can be used for preserving records according to the text?,"The text mentions the following formats for preserving records: microfilm, microfiche, cipher tapes, floppy disks, CDs, and servers.","['microfilm', 'microfiche', 'cipher', 'floppy', 'CDs', 'servers']",Policy_Document.pdf
What is the purpose of determining the media to be used for preserving records?,The purpose of determining the media to be used for preserving records is to ensure that the records are accessible and preserved for the required period of time.,"['ensure', 'preserved', 'required']",Policy_Document.pdf
What are the factors that need to be considered while choosing the medium for preserving records?,"The factors that need to be considered while choosing the medium for preserving records include statutory and regulatory requirements, accessibility, and physical conditions under which the records will be stored.","['statutory', 'regulatory', 'accessibility', 'physical']",Policy_Document.pdf
Where are the records located?,The records are located at the respective branches/offices of the bank. Electronic records may be kept at the respective branches/offices and/or nearby off-site locations.,"['records', 'located', 'branches', 'offices', 'bank', 'electronic', 'records', 'kept', 'off-site']",Policy_Document.pdf
What is the procedure for removing and destroying old records?,"The procedure for removing and destroying old records includes authorization and approval prior to destruction, establishment of procedures for destruction of electronic media, and maintenance of records in registers.","['procedure', 'destruction', 'records']",Policy_Document.pdf
How are old records destroyed?,"Old records are destroyed by burning them in the presence of the incumbent in-charge and the officer. Alternatively, they may be sold to a chemical furnace or paper mill for being burnt or converted into pulp.","['burning', 'sold', 'burnt', 'pulp']",Policy_Document.pdf
What details are recorded in the register of old records?,"The following details are recorded in the register of old records: serial number, description of book/file, date of commencement, date of completion, date of destruction, and mode of destruction.","['serial number', 'description of book/file', 'date of commencement', 'date of completion', 'date of destruction', 'mode of destruction']",Policy_Document.pdf
Who is responsible for seeking approval for destroying old records?,The concerned office is responsible for seeking approval for destroying old records from the Competent Authority.,"['The', 'concerned', 'office', 'is', 'responsible', 'for', 'seeking', 'approval', 'for', 'destroying', 'old', 'records', 'from', 'the', 'Competent', 'Authority']",Policy_Document.pdf
What are the exceptions to the destruction of records?,"Records relating to matters under dispute, matters on which an action by the bank against a customer or by a customer against the bank is likely to be founded, claims notices received by or garnishee orders served on the bank, and correspondence to which important or legal reference may have to be made on a future date should not be destroyed.","['not', 'be', 'destroyed']",Policy_Document.pdf
What is the purpose of maintaining a certificate of destruction of records?,The purpose of maintaining a certificate of destruction of records is to provide evidence that the records have been destroyed as per the rules and to ensure that the destruction has been completed properly.,"['certificate', 'destruction', 'records', 'rules']",Policy_Document.pdf
What is the purpose of the policy for records management in the bank?,"The purpose of the policy is to ensure that records are properly maintained, catalogued, and indexed, and to ensure compliance with regulatory guidelines and internal requirements.","['ensure', 'properly', 'maintained', 'catalogued', 'indexed', 'compliance', 'regulatory', 'guidelines', 'internal', 'requirements']",Policy_Document.pdf
What are the different types of records that the policy covers?,"The policy covers various types of records, including account opening forms, personal ledgers, payment system applications, outward clearing cheques, and electronic records.","['various types of records', 'account opening forms', 'personal ledgers', 'payment system applications', 'outward clearing cheques', 'electronic records']",Policy_Document.pdf
What is the retention period for account opening forms and related documents?,The retention period for account opening forms and related documents is 10 years.,['10 years'],Policy_Document.pdf
"What is the retention period for records related to payment system applications, outward clearing cheques, and electronic clearing system?","The retention period for records related to payment system applications, outward clearing cheques, and electronic clearing system is 10 years.",['10 years'],Policy_Document.pdf
Can certain records be preserved in electronic form?,"Yes, certain records can be preserved in electronic form, and the details of such records and their retention period will be intimated by the HO IT Department separately.",['Yes'],Policy_Document.pdf
What is the role of the Zonal Offices and Head Offices in the records management process?,"The Zonal Offices and Head Offices are responsible for ensuring that the records are properly maintained, catalogued, and indexed, and for rendering assistance to government offices or any agency designated by the bank that seeks information.","['Zonal Offices', 'Head Offices', 'records', 'maintained', 'catalogued', 'indexed', 'assistance', 'government offices', 'agency', 'bank', 'seeks', 'information']",Policy_Document.pdf
How long should items of records that were not included in the list of records to be preserved be maintained?,Items of records that were not included in the list of records to be preserved should continue to be maintained for a period of 10 years.,['10 years'],Policy_Document.pdf
Who is responsible for preparing the procedural aspects regarding maintaining records in electronic form?,The HO IT Department is responsible for preparing the procedural aspects regarding maintaining records in electronic form.,"['The', 'HO', 'IT', 'Department']",Policy_Document.pdf
What should be done with records that are no longer required to be maintained?,Records that are no longer required to be maintained should be destroyed/disposed of after obtaining permission from the Zonal Office/HO GA Department.,"['destroyed', 'disposed of', 'permission', 'Zonal Office', 'HO GA Department']",Policy_Document.pdf
How often should the policy be reviewed?,The policy should be reviewed annually in tune with regulatory guidelines/internal requirements or as and when considered necessary.,"['annually', 'regulatory', 'internal', 'necessary']",Policy_Document.pdf
What is the purpose of maintaining records in electronic form?,The purpose of maintaining records in electronic form is to ensure that the records are properly preserved and can be easily traced as and when required.,"['properly', 'preserved', 'easily', 'traced', 'required']",Policy_Document.pdf
What is the preservation period for items of records that are not included in the list of records to be preserved?,The preservation period for items of records that are not included in the list of records to be preserved is 10 years.,['10 years'],Policy_Document.pdf
What are the difficulties faced due to non-disposal of old records?,"The difficulties faced due to non-disposal of old records include occupation of space meant for destruction, improper segregation of records, wastage of time and money in preserving old records, and non-utilization of space for other productive purposes.","['occupation', 'improper', 'wastage', 'non-utilization']",Policy_Document.pdf
What are the steps to be taken by Incumbents Incharge to make room for proper upkeep of current records?,"The steps to be taken by Incumbents Incharge to make room for proper upkeep of current records include disposing of old records that have lived their preservation period, sending details of surplus stationery items to controlling offices, and ensuring that records are duly catalogued and indexed.","['disposing', 'sending', 'ensuring']",Policy_Document.pdf
What is the deadline for branches to confirm the disposal of old records and segregation of surplus stationery items?,The deadline for branches to confirm the disposal of old records and segregation of surplus stationery items is 15th February every year.,['15th February'],Policy_Document.pdf
"What are the transactions that branches shall maintain records for, as per KYC/AML measures?","Branches shall maintain records of all transactions, whether single or integrally connected, that take place within a month, towards compliance of KYC/AML measures.","['all', 'transactions', 'within', 'month', 'compliance']",Policy_Document.pdf
How long should written off loan accounts for which DICGC claims have already been settled and adjusted to the loan accounts be maintained?,Written off loan accounts for which DICGC claims have already been settled and adjusted to the loan accounts should be maintained for a period of 5 years from the date of closure.,['5 years'],Policy_Document.pdf
