question,answer,tokens_present,document
What is the purpose of the Directors’ responsibility statement?,"The purpose of the Directors’ responsibility statement is to explain the directors’ responsibilities for the financial statements and to confirm that they consider the Annual Report, taken as a whole, is fair, balanced and understandable, and provides the information necessary for the members to assess the group’s and parent company’s position, performance, business model and strategy.","['fair', 'balanced', 'understandable']",HSBC_Annual_Report.pdf
What is the scope of the audit of the financial statements?,"The scope of the audit of the financial statements includes the group’s and parent company’s financial statements, as well as the review of the effectiveness of risk management and internal control systems.","['group’s', 'parent company’s', 'financial statements', 'risk management', 'internal control systems']",HSBC_Annual_Report.pdf
What is the basis of accounting used in the financial statements?,"The financial statements are prepared on the going concern basis of accounting, unless the directors intend to liquidate the group or the parent company or to cease operations, or have no realistic alternative but to do so.",['going concern'],HSBC_Annual_Report.pdf
What is the role of the group engagement team in the audit?,The group engagement team shared the risk assessment with the component auditors so that they could include appropriate audit procedures in response to such risks in their work.,"['shared', 'risk', 'assessment', 'audit', 'procedures']",HSBC_Annual_Report.pdf
What was the purpose of the group engagement team sharing the risk assessment with the component auditors?,The purpose of the group engagement team sharing the risk assessment with the component auditors was so that they could include appropriate audit procedures in response to such risks in their work.,"['so', 'that', 'they', 'could', 'include', 'appropriate', 'audit', 'procedures', 'in', 'response', 'to', 'such', 'risks', 'in', 'their', 'work']",HSBC_Annual_Report.pdf
What were some of the audit procedures performed by the group engagement team and/or component auditors?,"Some of the audit procedures performed by the group engagement team and/or component auditors included review of correspondence with and reports from regulators, review of reporting to the GAC and GRC in respect of compliance and legal matters, enquiries of management and review of internal audit reports, obtaining legal confirmations from legal advisors, assessment of matters reported on the group's whistleblowing programs, challenging assumptions and judgments made by management, obtaining confirmations from third parties, and identifying and testing journal entries.","['review', 'reports', 'enquiries', 'management', 'legal', 'confirmations', 'assessment', 'whistleblowing', 'challenging', 'judgments', 'third parties', 'identifying', 'testing', 'journal', 'entries']",HSBC_Annual_Report.pdf
What are inherent limitations in the audit procedures described above?,"Inherent limitations in the audit procedures described above include the risk of not detecting instances of non-compliance with laws and regulations that are not closely related to events and transactions reflected in the financial statements, as well as the risk of not detecting a material misstatement due to fraud, which may involve deliberate concealment.","['risk', 'non-compliance', 'laws', 'regulations', 'financial statements', 'fraud', 'deliberate concealment']",HSBC_Annual_Report.pdf
How does the audit testing typically work?,"The audit testing typically involves selecting a limited number of items for testing, rather than testing complete populations, and may also involve using audit sampling to enable the auditor to draw a conclusion about the population from which the sample is selected.","['limited', 'testing', 'populations', 'sample', 'auditor', 'conclusion']",HSBC_Annual_Report.pdf
What is the role of professional judgement and scepticism in an audit?,"In an audit, professional judgement and scepticism are essential in identifying and assessing the risks of material misstatement, designing audit procedures responsive to those risks, and obtaining audit evidence that is sufficient and appropriate to provide a basis for the auditor's opinion.","['professional', 'judgement', 'scepticism', 'audit', 'risks', 'material', 'misstatement', 'designing', 'audit procedures', 'obtaining', 'audit', 'evidence', 'basis', ""auditor's"", 'opinion']",HSBC_Annual_Report.pdf
What is the difference between the risk of not detecting a material misstatement resulting from fraud and the risk of not detecting one resulting from error?,"The risk of not detecting a material misstatement resulting from fraud is higher than the risk of not detecting one resulting from error, as fraud may involve collusion, forgery, intentional omissions, misrepresentations, or the override of internal control.","['fraud', 'error']",HSBC_Annual_Report.pdf
What is the purpose of obtaining an understanding of internal controls relevant to the audit?,"The purpose of obtaining an understanding of internal controls relevant to the audit is to design audit procedures that are appropriate in the circumstances, but not for the purpose of expressing an opinion on the effectiveness of the group's and parent company's internal controls.","['obtaining', 'internal', 'controls', 'relevant', 'audit', 'design', 'appropriate', 'circumstances', 'expressing', 'opinion', 'effectiveness', ""group's"", 'parent', ""company's""]",HSBC_Annual_Report.pdf
What is the role of evaluation of accounting policies and estimates in an audit?,"In an audit, the auditor must evaluate the appropriateness of accounting policies used and the reasonableness of accounting estimates and related disclosures made by management.","['appropriateness', 'reasonableness', 'accounting', 'policies', 'estimates', 'disclosures', 'management']",HSBC_Annual_Report.pdf
What is the auditor's responsibility regarding the appropriateness of management's use of the going concern basis of accounting?,"The auditor must conclude on the appropriateness of management's use of the going concern basis of accounting and, based on the audit evidence obtained, whether a material uncertainty exists related to events or conditions that may cast significant doubt on the group's and parent company's ability to continue as a going concern.","['going concern', 'material uncertainty', 'events or conditions', 'ability to continue']",HSBC_Annual_Report.pdf
Where can additional information about the auditor's responsibilities be found?,Additional information about the auditor's responsibilities can be found in the Financial Reporting Council's (FRC) website at: www.frc.org.uk/auditorsresponsibilities.,['www.frc.org.uk/auditorsresponsibilities'],HSBC_Annual_Report.pdf