question,answer,tokens_present,document
What is the name of the credit card launched by HSBC Holdings plc in May 2023?,The name of the credit card launched by HSBC Holdings plc in May 2023 is TravelOne.,['TravelOne'],HSBC_Annual_Report.pdf
In which countries was the TravelOne credit card initially launched?,"The TravelOne credit card was initially launched in Singapore, Malaysia, and Vietnam.","['Singapore', 'Malaysia', 'Vietnam']",HSBC_Annual_Report.pdf
What is the unique feature of the TravelOne credit card?,"The TravelOne credit card allows customers to earn extra reward points for travel and cross-border spending, which can be redeemed instantly with 17 international airline programs and 20,000 hotel partners.","['extra reward points', 'travel', 'cross-border spending', 'redeemed', 'instantly', '17 international airline programs', '20,000 hotel partners']",HSBC_Annual_Report.pdf
What is the purpose of HSBC Holdings plc's wealth strategy?,HSBC Holdings plc's wealth strategy aims to grow its cross-border international customer franchise and unsecured lending business in south Asia.,"['HSBC Holdings plc', 'wealth strategy', 'aims', 'grow', 'cross-border', 'international', 'customer', 'franchise', 'unsecured lending', 'business', 'south Asia']",HSBC_Annual_Report.pdf
What is the name of the report provided by the independent auditors of HSBC Holdings plc?,"The name of the report provided by the independent auditors of HSBC Holdings plc is ""Report of Independent Registered Public Accounting Firm to the Board of Directors and Shareholders of HSBC Holdings plc.""","['Report', 'of', 'Independent', 'Registered', 'Public', 'Accounting', 'Firm', 'to', 'the', 'Board', 'of', 'Directors', 'and', 'Shareholders', 'of', 'HSBC', 'Holdings', 'plc']",HSBC_Annual_Report.pdf
What is the opinion of the independent auditors on the financial statements of HSBC Holdings plc?,"The independent auditors have expressed an unmodified opinion on the financial statements of HSBC Holdings plc, stating that they give a true and fair view of the state of the group's and parent company's affairs as at 31 December 2023 and of the group's and parent company's profit and cash flows for the year then ended.","['unmodified', 'true', 'fair']",HSBC_Annual_Report.pdf
What is the basis for the independent auditors' opinion on the financial statements of HSBC Holdings plc?,"The basis for the independent auditors' opinion on the financial statements of HSBC Holdings plc is International Standards on Auditing (UK) (“ISAs (UK)”), International Standards on Auditing issued by the International Auditing and Assurance Standards Board (“ISAs”), and applicable law.","['International Standards on Auditing (UK)', 'International Standards on Auditing', 'applicable law']",HSBC_Annual_Report.pdf
What is the name of the note that provides material accounting policy information and other explanatory information in the financial statements of HSBC Holdings plc?,The note that provides material accounting policy information and other explanatory information in the financial statements of HSBC Holdings plc is Note 1.1(a) to the financial statements.,"['Note', '1.1(a)']",HSBC_Annual_Report.pdf
"What is the name of the section in the Annual Report and Accounts 2023 that includes the consolidated and parent company balance sheets, income statements, statements of comprehensive income, statements of changes in equity, and statements of cash flows?","The name of the section in the Annual Report and Accounts 2023 that includes the consolidated and parent company balance sheets, income statements, statements of comprehensive income, statements of changes in equity, and statements of cash flows is ""Financial Statements.""",,HSBC_Annual_Report.pdf
What is the name of the committee that the independent auditors report to in relation to their audit of the financial statements of HSBC Holdings plc?,The independent auditors report to the Group Audit Committee (’GAC’) in relation to their audit of the financial statements of HSBC Holdings plc.,['GAC'],HSBC_Annual_Report.pdf
What is the opinion of the auditors regarding the group and parent company financial statements?,The auditors believe that the group and parent company financial statements have been properly prepared in accordance with IFRS Accounting Standards.,"['properly prepared', 'IFRS Accounting Standards']",HSBC_Annual_Report.pdf
What is the basis for the auditors' opinion?,"The auditors conducted their audit in accordance with International Standards on Auditing (UK) (“ISAs (UK)”), International Standards on Auditing issued by the International Auditing and Assurance Standards Board (“ISAs”), and applicable law.","['International Standards on Auditing (UK)', 'International Auditing and Assurance Standards Board', 'applicable law']",HSBC_Annual_Report.pdf
What are the responsibilities of the auditors under ISAs (UK) and ISAs?,"The auditors' responsibilities under ISAs (UK) and ISAs include describing the audit scope, identifying and assessing the risks of material misstatement, and providing a basis for their opinion on the financial statements.","['describing', 'identifying', 'assessing', 'providing']",HSBC_Annual_Report.pdf
How did the auditors assess the risks of material misstatement?,"The auditors assessed the risks of material misstatement by identifying key audit matters, which include expected credit losses, impairment of loans and advances, impairment of investment in associate, valuation of defined benefit pension obligations, and performance materiality.","['expected credit losses', 'impairment of loans and advances', 'impairment of investment in associate', 'valuation of defined benefit pension obligations', 'performance materiality']",HSBC_Annual_Report.pdf
What is the definition of materiality in the context of the audit?,Materiality refers to the significance of a particular item or transaction in relation to the financial statements as a whole. The auditors determined materiality based on a percentage of profit before tax adjusted for notable items.,"['materiality', 'financial', 'statements', 'profit', 'tax', 'notable', 'items']",HSBC_Annual_Report.pdf
What was the overall group materiality for the audit?,"The overall group materiality for the audit was US$1.6bn, based on 5% of profit before tax adjusted for notable items.",['US$1.6bn'],HSBC_Annual_Report.pdf
What was the overall parent company materiality for the audit?,"The overall parent company materiality for the audit was US$1.5bn, based on 0.75% of total assets.","['US$1.5bn', '0.75%']",HSBC_Annual_Report.pdf
What is the purpose of the audit approach section in the report?,"The audit approach section in the report provides an overview of how the auditors approached the audit, how it changed from the previous year, and details of the significant discussions that they had with the GAC.","['how', 'approached', 'audit', 'changed', 'previous', 'year', 'details', 'significant', 'discussions', 'GAC']",HSBC_Annual_Report.pdf
What is the significance of the key audit matters identified by the auditors?,"The key audit matters identified by the auditors are those that, in the auditors' professional judgement, were of most significance in the audit of the financial statements of the current period and include the most significant assessed risks of material misstatement (whether or not due to fraud) identified by the auditors.","['significance', 'audit', 'risks', 'material', 'misstatement', 'fraud']",HSBC_Annual_Report.pdf
Is the list of key audit matters exhaustive?,"No, the list of key audit matters is not exhaustive, and it does not provide a separate opinion on these matters. It is intended to provide a summary of the most significant risks identified by the auditors in the audit of the financial statements.",['No'],HSBC_Annual_Report.pdf
What is the key audit matter that is no longer included in the list of risks identified by the audit?,"Held for sale accounting (group), which was a key audit matter last year, is no longer included because the risk has reduced following the completion of the sale of the retail banking operations in France.","['no longer included', 'reduced', 'sale']",HSBC_Annual_Report.pdf
What is the nature of the key audit matter related to expected credit losses?,Determining expected credit losses (‘ECL’) involves management judgement and is subject to a high degree of estimation uncertainty.,"['involves', 'management', 'judgement', 'high', 'degree', 'estimation', 'uncertainty']",HSBC_Annual_Report.pdf
What are the significant assumptions that the audit focused on in estimating ECL?,"The significant assumptions that the audit focused on in estimating ECL included those with greater levels of management judgement and for which variations had the most significant impact on ECL, such as assumptions made in determining economic scenarios and their probability weightings, and estimating discounted cash flows for material credit impaired exposures in relation to the mainland China commercial real estate portfolio.","['management judgement', 'economic scenarios', 'probability weightings', 'discounted cash flows', 'material credit impaired exposures', 'mainland China commercial real estate portfolio']",HSBC_Annual_Report.pdf
What is the level of estimation uncertainty and judgement in estimating ECL during 2023?,"The level of estimation uncertainty and judgement has remained high during 2023 as a result of the uncertainties in the macroeconomic and geopolitical environment, persistently high levels of inflation in some territories, and the rising global interest rate environment, as well as developments in mainland China’s commercial real estate sector and economy more broadly.",['high'],HSBC_Annual_Report.pdf
How did the audit address the key audit matter related to expected credit losses?,"The audit assessed the design and effectiveness of governance and controls over the estimation of ECL. The audit observed management’s review and challenge in governance forums for the determination of economic scenarios and their probability weightings, and the assessment of ECL for Retail and Wholesale portfolios, including the assessment of management judgemental adjustments. The audit also tested controls over model validation and monitoring, the identification of credit impaired triggers, the input of critical data into source systems, and the calculation and approval of management judgemental adjustments to modelled outcomes.","['governance', 'controls', 'ECL', 'Retail', 'Wholesale', 'management', 'judgemental', 'adjustments']",HSBC_Annual_Report.pdf
What were the areas of focus of the discussions held with the Group Audit Committee regarding ECL?,"The discussions held with the Group Audit Committee covered governance and controls over ECL, with a significant focus on the uncertain prevailing macroeconomic conditions and developments in mainland China’s commercial real estate sector. The areas of focus included the severity of economic scenarios and their related probability weightings across territories, significant assumptions used to estimate the discounted cash flow projections for defaulted exposures in relation to the mainland China commercial real estate portfolio, assumptions made in determining judgemental management adjustments, and the disclosures made in relation to ECL.","['governance', 'controls', 'ECL', 'macroeconomic', 'conditions', 'commercial', 'real estate', 'territories', 'probability', 'weightings', 'scenarios', 'assumptions', 'discounted', 'cash flow', 'projections', 'defaulted', 'exposures', 'portfolio', 'judgemental', 'adjustments', 'disclosures']",HSBC_Annual_Report.pdf
How did the audit involve economic experts in assessing the significant assumptions made in determining the severity and probability weighting of economic scenarios?,The audit involved economic experts in assessing the significant assumptions made in determining the severity and probability weighting of economic scenarios. These assessments considered the sensitivity of ECL to variations in the severity and probability weighting of economic scenarios.,"['The', 'audit', 'involved', 'economic', 'experts', 'assessing', 'significant', 'assumptions', 'made', 'determining', 'severity', 'probability', 'weighting', 'economic', 'scenarios', 'considered', 'sensitivity', 'ECL', 'variations', 'severity', 'probability', 'weighting', 'economic', 'scenarios']",HSBC_Annual_Report.pdf
What are the limitations of the modelling methodologies used to estimate ECL?,"The modelling methodologies used to estimate ECL are developed using historical experience. However, the impact of the prevailing macroeconomic conditions has resulted in certain limitations in the reliability of these methodologies to forecast the extent and timing of future customer defaults and therefore estimate ECL. In addition, modelling methodologies do not incorporate all factors that are relevant to estimating ECL, such as the differentiated impact of economic conditions on certain industry sectors.","['historical experience', 'macroeconomic conditions', 'customer defaults', 'ECL', 'modelling methodologies']",HSBC_Annual_Report.pdf
What is the impact of macroeconomic conditions on the estimation of ECL?,"Macroeconomic conditions vary between territories and industries, leading to uncertainty around judgements made in determining the severity and probability weighting of economic scenarios used in ECL models. The prevailing macroeconomic conditions have resulted in certain limitations in the reliability of the modelling methodologies used to forecast the extent and timing of future customer defaults and therefore estimate ECL.","['macroenconomic', 'conditions', 'uncertainty', 'judgements', 'severity', 'probability', 'weighting', 'economic', 'scenarios', 'models', 'reliability', 'modelling', 'methodologies', 'forecast', 'extent', 'timing', 'future', 'customer', 'defaults', 'ECL']",HSBC_Annual_Report.pdf
What is the role of management judgement in estimating ECL?,"Management judgement plays a significant role in estimating ECL, as it","['Management', 'judgement', 'ECL']",HSBC_Annual_Report.pdf
What was the key audit matter for HSBC Holdings plc in 2023?,"The key audit matter for HSBC Holdings plc in 2023 was the impairment of the investment in Bank of Communications Co., Ltd (‘BoCom’).","['impairment', 'investment', 'Bank of Communications Co., Ltd', 'BoCom']",HSBC_Annual_Report.pdf
What was the carrying value of the investment in BoCom at 31 December 2023?,The carrying value of the investment in BoCom at 31 December 2023 was US$21.2bn.,['US$21.2bn'],HSBC_Annual_Report.pdf
What was the reason for the impairment of the investment in BoCom?,"The investment in BoCom was impaired due to a potential impairment indicator, which was identified based on the share price of BoCom being lower than the carrying amount for a number of years.","['lower', 'carrying', 'number', 'years']",HSBC_Annual_Report.pdf
What methodology was used by management to assess the impairment of the investment in BoCom?,Management used a value in use (‘VIU’) model to assess the impairment of the investment in BoCom.,"['value in use', 'VIU', 'model']",HSBC_Annual_Report.pdf
What were the significant assumptions used in the VIU model for the impairment assessment of BoCom?,"The significant assumptions used in the VIU model included the discount rate, short-term assumptions for operating income growth rate, loans and advances to customers growth rate, cost-income ratio, and expected credit losses as a percentage of loans and advances to customers, long-term assumptions for profit and asset growth rates, expected credit losses as a percentage of loans and advances to customers, and effective tax rates, and capital related assumptions (risk-weighted assets as a percentage of total assets and capital adequacy ratios).","['discount rate', 'operating income growth rate', 'loans and advances to customers growth rate', 'cost-income ratio', 'expected credit losses', 'profit and asset growth rates', 'effective tax rates', 'risk-weighted assets', 'total assets', 'capital adequacy ratios']",HSBC_Annual_Report.pdf
How did the auditors assess the appropriateness of the methodology and assumptions used in the VIU model?,"The auditors assessed the appropriateness of the methodology and assumptions used in the VIU model by reviewing the methodology and its consistent application period over period, and discussing the significant assumptions with the Group Audit Committee.","['reviewing', 'discussing']",HSBC_Annual_Report.pdf
What was the result of the impairment assessment of the investment in BoCom?,The impairment assessment of the investment in BoCom resulted in an impairment charge of US$3.0bn.,['US$3.0bn'],HSBC_Annual_Report.pdf
How did the auditors address the key audit matter in their audit?,"The auditors had oversight of the audit work performed by the component audit team in Hong Kong in relation to the impairment assessment of BoCom, and discussed the appropriateness of the methodology, its consistent application period over period, and significant assumptions with the Group Audit Committee.","['Hong Kong', 'BoCom', 'Group Audit Committee']",HSBC_Annual_Report.pdf
What disclosures were made in relation to the impairment of the investment in BoCom in the Annual Report and Accounts 2023?,"The Annual Report and Accounts 2023 included disclosures related to the impairment of the investment in BoCom, including the use of sensitivity analysis to explain estimation uncertainty.","['including', 'sensitivity', 'analysis', 'uncertainty']",HSBC_Annual_Report.pdf
What was the nature of the key audit matter discussed with the Group Audit Committee?,"The nature of the key audit matter discussed with the Group Audit Committee was the appropriateness of the methodology, its consistent application period over period, and significant assumptions used in the VIU model for the impairment assessment of BoCom.","['appropriateness', 'methodology', 'consistent', 'period', 'significant', 'assumptions', 'VIU', 'model', 'impairment', 'assessment', 'BoCom']",HSBC_Annual_Report.pdf
What was the focus of the audit work performed by the component audit team in Hong Kong?,"The focus of the audit work performed by the component audit team in Hong Kong was the impairment assessment of BoCom, including testing controls over significant assumptions, assessing the appropriateness of the methodology used, and evaluating the disclosures in relation to BoCom in the Annual Report.","['impairment assessment', 'BoCom', 'Annual Report']",HSBC_Annual_Report.pdf
What were the significant assumptions that the audit team focused on in relation to the determination of the VIU?,"The significant assumptions that the audit team focused on in relation to the determination of the VIU were HSBC's business plan for 2024 to 2028, regulatory capital requirements, long-term growth rates, and discount rates.","['HSBC', 'business plan', 'regulatory', 'long-term', 'discount', 'rates']",HSBC_Annual_Report.pdf
What was the result of management's assessment of the investment in HOHU?,"Management's assessment of the investment in HOHU resulted in an impairment charge of US$5.5bn, which resulted in an investment in subsidiaries of US$159bn at 31 December 2023.","['US$5.5bn', 'US$159bn']",HSBC_Annual_Report.pdf
"What was the purpose of the meetings observed by the component auditor, management, and BoCom management?","The purpose of the meetings observed by the component auditor, management, and BoCom management was to identify facts and circumstances impacting significant assumptions relevant to the determination of the VIU.","['identify', 'facts', 'circumstances', 'impacting', 'significant', 'assumptions', 'relevant', 'determination', 'VIU']",HSBC_Annual_Report.pdf
How did the audit team assess the appropriateness of the methodology used to determine the recoverable amounts?,The audit team assessed the appropriateness of the methodology used to determine the recoverable amounts by testing the mathematical accuracy of the calculations and evaluating the consistency of the methodology with IAS 36.,"['testing', 'mathematical', 'accuracy', 'consistency', 'IAS 36']",HSBC_Annual_Report.pdf
What was the basis for the impairment charge recognized in prior periods?,"The basis for the impairment charge recognized in prior periods was the recoverable amount, which was estimated using the higher of value in use (VIU) or fair value less cost to sell.","['recoverable amount', 'VIU', 'fair value', 'cost to sell']",HSBC_Annual_Report.pdf
What was the role of the Group Audit Committee in relation to the impairment charge for HOHU?,"The Group Audit Committee was involved in discussions regarding the impairment charge for HOHU, the appropriateness of methodologies used, and significant assumptions, giving consideration to the macroeconomic outlook and HSBC's strategy.","['Group Audit Committee', 'impairment', 'HOHU', 'methodologies', 'macroeconomic', 'HSBC', 'strategy']",HSBC_Annual_Report.pdf
How did the audit team assess the design and effectiveness of controls in place over significant assumptions and the model used to determine the recoverable amounts?,The audit team assessed the design and effectiveness of controls in place over significant assumptions and the model used to determine the recoverable amounts by testing the controls and evaluating their operating effectiveness.,"['testing', 'evaluating']",HSBC_Annual_Report.pdf
What was the nature of the key audit matter discussed with the Group Audit Committee?,"The nature of the key audit matter discussed with the Group Audit Committee was the impairment charge for HOHU, the appropriateness of methodologies used, and significant assumptions.","['impairment', 'HOHU', 'appropriateness', 'methodologies', 'significant', 'assumptions']",HSBC_Annual_Report.pdf
What was the outcome of the audit work performed by the component audit team in Hong Kong?,The outcome of the audit work performed by the component audit team in Hong Kong was that the audit team assessed the design and tested the effectiveness of controls in place over significant assumptions and the model used to determine the recoverable amounts.,"['assessed', 'tested', 'controls', 'significant', 'model', 'recoverable']",HSBC_Annual_Report.pdf
What was the focus of the audit in relation to the recoverable amounts?,The audit focused on assessing the design and effectiveness of controls over significant assumptions and the model used to determine the recoverable amounts.,"['The', 'audit', 'focused', 'on', 'assessing', 'controls', 'over', 'significant', 'assumptions', 'and', 'the', 'model', 'used', 'to', 'determine', 'the', 'recoverable', 'amounts']",HSBC_Annual_Report.pdf
What were the significant assumptions that were tested in relation to the recoverable amounts?,"The significant assumptions that were tested included the appropriateness of the methodology used, mathematical accuracy of the calculations, and the sensitivity of the recoverable amount to reasonable variations in significant assumptions.","['appropriateness', 'mathematical', 'sensitivity', 'recoverable', 'amount', 'variations', 'significant']",HSBC_Annual_Report.pdf
How did the audit address the valuation of defined benefit pension obligations?,The audit assessed the design and tested the effectiveness of governance and controls in place over the methodologies and significant assumptions used in the valuation of defined benefit obligations.,"['valuation', 'defined benefit', 'obligations']",HSBC_Annual_Report.pdf
What was the nature of the key audit matter in relation to investment in subsidiaries?,The key audit matter in relation to investment in subsidiaries was the valuation of defined benefit pension obligations.,"['valuation', 'defined', 'benefit', 'pension', 'obligations']",HSBC_Annual_Report.pdf
What was the scope of the audit in relation to the defined benefit pension obligation?,"The audit scope was tailored to ensure that enough work was performed to give an opinion on the financial statements as a whole, taking into account the structure of the group and the parent company, the accounting processes and controls, and the industry in which they operate.","['tailored', 'audit', 'scope', 'financial', 'statements', 'group', 'parent', 'company', 'accounting', 'processes', 'controls', 'industry']",HSBC_Annual_Report.pdf
"What were the risks that HSBC faces, and how did the audit address them?","HSBC faces diverse risks, including interdependencies between them. The audit engaged with a number of stakeholders to ensure that the risks and their interrelationships were appropriately understood and considered.","['HSBC', 'risks', 'audit', 'stakeholders', 'interdependencies']",HSBC_Annual_Report.pdf
What was the basis for evaluating the disclosures made in the Annual Report in relation to investment in subsidiaries?,"The audit evaluated and tested the disclosures made in the Annual Report in relation to investment in subsidiaries, including the disclosures related to the valuation of defined benefit pension obligations.","['including', 'valuation']",HSBC_Annual_Report.pdf
How did the audit assess the objectivity and competence of management’s expert involved in the valuation of the defined benefit obligation?,"The audit assessed the objectivity and competence of management’s expert involved in the valuation of the defined benefit obligation by evaluating their qualifications, experience, and independence.","['evaluating', 'qualifications', 'experience', 'independence']",HSBC_Annual_Report.pdf
