question,answer,tokens_present,document
What was the basis for assessing the appropriateness of the methodology used in the valuation of defined benefit pension obligations?,The audit assessed the appropriateness of the methodology used in the valuation of defined benefit pension obligations by comparing it to market observable indices and the knowledge and opinions of actuarial experts.,"['valuation', 'defined benefit pension obligations', 'market observable indices', 'actuarial experts']",HSBC_Annual_Report.pdf
How did the audit address the interdependencies between the risks faced by HSBC?,The audit addressed the interdependencies between the risks faced by HSBC by engaging with a number of stakeholders to ensure that the risks and their interrelationships were appropriately understood and considered.,"['engaging', 'ensuring', 'understood', 'considered']",HSBC_Annual_Report.pdf
"What are the risks that HSBC faces, and how are they interconnected?","HSBC faces diverse risks, including external factors such as geopolitical, macroeconomic, and regulatory changes, as well as internal factors driven by strategy and transformation. These risks are interconnected and complex, and include the impact of climate change risk on the financial statements.","['HSBC', 'risks', 'geopolitical', 'macroeconomic', 'regulatory', 'climate change']",HSBC_Annual_Report.pdf
How did PwC assess the impact of climate change risk on HSBC's financial statements?,"PwC evaluated and challenged management's assessment of the impact of climate change risk, including their conclusion that there is no material impact on the financial statements. They considered management's use of stress testing and scenario analysis and assessed the areas in the financial statements most likely to be impacted by climate risk.","['PwC', 'evaluated', 'challenged', ""management's"", 'assessment', 'impact', 'climate', 'risk', 'financial', 'statements']",HSBC_Annual_Report.pdf
"What are the areas in the financial statements that are most likely to be impacted by climate risk, according to HSBC's management?","HSBC's management identified the impact on ECL on loans and advances to customers, forecast cashflows from the five-year business plan and long-term growth rates used in estimating recoverable amounts, the impact of climate-related terms on the solely payments of principal and interest test, and climate risks relating to contingent liabilities as the areas most likely to be impacted by climate risk.","['ECL', 'loans', 'advances', 'customers', 'forecast', 'cashflows', 'business plan', 'long-term', 'growth', 'rates', 'recoverable', 'amounts', 'climate-related', 'terms', 'solely', 'payments', 'principal', 'interest', 'test', 'contingent', 'liabilities']",HSBC_Annual_Report.pdf
What was the scope of PwC's audit of HSBC's ESG data?,"PwC was engaged separately to provide independent limited assurance to the Directors over certain ESG data, including on-balance sheet financed emissions for six sectors, thermal coal financing drawn balance exposure, thermal coal mining on-balance sheet financed emissions, off-balance facilitated emissions for two sectors, and HSBC's own operations scope 1, 2 and 3 greenhouse gas emissions data for 2023.","['including', 'on-balance', 'thermal', 'off-balance', 'scope']",HSBC_Annual_Report.pdf
What is the difference between the work performed for a limited assurance report and a financial audit?,"The work performed for a limited assurance report is substantially less than the work performed for a financial audit, which provides reasonable assurance.","['substantially', 'less', 'reasonable', 'assurance']",HSBC_Annual_Report.pdf
How did PwC determine which entities and balances to test in order to support their group opinion?,"PwC tailored their determination of which entities and balances to test based on the complex and disaggregated group structure, accounting processes and controls, and industry in which they operate. They continually assessed risks and changed the scope of their audit where necessary.","['PwC', 'tailored', 'determination', 'entities', 'balances', 'test', 'based', 'complex', 'disaggregated', 'group', 'structure', 'accounting', 'processes', 'controls', 'industry', 'operate', 'continually', 'assessed', 'risks', 'changed', 'scope', 'audit', 'where', 'necessary']",HSBC_Annual_Report.pdf
"Which entities did PwC obtain audit opinions for, and what was the scope of these opinions?","PwC obtained full scope audit opinions for the consolidated financial position and performance of The Hongkong and Shanghai Banking Corporation Limited, HSBC Bank plc, and HSBC North America Holdings Inc. They also obtained full scope audit opinions for the company financial position and performance of HSBC UK Bank plc, HSBC Bank Canada, and HSBC Mexico S.A. Banco. They obtained audit opinions over specific balances for HSBC Bank Middle East Limited - UAE Operations and the HSBC UK Bank plc group.","['Hongkong', 'Shanghai', 'HSBC', 'North America', 'UK', 'Canada', 'Mexico', 'UAE', 'Banco']",HSBC_Annual_Report.pdf
Who performed the audits for HSBC Bank plc and HSBC UK Bank plc?,The audits for HSBC Bank plc and HSBC UK Bank plc were performed by other PwC teams in the UK.,"['other', 'PwC', 'teams', 'UK']",HSBC_Annual_Report.pdf
How did PwC assess the risks of material misstatement in HSBC's financial statements?,PwC assessed the risks of material misstatement in HSBC's financial statements by identifying the most financially significant entities within the group and those that drive particular significant risks identified as part of their risk assessment. They obtained sufficient coverage for each financial statement line item (FSLI) and continually assessed risks and changed the scope of their audit where necessary.,"['PwC', 'HSBC', 'risks', 'assessment', 'entities', 'FSLI', 'audit']",HSBC_Annual_Report.pdf
What was the scope of the audit opinions obtained for HSBC UK Bank plc and HSBC Bank Canada?,The audit opinions for HSBC UK Bank plc and HSBC Bank Canada were full scope audit opinions.,['full scope audit opinions'],HSBC_Annual_Report.pdf
What was the scope of the audit opinions obtained for HSBC Mexico S.A. Banco?,The audit opinion for HSBC Mexico S.A. Banco was a full scope audit opinion.,['full scope audit opinion'],HSBC_Annual_Report.pdf
What were the audit approaches used for HSBC Bank Middle East Limited - UAE Operations and the HSBC UK Bank plc group?,The audit approaches used for HSBC Bank Middle East Limited - UAE Operations and the HSBC UK Bank plc group were audit opinions over specific balances.,"['audit', 'opinions', 'specific', 'balances']",HSBC_Annual_Report.pdf
Who performed the audits for HSBC Bank plc and HSBC UK Bank plc?,The audits for HSBC Bank plc and HSBC UK Bank plc were performed by other PwC teams in the UK.,"['other', 'PwC', 'teams', 'UK']",HSBC_Annual_Report.pdf
Who performed the audits for the other Significant Subsidiaries?,The audits for the other Significant Subsidiaries were performed by other PwC network firms.,['other PwC network firms'],HSBC_Annual_Report.pdf
What is the name of the function that performs financial reporting processes and controls for HSBC?,The function that performs financial reporting processes and controls for HSBC is Group Finance.,['Group Finance'],HSBC_Annual_Report.pdf
What is the name of the function that performs IT and operational processes and controls relevant to financial reporting for HSBC?,The function that performs IT and operational processes and controls relevant to financial reporting for HSBC is Digital Business Services (‘DBS‘).,"['HSBC', 'Digital', 'Business', 'Services', 'DBS']",HSBC_Annual_Report.pdf
What are some of the areas that were subject to specified audit procedures or an audit over specific FSLIs?,"Some of the areas that were subject to specified audit procedures or an audit over specific FSLIs include testing of IT general controls, IT dependencies, forward-looking economic scenarios for ECL, operating expenses, intangible assets, valuation of financial instruments, existence testing of financial instruments, intercompany eliminations, reconciliations, and consolidation.","['testing', 'IT', 'forward-looking', 'operating', 'intangible', 'valuation', 'existence', 'intercompany', 'reconciliations', 'consolidation']",HSBC_Annual_Report.pdf
What was the purpose of the meeting held in Hong Kong with the partners and senior staff from the group audit team and certain PwC teams?,"The purpose of the meeting held in Hong Kong was to discuss the approach to auditing HSBC’s businesses, changes at HSBC and in the PwC teams, and how to continue to innovate and improve the quality of the audit with a focus on technology and the global delivery model.","['discuss', 'auditing', 'HSBC', 'PwC', 'technology', 'global delivery model']",HSBC_Annual_Report.pdf
What were the overall materiality levels ranged from for the Significant Subsidiaries?,The overall materiality levels ranged from US$107m to US$1.0bn.,"['US$107m', 'US$1.0bn']",HSBC_Annual_Report.pdf
What was the scope of the audit for the Hongkong and Shanghai Banking Corporation Limited?,"The audit of The Hongkong and Shanghai Banking Corporation Limited in Hong Kong relied upon work performed by other teams in Hong Kong and the PwC network firms in India, mainland China, and Singapore.","['Hong Kong', 'India', 'mainland China', 'Singapore']",HSBC_Annual_Report.pdf
How did the audit team obtain audit evidence from third parties?,"The team obtained audit evidence from work that is scoped and provided by other auditors that are engaged by those third parties. For example, they obtained a report evidencing the testing of external systems and controls supporting HSBC's payroll and HR processes.","['obtained', 'report', 'testing', 'external', 'systems', 'controls', 'payroll', 'HR', 'processes']",HSBC_Annual_Report.pdf
What was the overall materiality for the financial statements as a whole for the group?,"The overall materiality for the financial statements as a whole for the group was US$1.6bn, which was determined based on 5% of profit before tax adjusted for notable items.",['US$1.6bn'],HSBC_Annual_Report.pdf
How did the team determine the scope of their audit and the nature and extent of their testing?,"The team determined the scope of their audit and the nature and extent of their testing based on their application of materiality, using both quantitative thresholds and qualitative considerations.","['based', 'quantitative', 'qualitative']",HSBC_Annual_Report.pdf
What was the performance materiality used by the team in determining sample sizes?,"The team used performance materiality of 75% of overall materiality, amounting to US$1.2bn for the group financial statements and US$1.1bn for the parent company financial statements.","['75%', 'US$1.2bn', 'US$1.1bn']",HSBC_Annual_Report.pdf
What was the rationale for the benchmark applied for determining materiality?,"The team believed that a standard benchmark of 5% of profit before tax adjusted for notable items was an appropriate quantitative indicator of materiality, although certain items could also be material for qualitative reasons. This benchmark is consistent with their approach for listed entities.","['5%', 'profit', 'tax', 'notable items', 'materiality', 'listed entities']",HSBC_Annual_Report.pdf
How did the team consider the work of others in their audit?,The team considered how the audit partners and teams for the Significant Subsidiaries instructed and provided oversight to the work performed in these locations. They also relied upon work performed by other teams in the UK and the PwC network firms in France and Germany for the audit of HSBC Bank plc in the UK.,"['instructed', 'provided', 'relied', 'work', 'performed', 'UK', 'France', 'Germany']",HSBC_Annual_Report.pdf
What percentage of total assets and operating income did the Significant Subsidiaries cover?,The Significant Subsidiaries covered 83% of total assets and 74% of total operating income.,"['83%', '74%']",HSBC_Annual_Report.pdf
How did the team assess the competence and objectivity of those performing testing?,"The team re-performed a portion of the testing to ensure appropriate quality of testing, as well as assessing the competence and objectivity of those performing the testing.","['competence', 'objectivity', 'testing']",HSBC_Annual_Report.pdf
"What was the primary purpose of the parent company, according to the text?","The primary purpose of the parent company was to act as a holding parent company with investments in the group's subsidiaries, not to generate operating profits. Therefore, a profit-based measure was not relevant, and a benchmark of total assets was used instead.","['holding', 'parent', 'company', 'investments', 'subsidiaries', 'total', 'assets']",HSBC_Annual_Report.pdf
What was the performance materiality for the group financial statements in 2023?,"The performance materiality for the group financial statements in 2023 was US$1.2bn, which is 75% of the overall materiality.","['US$1.2bn', '75%']",HSBC_Annual_Report.pdf
What was the performance materiality for the parent company financial statements in 2023?,"The performance materiality for the parent company financial statements in 2023 was US$1.1bn, which is 75% of the overall materiality.","['US$1.1bn', '75%']",HSBC_Annual_Report.pdf
What is the purpose of determining performance materiality?,"Performance materiality is used to determine the scope of the audit and the nature and extent of testing of account balances, classes of transactions, and disclosures.","['performance', 'materiality', 'audit', 'account', 'balances', 'classes', 'transactions', 'disclosures']",HSBC_Annual_Report.pdf
What factors were considered when determining performance materiality?,"The history of misstatements, risk assessment, aggregation risk, and the effectiveness of controls were considered when determining performance materiality.","['history', 'risk', 'aggregation', 'effectiveness', 'controls']",HSBC_Annual_Report.pdf
What was the amount of misstatements identified during the audit that were reported to the GAC?,"Misstatements identified during the audit above US$80m (group audit) and US$80m (parent company audit) were reported to the GAC, as well as misstatements below those amounts that, in the auditor's view, warranted reporting for qualitative reasons.","['US$80m', 'GAC']",HSBC_Annual_Report.pdf
What is the directors' responsibility with respect to going concern?,The directors are responsible for assessing the group's and the parent company's ability to continue as a going concern and for providing adequate disclosures in the financial statements in relation to going concern.,"['going concern', 'directors', 'responsible', 'assessing', 'ability', 'continue', 'providing', 'adequate', 'disclosures', 'financial', 'statements', 'relation']",HSBC_Annual_Report.pdf
What did the auditor's evaluation of the directors' assessment of going concern include?,"The auditor's evaluation of the directors' assessment of going concern included performing a risk assessment, understanding and evaluating financial forecasts, understanding and evaluating stress testing of liquidity and regulatory capital, reading and evaluating credit rating agency ratings and actions, and reading and evaluating the adequacy of disclosures made in the financial statements.","['risk assessment', 'financial forecasts', 'stress testing', 'credit rating agency ratings', 'disclosures']",HSBC_Annual_Report.pdf
Did the auditor identify any material uncertainties relating to events or conditions that may cast significant doubt on the group's and the parent company's ability to continue as a going concern?,"No, the auditor did not identify any material uncertainties relating to events or conditions that may cast significant doubt on the group's and the parent company's ability to continue as a going concern.",['No'],HSBC_Annual_Report.pdf
What is the auditor's responsibility with respect to other information in the Annual Report?,"The auditor's responsibility is to read the other information and, in doing so, consider whether the other information is materially inconsistent with the financial statements or the auditor's knowledge obtained in the audit, or otherwise appears to be materially misstated. If the auditor identifies an apparent material inconsistency or material misstatement, they are required to perform procedures to conclude whether there is a material misstatement of the financial statements or a material misstatement of the other information.","['materially', 'inconsistent', 'misstated', 'financial', 'statements', ""auditor's"", 'knowledge', 'obtained', 'audit', 'procedures', 'conclude']",HSBC_Annual_Report.pdf
What is the purpose of the audit described in the text?,The purpose of the audit is to provide an opinion on whether the financial statements of HSBC Holdings plc are materially consistent with the financial statements and to report on certain opinions and matters as described in the UK Companies Act 2006.,"['materially', 'consistent', 'financial', 'statements', 'report', 'opinion', 'UK', 'Companies', 'Act', '2006']",HSBC_Annual_Report.pdf
What are the responsibilities of the auditor with respect to the Strategic report and Report of the Directors?,The auditor's responsibilities with respect to the Strategic report and Report of the Directors are to consider whether the disclosures required by the UK Companies Act 2006 have been included and to report on whether the information given in the Strategic report and Report of the Directors is consistent with the financial statements and has been prepared in accordance with applicable legal requirements.,"['The', ""auditor's"", 'responsibilities', 'with', 'respect', 'to', 'the', 'Strategic', 'report', 'and', 'Report', 'of', 'the', 'Directors', 'are', 'to', 'consider', 'whether', 'the', 'disclosures', 'required', 'by', 'the', 'UK', 'Companies', 'Act', '2006', 'have', 'been', 'included', 'and', 'to', 'report', 'on', 'whether', 'the', 'information', 'given', 'in', 'the', 'Strategic', 'report', 'and', 'Report', 'of', 'the', 'Directors', 'is', 'consistent', 'with', 'the', 'financial', 'statements', 'and', 'has', 'been', 'prepared', 'in', 'accordance', 'with', 'applicable', 'legal', 'requirements.']",HSBC_Annual_Report.pdf
What is the auditor's opinion on the Strategic report and Report of the Directors?,"The auditor's opinion is that, based on the work undertaken in the course of the audit, the information given in the Strategic report and Report of the Directors for the year ended 31 December 2023 is consistent with the financial statements and has been prepared in accordance with applicable legal requirements.","['consistent', 'financial', 'statements', 'legal', 'requirements']",HSBC_Annual_Report.pdf
What are the auditor's responsibilities with respect to Directors' Remuneration?,The auditor's responsibilities with respect to Directors' Remuneration are to opine on whether the part of the Directors' Remuneration Report to be audited has been properly prepared in accordance with the Companies Act 2006.,"['opine', 'properly', 'prepared', 'Companies Act 2006']",HSBC_Annual_Report.pdf
What is the auditor's opinion on Directors' Remuneration?,The auditor's opinion is that the part of the Directors' Remuneration Report to be audited has been properly prepared in accordance with the Companies Act 2006.,"['properly', 'prepared', 'Companies Act 2006']",HSBC_Annual_Report.pdf
What are the auditor's responsibilities with respect to the corporate governance statement?,"The auditor's responsibilities with respect to the corporate governance statement are to review the directors' statements in relation to going concern, longer-term viability and that part of the corporate governance statement relating to the parent company's compliance with the provisions of the UK Corporate Governance Code specified for the auditor's review.","['review', ""directors'"", 'going concern', 'longer-term', 'viability', 'corporate', 'governance', 'statement', 'parent', ""company's"", 'compliance', 'provisions', 'UK', 'Corporate', 'Governance', 'Code']",HSBC_Annual_Report.pdf
What elements of the corporate governance statement has the auditor reviewed?,"The auditor has reviewed the directors' confirmation that they have carried out an appropriate assessment of the emerging and principal risks, the disclosures in the Annual Report that describe those principal risks, the directors' statement in the financial statements about whether they considered it appropriate to adopt the going concern basis of accounting, the directors' explanation as to their assessment of the group's and parent company's prospects, and the directors' statement as to whether they have a reasonable expectation that the parent company will be able to continue in operation and meet its liabilities as they fall due over the period of its assessment.","['appropriate', 'assessment', 'risks', 'disclosures', 'Annual Report', 'financial statements', 'going concern', 'assessment', 'prospects', 'liabilities']",HSBC_Annual_Report.pdf
What is the auditor's conclusion on the corporate governance statement?,"The auditor's conclusion is that each of the elements of the corporate governance statement that they have reviewed is materially consistent with the financial statements and their knowledge obtained during the audit, and they have nothing material to add or draw attention to in relation to these elements.","['materially', 'consistent', 'financial', 'statements', 'audit']",HSBC_Annual_Report.pdf
What is the scope of the auditor's review of the directors' statement regarding the longer-term viability of the group and parent company?,"The scope of the auditor's review of the directors' statement regarding the longer-term viability of the group and parent company was substantially less in scope than an audit and only consisted of making inquiries and considering the directors' process supporting their statement, checking that the statement is in alignment with the relevant provisions of the UK Corporate Governance Code, and considering whether the statement is consistent with the financial statements and the auditor's knowledge and understanding of the group and parent company and their environment obtained in the course of the audit.","['substantially', 'less', 'inquiries', 'considering', ""directors'"", 'statement', 'alignment', 'provisions', 'consistent', 'financial', 'statements', ""auditor's"", 'knowledge', 'understanding', 'group', 'parent', 'company', 'environment']",HSBC_Annual_Report.pdf
What is the purpose of the audit described in the text?,"The purpose of the audit is to obtain reasonable assurance about whether the financial statements as a whole are free from material misstatement, whether due to fraud or error, and to issue an auditors’ report that includes our opinion.","['reasonable', 'assurance', 'financial', 'statements', 'free', 'material', 'misstatement', 'fraud', 'error', 'auditors’', 'report', 'opinion']",HSBC_Annual_Report.pdf
What are the responsibilities of the directors for the financial statements?,"The directors are responsible for the preparation of the financial statements in accordance with the applicable framework and for being satisfied that they give a true and fair view. They are also responsible for such internal control as they determine is necessary to enable the preparation of financial statements that are free from material misstatement, whether due to fraud or error.","['responsibilities', 'directors', 'financial', 'statements', 'preparation', 'framework', 'true', 'fair', 'internal', 'control', 'material', 'misstatement', 'fraud', 'error']",HSBC_Annual_Report.pdf
What are the auditors’ responsibilities for the audit of the financial statements?,"The auditors’ responsibilities are to obtain reasonable assurance about whether the financial statements as a whole are free from material misstatement, whether due to fraud or error, and to issue an auditors’ report that includes our opinion.","['reasonable', 'assurance', 'financial', 'statements', 'free', 'material', 'misstatement', 'fraud', 'error', 'auditors', 'report', 'opinion']",HSBC_Annual_Report.pdf
What is the level of assurance that the audit provides?,"The audit provides a high level of assurance, but is not a guarantee that an audit conducted in accordance with ISAs (UK) and ISAs will always detect a material misstatement when it exists.","['high', 'level', 'assurance']",HSBC_Annual_Report.pdf
What are the principal risks of non-compliance with laws and regulations that the auditors identified?,"The principal risks of non-compliance with laws and regulations that the auditors identified were breaches of financial crime laws and regulations and regulatory compliance, including regulatory reporting requirements and conduct of business.","['breaches', 'regulatory', 'compliance']",HSBC_Annual_Report.pdf
How did the auditors assess the risk of fraudulent manipulation of the financial statements?,"The auditors evaluated management’s incentives and opportunities for fraudulent manipulation of the financial statements, and determined that the principal risks were related to posting inappropriate journal entries in relation to cost targets, and management bias in accounting estimates.","['fraudulent manipulation', 'financial statements', 'risks', 'journal entries', 'cost targets', 'management bias', 'accounting estimates']",HSBC_Annual_Report.pdf
