question,answer,tokens_present,document
What is the title of the report described in the text?,"The title of the report described in the text is ""IMF Annual Report 2022 Financial Statements.""",['IMF Annual Report 2022 Financial Statements'],IMF_Financial_Statements.pdf
What is the name of the department that has prepared the financial statements included in the report?,The financial statements included in the report have been prepared by the Financial Statements Department.,['Financial Statements Department'],IMF_Financial_Statements.pdf
What is the purpose of Schedule 1 in the report?,"Schedule 1 in the report provides information on quota subscriptions, GRA's holdings of currencies, reserve tranche positions, and outstanding credit in the General Resources Account at April 30, 2022.","['Schedule 1', 'report', 'quota', 'subscriptions', 'GRA', 'holdings', 'currencies', 'reserve', 'tranche', 'positions', 'outstanding', 'credit', 'General', 'Resources', 'Account', 'April 30', '2022']",IMF_Financial_Statements.pdf
What is the purpose of Schedule 5 in the report?,"Schedule 5 in the report provides information on effective bilateral borrowing agreements in the General Resources Account at April 30, 2022, and 2021.","['Schedule 5', 'General Resources Account', 'April 30', '2022', '2021']",IMF_Financial_Statements.pdf
What is the name of the trust that has been established to provide concessional lending and debt relief to low-income countries?,The trust that has been established to provide concessional lending and debt relief to low-income countries is the Poverty Reduction and Growth Trust (PRG Trust).,"['Poverty Reduction and Growth Trust', 'PRG Trust']",IMF_Financial_Statements.pdf
What is the name of the account that has been established to administer the resources provided by the PRG Trust?,The account that has been established to administer the resources provided by the PRG Trust is the PRG Trust Loan Account.,['PRG Trust Loan Account'],IMF_Financial_Statements.pdf
What is the purpose of Schedule 4 in the report?,"Schedule 4 in the report provides information on cumulative contributions to the PRG, PRG-HIPC, and CCR Trusts at April 30, 2022.","['Schedule 4', 'PRG', 'PRG-HIPC', 'CCR Trusts', 'April 30', '2022']",IMF_Financial_Statements.pdf
What is the purpose of Schedule 5 in the report?,"Schedule 5 in the report provides information on the response of the CCR Trust to the COVID-19 pandemic, including cumulative debt relief assistance provided at April 30, 2022.","['Schedule 5', 'COVID-19', 'pandemic', 'cumulative', 'debt', 'relief', 'assistance', 'April 30', '2022']",IMF_Financial_Statements.pdf
What is the name of the department that has prepared the financial statements and supplementary schedules of the administered accounts included in the report?,The department that has prepared the financial statements and supplementary schedules of the administered accounts included in the report is the Administered Accounts Department.,['Administered Accounts Department'],IMF_Financial_Statements.pdf
What is the name of the organization that publishes the Annual Report 2022?,The organization that publishes the Annual Report 2022 is the International Monetary Fund (IMF).,"['International Monetary Fund', 'IMF']",IMF_Financial_Statements.pdf
What is the title of the report that contains the audited financial statements of the General Department of the IMF?,"The title of the report that contains the audited financial statements of the General Department of the IMF is ""Financial Statements of the General Department.""",['Financial Statements of the General Department.'],IMF_Financial_Statements.pdf
Who is responsible for the preparation and fair presentation of the financial statements of the General Department of the IMF?,Management is responsible for the preparation and fair presentation of the financial statements of the General Department of the IMF.,"['Management', 'responsible', 'preparation', 'fair', 'presentation', 'financial', 'statements', 'General', 'Department', 'IMF']",IMF_Financial_Statements.pdf
What is the name of the audit firm that conducted the audit of the financial statements of the General Department of the IMF?,The name of the audit firm that conducted the audit of the financial statements of the General Department of the IMF is PricewaterhouseCoopers LLP.,['PricewaterhouseCoopers LLP'],IMF_Financial_Statements.pdf
What is the opinion of the auditors on the financial statements of the General Department of the IMF?,"The opinion of the auditors on the financial statements of the General Department of the IMF is that they present fairly, in all material respects, the financial position of the Department as of April 30, 2022 and 2021, and the results of its operations and its cash flows for the years then ended in accordance with International Financial Reporting Standards as issued by the International Accounting Standards Board.","['fairly', 'financial', 'position', 'Department', 'April 30', '2022', '2021', 'results', 'operations', 'cash', 'flows', 'years', 'ended', 'International', 'Financial', 'Reporting', 'Standards', 'issued', 'International', 'Accounting', 'Standards', 'Board']",IMF_Financial_Statements.pdf
What is the basis for the auditors' opinion on the financial statements of the General Department of the IMF?,The basis for the auditors' opinion on the financial statements of the General Department of the IMF is their audit conducted in accordance with auditing standards generally accepted in the United States of America (US GAAS) and in accordance with International Standards on Auditing (ISAs).,"['US GAAS', 'ISAs']",IMF_Financial_Statements.pdf
What is the role of the Board of Governors of the IMF in relation to the financial statements of the General Department of the IMF?,"The Board of Governors of the IMF is responsible for overseeing the financial activities of the General Department of the IMF, including the approval of the financial statements.","['Board', 'Governors', 'IMF', 'financial', 'statements', 'approval']",IMF_Financial_Statements.pdf
What is the purpose of the Annual Report 2022?,"The purpose of the Annual Report 2022 is to provide information on the financial activities and performance of the IMF during the financial year ended April 30, 2022.","['financial activities', 'performance', 'IMF', 'financial year', 'April 30', '2022']",IMF_Financial_Statements.pdf
How can the Annual Report 2022 be obtained?,"The Annual Report 2022 can be obtained through IMF Publication Services at the following address: International Monetary Fund, Publication Services, P.O. Box 92780, Washington, DC 20090, U.S.A. It can also be downloaded from the IMF's website at www.imf.org/AR2022.",['www.imf.org/AR2022'],IMF_Financial_Statements.pdf
What are the languages in which the Annual Report 2022 is available?,"The Annual Report 2022 is available in nine languages: Arabic, Chinese, English, French, German, Japanese, Portuguese, Russian, and Spanish.","['Arabic', 'Chinese', 'English', 'French', 'German', 'Japanese', 'Portuguese', 'Russian', 'Spanish']",IMF_Financial_Statements.pdf
What is the responsibility of management in preparing the financial statements?,"Management is responsible for assessing the Department’s ability to continue as a going concern for at least twelve months from the end of the reporting period and disclosing, as applicable, matters related to going concern and using the going concern basis of accounting.","['going concern', 'management', 'assessing', 'disclosing', 'reporting period']",IMF_Financial_Statements.pdf
What is the role of those charged with governance in the financial reporting process?,Those charged with governance are responsible for overseeing the Department’s financial reporting process.,"['Those', 'charged', 'with', 'governance', 'responsible', 'overseeing', 'Department’s', 'financial', 'reporting', 'process']",IMF_Financial_Statements.pdf
What are the auditors’ responsibilities for the audit of the financial statements?,"The auditors’ responsibilities include obtaining reasonable assurance about whether the financial statements as a whole are free from material misstatement, whether due to fraud or error, and issuing an auditors’ report that includes their opinion.","['reasonable', 'assurance', 'financial', 'statements', 'free', 'material', 'misstatement', 'fraud', 'error', 'auditors', 'report', 'opinion']",IMF_Financial_Statements.pdf
What is the level of assurance that auditors strive for in their audit?,"Auditors strive for a high level of assurance, which is reasonable assurance, but not absolute assurance, and therefore is not a guarantee that an audit conducted in accordance with US GAAS and ISAs will always detect a material misstatement when it exists.","['high', 'reasonable', 'assurance']",IMF_Financial_Statements.pdf
What are misstatements considered material if they have a substantial likelihood of influencing the judgment made by a reasonable user based on the financial statements?,"Misstatements are considered material if there is a substantial likelihood that, individually or in the aggregate, they would influence the judgment made by a reasonable user based on the financial statements.","['substantial likelihood', 'judgment', 'financial statements']",IMF_Financial_Statements.pdf
What procedures do auditors perform to identify and assess the risks of material misstatement of the financial statements?,"Auditors identify and assess the risks of material misstatement of the financial statements by exercising professional judgment and maintaining professional skepticism throughout the audit, and designing and performing audit procedures responsive to those risks.","['risks', 'material', 'misstatement', 'financial', 'statements', 'audit', 'procedures']",IMF_Financial_Statements.pdf
What is the purpose of obtaining an understanding of internal control relevant to the audit?,"The purpose of obtaining an understanding of internal control relevant to the audit is to design audit procedures that are appropriate in the circumstances, but not for the purpose of expressing an opinion on the effectiveness of the Department’s internal control.","['obtaining', 'internal', 'control', 'relevant', 'audit', 'design', 'appropriate', 'circumstances', 'expressing', 'opinion', 'effectiveness', 'Department', 'internal', 'control']",IMF_Financial_Statements.pdf
What is the responsibility of auditors regarding communication with those charged with governance?,"Auditors are required to communicate with those charged with governance regarding, among other matters, the planned scope and timing of the audit, significant audit findings, and certain internal control-related matters that they identified during the audit.","['Auditors', 'communicate', 'with', 'those', 'charged', 'governance', 'regarding', 'planned', 'scope', 'timing', 'audit', 'significant', 'findings', 'certain', 'internal', 'control-related', 'matters', 'identified', 'during', 'audit']",IMF_Financial_Statements.pdf
What is the purpose of the supplemental schedules presented in the financial statements?,The supplemental schedules are presented for purposes of additional analysis and are not a required part of the financial statements. They are the responsibility of management and were derived from and relate directly to the underlying accounting and other records used to prepare the financial statements.,"['The', 'supplemental', 'schedules', 'presented', 'financial', 'statements', 'purpose', 'additional', 'analysis', 'not', 'required', 'part', 'management', 'derived', 'underlying', 'accounting', 'records', 'prepare', 'financial', 'statements']",IMF_Financial_Statements.pdf
What is the conclusion of the auditors regarding the Department’s ability to continue as a going concern?,"The auditors concluded that, in their judgment, there are conditions or events, considered in the aggregate, that raise substantial doubt about the Department’s ability to continue as a going concern for a reasonable period of time.","['substantial doubt', 'going concern', 'reasonable period of time']",IMF_Financial_Statements.pdf
"What was the total amount of usable currencies reported in the Statement of Financial Position at April 30, 2022?","The total amount of usable currencies reported in the Statement of Financial Position at April 30, 2022 was 292,280 million SDRs.","['292,280 million SDRs']",IMF_Financial_Statements.pdf
"What was the total amount of investments reported in the Statement of Financial Position at April 30, 2022?","The total amount of investments reported in the Statement of Financial Position at April 30, 2022 was 25,418 million SDRs.","['25,418 million SDRs']",IMF_Financial_Statements.pdf
"What was the total amount of gold holdings reported in the Statement of Financial Position at April 30, 2022?","The total amount of gold holdings reported in the Statement of Financial Position at April 30, 2022 was 3,167 million SDRs.","['3,167 million SDRs']",IMF_Financial_Statements.pdf
"What was the total amount of property, plant, and equipment reported in the Statement of Financial Position at April 30, 2022?","The total amount of property, plant, and equipment reported in the Statement of Financial Position at April 30, 2022 was 551 million SDRs.",['551 million SDRs'],IMF_Financial_Statements.pdf
"What was the total amount of net assets under retirement benefit plans reported in the Statement of Financial Position at April 30, 2022?","The total amount of net assets under retirement benefit plans reported in the Statement of Financial Position at April 30, 2022 was 1,375 million SDRs.","['1,375 million SDRs']",IMF_Financial_Statements.pdf
"What was the total amount of borrowings reported in the Statement of Financial Position at April 30, 2022?","The total amount of borrowings reported in the Statement of Financial Position at April 30, 2022 was 2,615 million SDRs.","['2,615 million SDRs']",IMF_Financial_Statements.pdf
"What was the total amount of quota subscriptions reported in the Statement of Financial Position at April 30, 2022?","The total amount of quota subscriptions reported in the Statement of Financial Position at April 30, 2022 was 476,272 million SDRs.","['476,272 million SDRs']",IMF_Financial_Statements.pdf
"What was the total amount of net liabilities under retirement benefit plans reported in the Statement of Financial Position at April 30, 2022?","The total amount of net liabilities under retirement benefit plans reported in the Statement of Financial Position at April 30, 2022 was 127 million SDRs.",['127 million SDRs'],IMF_Financial_Statements.pdf
"What was the total amount of other liabilities reported in the Statement of Financial Position at April 30, 2022?","The total amount of other liabilities reported in the Statement of Financial Position at April 30, 2022 was 970 million SDRs.",['970 million SDRs'],IMF_Financial_Statements.pdf
"What was the total amount of resources of the Special Disbursement Account reported in the Statement of Financial Position at April 30, 2022?","The total amount of resources of the Special Disbursement Account reported in the Statement of Financial Position at April 30, 2022 was zero.",['zero'],IMF_Financial_Statements.pdf
"What was the total amount of comprehensive income reported in the Statement of Comprehensive Income for the financial year ended April 30, 2022?","The total amount of comprehensive income reported in the Statement of Comprehensive Income for the financial year ended April 30, 2022 was 3,085 million SDRs.","['3,085 million SDRs']",IMF_Financial_Statements.pdf
What is the name of the international organization that is the subject of the financial statements?,The name of the international organization that is the subject of the financial statements is the International Monetary Fund (IMF).,"['International Monetary Fund', 'IMF']",IMF_Financial_Statements.pdf
What is the primary mission of the IMF?,The primary mission of the IMF is to ensure the stability of the international monetary system.,"['stability', 'international', 'monetary', 'system']",IMF_Financial_Statements.pdf
How does the IMF conduct its operations and transactions?,"The IMF conducts its operations and transactions through the General Department, which comprises three accounts: the General Resources Account (GRA), the Investment Account (IA), and the Special Disbursement Account (SDA).","['The', 'IMF', 'GRA', 'IA', 'SDA']",IMF_Financial_Statements.pdf
What is the purpose of the General Resources Account (GRA)?,The General Resources Account (GRA) is used to conduct the IMF's financial operations with its members.,"['GRA', 'IMF', 'financial', 'operations', 'members']",IMF_Financial_Statements.pdf
What is the purpose of the Investment Account (IA)?,The Investment Account (IA) is used to manage the IMF's investments.,"['IMF', 'investments']",IMF_Financial_Statements.pdf
What is the purpose of the Special Disbursement Account (SDA)?,The Special Disbursement Account (SDA) is used to provide financial assistance to member countries.,"['The', 'Special', 'Disbursement', 'Account', 'is', 'used', 'to', 'provide', 'financial', 'assistance', 'to', 'member', 'countries']",IMF_Financial_Statements.pdf
What is the name of the account that is used to record the IMF's net income?,The name of the account that is used to record the IMF's net income is the General Resources Account (GRA).,['General Resources Account (GRA)'],IMF_Financial_Statements.pdf
What is the name of the account that is used to record the IMF's other comprehensive income?,The name of the account that is used to record the IMF's other comprehensive income is the Investment Account (IA).,['Investment Account (IA)'],IMF_Financial_Statements.pdf
What is the name of the account that is used to record the IMF's transfers from the Investment Account?,The name of the account that is used to record the IMF's transfers from the Investment Account is the General Resources Account (GRA).,['General Resources Account (GRA)'],IMF_Financial_Statements.pdf
What is the name of the note that provides information about the IMF's financing activities?,The name of the note that provides information about the IMF's financing activities is Note 11: Financing Activities.,"['Note 11', 'Financing Activities']",IMF_Financial_Statements.pdf
Where is the IMF headquartered?,"The IMF is headquartered in Washington, DC, USA.","['Washington', 'DC', 'USA']",IMF_Financial_Statements.pdf
What are the three accounts that comprise the General Department of the IMF?,"The three accounts that comprise the General Department of the IMF are the General Resources Account (GRA), the Investment Account (IA), and the Special Disbursement Account (SDA).","['GRA', 'IA', 'SDA']",IMF_Financial_Statements.pdf
What is the primary purpose of the GRA?,The primary purpose of the GRA is to conduct financial operations with member countries and provide financial assistance to members experiencing balance of payments problems.,"['GRA', 'financial', 'operations', 'member', 'countries', 'financial', 'assistance', 'members', 'balance', 'payments', 'problems']",IMF_Financial_Statements.pdf
What is the Stand-By Arrangement (SBA)?,The Stand-By Arrangement (SBA) is a financing arrangement that provides financial assistance to members with balance of payments problems expected to be resolved in the short to medium term.,"['Stand-By Arrangement', 'financing', 'balance of payments', 'short to medium term']",IMF_Financial_Statements.pdf
What is the Extended Fund Facility (EFF)?,"The Extended Fund Facility (EFF) is a special facility in the GRA for members with longer-term balance of payments problems, the resolution of which would require structural and more comprehensive economic reforms.","['EFF', 'GRA', 'balance', 'payments', 'problems', 'reforms']",IMF_Financial_Statements.pdf
What is the Flexible Credit Line (FCL)?,"The Flexible Credit Line (FCL) is available for members with very strong fundamentals, policies, and track records of policy implementation and is intended for both crisis prevention and resolution.","['Flexible', 'Credit', 'Line']",IMF_Financial_Statements.pdf
What is the Short-term Liquidity Line (SLL)?,"The Short-term Liquidity Line (SLL) is designed to provide liquidity support and has several innovative features, including revolving access.",['Short-term Liquidity Line (SLL)'],IMF_Financial_Statements.pdf
What is the Precautionary and Liquidity Line (PLL)?,The Precautionary and Liquidity Line (PLL) is available for members with sound economic fundamentals but with some remaining vulnerabilities that prevent them from meeting the qualification criteria for the FCL and the SLL.,"['Precautionary', 'Liquidity', 'Line', 'available', 'members', 'sound', 'economic', 'fundamentals', 'vulnerabilities', 'qualification', 'criteria', 'FCL', 'SLL']",IMF_Financial_Statements.pdf
What is the Rapid Financing Instrument (RFI)?,The Rapid Financing Instrument (RFI) is used by members facing an urgent balance of payments need without the necessity or capacity for a full-fledged program.,"['Rapid Financing Instrument', 'RFI', 'urgent balance of payments need', 'full-fledged program']",IMF_Financial_Statements.pdf
What is the purpose of the Investment Account (IA)?,The purpose of the Investment Account (IA) is to broaden the IMF's income base by investing resources transferred from the GRA.,"[""The purpose of the Investment Account (IA) is to broaden the IMF's income base by investing resources transferred from the GRA.""]",IMF_Financial_Statements.pdf
"What was the investment objective of the Fixed-Income Subaccount during the financial year ended April 30, 2022?","The investment objective of the Fixed-Income Subaccount during the financial year ended April 30, 2022 was to achieve, over time, returns that exceed the SDR interest rate by a margin of 50 basis points.","['achieve', 'exceed', 'SDR', 'interest', 'rate', 'margin', 'basis', 'points']",IMF_Financial_Statements.pdf
What was the amount of profits credited to the Endowment Subaccount from gold sales during financial years 2010 and 2011?,The Endowment Subaccount was credited with SDR 4.4 billion in profits from gold sales during financial years 2010 and 2011.,['SDR 4.4 billion'],IMF_Financial_Statements.pdf
What is the investment objective of the Endowment Subaccount?,"The investment objective of the Endowment Subaccount is to achieve a real return of 3 percent in US dollar terms over the long term to contribute to covering the IMF’s administrative expenditures, while preserving the long-term real value of these assets.","['3 percent', 'long term', 'real value']",IMF_Financial_Statements.pdf
What is the purpose of the Special Disbursement Account (SDA)?,"The SDA is used to receive profits from the sale of gold held by the IMF at the time of the Second Amendment of the IMF’s Articles of Agreement (April 1978). SDA resources can be used for various purposes, including transfers to the GRA for immediate use in operations and transactions, transfers to the IA, or operations and transactions that are not authorized by other provisions of the IMF’s Articles of Agreement but are consistent with the mandate of the IMF, in particular to provide balance of payments assistance on special terms to low-income member countries.","['SDA', 'IMF', 'GRA', 'IA']",IMF_Financial_Statements.pdf
"What are the other entities administered by the IMF, aside from the General Department?","The IMF also administers the Special Drawing Rights Department (SDR Department), trusts (Concessional Lending and Debt Relief Trusts), and special purpose accounts (Administered Accounts) established to fund financial and technical services consistent with the IMF’s purposes.","['Special Drawing Rights Department', 'Concessional Lending', 'Debt Relief Trusts', 'Administered Accounts']",IMF_Financial_Statements.pdf
How are the resources of the SDR Department held and used?,"The resources of the SDR Department are held separately from the assets of all other accounts owned or administered by the IMF. As specified in the IMF’s Articles of Agreement, these resources may not be used to meet the liabilities, obligations, or losses incurred in the operations of the General Department (or vice versa), except that expenses of conducting the business of the SDR Department are paid by the General Department and are then reimbursed by the SDR Department.","['held', 'separately', 'resources', 'IMF', 'Articles', 'Agreement', 'liabilities', 'obligations', 'losses', 'operations', 'General', 'Department', 'expenses', 'business', 'reimbursed']",IMF_Financial_Statements.pdf
What is the impact of the COVID-19 pandemic on the IMF's financing activity?,"The COVID-19 pandemic has created severe disruptions in global economic activity, and the IMF responded to the crisis with unprecedented speed and magnitude of financial assistance, to help countries, notably to protect the most vulnerable and set the stage for economic recovery. A significant number of countries benefited from emergency financing through RFI purchases during the financial year ended April 30, 2021.","['severe', 'disruptions', 'global', 'economic', 'activity', 'IMF', 'responded', 'crisis', 'unprecedented', 'speed', 'magnitude', 'financial', 'assistance', 'countries', 'vulnerable', 'recovery', 'emergency', 'financing', 'RFI', 'purchases']",IMF_Financial_Statements.pdf
How has the pandemic affected the General Department's credit exposure?,"The pandemic has increased the General Department's credit exposure compared with the pre-pandemic level, due to the increased financing activity.","['increased', 'credit', 'exposure', 'pre-pandemic', 'financing', 'activity']",IMF_Financial_Statements.pdf
