question,answer,tokens_present,document
What is the expected impact of the war in Ukraine on global growth?,"The war in Ukraine that started in February 2022 is expected to have a significant negative effect on global growth through commodity markets, trade, and, to a lesser extent, financial interlinkages.","['significant', 'negative', 'effect', 'global', 'growth']",IMF_Financial_Statements.pdf
What is the purpose of the Schedule 3 mentioned in the text?,"Schedule 3 provides information on the IMF's financial assistance approved under its lending arrangements and augmented existing lending arrangements to accommodate new needs arising from the impact of the pandemic during the financial years ended April 30, 2022, and 2021.","['Schedule', '3', 'IMF', 'lending', 'arrangements', 'pandemic']",IMF_Financial_Statements.pdf
What is the basis of preparation and measurement for the financial statements of the General Department?,"The financial statements of the General Department are prepared in accordance with International Financial Reporting Standards (IFRS) issued by the International Accounting Standards Board (IASB) and have been prepared under the historical cost convention, except for the revaluation of financial instruments at fair value through profit or loss.","['IFRS', 'IASB']",IMF_Financial_Statements.pdf
What is the unit of account used in the financial statements of the General Department?,"The financial statements are presented in SDRs, which is the IMF’s unit of account.",['SDRs'],IMF_Financial_Statements.pdf
"What is the composition of the SDR valuation basket as of April 30, 2022?","The SDR valuation basket consists of five currencies, with the following weights: Chinese renminbi (10.92%), Euro (30.93%), Japanese yen (8.33%), Pound sterling (8.09%), and US dollar (41.73%).","['Chinese renminbi', 'Euro', 'Japanese yen', 'Pound sterling', 'US dollar']",IMF_Financial_Statements.pdf
"What was the value of SDR 1 in US dollars as of April 30, 2022?","SDR 1 was equal to US$1.34430 as of April 30, 2022.",['1.34430'],IMF_Financial_Statements.pdf
"What was the reason for the extension of the current SDR valuation basket beyond its original expiration date of September 30, 2021?","The Executive Board decided to extend the current SDR valuation basket to July 31, 2022, to allow for the completion of the quinquennial review of the method of valuation of the SDR.","['The', 'Executive', 'Board', 'decided', 'to', 'extend', 'the', 'current', 'SDR', 'valuation', 'basket', 'to', 'July', '31', '2022', 'to', 'allow', 'for', 'the', 'completion', 'of', 'the', 'quinquennial', 'review', 'of', 'the', 'method', 'of', 'valuation', 'of', 'the', 'SDR']",IMF_Financial_Statements.pdf
"What changes were made to the SDR basket valuation basket as a result of the quinquennial review concluded on May 11, 2022?","The Executive Board agreed to maintain the current composition of the SDR currency and interest rate baskets and approved their updated weights, which imply slightly higher weights for the US dollar and the Chinese renminbi and somewhat lower weights for the British pound, the euro, and the Japanese yen.","['US dollar', 'Chinese renminbi', 'British pound', 'euro', 'Japanese yen']",IMF_Financial_Statements.pdf
"What are the new weights for the SDR basket currencies effective August 1, 2022?","The new weights for the SDR basket currencies effective August 1, 2022, are as follows: Chinese renminbi (12.28%), Euro (29.31%), Japanese yen (7.59%), Pound sterling (7.44%), and US dollar (43%).","['Chinese renminbi', 'Euro', 'Japanese yen', 'Pound sterling', 'US dollar']",IMF_Financial_Statements.pdf
How has the war in Ukraine affected the investment portfolios of the General Department?,"The war in Ukraine has had a significant negative effect on global growth through commodity markets, trade, and, to a lesser extent, financial interlinkages, which has impacted the investment portfolios of the General Department.","['significant', 'negative', 'impacted']",IMF_Financial_Statements.pdf
How has the General Department managed its risks in response to the pandemic and the war in Ukraine?,"The General Department continues to manage its risks in accordance with its existing risk management framework, which has been effective in mitigating the risk exposure of the effects of the global developments on the investment portfolios.","['mitigating', 'risk', 'management', 'framework']",IMF_Financial_Statements.pdf
What is the basis for the valuation of investments held at amortized cost in the financial statements of the General Department?,The valuation of investments held at amortized cost in the financial statements of the General Department is not impacted by the global developments.,"['not', 'impacted']",IMF_Financial_Statements.pdf
What is the purpose of the SDR basket valuation?,"The SDR basket valuation is used to determine the weights of the five currencies (Chinese renminbi, euro, Japanese yen, British pound, and US dollar) in the SDR basket, which is used as the basis for calculating the interest rate on SDR holdings, remuneration paid on members’ reserve tranche positions, and interest on borrowings.","['SDR basket valuation', 'interest rate', 'remuneration', 'borrowings']",IMF_Financial_Statements.pdf
What are the five currencies included in the SDR basket?,"The five currencies included in the SDR basket are the Chinese renminbi, euro, Japanese yen, British pound, and US dollar.","['Chinese renminbi', 'euro', 'Japanese yen', 'British pound', 'US dollar']",IMF_Financial_Statements.pdf
How are the weights of the currencies in the SDR basket determined?,"The weights of the currencies in the SDR basket are determined based on a review conducted every five years, or sooner if developments in the interim justify an earlier review. The review takes into account the economic positions of the currencies and the interests of the IMF's member countries.","['based', 'every', 'five', 'years']",IMF_Financial_Statements.pdf
What is the SDR interest rate?,"The SDR interest rate is the interest rate paid on SDR holdings, remuneration paid on members’ reserve tranche positions, and interest on borrowings. It is determined weekly by reference to a weighted average of yields or rates on short-term instruments in the money markets of the members whose currencies are included in the SDR valuation basket.","['SDR interest rate', 'interest rate', 'yields', 'rates', 'short-term instruments', 'money markets', 'members', 'currencies', 'SDR valuation basket']",IMF_Financial_Statements.pdf
What is the floor for the SDR interest rate?,The SDR interest rate is subject to a floor of 0.050 percent.,['0.050 percent'],IMF_Financial_Statements.pdf
"What is the average SDR interest rate for the financial years ended April 30, 2022, and 2021?","The average SDR interest rate was 0.107 percent per annum for the financial year ended April 30, 2022, and 0.077 percent per annum for the financial year ended April 30, 2021.","['0.107', '0.077']",IMF_Financial_Statements.pdf
"What is the significance of the transition date of July 29, 2022, in relation to the SDR basket valuation?","The transition date of July 29, 2022, is significant because it is the date on which the new weights for the SDR basket currencies will be assigned and used to calculate the SDR interest rate.","['July 29, 2022', 'SDR basket', 'SDR interest rate']",IMF_Financial_Statements.pdf
What is the basis for accounting for financial instruments in the financial statements of the General Department?,"Financial instruments in the financial statements of the General Department are accounted for using settlement date accounting, except for investments, which are accounted for using trade date accounting. At initial recognition, a financial instrument is measured at its fair value, which is best evidenced by the transaction amount.","['fair value', 'transaction amount']",IMF_Financial_Statements.pdf
When are financial assets derecognized in the financial statements of the General Department?,"Financial assets are derecognized in the financial statements of the General Department when the contractual rights to receive the cash flows from the assets have expired, or when they have been transferred and either: (i) the General Department transfers substantially all the risks and rewards of ownership; or (ii) the General Department neither transfers nor retains substantially all the risks and rewards of ownership but the General Department has not retained control.","['derecognized', 'financial', 'assets', 'General', 'Department']",IMF_Financial_Statements.pdf
How are financial liabilities derecognized in the financial statements of the General Department?,"Financial liabilities are derecognized in the financial statements of the General Department when they are extinguished (i.e., when the obligation is discharged, canceled, or expires).","['derecognized', 'financial', 'liabilities', 'General', 'Department', 'extinguished', 'obligation', 'discharged', 'canceled', 'expires']",IMF_Financial_Statements.pdf
How are financial liabilities derecognized?,"Financial liabilities are derecognized when they are extinguished, such as when the obligation is discharged, canceled, or expires.","['discharged', 'canceled', 'expires']",IMF_Financial_Statements.pdf
How are financial assets classified on initial recognition?,Financial assets are classified on initial recognition based on two factors: the business model for managing the financial asset and its contractual cash flow characteristics.,"['based', 'two', 'factors']",IMF_Financial_Statements.pdf
What is the measurement basis for financial assets held for collection of contractual cash flows where those cash flows represent solely payments of principal and interest?,Financial assets that are held for collection of contractual cash flows where those cash flows represent solely payments of principal and interest are measured at amortized cost (AC).,"['amortized cost', 'AC']",IMF_Financial_Statements.pdf
"What is the measurement basis for financial assets held for collection of contractual cash flows and for selling, where the assets’ cash flows represent solely payments of principal and interest?","Financial assets that are held for collection of contractual cash flows and for selling, where the assets’ cash flows represent solely payments of principal and interest, would be measured at fair value through other comprehensive income (FVOCI).",['FVOCI'],IMF_Financial_Statements.pdf
How are financial assets measured at fair value?,"Financial assets that do not meet the criteria to be measured at AC or FVOCI are measured at fair value, with changes in fair value recognized in profit or loss (FVPL).","['fair value', 'profit or loss', 'FVPL']",IMF_Financial_Statements.pdf
What is the purpose of evaluating expected credit losses (ECL) associated with financial assets at AC and with undrawn balances under lending commitments?,"The purpose of evaluating ECL is to assess the expected credit losses associated with financial assets at AC and with undrawn balances under lending commitments, and to record impairment allowances for assets at AC and liability provisions for undrawn commitments as needed.","['ECL', 'assess', 'credit', 'losses', 'associated', 'financial', 'assets', 'AC', 'undrawn', 'balances', 'lending', 'commitments', 'record', 'impairment', 'allowances', 'liability', 'provisions']",IMF_Financial_Statements.pdf
How are impairment allowances for financial assets at AC calculated?,"Impairment allowances for financial assets at AC are calculated by applying the effective interest rate to its amortized cost (i.e., net of the impairment allowance).","['applying', 'effective', 'interest', 'rate', 'amortized', 'cost', 'net', 'impairment', 'allowance']",IMF_Financial_Statements.pdf
How are derivative financial liabilities measured?,Derivative financial liabilities are measured at fair value with changes in fair value recognized in profit or loss.,"['fair value', 'profit or loss']",IMF_Financial_Statements.pdf
How are other financial liabilities measured?,All other financial liabilities are measured at amortized cost. Interest expense from these financial liabilities is included in the statements of income using the effective interest method.,"['amortized', 'cost', 'interest', 'income', 'effective', 'method']",IMF_Financial_Statements.pdf
What is the purpose of the currency revaluation receivables and payables included in the statements of financial position?,The currency revaluation receivables and payables are included in the statements of financial position to reflect the impact of currency fluctuations on the value of the GRA's assets and liabilities denominated in foreign currencies.,"['currency', 'revaluation', 'receivables', 'payables', 'statements', 'financial', 'position', 'impact', 'currency', 'fluctuations', 'value', ""GRA's"", 'assets', 'liabilities', 'foreign', 'currencies']",IMF_Financial_Statements.pdf
How do members receive financing from the GRA?,Members receive financing from the GRA by purchasing SDRs or usable currencies in exchange for their own currencies.,"['SDRs', 'usable currencies', 'exchange', 'currencies']",IMF_Financial_Statements.pdf
How is the GRA credit repaid by members?,GRA credit is repaid by members by repurchasing holdings of their currencies in exchange for SDRs or usable currencies.,"['GRA', 'credit', 'repurchasing', 'holdings', 'currencies', 'SDRs', 'usable currencies']",IMF_Financial_Statements.pdf
What are the charges and fees associated with GRA credit?,"The GRA earns interest, referred to as basic charges, on members’ use of GRA credit. Basic charges are recognized using the effective interest method. In addition, outstanding GRA credit is also subject to level-based and time-based surcharges.","['interest', 'basic charges', 'surcharges']",IMF_Financial_Statements.pdf
What happens if charges not received from members within the required timeframe are not paid?,"Charges not received from members within the required timeframe are recovered by the GRA under the burden-sharing mechanism, through adjustments to increase the rate of charge for debtor member s and decrease the rate of remuneration on members’ reserve tranche positions.","['not', 'paid']",IMF_Financial_Statements.pdf
Is a service charge levied by the GRA on all purchases from the GRA?,"Yes, a service charge is levied by the GRA on all purchases from the GRA except reserve tranche purchases.",['Yes'],IMF_Financial_Statements.pdf
How is commitment fee income recognized by the GRA?,Commitment fee income is recognized on a straight-line basis over the duration of the SLL arrangement.,"['straight-line', 'basis', 'duration', 'SLL arrangement']",IMF_Financial_Statements.pdf
What is the basis for the General Department’s assessment for impairment of its credit outstanding?,The General Department’s assessment for impairment of its credit outstanding is grounded in the context of the nature of the IMF’s financing and its unique institutional status.,"['grounded', 'context', 'nature', ""IMF's"", 'financing', 'unique', 'institutional', 'status']",IMF_Financial_Statements.pdf
Has the General Department recognized any impairment losses since inception?,"No, the General Department has not recognized any impairment losses since inception.",['No'],IMF_Financial_Statements.pdf
How does the General Department assess credit risk?,"The General Department assesses credit risk holistically based on qualitative and quantitative considerations pertaining to each debtor member, such as the status of the economic programs underlying IMF financing, the member’s cooperation on policy implementation and timely settlement of IMF financial obligations, and forward-looking assessment of the member’s capacity to repay.","['holistically', 'qualitative', 'quantitative', 'debtor', 'member', 'IMF', 'financing', 'cooperation', 'policy', 'implementation', 'timely', 'settlement', 'financial', 'obligations', 'forward-looking', 'capacity', 'repay']",IMF_Financial_Statements.pdf
Are external credit risk ratings used by the General Department to assess credit risk?,"No, the General Department does not use external credit risk ratings to assess credit risk as its credit risk exposure is not comparable to sovereign credit risk faced by commercial financial entities.",['No'],IMF_Financial_Statements.pdf
What is the basis for assessing credit risk for the General Department's exposure to a member country?,"The credit risk for the General Department's exposure to a member country is assessed holistically based on qualitative and quantitative considerations pertaining to each debtor member, such as the status of the economic programs underlying IMF financing, the member's cooperation on policy implementation and timely settlement of IMF financial obligations, and forward-looking assessment of the member's capacity to repay.","['holistically', 'qualitative', 'quantitative', 'debtor', 'member', 'status', 'economic', 'programs', 'IMF', 'financing', 'cooperation', 'policy', 'implementation', 'timely', 'settlement', 'IMF', 'obligations', 'forward-looking', 'assessment', 'capacity', 'repay']",IMF_Financial_Statements.pdf
What is the definition of default according to the General Department?,"According to the General Department, a member country is considered to be in default when it is six months or more overdue in settling its financial obligations to the General Department.","['six months', 'more overdue', 'financial obligations']",IMF_Financial_Statements.pdf
What is considered credit-impaired according to the General Department?,"Credit outstanding is considered credit-impaired when the obligation has defaulted, and the General Department assumes that the credit risk of a member country has increased significantly since initial recognition if the member is determined to have low credit risk at the reporting date.","['credit-impaired', 'defaulted', 'obligation', 'member country', 'credit risk', 'reporting date']",IMF_Financial_Statements.pdf
How does the General Department assess whether a significant increase in credit risk has occurred?,"The General Department assesses whether a significant increase in credit risk has occurred on a member-by-member basis by comparing the risk of default at the reporting date with the risk of default at the date of the most recent disbursement to the debtor member, taking into account a range of qualitative and quantitative criteria.","['significant', 'increase', 'credit', 'risk', 'member', 'default']",IMF_Financial_Statements.pdf
What are some of the criteria used by the General Department to identify significant increases in credit risk?,"Some of the criteria used by the General Department to identify significant increases in credit risk include overdue obligations to the IMF, signals of noncooperation by the member, and forward-looking indicators of capacity to repay the IMF.","['overdue obligations', 'signals of noncooperation', 'forward-looking indicators', 'capacity to repay']",IMF_Financial_Statements.pdf
How does the General Department measure expected credit loss (ECL)?,"The General Department measures ECL by comparing expected cash flows with contractual cash flows and discounting the expected cash shortfalls at the effective interest rate, which is the basic rate of charge.","['The', 'General', 'Department', 'measures', 'ECL', 'by', 'comparing', 'expected', 'cash', 'flows', 'with', 'contractual', 'cash', 'flows', 'and', 'discounting', 'the', 'expected', 'cash', 'shortfalls', 'at', 'the', 'effective', 'interest', 'rate', 'which', 'is', 'the', 'basic', 'rate', 'of', 'charge']",IMF_Financial_Statements.pdf
What is the basis for the General Department's assumption that credit risk related to a member country is low?,"The General Department assumes that credit risk related to a member country is low if the member has a low risk of default, a strong capacity to meet its contractual cash flow obligations in the near term, and adverse changes in economic and business conditions in the longer term may, but will not necessarily, reduce the ability of the member country to fulfill its contractual cash flow obligations.","['low risk of default', 'strong capacity', 'contractual cash flow obligations', 'adverse changes', 'economic and business conditions']",IMF_Financial_Statements.pdf
What is the purpose of the burden-sharing mechanism in the IMF's financial structure and operations?,The purpose of the burden-sharing mechanism in the IMF's financial structure and operations is to compensate the IMF for loss of income due to overdue payments.,"['compensate', 'IMF', 'loss', 'income', 'overdue', 'payments']",IMF_Financial_Statements.pdf
How does the General Department consider financial safeguards in measuring ECL?,"The General Department considers financial safeguards that are integral to the IMF's financial structure and operations, such as the burden-sharing mechanism, when measuring ECL.","['The', ""IMF's""]",IMF_Financial_Statements.pdf
What is the source of the General Department's ECL estimation model?,"The General Department has developed a model for ECL estimation based on changes in credit quality since initial recognition, where credit quality is referred to as Stage 1, Stage 2, and Stage 3.","['The', 'General', 'Department', 'has', 'developed', 'a', 'model', 'for', 'ECL', 'estimation', 'based', 'on', 'changes', 'in', 'credit', 'quality', 'since', 'initial', 'recognition', 'where', 'credit', 'quality', 'is', 'referred', 'to', 'as', 'Stage', '1', 'Stage', '2', 'and', 'Stage', '3']",IMF_Financial_Statements.pdf
What is the basis for recognizing investment income in the financial statements of the IMF?,"Investment income is recognized using the effective interest method, and it includes interest income on investments at AC, interest and dividend income, and realized and unrealized gains and losses from FVPL investments, including currency valuation differences arising from exchange rate movements against the SDR, net of all trading-related fees.","['interest', 'income', 'investments', 'gains', 'losses', 'currency', 'valuation', 'differences', 'exchange', 'rate', 'movements', 'SDR', 'trading-related', 'fees']",IMF_Financial_Statements.pdf
How are investments in the IMF's portfolios managed and evaluated?,Investments in each of the two subaccounts are managed in accordance with their respective investment strategy and their performance is evaluated on a fair value basis. The business model for the invested portfolios focuses on achieving fair value gains.,['fair value'],IMF_Financial_Statements.pdf
What is the carrying value of gold holdings in the IMF's financial statements?,"Gold holdings are carried at historical cost using the specific identification method, and the carrying value is determined by the restrictions on the use of the IMF's gold holdings and the disposition of profits from the sale of gold.","['historical cost', 'specific identification method', 'carrying value', 'restrictions', 'use', 'disposition', 'profits', 'sale']",IMF_Financial_Statements.pdf
What is the basis for recognizing cash and cash equivalents in the IMF's financial statements?,Usable currencies and SDR holdings are considered cash and cash equivalents in the statements of cash flows.,"['usable currencies', 'SDR holdings', 'cash', 'cash equivalents', 'statements', 'flows']",IMF_Financial_Statements.pdf
"How are property, plant, and equipment, and intangible assets measured and depreciated or amortized in the IMF's financial statements?","Property, plant, and equipment, and intangible assets are measured at historical cost less accumulated depreciation or amortization. They are capitalized and depreciated or amortized over the estimated remaining useful lives using the straight-line method.","['historical cost', 'accumulated depreciation', 'amortization', 'straight-line method']",IMF_Financial_Statements.pdf
What is the purpose of the Special Contingent Account (SCA-1) in the IMF's financial structure?,The Special Contingent Account (SCA-1) is used to protect the IMF in case of the ultimate failure of a member to repay its overdue obligations to the General Department.,['The Special Contingent Account (SCA-1)'],IMF_Financial_Statements.pdf
What is the basis for recognizing write-offs in the IMF's financial statements?,"Write-offs are recognized in the unlikely event that a member with credit outstanding withdraws from the IMF, repudiates its outstanding obligations to the General Department, and there are no prospects of recovering amounts due to the General Department in the foreseeable future.","['withdraws', 'repudiates', 'outstanding', 'obligations', 'General Department', 'foreseeable', 'future']",IMF_Financial_Statements.pdf
How are SDR holdings measured and classified in the IMF's financial statements?,SDR holdings are measured at AC and classified as SDR holdings in the statements of financial position.,"['SDR holdings', 'measured', 'classified', 'statements', 'financial position']",IMF_Financial_Statements.pdf
What is the purpose of the burden-sharing mechanism in the IMF's financial structure?,The burden-sharing mechanism is used to compensate the IMF for loss of income due to overdue payments.,"['burden-sharing', 'mechanism', 'IMF', 'loss', 'income', 'overdue', 'payments']",IMF_Financial_Statements.pdf
How are dividend income and realized and unrealized gains and losses from FVPL investments recognized in the IMF's financial statements?,"Dividend income is recognized based on the ex-dividend date, and realized and unrealized gains and losses from FVPL investments are recognized in investment income using the effective interest method.","['dividend', 'income', 'realized', 'unrealized', 'gains', 'losses', 'FVPL', 'investments', 'recognized', 'financial', 'statements']",IMF_Financial_Statements.pdf
