question,answer,tokens_present,document
What is the purpose of the table provided in the text?,The purpose of the table provided in the text is to list the essential components of an EMR system and their minimal functionalities.,"['The', 'purpose', 'of', 'the', 'table', 'provided', 'in', 'the', 'text', 'is', 'to', 'list', 'the', 'essential', 'components', 'of', 'an', 'EMR', 'system', 'and', 'their', 'minimal', 'functionalities']",Digital_Health_Guidelines.pdf
What is the recommended architecture for EMR systems in Sri Lanka?,"The recommended architecture for EMR systems in Sri Lanka is a ""Microservices Architecture"" that communicates through Application Programming Interfaces (APIs).","['Microservices Architecture', 'APIs']",Digital_Health_Guidelines.pdf
What is the purpose of the National Electronic Health Record (NEHR)?,"The purpose of the NEHR is to provide a single, unified repository of all personal health information of individuals from their birth to death, facilitating information sharing among authorized users, including healthcare recipients, irrespective of their geographical location.","['NEHR', 'health', 'information', 'sharing', 'recipients']",Digital_Health_Guidelines.pdf
What is the role of the Ministry of Health in relation to the NEHR?,"The Ministry of Health is the owner of the NEHR and is responsible for its design, development, and maintenance.","['Ministry', 'Health', 'owner', 'NEHR', 'responsible']",Digital_Health_Guidelines.pdf
How do EMR systems communicate with the NEHR?,EMR systems communicate with the NEHR through APIs.,"['EMR', 'NEHR', 'APIs']",Digital_Health_Guidelines.pdf
What is the purpose of the Personal Health Number (PHN)?,The PHN is used to uniquely identify patients/clients in the system and is recommended for use in both public and private sector EMR systems.,"['Personal Health Number', 'PHN', 'patients', 'clients', 'system']",Digital_Health_Guidelines.pdf
What is the purpose of the Health Institution Number (HIN)?,The HIN is used to uniquely identify sector healthcare institutions in the system.,"['Health', 'Institution', 'Number', 'system']",Digital_Health_Guidelines.pdf
What is the purpose of clinical decision support in EMR systems?,Clinical decision support in EMR systems is based on currently accepted clinical guidelines issued by competent authorities and is intended to aid healthcare professionals in making informed decisions.,"['aid', 'based', 'competent', 'currently', 'decision', 'decisions', 'EMR', 'healthcare', 'informed', 'intended', 'issued', 'professionals', 'support', 'systems']",Digital_Health_Guidelines.pdf
What is the purpose of decision-support dashboards in EMR systems?,Decision-support dashboards in EMR systems are intended to aid hospital administrators in making administrative and operational decisions.,"['decision-support', 'dashboards', 'EMR', 'systems', 'administrators', 'decisions']",Digital_Health_Guidelines.pdf
What is the scope of the National Information Security Standards that EMR systems must comply with?,"The National Information Security Standards that EMR systems must comply with are related to the protection of personal health information and ensure the confidentiality, integrity, and availability of the information.","['personal health information', 'confidentiality', 'integrity', 'availability', 'information']",Digital_Health_Guidelines.pdf
What is the purpose of the National/Cluster MPIs that EMR systems should communicate with?,The National/Cluster MPIs are used to uniquely identify patients/clients in the system and are recommended for use in both public and private sector EMR systems.,"['National', 'Cluster', 'MPIs', 'patients', 'clients', 'system']",Digital_Health_Guidelines.pdf
How do care recipients access their Electronic Health Record in the NEHR?,"Care recipients can access their Electronic Health Record in the NEHR through a patient portal, following authentication and authorization at approved healthcare institutions.","['patient portal', 'authentication', 'authorization', 'healthcare institutions']",Digital_Health_Guidelines.pdf
What is a Personal Health Record (PHR)?,"A Personal Health Record (PHR) is an electronic application through which patients can maintain and manage their health information (and that of others for whom they are authorized) in a private, secure, and confidential environment.","['Personal', 'Health', 'Record', 'electronic', 'application', 'patients', 'health', 'information', 'private', 'secure', 'confidential', 'environment']",Digital_Health_Guidelines.pdf
What is the recommended network architecture for health institutions in Sri Lanka?,"It is recommended to follow the latest and/or widely accepted versions of networking standards, including mobile devices, and cabling standards of the Institute of Electrical and Electronics Engineers (IEEE), International Organization for Standardization (ISO), Electronic Industries Alliance (EIA), and Telecommunications Industry Association (TIA).",,Digital_Health_Guidelines.pdf
What is the recommended way to manage network infrastructure for health institutions in Sri Lanka?,"Health institutions are recommended to maintain their own Private Local Area Network (P-LAN) interconnecting all the devices within the institution, and open network protocols are recommended to ensure freedom of hardware selection.","['Private Local Area Network', 'P-LAN', 'open network protocols', 'hardware selection']",Digital_Health_Guidelines.pdf
What are the recommended communication interfaces for state healthcare sector institutions in Sri Lanka?,"Websites of state healthcare sector institutions should be available in Sinhala, Tamil, and English, and should have a mechanism to handle complaints or concerns on healthcare-related content on the website.","['Sinhala', 'Tamil', 'English']",Digital_Health_Guidelines.pdf
Who is responsible for issuing official domain names to line ministry institutions and institutions coming under the provincial ministries in Sri Lanka?,The Health Informatics Unit (HIU) will issue the official domain names to line ministry institutions and institutions coming under the provincial ministries.,['Health Informatics Unit (HIU)'],Digital_Health_Guidelines.pdf
What is the recommended email address format for official communication in state healthcare sector institutions in Sri Lanka?,Email addresses should be assigned in accordance with the “General Circular Letter No. 02-l87/2012” (Annexure-II).,['General Circular Letter No. 02-l87/2012'],Digital_Health_Guidelines.pdf
What is the recommended way to manage email communication in state healthcare sector institutions in Sri Lanka?,"Email accounts on an organization’s domain shall be used for official purposes only, and all official electronic communications should only be carried out using the official email address under the organization’s domain.","['shall', 'only', 'official', 'domain']",Digital_Health_Guidelines.pdf
What are the recommended network security standards for health institutions in Sri Lanka?,"All PHRs shall comply with the national information security standards, and it is recommended that PHR systems should comply with the National HL7 FHIR profile.","['National HL7 FHIR profile', 'national information security standards']",Digital_Health_Guidelines.pdf
What is the recommended way to exchange health-related data between institutions in the health domain in Sri Lanka?,All institutions under the Ministry of Health and the provincial departments of health should be able to exchange health-related data through the official network of the Government of Sri Lanka.,"['All', 'institutions', 'under', 'the', 'Ministry', 'of', 'Health', 'and', 'the', 'provincial', 'departments', 'of', 'health', 'should', 'be', 'able', 'to', 'exchange', 'health-related', 'data', 'through', 'the', 'official', 'network', 'of', 'the', 'Government', 'of', 'Sri', 'Lanka']",Digital_Health_Guidelines.pdf
What is the recommended way to maintain paper-based archiving regulations for email communications in state healthcare sector institutions in Sri Lanka?,"Paper-based archiving regulations should also be applied to all email communications, and all email communications should follow the proper channels of communication as per existing guidelines and norms for paper-based document communication.","['paper-based', 'email', 'communication', 'guidelines', 'norms']",Digital_Health_Guidelines.pdf
What is the purpose of the guidelines for email communication in an organization?,"The purpose of the guidelines for email communication in an organization is to ensure that all official electronic communications are carried out using the official email address under the organization’s domain, and that all email communications follow the proper channels of communication as per existing guidelines and norms for paper-based document communication.","['ensure', 'official', 'communications', 'proper', 'channels', 'guidelines', 'norms']",Digital_Health_Guidelines.pdf
"What is the definition of ""anonymize"" in the context of privacy and confidentiality?","In the context of privacy and confidentiality, ""anonymize"" means permanently removing any personal identifiers to render any personal data from being related to an identified or identifiable natural person.","['anonymize', 'personal', 'identifiers', 'person']",Digital_Health_Guidelines.pdf
"What is the definition of ""consent"" in the context of privacy and confidentiality?","In the context of privacy and confidentiality, ""consent"" means any freely given, specific, informed, and unambiguous indication by way of a written declaration or an affirmative action signifying a data subject’s agreement to the processing of his/her personal data.","['consent', 'privacy', 'confidentiality', 'personal data', 'processing']",Digital_Health_Guidelines.pdf
"What is the definition of ""data subject"" in the context of privacy and confidentiality?","In the context of privacy and confidentiality, ""data subject"" means an identified or identifiable natural person. An identifiable natural person is one who can be identified, directly or indirectly, in particular by reference to an identifier including but not limited to a name, an identification number, location data, an online identifier or to one or more factors specific to the physical, physiological, genetic, psychological, economic, cultural or social identity of that natural person.","['identified', 'identifiable', 'natural person', 'identifier', 'name', 'identification number', 'location data', 'online identifier', 'physical', 'physiological', 'genetic', 'psychological', 'economic', 'cultural', 'social identity']",Digital_Health_Guidelines.pdf
"What is the definition of ""encryption"" in the context of privacy and confidentiality?","In the context of privacy and confidentiality, ""encryption"" means the act of ciphering or altering data using a mathematical algorithm to make such data unintelligible to unauthorized users.","['encryption', 'ciphering', 'altering', 'data', 'unintelligible', 'unauthorized']",Digital_Health_Guidelines.pdf
"What is the definition of ""personal data"" in the context of privacy and confidentiality?","In the context of privacy and confidentiality, ""personal data"" means any information whether true or not, relating to a data subject.","['personal data', 'data subject']",Digital_Health_Guidelines.pdf
"What is the definition of ""pseudonymization"" in the context of privacy and confidentiality?","In the context of privacy and confidentiality, ""pseudonymization"" means the processing of personal data in such a manner that the personal data cannot be used to identify a data subject without the use of additional information and such additional information is kept separately and is subject to technical and organizational measures to ensure that the personal data are not attributed to a data subject.","['pseudonymization', 'personal data', 'data subject', 'additional information', 'technical', 'organizational', 'measures']",Digital_Health_Guidelines.pdf
Who is responsible for ensuring the privacy and confidentiality of healthcare recipients' information?,Ensuring the privacy and confidentiality of healthcare recipients' information is a fundamental ethical concept in Medical Practice and shall be paramount in all digital Health solutions.,"['shall', 'paramount']",Digital_Health_Guidelines.pdf
What is the role of the Forum for Ethics Review Committees in Sri Lanka (FERCSL) in ensuring the privacy and confidentiality of healthcare recipients' information?,"The Forum for Ethics Review Committees in Sri Lanka (FERCSL) is responsible for reviewing and approving electronic health systems that handle personally identifiable data of patients, clients or the general public for research purposes, to ensure that they comply with ethical standards and regulations.","['Forum', 'Ethics', 'Review', 'Committees', 'Sri Lanka', 'FERCSL', 'responsible', 'reviewing', 'approving', 'electronic', 'health', 'systems', 'personally', 'identifiable', 'data', 'patients', 'clients', 'general public', 'research', 'purposes', 'ensure', 'ethical', 'standards', 'regulations']",Digital_Health_Guidelines.pdf
What is the requirement for disclosure of personally identifiable information in healthcare?,"Personally identifiable information shall not be disclosed without the written informed consent of the individual concerned for any other purpose than the purpose for which it was collected, unless disclosure is enforced by law.","['personally identifiable information', 'written informed consent', 'individual concerned', 'disclosure', 'law']",Digital_Health_Guidelines.pdf
What is the purpose of role-based access control profiles in healthcare institutions?,"Role-based access control profiles are used to ensure that employees have access only to the information they need to perform their job functions, and to maintain the confidentiality of patient information.","['role-based access control', 'healthcare institutions', 'employees', 'job functions', 'patient information']",Digital_Health_Guidelines.pdf
What is the responsibility of healthcare institutions regarding employee confidentiality agreements?,"Healthcare institutions are responsible for ensuring that employees who leave the organization are bound to maintain the confidentiality of personal information related to patients/clients that they have come to know during their employment, unless enforced by law.","['Healthcare', 'institutions', 'responsible', 'employees', 'confidentiality', 'personal', 'information', 'patients', 'clients', 'employment', 'law']",Digital_Health_Guidelines.pdf
"What is required for third-party personnel involved with health information systems, including maintenance?","Third-party personnel involved with health information systems, including maintenance, must sign non-disclosure agreements.",['non-disclosure agreements'],Digital_Health_Guidelines.pdf
Can an individual request changes to their personal information held in an information system?,"Yes, an individual has the right to request changes and amendments to personal information held in an information system in the event of any discrepancy.",['Yes'],Digital_Health_Guidelines.pdf
How should electronic documents be maintained in healthcare institutions?,Electronic documents should be maintained following existing guidelines governing paper-based documents and the prevailing legislation in the country.,"['electronic', 'documents', 'maintained', 'guidelines', 'paper-based', 'legislation', 'country']",Digital_Health_Guidelines.pdf
What are the security standards and guidelines that digital health systems must follow?,"Digital health systems must follow the security standards and guidelines defined by the Sri Lanka Government, which shall be strictly followed.",['Sri Lanka Government'],Digital_Health_Guidelines.pdf
What is the requirement for recording data changes in digital health systems?,"Digital health systems must ensure that every creation, reading, update, and deletion action on data is recorded in an event log with the original data being preserved and visible.","['digital', 'health', 'systems', 'data', 'event', 'log', 'original', 'preserved', 'visible']",Digital_Health_Guidelines.pdf
How should institutions ensure the physical security of ICT hardware and documentation?,"Institutions shall ensure the physical security of all ICT hardware and relevant documentation, and maintain access restricted rooms to keep critical computer equipment such as servers and networking equipment.","['physical security', 'ICT hardware', 'relevant documentation', 'access restricted rooms', 'servers', 'networking equipment']",Digital_Health_Guidelines.pdf
"What should institutions do with employee identification cards, access cards, keys, and other means of access when an employee leaves the institution?","Institutions shall ensure that employee/s who are leaving the institution/unit have surrendered identification cards, access cards, keys, and other means of access and dispose of (destroy or deactivate) them appropriately.","['surrendered', 'identification cards', 'access cards', 'keys', 'other means of access', 'dispose of', 'destroy', 'deactivate']",Digital_Health_Guidelines.pdf
How often should information systems security audits be performed in healthcare institutions?,Information systems security audits should be performed annually in healthcare institutions.,['annually'],Digital_Health_Guidelines.pdf
What is a Personal Health Number (PHN)?,A Personal Health Number (PHN) is a unique number assigned to a healthcare recipient.,"['Personal', 'Health', 'Number', 'unique', 'assigned', 'healthcare', 'recipient']",Digital_Health_Guidelines.pdf
What is the purpose of the PHN?,The PHN is used for the positive identification of healthcare recipients within the health system.,"['PHN', 'healthcare', 'recipients', 'health', 'system']",Digital_Health_Guidelines.pdf
How many components make up the PHN?,"The PHN consists of three components: a four-digit alpha-numeric string, a six-character alpha-numeric string, and a check digit.","['three', 'four-digit', 'alpha-numeric', 'six-character', 'check digit']",Digital_Health_Guidelines.pdf
What is the role of the Health Information Unit (HIU) in issuing PHNs?,The HIU is responsible for assigning a unique identification number for the Point of Issue (POI) and for maintaining a registry of Healthcare Institutions.,"['HIU', 'POI', 'Healthcare Institutions']",Digital_Health_Guidelines.pdf
What is the maximum number of PHNs that can be issued under each POI ID?,Only one million PHNs shall be issued under each POI ID.,['one million'],Digital_Health_Guidelines.pdf
How are PHNs generated?,PHNs are generated using a standard random string generation algorithm.,"['PHNs', 'generated', 'standard', 'random', 'string', 'generation', 'algorithm']",Digital_Health_Guidelines.pdf
What characters are recommended for use in generating the PHN?,The following characters are recommended for use in generating the PHN: 2346789BCDFGHJKMPQRTVWXY.,['2346789BCDFGHJKMPQRTVWXY'],Digital_Health_Guidelines.pdf
What is the purpose of the check digit in the PHN?,The check digit is generated using the modified Luhn Algorithm used by Regenstrief Institute Inc. and is used to validate the PHN for transcription errors.,"['modified Luhn Algorithm', 'Regenstrief Institute Inc.', 'transcription errors']",Digital_Health_Guidelines.pdf
What is the Master Patient Index (MPI)?,The Master Patient Index (MPI) is a national registry of healthcare recipients maintained by the Ministry of Health.,"['Master', 'Patient', 'Index', 'Ministry', 'Health']",Digital_Health_Guidelines.pdf
What data elements are used for positive identification of healthcare recipients within the MPI?,"The following data elements are used for positive identification of healthcare recipients within the MPI: Citizen Identification Number/National Identity Card Number (NIC)/Sri Lanka Identification Number, Personal Health Number (PHN), legal name, telecommunication details, prefixes, suffix, date of birth, gender, address, and marital status.","['Citizen Identification Number', 'National Identity Card Number', 'Sri Lanka Identification Number', 'Personal Health Number', 'legal name', 'telecommunication details', 'prefixes', 'suffix', 'date of birth', 'gender', 'address', 'marital status']",Digital_Health_Guidelines.pdf
What is the Healthcare Facility Registry?,"The Healthcare Facility Registry is a registry of Healthcare Institutions maintained at the HIU, which holds a unique identification number (Health Institution Number (HIN)) for the Institution and other relevant information.","['Healthcare Facility Registry', 'Health Institution Number', 'HIN']",Digital_Health_Guidelines.pdf
What is the purpose of the facility registry?,"The purpose of the facility registry is to maintain a record of healthcare facilities, including their demographic data, and to provide a unique identifier for each facility.","['facility', 'registry', 'record', 'healthcare', 'demographic', 'data', 'unique', 'identifier']",Digital_Health_Guidelines.pdf
What are the recommended data elements for the facility registry?,"The recommended data elements for the facility registry include individual provider identifier, national identification number, professional registration number, professional registration issuer, legal name, staff category, telecommunication details, and active or not.","['individual provider identifier', 'national identification number', 'professional registration number', 'professional registration issuer', 'legal name', 'staff category', 'telecommunication details', 'active or not']",Digital_Health_Guidelines.pdf
What is the recommended standard for data exchange in healthcare?,The recommended standard for data exchange in healthcare is Health Level Seven (HL7) Fast Healthcare Interoperability Resources (FHIR) Release 4.,"['Health Level Seven', 'FHIR', 'Release 4']",Digital_Health_Guidelines.pdf
What is Aggregated Data Exchange (ADX)?,Aggregated Data Exchange (ADX) is a standard developed and maintained by the Quality Research and Public Health committee of the IHE (Integrating the Health Care Enterprise) for exchanging aggregated health data.,"['Aggregated', 'Data', 'Exchange', 'ADX', 'standard', 'developed', 'maintained', 'IHE', 'Integrating', 'health', 'data']",Digital_Health_Guidelines.pdf
What is LOINC?,LOINC (Logical Observation Identifiers Names and Codes) is a standard developed by Regenstrief Institute Inc. for identifying laboratory observations and clinical measurements.,"['LOINC', 'Logical', 'Observation', 'Identifiers', 'Names', 'Codes', 'standard', 'developed', 'Regenstrief', 'Institute', 'Inc.']",Digital_Health_Guidelines.pdf
What is DICOM?,"DICOM (Digital Imaging and Communication in Medicine) is a standard developed by the National Electrical Manufacturers Association, USA, for the transfer and storage of medical images.","['DICOM', 'Digital', 'Imaging', 'Communication', 'Medicine', 'standard', 'National', 'Electrical', 'Manufacturers', 'Association', 'USA', 'transfer', 'storage', 'medical', 'images']",Digital_Health_Guidelines.pdf
What is SNOMED CT?,SNOMED CT (Systematized Nomenclature of Medicine – Clinical Terms) is a clinical terminology used for coding clinical concepts in healthcare settings.,"['SNOMED', 'CT', 'Systematized', 'Nomenclature', 'Medicine', 'Clinical', 'Terms']",Digital_Health_Guidelines.pdf
What is ICD?,ICD (International Classification of Diseases) is a standard developed by the World Health Organization for classifying diseases and health problems.,"['ICD', 'International Classification of Diseases', 'World Health Organization']",Digital_Health_Guidelines.pdf
What is ICPC-2?,"ICPC-2 (International Classification of Primary Care, Second edition) is a standard developed for recording reasons for encounter in outpatient department (OPD), primary care, and general practice (GP) settings.","['ICPC-2', 'International', 'Classification', 'Primary', 'Care', 'Second', 'edition', 'standard', 'recording', 'reasons', 'encounter', 'outpatient', 'department', 'OPD', 'primary', 'care', 'general', 'practice', 'GP', 'settings']",Digital_Health_Guidelines.pdf
What is the purpose of the National Electronic Health Record (NEHR)?,The purpose of the National Electronic Health Record (NEHR) is to maintain a comprehensive and integrated record of healthcare encounters and events across different healthcare providers and settings.,"['comprehensive', 'integrated', 'healthcare', 'encounters', 'events', 'providers', 'settings']",Digital_Health_Guidelines.pdf
What is the name of the dataset described in Table 3?,"The name of the dataset described in Table 3 is ""Healthcare recipient demographic data (complete dataset)"".","['Healthcare', 'recipient', 'demographic', 'data']",Digital_Health_Guidelines.pdf
What is the purpose of the minimal dataset described in Table 4?,"The purpose of the minimal dataset described in Table 4 is to provide a subset of the complete dataset that can be transmitted to the National Electronic Health Record (NEHR) along with other relevant healthcare encounter data, if the healthcare recipient demographic data is not updated.",['The purpose of the minimal dataset described in Table 4 is to provide a subset of the complete dataset that can be transmitted to the National Electronic Health Record (NEHR)'],Digital_Health_Guidelines.pdf
