question,answer,tokens_present,document
What were the National eHealth Guidelines & Standards first published in?,The National eHealth Guidelines & Standards were first published in 2016.,['2016'],Digital_Health_Guidelines.pdf
What was the purpose of publishing the National eHealth Guidelines & Standards?,The purpose of publishing the National eHealth Guidelines & Standards was to streamline the implementation of eHealth solutions in the health sector of Sri Lanka.,"['streamline', 'eHealth', 'solutions', 'health', 'sector', 'Sri Lanka']",Digital_Health_Guidelines.pdf
What was the need that arose to review the existing National eHealth Guidelines & Standards?,The need to review the existing National eHealth Guidelines & Standards arose due to new developments in the digital health ecosystem in the country and innovations in the ICT sector.,"['new developments', 'digital health ecosystem', 'ICT sector']",Digital_Health_Guidelines.pdf
What was the name given to the Technical Working Group appointed to review the NeGS?,The Technical Working Group appointed to review the NeGS was named the Technical Working Group: Digital Health Standards & Interoperability (TWG – DHSI).,['Technical Working Group: Digital Health Standards & Interoperability (TWG – DHSI)'],Digital_Health_Guidelines.pdf
What was the main objective of the TWG – DHSI?,The main objective of the TWG – DHSI was to review the existing National eHealth Guidelines & Standards and recommend necessary changes.,"['review', 'existing', 'National', 'eHealth', 'Guidelines', 'Standards', 'recommend', 'necessary', 'changes']",Digital_Health_Guidelines.pdf
What was the outcome of the review process conducted by the TWG – DHSI?,The outcome of the review process conducted by the TWG – DHSI was the development of the National Digital Health Guidelines and Standards (NDHGS) document.,"['development', 'NDHGS', 'document']",Digital_Health_Guidelines.pdf
What are the seven areas that the NDHGS document lays down standards and guidelines for?,"The NDHGS document lays down standards and guidelines for the following seven areas: Digital Health Architecture, Hardware for Digital Health, Digital Health Software Services, Network and Connectivity, Communication Interface, Privacy, Confidentiality, Security and Medical Ethics, and Digital Health Systems Interoperability.","['Digital Health Architecture', 'Hardware for Digital Health', 'Digital Health Software Services', 'Network and Connectivity', 'Communication Interface', 'Privacy', 'Confidentiality', 'Security', 'Medical Ethics', 'Digital Health Systems Interoperability']",Digital_Health_Guidelines.pdf
"What is the importance of having proper website standards, domain name structure, and official email nomenclature in the healthcare sector?","Having proper website standards, domain name structure, and official email nomenclature is important in the healthcare sector as it emphasizes the proper use of emails as an official mode of communication.","['proper', 'email', 'communication']",Digital_Health_Guidelines.pdf
What is the significance of maintaining patient privacy and confidentiality in the healthcare sector?,Maintaining patient privacy and confidentiality is of utmost importance in the healthcare sector as it bears the highest importance in the field of healthcare.,"['maintaining', 'patient', 'privacy', 'confidentiality', 'healthcare', 'sector']",Digital_Health_Guidelines.pdf
What is the purpose of prescribing guidelines and standards for achieving seamless communication between digital health solutions?,The purpose of prescribing guidelines and standards for achieving seamless communication between digital health solutions is to ensure interoperability between different digital health systems.,"['ensure', 'interoperability', 'digital', 'health', 'systems']",Digital_Health_Guidelines.pdf
What is the purpose of the National Digital Health System?,"The purpose of the National Digital Health System is to provide a comprehensive and integrated healthcare system that enables the sharing of healthcare information and data between different healthcare providers, patients, and other stakeholders.","['comprehensive', 'integrated', 'healthcare', 'sharing', 'information', 'data', 'providers', 'patients', 'stakeholders']",Digital_Health_Guidelines.pdf
What is the architectural model of the National Digital Health System?,"The architectural model of the National Digital Health System consists of four layers: the presentation layer, application layer, data storage layer, and infrastructure layer.","['presentation layer', 'application layer', 'data storage layer', 'infrastructure layer']",Digital_Health_Guidelines.pdf
What are the essential components of an Electronic Medical Record (EMR) system?,"The essential components of an EMR system include patient demographics, medical history, medication management, laboratory and imaging results, and clinical notes.","['patient demographics', 'medical history', 'medication management', 'laboratory', 'imaging results', 'clinical notes']",Digital_Health_Guidelines.pdf
What is the purpose of a Personal Health Number (PHN)?,The purpose of a PHN is to uniquely identify each patient and enable the sharing of their healthcare information across different healthcare providers and systems.,"['Personal Health Number', 'PHN', 'patient', 'healthcare', 'information', 'sharing']",Digital_Health_Guidelines.pdf
What is the National Electronic Health Record (NEHR)?,"The NEHR is a centralized repository of electronic health records that contains a patient's comprehensive healthcare information, including demographic data, medical history, medication management, laboratory and imaging results, and clinical notes.","['NEHR', 'centralized', 'repository', 'electronic', 'health', 'records', 'patient', 'comprehensive', 'healthcare', 'information', 'demographic', 'data', 'medical', 'history', 'medication', 'management', 'laboratory', 'imaging', 'results', 'clinical', 'notes']",Digital_Health_Guidelines.pdf
What is the difference between privacy and confidentiality in healthcare?,"Privacy refers to the right of patients to control their personal health information, while confidentiality refers to the obligation of healthcare providers to protect patients' personal health information from unauthorized disclosure.","['privacy', 'confidentiality', 'healthcare', 'patients', 'personal', 'information', 'providers', 'disclosure']",Digital_Health_Guidelines.pdf
What is the purpose of a Master Patient Index (MPI)?,"The purpose of an MPI is to accurately identify patients and match them with their corresponding healthcare records, ensuring that healthcare providers have access to accurate and up-to-date information.","['Master Patient Index', 'patients', 'healthcare records', 'healthcare providers', 'accurate', 'up-to-date']",Digital_Health_Guidelines.pdf
What is the role of data interchange standards in digital health systems?,"Data interchange standards facilitate the sharing and exchange of healthcare information between different healthcare providers and systems, ensuring that data is transmitted accurately and securely.","['data', 'interchange', 'standards', 'healthcare', 'providers', 'systems', 'transmitted', 'accurately', 'securely']",Digital_Health_Guidelines.pdf
What is a minimal dataset for the National Electronic Health Record (NEHR)?,"A minimal dataset for the NEHR includes a patient's demographic data, medical history, medication management, laboratory and imaging results, and clinical notes.","['demographic data', 'medical history', 'medication management', 'laboratory', 'imaging results', 'clinical notes']",Digital_Health_Guidelines.pdf
What is the purpose of a Healthcare Facility Registry?,"The purpose of a Healthcare Facility Registry is to maintain accurate and up-to-date information about healthcare facilities, including their location, services offered, and contact information.","['Healthcare Facility Registry', 'location', 'services', 'contact information']",Digital_Health_Guidelines.pdf
What is the name of the dataset that contains information about healthcare encounters?,"The dataset that contains information about healthcare encounters is called the ""Complimentary dataset for healthcare encounter output.""",,Digital_Health_Guidelines.pdf
What is the name of the dataset that contains information about laboratory test results?,"The dataset that contains information about laboratory test results is called the ""Laboratory test result"" dataset.","['Laboratory', 'test', 'result', 'dataset']",Digital_Health_Guidelines.pdf
What is the name of the dataset that contains information about imaging examination results?,"The dataset that contains information about imaging examination results is called the ""Imaging examination results"" dataset.",['Imaging examination results'],Digital_Health_Guidelines.pdf
What is the name of the dataset that contains information about medication administration?,"The dataset that contains information about medication administration is called the ""Medication administration"" dataset.","['Medication', 'administration', 'dataset']",Digital_Health_Guidelines.pdf
What is the name of the dataset that contains information about procedure results?,"The dataset that contains information about procedure results is called the ""Procedure"" dataset.",['Procedure'],Digital_Health_Guidelines.pdf
What is the name of the dataset that contains information about medication dispensing?,"The dataset that contains information about medication dispensing is called the ""Medication dispensing"" dataset.","['Medication', 'dispensing', 'dataset']",Digital_Health_Guidelines.pdf
What is the name of the dataset that contains information about discharge summaries?,"The dataset that contains information about discharge summaries is called the ""Discharge summary"" dataset.",['Discharge summary'],Digital_Health_Guidelines.pdf
What is the name of the dataset that contains information about death declarations?,"The dataset that contains information about death declarations is called the ""Death declaration"" dataset.",['Death declaration'],Digital_Health_Guidelines.pdf
What is the name of the organization that published the National eHealth Guidelines and Standards for Sri Lanka in 2016?,The organization that published the National eHealth Guidelines and Standards for Sri Lanka in 2016 is the Ministry of Health.,"['Ministry', 'of', 'Health']",Digital_Health_Guidelines.pdf
What is the name of the committee that was appointed to revise the National eHealth Guidelines and Standards?,The committee that was appointed to revise the National eHealth Guidelines and Standards is the Technical Working Group: Digital Health Standards & Interoperability (TWG – DHSI).,['Technical Working Group: Digital Health Standards & Interoperability (TWG – DHSI)'],Digital_Health_Guidelines.pdf
What is the name of the document that contains the guidelines and standards for digital health in Sri Lanka?,The document that contains the guidelines and standards for digital health in Sri Lanka is the National eHealth Guidelines and Standards for Sri Lanka.,['National eHealth Guidelines and Standards for Sri Lanka'],Digital_Health_Guidelines.pdf
What was the reason for revising the National eHealth Guidelines and Standards?,"The need for revising the National eHealth Guidelines and Standards was identified due to recent developments and innovations in ICT technologies, and the appointment of the Technical Working Group: Digital Health Standards & Interoperability (TWG – DHSI) by the National eHealth Steering Committee.","['recent', 'developments', 'innovations', 'ICT', 'technologies', 'appointment', 'Technical', 'Working', 'Group', 'Digital', 'Health', 'Standards', 'Interoperability', 'TWG', 'DHSI', 'National', 'eHealth', 'Steering', 'Committee']",Digital_Health_Guidelines.pdf
What is the purpose of the National Digital Health Guidelines and Standards?,"The purpose of the National Digital Health Guidelines and Standards is to provide a framework for the development and implementation of digital health solutions in Sri Lanka, and to ensure interoperability and standardization of digital health systems.","['framework', 'digital health', 'Sri Lanka', 'interoperability', 'standardization']",Digital_Health_Guidelines.pdf
What are the main changes made in the revised National Digital Health Guidelines and Standards?,"The main changes made in the revised National Digital Health Guidelines and Standards include the inclusion of a new chapter on digital health software services, new sections and subsections added to existing chapters, and changes to the content of other chapters to improve relevance and accuracy.","['new chapter', 'digital health software services', 'new sections', 'subsections', 'existing chapters', 'content', 'improve relevance', 'accuracy']",Digital_Health_Guidelines.pdf
What is the significance of the COVID-19 pandemic in relation to digital health solutions?,The COVID-19 pandemic has highlighted the importance of digital health solutions in healthcare and their potential to transform health systems in the post-pandemic era.,"['COVID-19', 'pandemic', 'digital', 'health', 'solutions', 'healthcare', 'transform', 'post-pandemic']",Digital_Health_Guidelines.pdf
Who is responsible for adhering to the National Digital Health Guidelines and Standards?,"The National Digital Health Guidelines and Standards are expected to be adhered to by state and private sector health institutions and the Sri Lankan ICT industry on an opt-in basis. However, adherence to these guidelines and standards is a mandatory requirement in the software enlisting process of the Ministry of Health.","['mandatory', 'Ministry of Health']",Digital_Health_Guidelines.pdf
What is the scope of the National Digital Health Guidelines and Standards?,"The National Digital Health Guidelines and Standards cover various aspects of digital health, including electronic health records, personal health records, health information systems, and interoperability standards.","['electronic', 'personal', 'health', 'information', 'interoperability']",Digital_Health_Guidelines.pdf
What is the role of the Technical Working Group: Digital Health Standards & Interoperability (TWG – DHSI)?,The Technical Working Group: Digital Health Standards & Interoperability (TWG – DHSI) was appointed by the National eHealth Steering Committee to review the existing National eHealth Guidelines and Standards and to formulate a new version of the guidelines and standards that align with current developments in digital health.,"['TWG – DHSI', 'National eHealth Steering Committee', 'National eHealth Guidelines and Standards', 'digital health']",Digital_Health_Guidelines.pdf
How often will the National Digital Health Guidelines and Standards be reviewed and updated?,The National Digital Health Guidelines and Standards will be periodically reviewed and updated to keep pace with current developments in the digital health ecosystem.,"['periodically', 'reviewed', 'updated']",Digital_Health_Guidelines.pdf
What is the significance of the Architectural Model of the National Digital Health Information System?,"The Architectural Model of the National Digital Health Information System provides a framework for the design and implementation of digital health systems in Sri Lanka, and ensures interoperability and standardization of digital health systems.","['framework', 'interoperability', 'standardization', 'digital health systems', 'Sri Lanka']",Digital_Health_Guidelines.pdf
What is the role of the Ministry of Health in relation to the National Digital Health Guidelines and Standards?,"The Ministry of Health is responsible for the revision and approval of the National Digital Health Guidelines and Standards, and for ensuring adherence to these guidelines and standards in the software enlisting process.","['Ministry', 'Health', 'responsible', 'revision', 'approval', 'adherence', 'guidelines', 'standards', 'software', 'enlisting', 'process']",Digital_Health_Guidelines.pdf
What is the purpose of the Architectural Model of the National Digital Health System?,"The purpose of the Architectural Model of the National Digital Health System is to provide a framework for the development, implementation, and maintenance of digital health services in Sri Lanka.","['framework', 'development', 'implementation', 'maintenance', 'digital', 'health', 'services', 'Sri Lanka']",Digital_Health_Guidelines.pdf
What are the guidelines for procurement of computer hardware for digital health services?,"The guidelines for procurement of computer hardware for digital health services are outlined in the National Procurement Guidelines (NPGs) and include the requirement for appropriate maintenance and service agreements, technical evaluation by a representative of the Information and Communication Technology Agency (ICTA) and/or an expert on Health Informatics, and consideration of the cost of consumables and maintenance.","['National Procurement Guidelines (NPGs)', 'maintenance', 'service agreements', 'technical evaluation', 'ICTA', 'Health Informatics', 'cost', 'consumables', 'maintenance']",Digital_Health_Guidelines.pdf
What is recommended when procuring electronic medical equipment?,"When procuring electronic medical equipment, it is recommended that the necessary workstation, firmware, and/or software compatible with the equipment are also procured.","['recommended', 'procured', 'compatible']",Digital_Health_Guidelines.pdf
What is the purpose of maintaining a hardware inventory?,The purpose of maintaining a hardware inventory is to keep track of all hardware according to the treasury guidelines and to ensure that all hardware is properly maintained and serviced.,"['hardware inventory', 'treasury guidelines', 'hardware', 'maintained', 'serviced']",Digital_Health_Guidelines.pdf
"What are the guidelines for service agreements for maintenance of equipment, firmware, and software?","The guidelines for service agreements for maintenance of equipment, firmware, and software are outlined in the National Procurement Guidelines (NPGs) and require that service agreements be reached for maintenance of all equipment, firmware, and software that is not covered under warranty conditions.","['NPGs', 'maintenance', 'equipment', 'firmware', 'software', 'warranty']",Digital_Health_Guidelines.pdf
"What is the recommended hosting platform for central databases, applications, and middleware?","The recommended hosting platform for central databases, applications, and middleware is a hosting facility/platform maintained by the competent authority of the Government of Sri Lanka or the Ministry of Health.","['Government of Sri Lanka', 'Ministry of Health']",Digital_Health_Guidelines.pdf
What is the purpose of the State Healthcare Sector Digital Health Software List?,"The purpose of the State Healthcare Sector Digital Health Software List is to maintain a list of all digital health systems that are developed, tested, piloted, or implemented in all State Sector Healthcare Institutions.","['maintain', 'list', 'digital', 'health', 'systems']",Digital_Health_Guidelines.pdf
What is the requirement for licensing of software used in government healthcare organizations?,"The requirement for licensing of software used in government healthcare organizations is that all software must be appropriately licensed, including proprietary as well as free and open-source software, and that all software developed for, implemented in, or used by the Ministry of Health must clearly define the license.","['all', 'proprietary', 'free', 'open-source', 'Ministry', 'Health', 'license']",Digital_Health_Guidelines.pdf
"What is the policy on acquiring software, including software donated free of charge?","The policy on acquiring software, including software donated free of charge, is that it must always be accompanied by contractual agreements with relevant parties for development, customization, and maintenance, and that the ownership of Intellectual Property Rights (IPR) including the source code of such software lies with the awarding party.","['it', 'must', 'always', 'be', 'accompanied', 'by', 'contractual', 'agreements', 'with', 'relevant', 'parties', 'for', 'development', 'customization', 'and', 'maintenance', 'and', 'that', 'the', 'ownership', 'of', 'Intellectual', 'Property', 'Rights', 'IPR', 'including', 'the', 'source', 'code', 'of', 'such', 'software', 'lies', 'with', 'the', 'awarding', 'party']",Digital_Health_Guidelines.pdf
What is the requirement for licensing of third-party components in software?,The requirement for licensing of third-party components in software is that appropriate licenses must be provided for such components.,"['appropriate licenses', 'third-party components', 'software']",Digital_Health_Guidelines.pdf
What is the purpose of the National eHealth steering committee in Sri Lanka?,"The National eHealth steering committee in Sri Lanka is responsible for granting special approval for the donation of software to the Government of Sri Lanka, and ensuring that appropriate licenses are provided for third-party components in software systems.","['National', 'eHealth', 'steering', 'committee', 'Sri Lanka', 'granting', 'special', 'approval', 'donation', 'software', 'Government', 'Sri Lanka', 'ensuring', 'appropriate', 'licenses', 'third-party', 'components', 'software', 'systems']",Digital_Health_Guidelines.pdf
What is the recommended approach for implementing a software system or component in a healthcare institution in Sri Lanka?,"The recommended approach for implementing a software system or component in a healthcare institution in Sri Lanka is to pilot the system or component at selected institutions/units, followed by a proper evaluation of the pilot project.","['pilot', 'evaluation', 'project']",Digital_Health_Guidelines.pdf
Who is responsible for conducting information system security audits in Sri Lanka?,The competent authority of the Government of Sri Lanka is responsible for conducting information system security audits throughout the software life cycle.,"['Government of Sri Lanka', 'responsible', 'conducting', 'information', 'system', 'security', 'audits']",Digital_Health_Guidelines.pdf
What are some of the essential components of an Electronic Medical Record (EMR) system?,"Essential components of an EMR system include patient registration, admission/discharge and transfer, clinical module for outpatient department/clinics/wards, laboratory module, radiology information system module, pharmacy module, and financial module (for relevant instances).","['patient registration', 'admission', 'discharge', 'transfer', 'clinical module', 'outpatient department', 'clinics', 'wards', 'laboratory module', 'radiology information system module', 'pharmacy module', 'financial module']",Digital_Health_Guidelines.pdf
What is the minimum functionality required for the clinical module of an EMR system?,"The minimum functionality required for the clinical module of an EMR system includes entering patient clinical details, viewing past visit information, referring to a different clinic, requesting laboratory tests, viewing laboratory test results, and prescribing medicine.","['entering patient clinical details', 'viewing past visit information', 'referring to a different clinic', 'requesting laboratory tests', 'viewing laboratory test results', 'prescribing medicine']",Digital_Health_Guidelines.pdf
How should agreements/contracts for software development in healthcare institutions in Sri Lanka be structured?,"Agreements/contracts for software development in healthcare institutions in Sri Lanka should cover important issues such as software requirement specifications, source code availability, milestones of the development process, percentage of payments to be made at reaching each milestone, provisions for flexibility in the specifications during the development process, software documentation, provision for modifications and updates to the software, declaration of compliance with existing legislation, handling of critical and non-critical failures, third-party licenses, and dispute resolution mechanisms.","['software requirement', 'source code', 'milestones', 'payment', 'flexibility', 'software documentation', 'modification', 'update', 'compliance', 'failure', 'license', 'dispute resolution']",Digital_Health_Guidelines.pdf
What are some of the clauses that should not be included in agreements/contracts for software development in healthcare institutions in Sri Lanka?,"Clauses that should not be included in agreements/contracts for software development in healthcare institutions in Sri Lanka include those that prevent the smooth transition of the healthcare institution to different software from another vendor in the future, broad exculpatory clauses that limit or exclude vendor’s liability, and clauses that prevent or limit the inheritance of the software in an event of a change of ownership of the healthcare institution.","['different', 'vendor', 'future', 'exculpatory', 'liability', 'inheritance', 'change', 'ownership']",Digital_Health_Guidelines.pdf
What is the recommended approach for integrating different modules in an EMR system?,"The recommended approach for integrating different modules in an EMR system is to use a ""Microservices Architecture"" and communicate through Application Programming Interfaces (APIs).","['Microservices Architecture', 'Application Programming Interfaces', 'APIs']",Digital_Health_Guidelines.pdf
