question,answer,tokens_present,document
What is the difference between the complete dataset and the minimal dataset?,"The complete dataset includes all the demographic data elements listed in Table 3, while the minimal dataset includes only the Personal Health Number (PHN), National Identity type, and National Identity (Ex. National Identity card number/SLIN/National Digital Identity).","['Personal Health Number', 'National Identity', 'National Identity card number', 'SLIN', 'National Digital Identity']",Digital_Health_Guidelines.pdf
What is the Personal Health Number (PHN)?,The Personal Health Number (PHN) is a unique identifier assigned to each healthcare recipient.,"['Personal', 'Health', 'Number']",Digital_Health_Guidelines.pdf
What is the National Identity type?,"The National Identity type refers to the type of identification document held by the healthcare recipient, such as a National Identity card, passport, or SLIN.","['National Identity card', 'passport', 'SLIN']",Digital_Health_Guidelines.pdf
What is the National Digital Identity?,The National Digital Identity is a digital version of the National Identity card or passport.,"['National', 'Digital', 'Identity']",Digital_Health_Guidelines.pdf
Is the date of birth calculated?,"No, the date of birth is not calculated. It is a field that contains the healthcare recipient's date of birth.",['No'],Digital_Health_Guidelines.pdf
What is the Grama Niladhari Division?,"The Grama Niladhari Division is a subdivision of a district in Sri Lanka, which is used for administrative purposes.","['Grama Niladhari Division', 'Sri Lanka', 'district', 'subdivision', 'administrative', 'purposes']",Digital_Health_Guidelines.pdf
What is the Divisional Secretariat?,The Divisional Secretariat is a local government authority responsible for providing public services to a division.,"['Divisional', 'Secretariat']",Digital_Health_Guidelines.pdf
What is the Contact type ID?,"The Contact type ID refers to a unique identifier assigned to a healthcare recipient's contact information, such as a phone number or email address.","['phone number', 'email address']",Digital_Health_Guidelines.pdf
What is the purpose of the Contact Details field?,"The purpose of the Contact Details field is to store the healthcare recipient's contact information, such as a phone number or email address, for communication and notification purposes.","['phone number', 'email address', 'communication', 'notification']",Digital_Health_Guidelines.pdf
What is the purpose of transmitting data to the National Electronic Health Record (NEHR)?,"The purpose of transmitting data to the NEHR is to provide a comprehensive and continuous record of an individual's healthcare history, including demographic data, healthcare encounter data, laboratory test results, imaging examination results, medication administration, and procedure data.","['NEHR', 'healthcare', 'demographic', 'laboratory', 'imaging', 'medication', 'procedure']",Digital_Health_Guidelines.pdf
What is the minimum dataset required for a healthcare encounter output?,"The minimum dataset required for a healthcare encounter output includes the healthcare recipient's demographic data, healthcare institution number, encounter identifier, date and time of the encounter, provider identifier, reason for encounter, diagnosis, and healthcare encounter output data.","['demographic data', 'healthcare institution number', 'encounter identifier', 'date', 'time', 'provider identifier', 'reason for encounter', 'diagnosis', 'healthcare encounter output data']",Digital_Health_Guidelines.pdf
What is the purpose of the 'Complimentary Dataset for Healthcare Encounter Output'?,"The purpose of the 'Complimentary Dataset for Healthcare Encounter Output' is to provide additional information relevant to a particular healthcare encounter, such as allergies and adverse reactions, past medical history, regular medication, obstetric summary, immunizations, behavioral risk factors, health risk assessment, and investigation request data.","['allergies', 'adverse reactions', 'past medical history', 'regular medication', 'obstetric summary', 'immunizations', 'behavioral risk factors', 'health risk assessment', 'investigation request data']",Digital_Health_Guidelines.pdf
What is the minimum dataset required for laboratory test results?,"The minimum dataset required for laboratory test results includes the date and time of the test, health institution number, investigation request identifier, personal health number, test name, test result, and test authorizing provider ID.","['date', 'time', 'health institution number', 'investigation request identifier', 'personal health number', 'test name', 'test result', 'test authorizing provider ID']",Digital_Health_Guidelines.pdf
What is the minimum dataset required for imaging examination results?,"The minimum dataset required for imaging examination results includes the date and time of the examination, health institution number, investigation request identifier, personal health number, radiology test name, radiology test impression, radiology test diagnosis/conclusion, and provider ID.","['date', 'time', 'health institution number', 'investigation request identifier', 'personal health number', 'radiology test name', 'radiology test impression', 'radiology test diagnosis/conclusion', 'provider ID']",Digital_Health_Guidelines.pdf
What is the minimum dataset required for medication administration?,"The minimum dataset required for medication administration includes the personal health number, medication name, medication form, dosage, route, number of doses administered, and date and time of administration.","['personal health number', 'medication name', 'medication form', 'dosage', 'route', 'number of doses administered', 'date and time of administration']",Digital_Health_Guidelines.pdf
What is the minimum dataset required for a procedure?,"The minimum dataset required for a procedure includes the personal health number, provider ID, procedure name, indication, operative note, medical device, date and time of the procedure, and procedure outcome.","['personal health number', 'provider ID', 'procedure name', 'indication', 'operative note', 'medical device', 'date and time of the procedure', 'procedure outcome']",Digital_Health_Guidelines.pdf
What is the purpose of the 'Medication Dispensing' dataset?,"The purpose of the 'Medication Dispensing' dataset is to provide information on medications dispensed to a healthcare recipient, including the pharmacy ID, personal health number, prescription ID, prescription issued healthcare institution number, dispensed medication name, dispensed medication form, quantity dispensed, and date and time of dispensing.","['purpose', 'medications', 'dispensed', 'healthcare', 'recipient', 'pharmacy', 'ID', 'personal', 'health', 'number', 'prescription', 'issued', 'healthcare', 'institution', 'number', 'dispensed', 'medication', 'name', 'dispensed', 'medication', 'form', 'quantity', 'dispensed', 'date', 'time']",Digital_Health_Guidelines.pdf
What is the purpose of the 'Discharge Summary' dataset?,"The purpose of the 'Discharge Summary' dataset is to provide a comprehensive summary of a healthcare recipient's inpatient stay, including demographic data, discharge diagnosis/diagnoses, allergies and adverse reactions, past medical history, past surgical history, regular medication, obstetric summary, immunizations, behavioral risk factors, health risk assessment, physical examination findings, laboratory test results, imaging examination results, medication administration, and procedure data.","['discharge summary', 'inpatient stay', 'demographic data', 'discharge diagnosis', 'allergies', 'adverse reactions', 'past medical history', 'past surgical history', 'regular medication', 'obstetric summary', 'immunizations', 'behavioral risk factors', 'health risk assessment', 'physical examination findings', 'laboratory test results', 'imaging examination results', 'medication administration', 'procedure data']",Digital_Health_Guidelines.pdf
What is the minimum dataset required for a discharge summary?,"The minimum dataset required for a discharge summary includes the healthcare recipient's demographic data, discharge diagnosis/diagnoses, allergies and adverse reactions, past medical history, past surgical history, regular medication, obstetric summary, immunizations, behavioral risk factors, health risk assessment, physical examination findings, laboratory test results, imaging examination results, medication administration, and procedure data.","['discharge diagnosis/diagnoses', 'allergies', 'adverse reactions', 'past medical history', 'past surgical history', 'regular medication', 'obstetric summary', 'immunizations', 'behavioral risk factors', 'health risk assessment', 'physical examination findings', 'laboratory test results', 'imaging examination results', 'medication administration', 'procedure data']",Digital_Health_Guidelines.pdf