question,answer,tokens_present,document
What is the purpose of the Procedural Instruction (PI) for arrivals without a visa?,The purpose of the PI is to provide guidance for Border Clearance Officers (BCOs) in the Aviation environment when dealing with non-citizen travellers who do not appear to hold a visa.,"['guidance', 'Border Clearance Officers', 'Aviation', 'non-citizen travellers', 'visa']",Home_Affairs.pdf
What is the scope of the PI?,The PI covers referrals of non-citizen travellers in immigration clearance who do not appear to hold a visa. It applies to BCOs in the Aviation environment providing immigration clearance under the Migration Act.,"['The PI', 'non-citizen travellers', 'immigration clearance', 'visa', 'BCOs', 'Aviation environment', 'Migration Act']",Home_Affairs.pdf
What is not covered by the PI?,"The PI does not cover immigration clearance of non-citizens who hold a visa, including imposters who appear to hold a visa, or apply for a visa whilst in clearance. It also does not cover immigration clearance of non-citizens without a visa in the Maritime environment, immigration clearance of Australian citizens, or clearance of travellers and/or goods under the Customs Act 1901.","['visa', 'non-citizens', 'clearance', 'Australian citizens', 'Maritime', 'Customs Act 1901']",Home_Affairs.pdf
What are the requirements for immigration clearance under the Migration Act?,"Under s166 of the Migration Act, a valid visa is required to enter and remain in Australia. Travellers must present evidence of their identity (a valid travel document such as a passport) and a valid visa to enter Australia, unless they have a prescribed status for a Special Purpose Visa (SPV).","['valid visa', 'passport', 'Special Purpose Visa (SPV)']",Home_Affairs.pdf
What is a Special Purpose Visa (SPV)?,"A Special Purpose Visa (SPV) is a type of visa that applies to certain categories of non-citizens who are exempt from holding a visa for travel to Australia. For further information, refer to the Migration Regulations 1994 (the Regulations) Reg 2.","['Special', 'Purpose', 'Visa', 'SPV', 'Australia', 'Migration', 'Regulations']",Home_Affairs.pdf
How do BCOs determine whether an offence under Section 229 of the Migration Act has occurred?,"BCOs must determine, in consultation with a supervisor, whether an offence under Section 229 of the Migration Act has occurred and whether it is appropriate in the circumstances to issue an infringement notice to the airline who transported the person to Australia.","['BCOs', 'offence', 'Section 229', 'Migration Act', 'supervisor', 'infringement', 'notice', 'airline', 'Australia']",Home_Affairs.pdf
What is Section 229 of the Migration Act?,Section 229 of the Migration Act refers to the offence of bringing a non-citizen to Australia without a visa.,"['Section', '229', 'Migration', 'Act', 'offence', 'bringing', 'non-citizen', 'Australia', 'without', 'visa']",Home_Affairs.pdf
What is the role of the Border Operations Centre (BOC) in immigration clearance?,"The BOC may authorize uplift for a traveller who does not hold a valid visa, under limited circumstances.","['The', 'BOC', 'may', 'authorize', 'uplift', 'for', 'a', 'traveller', 'who', 'does', 'not', 'hold', 'a', 'valid', 'visa', 'under', 'limited', 'circumstances']",Home_Affairs.pdf
What is the process for protection claims at the border?,Protection claims at the border are covered in Protection Claims at the Border – PI (BC -2436).,"['Protection', 'Claims', 'at', 'the', 'border']",Home_Affairs.pdf
What is the definition of an Australian citizen?,"An Australian citizen is a person who holds Australian citizenship, as defined in the Australian Citizenship Act 2007.","['Australian citizen', 'Australian Citizenship Act 2007']",Home_Affairs.pdf
What are the two types of documentary evidence required for immigration clearance in Australia?,The two types of documentary evidence required for immigration clearance in Australia are a valid visa to enter Australia for non-citizens and a completed and accurate Incoming Passenger Card (IPC).,"['valid visa', 'Incoming Passenger Card (IPC)']",Home_Affairs.pdf
What is the purpose of the Passenger Analysis Clearance Evaluation (PACE) system?,The purpose of the Passenger Analysis Clearance Evaluation (PACE) system is to confirm that a traveller holds a visa by scanning or entering the accurate passport/travel document details.,"['confirm', 'visa', 'passport', 'travel document']",Home_Affairs.pdf
What should a Primary Line officer (PLO) do if they cannot confirm that a traveller holds a visa through PACE?,"If a Primary Line officer (PLO) cannot confirm that a traveller holds a visa through PACE, they should process the traveller by the passport/travel document presented, which will generate a referral in PACE and then refer the traveller to a BCO for secondary clearance.","['process', 'referral', 'PACE', 'BCO', 'secondary clearance']",Home_Affairs.pdf
How should a PLO process a traveller who presents two passports/travel documents with the same bio-data but one is valid and the other has expired?,"A PLO should scan the valid passport/travel document first to confirm its genuineness and if a visa is attached. If a visa record against the valid passport/travel document is not located, the traveller should be processed on their expired passport/travel document and if it holds a valid visa, the PLO should manually refer the traveller to a BCO for secondary clearance.","['should', 'scan', 'valid', 'visa', 'attached', 'not', 'located', 'expired', 'holds', 'manual', 'refer']",Home_Affairs.pdf
What should a BCO do when a traveller presents two valid passports/travel documents with different bio-data?,"When a traveller presents two valid passports/travel documents with different bio-data, the BCO must process the traveller with the more recently issued passport/travel document and then refer them to a BCO for secondary clearance.","['BCO', 'traveller', 'passport', 'travel document', 'bio-data', 'secondary clearance']",Home_Affairs.pdf
What is the purpose of the Immigration Clearance of Australian Citizens – PI (BC-2536) and Immigration Clearance of Australian Citizens without an Australian Passport – PI (BC-2458)?,The purpose of the Immigration Clearance of Australian Citizens – PI (BC-2536) and Immigration Clearance of Australian Citizens without an Australian Passport – PI (BC-2458) is to provide guidance on the clearance of Australian citizens who do not hold an Australian passport.,"['guidance', 'Australian', 'citizens', 'passport']",Home_Affairs.pdf
What should a BCO do when a traveller arrives without a visa?,"When a traveller arrives without a visa, the BCO should determine why the traveller has arrived without a visa and confirm the traveller’s visa status by interrogating departmental systems and looking for evidence of a visa grant.","['BCO', 'traveller', 'visa', 'departmental systems', 'evidence', 'visa grant']",Home_Affairs.pdf
What are the three things that a BCO must be satisfied with regarding a visa holder’s identity?,"A BCO must be satisfied with the visa holder’s identity, visa status, and visa conditions.","['identity', 'visa status', 'visa conditions']",Home_Affairs.pdf
What is the role of the Passenger Card Coding – PI (BC-667) in the immigration clearance process?,The Passenger Card Coding – PI (BC-667) provides guidance on the coding of incoming passenger cards (IPCs) with the appropriate referral reason codes.,"['guidance', 'coding', 'incoming', 'passenger', 'cards', 'referral', 'reason', 'codes']",Home_Affairs.pdf
What is the purpose of the Arrivals without a visa – PI (BC-639) procedure?,The purpose of the Arrivals without a visa – PI (BC-639) procedure is to provide guidance on the processing of travellers who arrive without a visa.,"['provide', 'guidance', 'processing', 'travellers', 'arrive', 'without', 'visa']",Home_Affairs.pdf
What does a BCO need to do if they are unable to locate a visa record for a traveller in departmental systems?,"If a BCO is unable to locate a visa record for a traveller in departmental systems, they must check the traveller's visa history and status to determine if the traveller was granted a visa that is in effect.","['BCO', 'visa', 'traveller', 'departmental', 'systems']",Home_Affairs.pdf
What is the purpose of the Utilities (UT) system in Mainframe?,The Utilities (UT) system in Mainframe is used to amend data related to a traveller's visa status.,"['Utilities', 'Mainframe', 'amend', 'data', ""traveller's"", 'visa', 'status']",Home_Affairs.pdf
Can a BCO grant a visa to a traveller at the primary line?,"No, a BCO cannot grant a visa to a traveller at the primary line. If a traveller requires a visa, they must apply for one in advance of arriving in Australia.",['No'],Home_Affairs.pdf
What is the Transit Without Visa (TWOV) arrangement?,"The Transit Without Visa (TWOV) arrangement allows certain nationals of specified countries to transit through Australia without a visa, provided they meet certain conditions.","['Transit Without Visa', 'TWOV', 'arrangement', 'allows', 'certain', 'nationals', 'specified', 'countries', 'transit', 'Australia', 'without', 'visa', 'provided', 'conditions']",Home_Affairs.pdf
What happens if a TWOV eligible traveller needs to clear immigration?,"If a TWOV eligible traveller needs to clear immigration, for example, to collect baggage or board an onwards flight, they will need to have an Australian visa and be immigration cleared.","['Australian visa', 'immigration cleared']",Home_Affairs.pdf
How can a BCO ensure that a TWOV eligible traveller is not immigration cleared?,"To ensure that a TWOV eligible traveller is not immigration cleared, the BCO must redirect the traveller to the Transit Area instead of allowing them to proceed past the primary line.","['BCO', 'TWOV', 'Transit Area', 'primary line']",Home_Affairs.pdf
What is the role of the Automated Telephone Interpreters Service (ATIS) in the immigration clearance process?,The Automated Telephone Interpreters Service (ATIS) can be used by a BCO to assist in translating preliminary questions for a traveller who may not speak English fluently.,"['The', 'Automated', 'Telephone', 'Interpreters', 'Service', 'can', 'be', 'used', 'by', 'a', 'BCO', 'to', 'assist', 'in', 'translating', 'preliminary', 'questions', 'for', 'a', 'traveller', 'who', 'may', 'not', 'speak', 'English', 'fluently']",Home_Affairs.pdf
What is the purpose of the Movement Alerts Listing (MAL) narratives?,"The Movement Alerts Listing (MAL) narratives provide information on a traveller's previous immigration history, including any previous refusals of entry or removals.","['previous', 'immigration', 'history', 'refusals', 'entry', 'removals']",Home_Affairs.pdf
What is the purpose of the Procedural Instruction (PI) document?,The purpose of the PI document is to provide guidance to Department of Home Affairs staff on how to process passengers who arrive at an airport without a visa and are claiming to be eligible for a Temporary Work (Skilled) visa (subclass 457) or a Temporary Work (Short Stay Specialist) visa (subclass 400).,"['guidance', 'staff', 'process', 'passengers', 'airport', 'visa', 'eligible', 'Temporary Work', 'Skilled', 'subclass 457', 'Short Stay Specialist', 'subclass 400']",Home_Affairs.pdf
What is the definition of a Temporary Work (Skilled) visa (subclass 457)?,A Temporary Work (Skilled) visa (subclass 457) is a type of visa that allows skilled workers to come to Australia temporarily to work in a skilled position.,"['Temporary Work (Skilled) visa', 'subclass 457', 'skilled workers', 'Australia', 'skilled position']",Home_Affairs.pdf
What is the definition of a Temporary Work (Short Stay Specialist) visa (subclass 400)?,A Temporary Work (Short Stay Specialist) visa (subclass 400) is a type of visa that allows specialists to come to Australia temporarily to work in a specialized field.,"['Temporary Work', 'Short Stay Specialist', 'visa', 'subclass 400', 'Australia', 'specialized field']",Home_Affairs.pdf
Who is eligible for a Temporary Work (Skilled) visa (subclass 457) or a Temporary Work (Short Stay Specialist) visa (subclass 400)?,"To be eligible for a Temporary Work (Skilled) visa (subclass 457) or a Temporary Work (Short Stay Specialist) visa (subclass 400), a person must meet certain requirements, including having the necessary skills and qualifications for the job, having a genuine intention to stay in Australia temporarily, and meeting health and character requirements.","['eligible', 'Temporary Work', 'visa', 'subclass', '457', '400', 'skills', 'qualifications', 'job', 'Australia', 'health', 'character']",Home_Affairs.pdf
What is the process for assessing a passenger's bona fides?,"The process for assessing a passenger's bona fides includes assessing their reasons for traveling to Australia, their ability to fund their intended activities, and their proposed period of stay.","['assessing', 'reasons', 'fund', 'proposed']",Home_Affairs.pdf
What is the role of the Border Force Supervisor in the immigration clearance process?,The Border Force Supervisor is responsible for discussing with the airline carrier whether or not to infringe the carrier for a passenger who does not hold a valid visa and is not eligible for the grant of a visa.,"['The', 'Border', 'Force', 'Supervisor', 'is', 'responsible', 'for', 'discussing', 'with', 'the', 'airline', 'carrier', 'whether', 'or', 'not', 'to', 'infringe', 'the', 'carrier', 'for', 'a', 'passenger', 'who', 'does', 'not', 'hold', 'a', 'valid', 'visa', 'and', 'is', 'not', 'eligible', 'for', 'the', 'grant', 'of', 'a', 'visa']",Home_Affairs.pdf
What is the consequence of a breach of the APS Code of Conduct?,"Failure by an APS employee to comply with any direction contained in the PI document may be determined to be a breach of the APS Code of Conduct, which could result in sanctions under subsection 15(1) of the Public Service Act.","['failure', 'breach', 'APS', 'Code', 'of', 'Conduct', 'sanctions', 'Public', 'Service', 'Act']",Home_Affairs.pdf
What is the purpose of the Statement of Expectation in the PI document?,The purpose of the Statement of Expectation is to inform APS employees of their obligations under the APS Code of Conduct and the potential consequences of breaching those obligations.,"['inform', 'APS', 'obligations', 'consequences']",Home_Affairs.pdf
What is the difference between an eligible and an ineligible person for the grant of a Border visa?,"An eligible person for the grant of a Border visa is someone who meets the criteria for the grant of a visa, including having a genuine intention to stay in Australia temporarily and meeting health and character requirements. An ineligible person is someone who does not meet these criteria or who is not eligible for the grant of a visa under the Migration Act.","['eligible', 'person', 'criteria', 'visa', 'Australia', 'temporarily', 'health', 'character', 'requirements', 'Migration Act']",Home_Affairs.pdf
What is the requirement for photocopying documents in the immigration clearance process?,"The requirement for photocopying documents in the immigration clearance process is to photocopy the bio-data page of the passport, boarding pass, airline ticket/baggage tags, as these documents will assist with making a decision about whether to infringe the carrier.","['photocopy', 'passport', 'boarding', 'airline', 'ticket', 'baggage']",Home_Affairs.pdf
What is the purpose of the Border (Temporary) (Class TA) (Subclass 773) visa?,The purpose of the Border (Temporary) (Class TA) (Subclass 773) visa is to provide a pathway for non-citizen travellers who arrive in Australia without holding a visa or whose visa has been cancelled in immigration clearance to enter Australia.,"['provide', 'pathway', 'non-citizen', 'travellers', 'arrive', 'Australia', 'visa', 'cancelled', 'immigration', 'clearance']",Home_Affairs.pdf
Who is eligible for a Border visa?,"A traveller who arrives in Australia without holding a visa or whose visa has been cancelled in immigration clearance and has compelling reasons for granting a Border visa, and whose presence in Australia would not be contrary to Australia’s interests.","['A traveller', 'visa', 'Australia', ' Border visa', 'compelling reasons', 'granting', 'presence', ""Australia's interests""]",Home_Affairs.pdf
What are the reasons for considering a Border visa?,"The reasons for considering a Border visa include the traveller’s eligibility for a Border visa, compelling reasons for granting a Border visa, and the traveller’s presence in Australia not being contrary to Australia’s interests.","['eligibility', 'compelling', 'presence', 'Australia', 'interests']",Home_Affairs.pdf
What is the scope of the Procedural Instruction (PI)?,"The Procedural Instruction (PI) applies to Australian Border Force (ABF) Border Clearance Officers (BCO) in the airports and, in limited circumstances, seaports providing immigration clearance under the Migration Act 1958.","['Australian', 'Border', 'Force', 'Officers', 'airports', 'seaports', 'immigration', 'clearance', 'Migration', 'Act']",Home_Affairs.pdf
What is out of scope of the Procedural Instruction (PI)?,"The Procedural Instruction (PI) does not cover consideration and grant of a border visa after immigration clearance, clearance of travellers and/or goods under the Customs Act 1901.","['The', 'Procedural', 'Instruction', 'does', 'not', 'cover', 'consideration', 'and', 'grant', 'of', 'a', 'border', 'visa', 'after', 'immigration', 'clearance', 'clearance', 'of', 'travellers', 'and', '/', 'or', 'goods', 'under', 'the', 'Customs', 'Act', '1901']",Home_Affairs.pdf
Who is not eligible for a Border visa?,A person who is not eligible for a Border visa includes a person to whom sub-clause 773.213(1)(c) of the Migration Regulations 1994 applies.,"['not eligible', 'person', 'sub-clause', '773.213(1)(c)', 'Migration Regulations 1994']",Home_Affairs.pdf
What are the requirements for granting a Border visa?,"The requirements for granting a Border visa include the traveller’s eligibility for a Border visa, compelling reasons for granting a Border visa, and the traveller’s presence in Australia not being contrary to Australia’s interests.","['eligibility', 'compelling', 'presence', 'Australia', 'interests']",Home_Affairs.pdf
Can a Border visa be granted to a person who has not obtained a visa prior to travelling to Australia?,"A Border visa may be granted to a person who has not obtained a visa prior to travelling to Australia, but there should always be some mitigating factor justifying granting a Border visa.","['A', 'Border', 'visa', 'may', 'be', 'granted', 'to', 'a', 'person', 'who', 'has', 'not', 'obtained', 'a', 'visa', 'prior', 'to', 'travelling', 'to', 'Australia', 'but', 'there', 'should', 'always', 'be', 'some', 'mitigating', 'factor', 'justifying', 'granting', 'a', 'Border', 'visa']",Home_Affairs.pdf
What is the role of the Australian Border Force (ABF) Border Clearance Officers (BCO) in the process of granting a Border visa?,The Australian Border Force (ABF) Border Clearance Officers (BCO) are responsible for considering and granting Border visas to eligible travellers in immigration clearance.,"['ABF', 'BCO', 'Border visa', 'immigration clearance']",Home_Affairs.pdf
How is the decision to grant a Border visa determined?,"The decision to grant a Border visa is determined on a case-by-case basis, having considered all of the traveller’s circumstances.","['case-by-case', 'traveller’s', 'circumstances']",Home_Affairs.pdf
What is the purpose of the Migration Regulations 1994 (the Regulations)?,"The purpose of the Migration Regulations 1994 is to provide a framework for the granting of visas to individuals seeking to enter Australia, and to establish the criteria and processes for the granting of Border visas.","['Migration Regulations 1994', 'visas', 'Australia', 'Border visas']",Home_Affairs.pdf
What is a Border visa?,"A Border visa is a type of visa that may be granted to an individual who has entered Australia without a visa or whose visa has been cancelled, and who is seeking to remain in Australia on a temporary basis.","['Border', 'visa', 'Australia']",Home_Affairs.pdf
Who is eligible for a Border visa?,"Under clause 773.213 of the Regulations, certain categories of travellers may be eligible for a Border visa, including spouses/de facto partners of Australian citizens or permanent residents, accompanying dependent children, certain returning former holders of visas, and travellers who seek to remain in Australia on a temporary basis and appear to be eligible for a Visitor visa, Transit visa, or Temporary Work (Short Stay Specialist) visa.","['eligible', 'Border visa', 'Australian citizens', 'permanent residents', 'dependent children', 'returning former holders', 'Visitor visa', 'Transit visa', 'Temporary Work (Short Stay Specialist) visa']",Home_Affairs.pdf
What is the criteria for assessing a Border visa application?,"The criteria for assessing a Border visa application include compelling reasons for granting the visa, the traveller's presence in Australia not being contrary to Australia's interests, and the traveller having a good reason for not holding a visa on arrival. The decision to consider a Border visa must be determined on a case-by-case basis, considering all of the traveller's circumstances.","['compelling', 'reasons', 'granting', ""traveller's"", ""Australia's"", 'good', 'reason', 'visa', 'circumstances']",Home_Affairs.pdf
Who is ineligible for a Border visa?,"Certain classes of travellers are ineligible for a Border visa, including protection claimants, travellers subject to a 5-year exclusion period, and travellers who have been advised not to travel to Australia pending their section 501 assessment.","['protection claimants', '5-year exclusion period', 'section 501 assessment']",Home_Affairs.pdf
What is the process for applying for a Border visa?,"The process for applying for a Border visa involves submitting an application and supporting documentation to the Department of Home Affairs, and attending an interview with a border officer if required. The application will be assessed against the relevant criteria, and the applicant will be notified of the decision.","['submitting', 'application', 'supporting', 'documentation', 'attending', 'interview', 'border', 'officer', 'assessed', 'criteria', 'notified', 'decision']",Home_Affairs.pdf
Can a Border visa be granted for compelling reasons?,"Yes, a Border visa may be granted for compelling reasons, such as urgent business or personal reasons, death or illness of a close family member, or medevac emergencies. The decision to grant a Border visa for compelling reasons will be made on a case-by-case basis.",['Yes'],Home_Affairs.pdf
How long is a Border visa valid for?,"A Border visa is typically valid for a short period, usually up to 72 hours, and is intended to allow the holder to remain in Australia while their immigration status is resolved.",['up to 72 hours'],Home_Affairs.pdf
Can a Border visa be extended?,"No, a Border visa cannot be extended. If the holder of a Border visa wishes to remain in Australia for a longer period, they must apply for a different type of visa.",['No'],Home_Affairs.pdf
What are the consequences of breaching the conditions of a Border visa?,"Breaching the conditions of a Border visa can result in the visa being cancelled, and the holder may be subject to deportation. It is important to comply with the conditions of the visa to avoid any negative consequences.","['cancelled', 'deportation', 'negative consequences']",Home_Affairs.pdf
What is the purpose of a Border visa?,"A Border visa is granted to a traveller who does not hold a valid visa for re-entry to Australia, but has a good reason for not holding one, and their presence in Australia would not be contrary to Australia's interests.","['A Border visa', 'Australia']",Home_Affairs.pdf
What is considered a good reason for not holding a visa on arrival?,"A good reason for not holding a visa on arrival may include personal circumstances of the traveller or their Australian contacts, which may cause unnecessary inconvenience or distress if a visa were not granted.","['personal circumstances', 'Australian contacts', 'unnecessary inconvenience', 'distress', 'visa']",Home_Affairs.pdf
Who assess whether a traveller can be considered for a Border visa?,Border Control Officers (BCOs) assess whether a traveller can be considered for a Border visa.,['BCOs'],Home_Affairs.pdf
What considerations do BCOs give regard to when assessing a traveller's eligibility for a Border visa?,"BCOs consider community protection issues, such as health, safety, good order, and character, and whether the traveller's presence in Australia would be contrary to Australia's interests.","['community', 'protection', 'health', 'safety', 'good', 'order', 'character', 'Australia', 'interests']",Home_Affairs.pdf
What is a Behaviour Concern Non-Citizen (BCNC)?,A Behaviour Concern Non-Citizen (BCNC) is a traveller who has a substantial criminal history that falls within the scope of section 501 of the Migration Act (refusal or cancellation of visa on character grounds).,"['Behaviour', 'Concern', 'Non-Citizen', 'BCNC', 'criminal', 'history', 'Migration', 'Act', 'refusal', 'cancellation', 'visa', 'character', 'grounds']",Home_Affairs.pdf
Can a BCO finalise the immigration clearance of a traveller who has been referred for a Border visa?,"No, a BCO must not finalise the immigration clearance of a traveller who has been referred for a Border visa until the visa matter has been resolved.",['No'],Home_Affairs.pdf
