question,answer,tokens_present,document
What is the role of the Automated Telephone Interpreters Service (ATIS) in the process of assessing a traveller's eligibility for a Border visa?,The Automated Telephone Interpreters Service (ATIS) can be contacted by a BCO to assist in translating preliminary questions for a traveller who may not speak English fluently.,"['The', 'Automated', 'Telephone', 'Interpreters', 'Service', 'can', 'be', 'contacted', 'by', 'a', 'BCO', 'to', 'assist', 'in', 'translating', 'preliminary', 'questions', 'for', 'a', 'traveller', 'who', 'may', 'not', 'speak', 'English', 'fluently']",Home_Affairs.pdf
What is the purpose of examining a traveller's passport/travel document during the assessment process?,The purpose of examining a traveller's passport/travel document is to check its authenticity and look for indications of tampering and alteration.,"['authenticity', 'tampering', 'alteration']",Home_Affairs.pdf
What information can a BCO access through the Integrated Client Services Environment (ICSE) or Client Search Portal (CSP)?,A BCO can access information on a traveller's immigration status and history through the Integrated Client Services Environment (ICSE) or Client Search Portal (CSP).,"['BCO', 'immigration', 'status', 'history']",Home_Affairs.pdf
What is the significance of establishing a traveller's correct identity and immigration status in the process of assessing their eligibility for a Border visa?,"Establishing a traveller's correct identity and immigration status is critical in the process of assessing their eligibility for a Border visa, as it helps to ensure that the traveller does not pose a risk to Australia's interests.","['critical', 'identity', 'immigration', 'status', 'risk', 'Australia', 'interests']",Home_Affairs.pdf
What is the purpose of establishing a traveller's correct identity and immigration status?,"The purpose of establishing a traveller's correct identity and immigration status is to ensure that the traveller is not an Australian citizen or permanent resident travelling on another travel document/passport, and to confirm that no other visa is held, and to check for previous M304 reports about the person and consider the information where previous reports exist, and to check Central Movement Alert List (CMAL) for a possible listings, and to check whether the traveller has ever been removed from Australia or has ever been subject to section 501 cancellation or refusal consideration, and to review and confirm the person’s identity and immigration history before proceeding, and to check if an uplift approval (if any) has been given by the Border Operations Centre (BOC).","['ensure', 'confirm', 'check', 'consider', 'listings', 'remove', 'subject', 'review', 'confirm', 'uplift']",Home_Affairs.pdf
What is the requirement for a Border visa application?,"A Border visa application must be made on Form 871 - Application for a Border visa (subclass 773) which is available in Legend, and parts A and B must be completed by the traveller. Members of a family unit may combine their applications and be included on the one form.","['Application', 'Form', '871', 'Application', 'Border', 'visa']",Home_Affairs.pdf
What is the process for an uplift approval?,"The process for an uplift approval involves the Border Operations Centre (BOC) giving permission for the traveller to uplift and carry a passenger, in consideration with section 42 requirements, in limited circumstances. The reasons for an uplift approval can be viewed by selecting ‘List Authorised ‘G’ Overrides’ within the Referrals mainframe system (RF).","['uplift approval', 'BOC', 'permission', 'traveller', 'passenger', 'section 42', 'circumstances', 'Referrals mainframe system', 'RF']",Home_Affairs.pdf
What is the purpose of Schedule 1 requirement for Border visa application?,"The purpose of Schedule 1 requirement for Border visa application is to ensure that the applicant is in immigration clearance when applying for the visa, with the exception of a dependent child.","['ensure', 'immigration', 'clearance', 'applying', 'visa']",Home_Affairs.pdf
Can a dependent child apply for a Border visa?,"Yes, a dependent child can apply for a Border visa, and their application must be included on the same form as the primary applicant.",['Yes'],Home_Affairs.pdf
What is the requirement for a traveller whose visa is cancelled for breaching visa condition following entry into Australia?,"The traveller whose visa is cancelled for breaching visa condition following entry into Australia must provide a written statement that demonstrates the following criteria in sub-clauses 773.215(a) -(c), which includes having reasonable grounds for having failed to comply with that condition, providing compelling reasons for being allowed to leave the place of immigration clearance with the permission of the clearance officer, and stating that the specified person referred to in their visa (usually the primary visa holder or sponsor) will arrive in Australia within 30 days of the traveller being allowed to leave the place of immigration clearance with the permission of the BCO.","['reasonable grounds', 'compelling reasons', 'specified person', 'arrive in Australia', 'within 30 days']",Home_Affairs.pdf
What is the role of the Border Operations Centre (BOC) in the Border visa application process?,"The Border Operations Centre (BOC) plays a critical role in the Border visa application process as it is responsible for granting uplift approvals, reviewing and confirming the person’s identity and immigration history, and deciding whether to serve an airline infringement notice.","['uplift approvals', 'identity', 'immigration history', 'airline infringement notice']",Home_Affairs.pdf
How does the BCO complete the results of their actions and decisions on Form 871?,"The BCO must complete the results of their actions and decisions on Form 871, including the outcome of the decision, period of stay granted, and whether or not to serve an airline infringement notice.","['The', 'BCO', 'must', 'complete', 'Form', '871', 'outcome', 'decision', 'period', 'stay', 'granted', 'whether', 'serve', 'airline', 'infringement', 'notice']",Home_Affairs.pdf
What is the purpose of Clause 773.215 in the Border visa application process?,"The purpose of Clause 773.215 in the Border visa application process is to provide a special requirement for a traveller whose visa is cancelled for breaching visa condition following entry into Australia, which includes providing a written statement that demonstrates the criteria in sub-clauses 773.215(a) -(c).","['The purpose of', 'Border visa application process', 'visa', 'cancelled', 'breaching visa condition', 'Australia', 'written statement', 'criteria', 'sub-clauses']",Home_Affairs.pdf
What is the significance of Section 47E(d) in the Border visa application process?,Section 47E(d) is significant in the Border visa application process as it releases information under the Freedom of Information Act 1,"['Section', '47E(d)', 'Freedom of Information Act 1']",Home_Affairs.pdf
What are the eligibility criteria for a Border visa application?,"The eligibility criteria for a Border visa application include meeting the requirements of Schedule 2 Part 773 of the Migration Regulations, adverse declaration(s) or response(s) on the Border visa application form, and Schedule 4 - Public Interest Criteria considerations, including health, character or security concerns, debts to the Commonwealth, exclusions such as cancellations or overstay, and consideration of minors.","['Schedule 2 Part 773', 'Schedule 4', 'health', 'character', 'security', 'debts', 'Commonwealth', 'exclusions', 'cancellations', 'overstay', 'minors']",Home_Affairs.pdf
What is the purpose of Schedule 4 - Public Interest Criteria considerations?,"Schedule 4 - Public Interest Criteria considerations are used to assess whether a traveller meets the requirements for a Border visa, including health, character or security concerns, debts to the Commonwealth, exclusions such as cancellations or overstay, and consideration of minors.","['Schedule 4', 'Public Interest Criteria', 'visa', 'health', 'character', 'security', 'Commonwealth', 'exclusions', 'cancellations', 'overstay', 'minors']",Home_Affairs.pdf
What is PIC 4001 and what does it relate to?,PIC 4001 relates to the Minister being satisfied that the traveller passes the character test. It is one of the Public Interest Criteria (PICs) that must be considered when assessing a traveller’s eligibility for a Border visa.,"['PIC 4001', 'character test', 'Public Interest Criteria', 'Border visa']",Home_Affairs.pdf
How is the character test assessed for PIC 4001?,"The character test is assessed by considering the nature/seriousness of the crime or conduct, the frequency and ‘age’ of the crime or conduct, whether there is an escalation in offending conduct, and whether there is information to suggest that the person may have been rehabilitated.","['nature', 'seriousness', 'crime', 'conduct', 'frequency', 'age', 'escalation', 'offending', 'rehabilitated']",Home_Affairs.pdf
What is the five-year exclusion period for Border visa holders?,"A five-year exclusion period applies to previous Border visa holders who are prescribed under sub-clauses 773.213(1)(e), (f) or (g) of the Migration Regulations. If a traveller had been granted a Border visa in the last five years, they will be ineligible for a further Border visa unless they meet the criteria specified under 773.216(2)(b).","['five-year', 'exclusion', 'period', 'Border', 'visa', 'holders']",Home_Affairs.pdf
Can the five-year exclusion period be waived?,The five-year exclusion period can be waived if the traveller is a passenger on a vessel (which includes an aircraft or an installation) that has entered Australia because of matters beyond the control of the person in charge of the vessel.,"['can', 'waived', 'passenger', 'vessel', 'Australia', 'matters', 'control']",Home_Affairs.pdf
What is an example of a situation where the five-year exclusion period may be waived?,An example of a situation where the five-year exclusion period may be waived is if a vessel not destined for Australia is diverted from the original port of destination to Australia due to mechanical difficulties or inclement weather.,"['mechanical difficulties', 'inclement weather']",Home_Affairs.pdf
How does the BCO assess a traveller’s eligibility for a Border visa?,"The BCO assesses a traveller’s eligibility for a Border visa by considering the eligibility criteria, including Schedule 2 Part 773 of the Migration Regulations, adverse declaration(s) or response(s) on the Border visa application form, and Schedule 4 - Public Interest Criteria considerations.","['Schedule 2 Part 773', 'Migration Regulations', 'Schedule 4', 'Public Interest Criteria']",Home_Affairs.pdf
What is the role of the BCO in assessing a traveller’s character?,The BCO must consider the character test provisions under section 501 of the Migration Act when assessing a traveller’s character. They must also consider whether the traveller would likely fail the character test.,"['BCO', 'Migration Act', 'character test', 'traveller']",Home_Affairs.pdf
Can a traveller who has deliberately not declared their criminal history on the application form or on their completed IPC be granted a Border visa?,"A traveller who has deliberately not declared their criminal history on the application form or on their completed IPC may be viewed as deceptive, and this behaviour may work against them in terms of being invited to apply for a Border visa.","['may', 'deceptive', 'behaviour', 'invited']",Home_Affairs.pdf
What is the maximum period of validity for a Border visa?,The maximum period of validity for a Border visa is 30 days.,['30 days'],Home_Affairs.pdf
What is the purpose of a Border visa?,"A Border visa is granted to a traveller who is not eligible for a visa, but has compelling reasons for entering Australia.","['Border', 'visa', 'Australia']",Home_Affairs.pdf
Can a Border visa be granted for a period longer than 30 days?,"No, a Border visa cannot be granted for a period longer than 30 days.",['No'],Home_Affairs.pdf
What are the conditions that must be mirrored on a Border visa grant?,The conditions that must be mirrored on a Border visa grant are the same as those of the visa for which the traveller is apparently eligible.,"['The', 'same', 'as', 'those', 'of', 'the', 'visa', 'for', 'which', 'the', 'traveller', 'is', 'apparently', 'eligible']",Home_Affairs.pdf
What is the process for granting a Border visa?,"The process for granting a Border visa involves an assessment by a BCO, who must consider evidence and/or information available to them to determine whether the five-year exclusion period applies. If the BCO makes an assessment that the traveller may be granted a Border visa, they should grant the visa in either Mainframe RF or Border Security Portal.","['BCO', 'five-year', 'exclusion', 'period', 'grant', 'visa']",Home_Affairs.pdf
What is the difference between a Border visa and a Resident Return visa?,"A Border visa is granted to a traveller who is not eligible for a visa, while a Resident Return visa is granted to a traveller who is apparently eligible for a Resident Return visa.","['Border', 'Resident', 'Return', 'visa']",Home_Affairs.pdf
Can a Border visa be granted for a transit passenger who misses a connecting flight?,"Yes, a Border visa can be granted for a transit passenger who misses a connecting flight, sufficient to cover the period of stay necessary for the applicant to remain in Australia.",['Yes'],Home_Affairs.pdf
What is the role of a BCO in granting a Border visa?,"A BCO must consider evidence and/or information available to them to determine whether the five-year exclusion period applies and must ensure that all the client fields are completed, including the visa grant number, visa conditions attached to the visa, and period of stay granted.","['BCO', 'visa', 'grant']",Home_Affairs.pdf
How is a Border visa grant notified to the traveller?,"The traveller should be provided with the visa grant notification, either in writing or verbally in an emergency or time-limited situation.","['either', 'in writing', 'verbally']",Home_Affairs.pdf
Can a Border visa be granted for a period longer than the scheduled date of departure from Australia?,"No, a Border visa need only covers the visa holder until the applicant’s scheduled date of departure from Australia (if known).",['No'],Home_Affairs.pdf
What are the details that the BCO must complete for a Border visa grant?,"The BCO must complete the following details for a Border visa grant: visa grant number, visa conditions attached to the visa, and period of stay granted.","['visa grant number', 'visa conditions', 'period of stay']",Home_Affairs.pdf
Where can the latest version of the Border visa grant notice template be found?,The latest version of the Border visa grant notice template can be found on the Border Procedural Instruction Toolkit intranet page.,"['Border', 'visa', 'grant', 'notice', 'template', 'intranet']",Home_Affairs.pdf
What must the BCO do with the signed copy of the grant notice?,The BCO must retain a signed copy of the grant notice for their record and give it to the traveler together with the detached cover sheet of Form 871.,"['BCO', 'grant', 'notice', 'record', 'traveler', 'Form 871']",Home_Affairs.pdf
What must the BCO do with the document pertaining to the grant of the Border visa?,The BCO must save all documents pertaining to the grant of the Border visa in Content Manager (formerly known as TRIM).,"['The', 'BCO', 'must', 'save', 'all', 'documents', 'pertaining', 'to', 'the', 'grant', 'of', 'the', 'Border', 'visa', 'in', 'Content', 'Manager', '(formerly', 'known', 'as', 'TRIM)']",Home_Affairs.pdf
What must the BCO counsel the traveler about?,"The BCO must counsel the traveler about the visa validity, visa conditions, and that the visa is not valid for travel and will cease on their departure. They must also inform the traveler that if they travel to Australia again, they must obtain an appropriate visa prior to travel.","['visa validity', 'visa conditions', 'not valid for travel', 'cease', 'departure', 'travel', 'Australia', 'appropriate visa']",Home_Affairs.pdf
What is the purpose of Attachment C – Consultation in the Border visa grant process?,Attachment C – Consultation is used to consult with internal stakeholders such as the Border and Events Visas section and Port Operations.,"['Consultation', 'Border', 'Events', 'Visas', 'Port', 'Operations']",Home_Affairs.pdf
What are Australia’s interests in the context of the Border visa grant process?,"Australia’s interests include community safety, economic, social, and health factors. The Government has articulated community protection principles that can be applied in the context of decision-making relating to Border visas.","['community safety', 'economic', 'social', 'health', 'Government', 'protection principles', 'decision-making', 'Border visas']",Home_Affairs.pdf
What is the expectation of the Australian community regarding persons coming to or remaining in Australia?,"The Australian community expects that persons coming to or remaining in Australia are law-abiding, will respect important societal institutions, and will not cause or threaten harm to individuals or the community.","['law-abiding', 'respect', 'societal institutions', 'not cause or threaten harm']",Home_Affairs.pdf
What is the consequence of committing serious crimes in Australia or elsewhere for a person's visa?,The Australian Government can and should refuse entry to persons or cancel their visas if they commit serious crimes in Australia or elsewhere.,"['cancel', 'refuse']",Home_Affairs.pdf
What is the consideration for cancellation or refusal of a visa for persons who have lived in the Australian community for a short period of time?,The length of time making a positive contribution to the community and the consequences of cancellation or refusal on minor children and immediate family members are considerations in determining the appropriateness of cancellation or refusal.,"['short period of time', 'positive contribution', 'minor children', 'immediate family members', 'cancellation', 'refusal']",Home_Affairs.pdf
What should outweigh the interests of the individual in the context of the Border visa grant process?,"Australia’s interests, including those of the community and their protection from risk that a person may pose, should outweigh the interests of the individual.","['Australia', 'interests', 'community', 'protection', 'risk']",Home_Affairs.pdf
