question,answer,question_type,filename
What's Lending Crowd's role re Finance Direct?,"Pursuant to a Supplemental Trust Deed signed on 11 December 2015, Lending Crowd Limited became a Charging Subsidiary.",compress,Product Disclosure Statement.pdf
Who handles various tasks in the Company?,"Wayne Croad, the Managing Director, is responsible for risk analysis, strategic planning, sales, marketing, and general management in the Company.",compress,Product Disclosure Statement.pdf
What's the ranking of Debenture Stock in liquidation?,"Debenture Stock ranks below liabilities that rank in priority to it, such as creditors preferred by law and any permitted prior ranking security interests, and above liabilities that rank equally with it, such as lesser ranking secured creditors and unsecured creditors.",compress,Product Disclosure Statement.pdf
What should investors keep in mind when evaluating Finance Direct Limited?,"Some of the key ratios that investors should consider when evaluating Finance Direct Limited include the capital ratio, liquidity cover ratio, and related party exposures.",compress,Product Disclosure Statement.pdf
"Interest payments on Debenture Stock, how are they made?",Interest payments on the Debenture Stock are fixed and vary depending on the fixed term selected. The current fixed interest rates can be found at www.financedirect.co.nz or are available upon request from the Company.,compress,Product Disclosure Statement.pdf
What's Lending Crowd Limited's role in Debenture Stock offer?,"Lending Crowd Limited, a subsidiary company of Finance Direct Limited, has granted security over its assets in support of the guarantee for the Debenture Stock.",compress,Product Disclosure Statement.pdf
How does the company mitigate operational risk?,"The Company applies internal control procedures, including separation of duties, external monthly accountant reconciliations, and 6-monthly audits by an approved auditor.",compress,Product Disclosure Statement.pdf
What uni did Josh de Jong attend?,Auckland University,compress,Product Disclosure Statement.pdf
What assets back the Debenture Stock?,"The Debenture Stock is secured against the Company's Personal Property and a charge over the Company's Other Property pursuant to the Trust Deed granted by the Company in favour of the Supervisor, as described in Section 4 of the PDS (Key features of Debenture Stock).",compress,Product Disclosure Statement.pdf
What's the extent of the Supervisor's interest in the debenture stock?,"The secured Debenture Stock is secured by a first-ranking security interest in favor of the Supervisor, who represents the interests of investors.",compress,Product Disclosure Statement.pdf
What's CTSL's role in the debenture stock?,Covenant Trustee Services Limited provides independent oversight of Finance Direct Limited in relation to the Debenture Stock.,compress,Product Disclosure Statement.pdf
How often does Finance Direct update its financial info?,"Finance Direct Limited provides updates on its financial position on a quarterly basis, and these updates are available on the Disclose Register.",compress,Product Disclosure Statement.pdf
"What was the finder's fee paid to a party related to Wayne Croad during the 6-month period ended September 30, 2022?","A finder's fee of $140,000 was paid to a party related to Wayne Croad during the six-month period ended September 30, 2022.",compress,Product Disclosure Statement.pdf
What's the RWT rate for different entities?,"The RWT rates for individuals (including corporate trustees) are 10.5%, 17.5%, 30%, 33%, and 39%. For trustee investors, the 10.5% rate is only available for a trustee of a testamentary trust. The rates for companies are 28%, 33%, and 39%.",compress,Product Disclosure Statement.pdf
What's the risk of investing in loans through the Platform?,The principal risk of loss in investing in loans through the Platform is non-payment of amounts owing by borrowers who enter into loan agreements under the Platform.,compress,Product Disclosure Statement.pdf
What's HLB Mann Judd's role in risk management?,HLB Mann Judd (chartered accountants and business advisers) provides external expert advice to the Company as considered prudent from time to time to help manage risk.,compress,Product Disclosure Statement.pdf
When is the Debenture Stock due?,The issue date of the Debenture Stock is 22 September 2016.,compress,Product Disclosure Statement.pdf
What's the point of loan apps?,The purpose of the loan application and credit approval process is to ensure that the Company takes sufficient security to properly protect its position and to ensure that the Company follows stringent policies of monitoring loan performance.,compress,Product Disclosure Statement.pdf
Can interest in Debenture Stock be transferred?,"Yes, Investors may transfer their interest in the Debenture Stock at any time, not later than 30 days before the Maturity Date, by completion of a Transfer in such form as is normally used to transfer shares in New Zealand.",compress,Product Disclosure Statement.pdf
What's FDL's business strategy?,"Finance Direct Limited is a Non-Bank Deposit Taker that offers competitively priced, flexible products and provides speed of service not always met by other lending institutions. The company attracts its customers through a network of introducers, press, internet, and radio advertising.",compress,Product Disclosure Statement.pdf
"Investor seeking Finance Direct's financial information, where?",Finance Direct’s financial information can be found in Section 5 of the PDS.,compress,Product Disclosure Statement.pdf
"What was the finder's fee paid to Wayne Croad's related party during the six-month period ended September 30, 2022?","$140,000",compress,Product Disclosure Statement.pdf
How often does the Debenture Stock earn interest?,"Interest on the Debenture Stock is paid quarterly during the term of the investment, on 31 March, 30 June, 30 September, and 31 December.",compress,Product Disclosure Statement.pdf
What's the number for Finance Direct's investment team?,The phone number for Finance Direct Limited's investment team is +64 9 529 5399.,compress,Product Disclosure Statement.pdf
How often will investors get interest and tax statements?,Investors will receive statements of interest and withholding tax deductions quarterly.,compress,Product Disclosure Statement.pdf
What's the biggest risk for the Co.?,"The most significant risk faced by the Company is the risk that the Company is unable to recover loans in full from borrowers, as described in Section 6 of the PDS (Risks of Investing).",compress,Product Disclosure Statement.pdf
Who can own Finance Direct Limited investments?,"Yes, more than one person can take ownership of an investment in Finance Direct Limited.",compress,Product Disclosure Statement.pdf
Who is liable for the Debenture Stock repayment?,"The Company is responsible for repaying the Debenture Stock, and the obligation to repay is guaranteed by Lending Crowd Limited, a subsidiary company of Finance Direct Limited.",compress,Product Disclosure Statement.pdf
"What is the likelihood of the Company defaulting on its obligations under the Debenture Stock, given that it primarily lends on depreciating assets, has a higher loan-to-value ratio than larger financial institutions, and has a rigorous loan application and credit approval process in place?","The likelihood of the Company defaulting on its obligations under the Debenture Stock is high, given that it primarily lends on depreciating assets, has a higher loan-to-value ratio than larger financial institutions, and has a rigorous loan application and credit approval process in place. This is because the Company's ability to recover loans in full from borrowers is uncertain, and the value of the assets used as collateral may decrease over time, making it difficult for the Company to recover its investment. Additionally, the Company's high loan-to-value ratio increases the risk that borrowers may default on their loans, which could lead to a significant loss for the Company and impact its ability to meet its obligations under the Debenture Stock.",multi-hop reasoning,Product Disclosure Statement.pdf
"What is the capital ratio of Finance Direct Limited, and how does it compare to the required minimum ratio? What is the significance of this ratio in evaluating the company's financial health?","The capital ratio of Finance Direct Limited can be found on the Disclose Register at https://disclose-register.companiesoffice.govt.nz/. The capital ratio is calculated by dividing the company's total capital by its total risk-weighted assets. According to the Disclose Register, the company's capital ratio is 14.8%, which exceeds the required minimum ratio of 4%. This suggests that the company has a healthy capital position and is well-positioned to absorb potential losses. However, it's important to note that a higher capital ratio does not necessarily mean that the company is safe, as other factors such as the quality of its assets and off-balance-sheet exposures should also be considered when evaluating its financial health.",multi-hop reasoning,Product Disclosure Statement.pdf
"How does Finance Direct Limited's lending approach compare to its competitors, and what measures has the company taken to maintain its reputation as a niche lender?","Finance Direct Limited's lending approach is conservative, and the company has always adopted a non-recourse basis, meaning they have no residual credit risk liability to other financial institutions in the event of a default by the respective borrower. This approach is different from other lenders who may take on more risk by holding onto loans that do not meet their lending criteria. The company has maintained its reputation as a niche lender by focusing on exceptional service and quality rather than growth for growth's sake, and by offering competitively priced and flexible products. Additionally, the company has launched a peer-to-peer lending service, operated by Lending Crowd Limited, which allows for equal terms as other retail and institutional investors, providing another avenue to access quality business. The company's focus on maintaining its reputation and its commitment to exceptional service and quality have contributed to its continued success.",multi-hop reasoning,Product Disclosure Statement.pdf
"How does Finance Direct Limited manage to maintain its reputation as a niche lender while providing quality business and minimizing risk through a non-recourse basis, and how does its peer-to-peer lending service operated by Lending Crowd Limited, contribute to the company's success in navigating challenging economic times?","Finance Direct Limited maintains its reputation as a niche lender by focusing on exceptional service and quality rather than growth for growth's sake, and by adopting a conservative approach to lending, where loans that do not meet the company's lending criteria are brokered to a more appropriate lender on a non-recourse basis, minimizing the risk to the company. The company's peer-to-peer lending service operated by Lending Crowd Limited, launched in 2015, has proven to be another avenue to access quality business for the company, while providing an opportunity to invest in a wholly New Zealand owned company, and has helped the company successfully navigate challenging economic times by switching its activities between lending and brokering.",multi-hop reasoning,Product Disclosure Statement.pdf
"How does the company mitigate the risk of not having sufficient funds to meet its ongoing obligations, given that it principally raises funds from the issue of Debenture Stock, and what are the potential impacts on the company's profitability and ability to make payment obligations under the Debenture Stock if interest rate margins reduce due to larger investments in lower-yielding loans on the peer-to-peer lending platform?","To mitigate the risk of not having sufficient funds to meet its ongoing obligations, the company actively monitors loan repayment cycles to ensure the average actual term of its loans is shorter than the average term of its debenture borrowings, prepares detailed financial forecasts and holds regular management meetings to discuss liquidity management issues, maintains sufficient liquid funds to meet its commitments based on forecast financial information, obtains external expert advice as considered prudent from time to time, and manages its liquidity and reports on that liquidity to the Supervisor as required by the Trust Deed. If interest rate margins reduce due to larger investments in lower-yielding loans on the peer-to-peer lending platform, it may increase the risk of default and impact the company's ability to make payment obligations under the Debenture Stock, potentially affecting its profitability. To mitigate this risk, the company may cease lending on the platform, raise interest rates offered on the platform, or seek further retail and wholesale funding lines to fund a larger portion of the lower-yielding loans originations.",multi-hop reasoning,Product Disclosure Statement.pdf
"What steps can investors take to resolve a dispute regarding their Debenture Stock investment, and where can they find the necessary forms and information for this process?","Investors can resolve disputes regarding their Debenture Stock investment by first contacting Finance Direct Limited's internal disputes resolution scheme, which can be reached through their Freephone 0800 268 362, Telephone +64 9 302 0638, or Email team@covenant.co.nz. If a resolution cannot be reached through this channel, investors can contact Financial Services Complaints Limited, an approved disputes resolution scheme that can be reached through their Freephone 0800 347 257, Email complaints@fscl.org.nz, or Physical Address: Level 4 101 Lambton Quay Wellington. Investors can also contact the Financial Markets Authority through their website www.fma.govt.nz to make a complaint. Investors can find the necessary forms and information for this process on Finance Direct Limited's website at www.financedirect.co.nz, or on the Disclose Register at https://disclose-register.companiesoffice.govt.nz. They can also request a copy of the information on the Disclose Register from the Registrar of Financial Service Providers.",multi-hop reasoning,Product Disclosure Statement.pdf
"What are the possible tax consequences for an investor who is not a tax resident of New Zealand and holds secured deposits through a fixed establishment in New Zealand in which the investor is engaged in business in New Zealand, and how might these consequences be affected by the company's regulatory risk?","The possible tax consequences for an investor who is not a tax resident of New Zealand and holds secured deposits through a fixed establishment in New Zealand in which the investor is engaged in business in New Zealand include non-resident withholding tax (NRWT) deducted by the company at a rate of 10% or 15%, depending on the investor's country of residence and eligibility for relief under a relevant tax treaty. However, the company's regulatory risk may affect these tax consequences, as the company's failure to comply fully with regulatory requirements could result in fines or sanctions that might impact its ability to deduct NRWT correctly or make timely interest payments to investors, potentially disrupting business operations and profitability and increasing the risk of default in payment obligations under the Debenture Stock.",multi-hop reasoning,Product Disclosure Statement.pdf
"What are the possible ways an investor can withdraw their investment before the maturity date, considering the Company's discretion, security interests, financial position, performance, and market conditions, and how can an investor assess the credit risk and interest rate risk associated with the Debenture Stock?","An investor can withdraw their investment before the maturity date by selling their Debenture Stock, but this is subject to the Company's discretion. The Company may permit early repayment in cases of death or financial hardship. However, there is no established market for trading Debenture Stock, and the Company does not intend to quote it on a licensed market in New Zealand, which may limit the investor's ability to sell their stock. The investor can also assess the credit risk and interest rate risk associated with the Debenture Stock by reviewing the Company's financial information, which is available in Section 5 of the PDS. The Company's financial position and performance are essential in assessing its ability to meet its obligations under the Debenture Stock. The investor should also consider the risks associated with investing in debt securities, such as credit risk, liquidity risk, interest rate risk, and real estate and property market risk, which are discussed in Section 6 of the PDS. Additionally, the investor should evaluate the security interests that secure the Debenture Stock, which are described in Section 4 of the PDS.",multi-hop reasoning,Product Disclosure Statement.pdf
How does the company's relationship with Lending Crowd Limited affect its tax obligations?,"The company's relationship with Lending Crowd Limited, as a subsidiary and related party, indirectly subjects the company to a higher level of compliance and regulatory requirements. This means that the company must deduct resident withholding tax (RWT) from interest paid to or applied for the benefit of New Zealand resident investors and investors who hold secured deposits through a fixed establishment in New Zealand in which the investors are engaged in business in New Zealand, unless the investor has informed the company that they have RWT exemption status. The company must also deduct non-resident withholding tax (NRWT) from interest paid to or applied for the benefit of an investor who is not a tax resident of New Zealand, unless the investor holds secured deposits through a fixed establishment in New Zealand in which the investor is engaged in business in New Zealand. The company has obtained 'Approved Issuer' status and has registered the Debenture Stock as 'Registered Securities' for the purpose of the approved issuer levy provisions in Part 6B of the Stamp and Cheques Duties Act 1971, which allows the company to deduct and pay an Approved Issuer Levy (currently 2%) on interest payments made to non-residents in lieu of NRWT.",multi-hop reasoning,Product Disclosure Statement.pdf
"What steps can an investor take if they have a complaint regarding their Debenture Stock, and how can they find more information about the Debenture Stock and the issuer?","If an investor has a complaint regarding their Debenture Stock, they can first contact Finance Direct Limited's internal disputes resolution scheme by calling their freephone number 0800 399 666, emailing [investments@financedirect.co.nz](mailto:investments@financedirect.co.nz), or mailing their physical address at QB Studios, Level 2, 206 Jervois Road, Herne Bay, Auckland. If the issue cannot be resolved through the internal disputes resolution scheme, the investor can contact Financial Services Complaints Limited, an approved disputes resolution scheme, by calling their freephone number 0800 347 257, emailing [complaints@fscl.org.nz](mailto:complaints@fscl.org.nz), or mailing their physical address at Level 4, 101 Lambton Quay, Wellington. Investors can also contact the Financial Markets Authority through their website www.fma.govt.nz to make a complaint. Additionally, investors can find more information about the Debenture Stock and the issuer, Finance Direct Limited, by visiting their website at www.financedirect.co.nz, and on the Disclose Register at https://disclose-register.companiesoffice.govt.nz. They can also request a copy of the information on the Disclose Register from the Registrar of Financial Service Providers at Companies Office, Private Bag 92061, Victoria Street West, Auckland 1142.",multi-hop reasoning,Product Disclosure Statement.pdf
How does Finance Direct Limited's conservative approach to lending and its relationship with Lending Crowd Limited impact the company's ability to provide investors with a secure and profitable investment opportunity through the Product Disclosure Statement?,"Finance Direct Limited's conservative approach to lending has allowed the company to minimize its risk by only approving loans that meet its strict criteria, and brokering those that do not meet the criteria to other financial institutions on a non-recourse basis. This approach, combined with the company's relationship with Lending Crowd Limited, enables Finance Direct Limited to offer investors a secure and profitable investment opportunity through the Product Disclosure Statement by providing access to quality businesses for investment. Additionally, the company's focus on exceptional service and quality rather than growth for growth's sake has helped it maintain a strong reputation as a niche lender, further supporting the company's ability to provide investors with a positive investment experience.",multi-hop reasoning,Product Disclosure Statement.pdf
"How does Finance Direct Limited's commitment to exceptional service and quality, as well as its conservative approach to lending, contribute to its reputation as a niche lender, and how does this reputation impact its ability to attract customers through a network of introducers, press, internet, and radio advertising, and what role does the company's peer-to-peer lending service, operated by Lending Crowd Limited, play in maintaining this reputation?","Finance Direct Limited's commitment to exceptional service and quality, as well as its conservative approach to lending, has helped the company establish a reputation as a niche lender that is known for its reliability and trustworthiness. This reputation has allowed the company to attract customers through a network of introducers, press, internet, and radio advertising, as potential customers are drawn to the company's focus on quality and service rather than growth. The company's peer-to-peer lending service, operated by Lending Crowd Limited, also plays a role in maintaining this reputation by providing an innovative and accessible platform for customers to access quality business opportunities, further solidifying the company's position as a niche lender.",multi-hop reasoning,Product Disclosure Statement.pdf
"What is the name of the person who holds the position of Managing Director in a company that has a 63% shareholding by his family interests, has a credit manager role, and has over 20 years of experience in the New Zealand banking, finance, and insurance industries, and has received an annual salary of $145,000 and additional remuneration of $22,000 for utilities and general expenses, and has been responsible for implementing systems, key appointments, lending standards, and strategic direction since the company's inception, and has been paid a finder's fee of $140,000 as part of capital raising, and is intimately involved in the day-to-day management and operations of the business, and carries out the role of credit manager for the business operations?",The name of the person who holds the position of Managing Director in a company that matches the given description is Wayne Croad.,multi-hop reasoning,Product Disclosure Statement.pdf
"What is the maximum number of years for which the interest rate of a Debenture Stock can remain fixed, assuming the Debenture Stock is issued for a term of 49 months and the Company adjusts the interest rate applicable to the Investment to the current rate offered by the Company for the nearest term upon which those funds have been held by the Company in the event of early repayment, and the Company pays interest quarterly during the term of the Investment from the date of the deposit with the Company?","The maximum number of years for which the interest rate of a Debenture Stock can remain fixed is 5 years. This is because if the Debenture Stock is issued for a term of 49 months and the Company adjusts the interest rate applicable to the Investment to the current rate offered by the Company for the nearest term upon which those funds have been held by the Company in the event of early repayment, the interest rate will remain fixed for the remaining term of the Investment, which cannot exceed 5 years.",multi-hop reasoning,Product Disclosure Statement.pdf
