question,answer,question_type,filename
What are the claims on the assets of the Company that will or may rank ahead of an investor's claim if the Company is put into liquidation or wound up?,The claims on the assets of the Company that will or may rank ahead of an investor's claim if the Company is put into liquidation or wound up are described in Section 4 of the PDS (Key features of the Debenture Stock).,simple,Product Disclosure Statement.pdf
"Who is the non-executive director of the Company who is a Qualified UK Chartered Accountant with more than 20 years' experience in small and medium-sized businesses, both as an investor and a manager?",Richard Lott,simple,Product Disclosure Statement.pdf
"Who is the non-executive director of the Company who holds a Bachelor of Commerce and Law degrees from the University of Canterbury, New Zealand, and a Graduate Diploma in Wine Business from the University of Adelaide, Australia?",Kirstin Poole,simple,Product Disclosure Statement.pdf
What is the risk associated with the Company's ability to realize proceeds from the sale of mortgaged property in the event of borrower default?,"In the event that the Company is required to enforce its security through the registration of a mortgage and/or the exercise of the power of sale under that mortgage, the Company's ability to realize the proceeds of the sale of the mortgaged property would be subject to the claims of any prior ranking security interest registered over the mortgaged property in question.",simple,Product Disclosure Statement.pdf
What are the claims on the assets of the Company that will or may rank ahead of the claim if the Company is put into liquidation or wound up?,"The claims on the assets of the Company that will or may rank ahead of the claim include the fees and expenses incurred by any liquidator, certain claims by the Company's employees for unpaid remuneration, PAYE tax deductions, and any GST; claims by holders of prior security interests; and the Supervisor’s, or any receiver appointed by the Supervisor, remuneration, costs, charges, expenses, and liabilities.",simple,Product Disclosure Statement.pdf
What percentage of the Company's loans are secured by way of an agreement to mortgage over real estate owned by the borrower?,"As at 30 September 2022, approximately 20% of the Company's loans were secured by way of an agreement to mortgage over real estate owned by the borrower.",simple,Product Disclosure Statement.pdf
Can an investor require the Company to repay the Investment prior to the expiry of the fixed term of the Investment?,"No, an investor cannot require the Company to repay the Investment prior to the expiry of the fixed term of the Investment. However, the Company reserves the ability, at its absolute discretion, to permit the early repayment of Debenture Stock before the Maturity Date in the event of death or financial hardship.",simple,Product Disclosure Statement.pdf
What is the non-resident withholding tax (NRWT) rate for investors who are not tax residents of New Zealand?,The NRWT rate is currently 10% or 15% depending upon the investor's country of residence and whether the investor is eligible for relief under a relevant tax treaty.,simple,Product Disclosure Statement.pdf
Can the Company repay the Investment prior to the expiry of the fixed term of the Investment?,"Yes, the Company reserves the right, at its absolute discretion to repay the Investment prior to the expiry of the fixed term of the Investment.",simple,Product Disclosure Statement.pdf
Can the Company adjust the interest rate applicable to the Investment if it is repaid prior to the Maturity Date?,"Yes, the Company reserves the right at its discretion to adjust the interest rate applicable to the Investment to the current rate offered by the Company for the nearest term upon which those funds have been held by the Company.",simple,Product Disclosure Statement.pdf
Who is the non-executive director of the Company who holds a National Diploma in Accountancy and is a Registered Financial Adviser?,Stephen Massey,simple,Product Disclosure Statement.pdf
What is the regulatory requirement that the Company is subject to due to Lending Crowd Limited operating a licensed peer-to-peer service?,The Company is subject to a higher level of compliance and regulatory requirements compared to other non-bank deposit takers due to Lending Crowd Limited operating a licensed peer-to-peer service.,simple,Product Disclosure Statement.pdf
Can the Company repay the Investment prior to the expiry of the fixed term?,"Yes, the Company reserves the right, at its absolute discretion, to repay the Investment prior to the expiry of the fixed term of the Investment.",simple,Product Disclosure Statement.pdf
What percentage of the Company's loans are secured by agreements to mortgage over real estate owned by the borrower?,Approximately 20% of the Company's loans are secured by agreements to mortgage over real estate owned by the borrower.,simple,Product Disclosure Statement.pdf
What is the company's requirement for deducting resident withholding tax (RWT)?,"The company is generally required to deduct RWT from interest paid to, or applied for, the benefit of New Zealand resident investors and investors who hold secured deposits through a fixed establishment in New Zealand in which the investors are engaged in business in New Zealand.",simple,Product Disclosure Statement.pdf
How does the Company manage the risk of a decline in real estate values affecting the value of security underlying certain loans?,"In the event that the conditions in the real estate market deteriorate materially causing a depreciation in real estate values, this may adversely impact on the value of the security underlying certain of the Company's loans which it may realize in the event that it is required to enforce its security.",simple,Product Disclosure Statement.pdf
What is the ranking of the Debenture Stock in the event of liquidation or winding up of the Company?,"The Debenture Stock ranks first in priority in the event of liquidation or winding up of the Company, ahead of unsecured creditors.",simple,Product Disclosure Statement.pdf
Is there an established market for the sale or transfer of Debenture Stock in Finance Direct Limited?,"No, according to the opinion of the Company, there is no established market for the sale or transfer of Debenture Stock.",simple,Product Disclosure Statement.pdf
How does the Company mitigate the risk of borrower default?,"The Company has a number of procedures in place to mitigate the risk of borrower default, including requiring borrowers to take loan repayment insurance and seeking guarantees from third parties for certain loans.",simple,Product Disclosure Statement.pdf
"What is the aggregate principal amount of Debenture Stock issued by the Company as of September 30, 2022?","$12,927,095",simple,Product Disclosure Statement.pdf
Is the Supervisor responsible for guaranteeing the obligations of the Company under the Debenture Stock?,"No, the Supervisor does not guarantee the Company’s obligations under the Debenture Stock.",simple,Product Disclosure Statement.pdf
Is there a fee charged for early repayment of Debenture Stock?,"Yes, the Company may charge an investment break fee set by the Company from time to time (currently $150).",simple,Product Disclosure Statement.pdf
Who is the non-executive director of the Company who is also the Chairman of the Board of Directors?,Josh de Jong,simple,Product Disclosure Statement.pdf
"What is the amount of preferential liability that ranked ahead of the Debenture Stock as of September 30, 2022?","$45,546",simple,Product Disclosure Statement.pdf
What is the range of interest rates offered by the Company on its peer-to-peer lending platform?,"The interest rates offered by the Company on its peer-to-peer lending platform vary over 9 ""buckets"" of risk grades, ranging from 8.45% to 21.60% for unsecured loans and from 7.95% to 19.90% for secured loans.",simple,Product Disclosure Statement.pdf
How does the Company mitigate the risk associated with interest rate fluctuations?,"The Company has the option to cease lending on the Platform, raise interest rates offered on the Platform, or seek further retail and wholesale funding lines to fund a larger portion of the lower yielding loans originations.",simple,Product Disclosure Statement.pdf
"Considering the Company's practice of paying Fringe Benefit Tax for additional remuneration and the director's fee paid to Stephen Massey, how much will Stephen Massey receive as a director's fee, given that he is a proposed independent director stepping in as director for the Company on 01 April 2023, pending confirmation from all regulators?","$30,000 including GST",conditional,Product Disclosure Statement.pdf
"How does the transfer of ownership of an investment in Finance Direct Limited work, considering the role of related parties and the company's financial requirements?","The process for transferring ownership of an investment in Finance Direct Limited involves completing a Transfer form, which must be registered with the Company.",conditional,Product Disclosure Statement.pdf
"How does the company's peer-to-peer lending platform manage the risk of borrower default, given that it has a potentially greater credit risk compared to other non-bank deposit takers, and how does it mitigate the impact of interest rate fluctuations on its profitability?",The Company's peer-to-peer lending platform is reasonably unique in that it advances funds on equal terms with other retail and wholesale investors in that Platform.,conditional,Product Disclosure Statement.pdf
Under what circumstances can the company use the funds raised from the issue of Debenture Stock for purposes other than supporting its lending operations?,"No, the funds raised from the issue of Debenture Stock will be used to support the Company’s lending operations directly to clients of the Company and clients of its subsidiary company, Lending Crowd Limited.",conditional,Product Disclosure Statement.pdf
"Under what conditions, if any, can the company create prior security interests over its assets for borrowed or raised funds?","Yes, the Trust Deed permits the Company or any other Charging Group Member to create prior security interests over any asset to secure any moneys to be borrowed, raised, or otherwise owing in purchasing or acquiring such asset, subject to certain conditions.",conditional,Product Disclosure Statement.pdf
"What is the maximum amount of related party exposure allowed for the Company regarding soil nutrients and stability, considering the limitations and restrictions outlined in the Trust Deed, specifically Clause 5, and how does it impact the Company's creditworthiness?","According to the Trust Deed, the aggregated related party exposure must not exceed 15% of capital.",conditional,Product Disclosure Statement.pdf
"How does Finance Direct mitigate the risk of borrower default when investing in loans through the Platform, given the potential for real estate market deterioration, non-payment of amounts owing by borrowers, and the Company's reliance on third-party providers for technological infrastructure?",Finance Direct mitigates the risk of borrower default by lending over multiple loans (diversifying its exposure) and does not lend to any related party.,conditional,Product Disclosure Statement.pdf
"Considering the possibility of financial hardship or death, and the fact that the company does not intend to quote the Debenture Stock on a licensed market in New Zealand, how does the company's ability to permit early repayment of Debenture Stock before the maturity date affect the investor's ability to sell their Debenture Stock before the end of its term?","No, the Debenture Stock is not quoted on a licensed market in New Zealand and there is no other established market for trading them.",conditional,Product Disclosure Statement.pdf
"How does the company mitigate the risk of secured property being destroyed or disposed of illegally, considering the reliance on second-ranking security interests and loan rollovers?",The Company takes additional second-ranking security interests in some instances to mitigate the risk of secured property being destroyed or disposed of illegally.,conditional,Product Disclosure Statement.pdf
"Considering the Company's policy, how would the repayment process for Debenture Stock be affected if the Company decides to liquidate its assets before the Maturity Date?",Requests for early repayment of Debenture Stock must be made to the Company in writing.,conditional,Product Disclosure Statement.pdf
"What is the value of the company's total tangible assets as of September 30, 2022, that can be used to secure debenture stock, considering prior security interests and preferential liabilities?","$17,602,000",conditional,Product Disclosure Statement.pdf
"How does the company manage its risk of insolvency and ensure it can meet its financial obligations, given its high loan-to-value ratio and reliance on depreciating assets as security?","The Company ensures that it is able to meet its debts as they fall due by maintaining a capital ratio of not less than 10%, ensuring that the aggregated related party exposure does not exceed 15% of capital, and following stringent policies of monitoring loan performance.",conditional,Product Disclosure Statement.pdf
"Under what conditions can the company modify loan agreements during the loan facility, considering the roles of Lending Crowd Limited, Lending Crowd Trustee Limited, and Wayne Croad?","Yes, the Company's loan documentation allows for loans to be varied during the course of the loan facility agreement, including the ability to extend the repayment date of loans and roll over loans into new agreements.",conditional,Product Disclosure Statement.pdf
"How does the ranking of Debenture Stock work in the event of liquidation, considering the Company's prioritization of repayment to investors, preferential creditors, and the impact of early repayment fees?",The Debenture Stock being offered under this issue will rank equally with all existing and further Debenture Stock which may be issued pursuant to the Trust Deed.,conditional,Product Disclosure Statement.pdf
"Under what conditions can the company prepay its debenture stock before its maturity date, and how will the interest rate be adjusted?","Yes, the company may, at its absolute discretion, permit early repayment in the event of death or financial hardship. Requests for early repayment must be made to the company in writing.",conditional,Product Disclosure Statement.pdf
"What is the minimum capital ratio that the Company must maintain, given that it does not have a credit rating, according to the Trust Deed, while ensuring that the aggregated related party exposure does not exceed 15% of capital, and adhering to other financial limitations and restrictions?","According to the Trust Deed, the Company must maintain a capital ratio of not less than 10%.",conditional,Product Disclosure Statement.pdf
"How does a borrower's default affect the company's liquidity and profitability, considering the company's risk mitigation strategies, such as requiring guarantees, maintaining liquid funds, and managing loan repayment cycles?","If a borrower defaults on a loan, the Company may not be able to realise sufficient value from the sale of the assets pledged by the borrower as security for the loan.",conditional,Product Disclosure Statement.pdf
What is the risk associated with regulatory changes for a financial services company that invests in peer-to-peer lending and relies on a third-party software program?,Changes to law or regulation in the financial services market may affect the way the Platform is able to operate.,conditional,Product Disclosure Statement.pdf
"Considering the risk of borrowers defaulting on loans and the potential impact on the company's liquidity, how does the company balance its reliance on debenture stock with adequate risk mitigation measures?",The Company's reliance on debenture stock to raise funds creates a risk that it may encounter difficulty in raising funds at short notice to meet its lending and repayment commitments.,conditional,Product Disclosure Statement.pdf
"Given the information provided, the rewritten question could be:

What are the main factors that give rise to the risk of investing in debt securities, considering the company's reliance on recovering loans from borrowers, liquidity risks, interest rate risks, and exposure to adverse real estate market conditions?",The main factors that give rise to the risk of investing in debt securities are discussed in Section 6 of the PDS (Risks of Investing).,conditional,Product Disclosure Statement.pdf
"How does the company ensure the recovery of loans in full from borrowers, given the risk of insolvency and inadequate security?","The Company ensures that it is able to recover loans in full from borrowers by taking sufficient security to properly protect its position, monitoring loan performance, and following up with enforcement action if there is a breach of the terms of the loan documentation.",conditional,Product Disclosure Statement.pdf
"What is the risk associated with the Company's reliance on third-party providers for managing technological infrastructure, considering the Company's size and the fact that it does not have internal IT personnel?","The fact that the Company does not have its own internal IT personnel may result in a loss of information or delays in recovering loan payments or meeting obligations to Investors, increasing the risk of default on payment obligations under the Debenture Stock.",conditional,Product Disclosure Statement.pdf
"Considering the Company's lending sectors and risk management strategies, what is the total value of receivables owned by the Company as of September 30, 2022, and how does it break down between consumer and business loans?","The total value of receivables owned by the Company as of September 30, 2022, was $15,721,000.",conditional,Product Disclosure Statement.pdf
"What are the principal risks associated with investing in Debenture Stock, given the company's financial limitations and restrictions, creditworthiness, and loan recovery process?","The principal risks associated with investing in Debenture Stock include the risk that the Company becomes insolvent and is unable to meet its obligations under the Debenture Stock, and the risk that the value of the Company's assets falls and those assets are realized for less than the acquisition cost of those assets.",conditional,Product Disclosure Statement.pdf
"Considering the company pays Fringe Benefit Tax for additional remuneration, what is the name of the company that Kirstin Poole is the founder and sole partner of, given that Kirstin receives a director's fee of $18,000 plus GST in her role as a non-executive director?",kplegal Limited,conditional,Product Disclosure Statement.pdf
"How does the company mitigate operational and regulatory risks while maintaining compliance with various regulations, given its complex structure as a non-bank deposit taker and a subsidiary that operates a licensed peer-to-peer service?","The company has internal control procedures and risk management policies in place to mitigate these risks, and it also makes use of external specialists, including HLB Mann Judd for accounting matters and MinterEllisonRuddWatts for legal matters.",conditional,Product Disclosure Statement.pdf
"Considering the company's regulatory compliance and risk management procedures, what are the implications of the company's ""Approved Issuer"" status on its tax obligations and reputation?","Yes, the company has obtained ""Approved Issuer"" status and has registered the Debenture Stock as ""Registered Securities"" for the purpose of the approved issuer levy provisions in Part 6B of the Stamp and Cheques Duties Act 1971.",conditional,Product Disclosure Statement.pdf
"Considering the context of Finance Direct Limited's Product Disclosure Statement, what is the fee for early repayment of investment, and how does it relate to the interest rate and maturity date?","Yes, the Company may charge an investment break fee set by the Company from time to time (currently $150) for early repayment.",conditional,Product Disclosure Statement.pdf
"What is the minimum capital ratio required for Finance Direct Limited to avoid insolvency, and how does it relate to the company's ability to absorb unexpected losses?","The minimum requirement for the capital ratio for Finance Direct Limited is set out in the Deposit Takers (Credit Ratings, Capital Ratios, and Related Party Exposures) Regulations 2010 (Deposit Takers Regulations).",conditional,Product Disclosure Statement.pdf
"What are the tax consequences of investing in Debenture Stock, considering regulatory risks and compliance requirements?","Investing in Debenture Stock will have taxation consequences, and the effect of taxation will vary according to each investor's personal circumstances. There may be other tax consequences from acquiring or disposing of Debenture Stock that are not covered in the Product Disclosure Statement.",conditional,Product Disclosure Statement.pdf
"Considering the company pays Fringe Benefit Tax for additional remuneration, what is the name of the company that Stephen Massey operates as an independent Mortgage Adviser under, assuming Wayne Croad, a non-executive director, receives a finder's fee of $140,000?",Loan Market,conditional,Product Disclosure Statement.pdf
"What are the two primary risks associated with Finance Direct's lending practices, given that the company primarily lends against depreciating assets, has a higher loan-to-value ratio, and follows a rigorous loan application process?","The Company primarily lends against the security of motor vehicles, boats, and agreements to mortgage over real estate.",conditional,Product Disclosure Statement.pdf
"How does the company manage the risk of insufficient funds for its ongoing obligations, given its reliance on debenture stock and peer-to-peer lending platform, while maintaining profitability in the face of fluctuating interest rates and loan origination?","The Company actively monitors loan repayment cycles to ensure that the average actual term of its loans is shorter than the average term of its debenture borrowings, and it maintains sufficient liquid funds to meet its commitments based on forecast financial information.",conditional,Product Disclosure Statement.pdf
"How do tax rules for non-resident investors differ from those for residents, considering withholding tax rates, exemptions, and the impact of the Company's Approved Issuer status on non-resident investors?","Yes, there may be different tax rules relating to investors who are non-residents of New Zealand for tax purposes.",conditional,Product Disclosure Statement.pdf
How does the treatment of investment in the case of the death of a joint owner impact the company's financial requirements and ratios?,"Joint investment owners will be treated as joint tenants, meaning that on the death of one of them, ownership of the investment will vest automatically with the survivor(s).",conditional,Product Disclosure Statement.pdf
"Considering the Company's reliance on the Platform for funding, what risks are associated with the Company's inability to recover loans in full from borrowers, and how may this impact the Company's ability to meet its payment obligations under the Debenture Stock?","The risk associated with the Company's reliance on the Platform for funding is that the Company may encounter difficulty in raising funds at short notice to meet its lending and repayment commitments, as described in Section 6 of the PDS (Risks of Investing).",conditional,Product Disclosure Statement.pdf
"Considering the Company's financial requirements, what is the nature of the relationship between Finance Direct Limited and Lending Crowd Limited?","There is currently no fee payable in respect of the transfer of an investment to another person, but the Company reserves the right to charge a fee in the future.",conditional,Product Disclosure Statement.pdf
"Considering the Company's lending practices and risk management strategies, what percentage of the total receivables owned by the Company as of September 30, 2022, is exposed to the consumer and business loan sectors?","As of September 30, 2022, the Company's exposure to the lending sectors was 54% consumer loans and 46% business loans.",conditional,Product Disclosure Statement.pdf
"How does the company protect itself against operational, technological, and regulatory risks in its lending and investment activities?","The Company's highly automated nature of the Platform may make it an attractive target and potentially vulnerable to computer viruses, physical or electronic break-ins, and similar disruptions.",conditional,Product Disclosure Statement.pdf
Debenture Stock offer timeline?,"The offer opened on 22 September 2016 and there is no closing date, as it is a continuous offer.",compress,Product Disclosure Statement.pdf
Where does Debenture Stock stand in repayment?,The Debenture Stock ranks for repayment as described in Section 4 of the PDS (Key features of the Debenture Stock).,compress,Product Disclosure Statement.pdf
What's the name of the trust deed that applies to the Debenture Stock?,The Trust Deed,compress,Product Disclosure Statement.pdf
What's the point of the Trust Deed from the Company to the Supervisor?,The Trust Deed secures the obligations of the Company to Investors in respect of the Debenture Stock and provides a security interest in all of the Company’s Personal Property and a charge over the Company’s Other Property.,compress,Product Disclosure Statement.pdf
