question,answer,tokens_present,document
What is the deadline for filing Form 1040 or 1040-SR for the 2023 tax year?,"The deadline for filing Form 1040 or 1040-SR for the 2023 tax year is April 15, 2024.","['April 15, 2024']",IRS_Document_2
What is the Taxpayer Advocate Service (TAS)?,The Taxpayer Advocate Service (TAS) is an independent organization within the Internal Revenue Service (IRS) that helps taxpayers and protects taxpayer rights. TAS strives to ensure that every taxpayer is treated fairly and that you know and understand your rights under the Taxpayer Bill of Rights.,"['Taxpayer Advocate Service', 'TAS', 'Internal Revenue Service', 'IRS', 'taxpayer rights', 'Taxpayer Bill of Rights']",IRS_Document_2
What are Low Income Taxpayer Clinics (LITCs)?,"LITCs are independent from the Internal Revenue Service (IRS) and the Taxpayer Advocate Service (TAS). LITCs represent individuals whose income is below a certain level and who need to resolve tax problems with the IRS. LITCs can represent taxpayers in audits, appeals, and tax collection disputes before the IRS and in court.","['LITCs', 'IRS', 'TAS', 'taxpayers', 'income', 'audits', 'appeals', 'tax collection disputes', 'court']",IRS_Document_2
How do I reconcile advance payments of the premium tax credit with my premium tax credit for the year?,You will need to complete Form 8962 to reconcile advance payments of the premium tax credit with your premium tax credit for the year.,['You will need to complete Form 8962 to reconcile advance payments of the premium tax credit with your premium tax credit for the year.'],IRS_Document_2
What is the purpose of Form 1095-A?,Form 1095-A is used to report information about advance payments of the premium tax credit made to your insurance company to reduce your monthly premium payment.,"['Form 1095-A', 'premium tax credit', 'insurance company', 'monthly premium payment']",IRS_Document_2
How do I report the credit for previously owned clean vehicles on my tax return?,"The credit for previously owned clean vehicles is reported on Form 8936 and Schedule 3, line 6f.","['The credit for previously owned clean vehicles is reported on Form 8936 and Schedule 3, line 6f.']",IRS_Document_2
How do I report accrued leave payment on my tax return?,Accrued leave payment received as a lump sum is considered a salary payment and should be included in your income in the tax year you receive it.,"['salary payment', 'tax year']",IRS_Document_2
How do I report capital gain distributions on my tax return?,"Capital gain distributions are reported on line 7 of Form 1040 and are checked on that line. If you received capital gain distributions as a nominee, you should report only the amount that belongs to you.","['Capital gain distributions', 'Form 1040', 'line 7']",IRS_Document_2
What is the purpose of the Standard Deduction Worksheet for Dependents?,The Standard Deduction Worksheet for Dependents is used to figure the standard deduction for dependents who are filing a tax return. It takes into account the dependent's income and the amount that can be claimed as a deduction by the person who can claim the dependent.,"['dependent', 'deduction', 'income', 'claim', 'person']",IRS_Document_2
Do I have to file a tax return if I don't have to pay taxes?,"Yes, you should still file a tax return even if you don't have to pay taxes. You may be eligible for credits such as the Earned Income Tax Credit, Additional Child Tax Credit, or Premium Tax Credit, which you can only receive if you file a tax return.",['Yes'],IRS_Document_2
How do I know if I'm eligible for free tax software?,"The IRS's Free File program offers free tax software to those who earned $79,000 or less in 2023. You can visit IRS.gov/FreeFile to see all the eligibility criteria for free usage or use an online tool to find which free software products match your situation.","['$79,000', '2023', 'IRS.gov/FreeFile']",IRS_Document_2
Can I file my taxes electronically for free?,"Yes, you can file your taxes electronically for free through the IRS's Free File program or Free File Fillable Forms. Free File Fillable Forms is best for people experienced in preparing their own tax returns and supports only federal tax forms.",['Yes'],IRS_Document_2
Can I include my child's income on my tax return?,"If certain conditions apply, you can elect to include on your return the income of a child who was under age 19 at the end of 2023 or was a full-time student under age 24 at the end of 2023. To do so, use Form 8814.","['under age 19', 'full-time student', 'under age 24', 'Form 8814']",IRS_Document_2
Can I get an extension of time to file my tax return?,"Yes, you can get an automatic 6-month extension of time to file your tax return by filing Form 4868. This extension gives you an extra 2 months to file and pay the tax, but interest will be charged on any unpaid tax.",['Yes'],IRS_Document_2
Who qualifies for an automatic extension of time to file without filing Form 4868?,"U.S. citizens or resident aliens who live outside the United States and Puerto Rico and have their main place of business or post of duty outside the United States and Puerto Rico, or those who are in military or naval service on duty outside the United States and Puerto Rico, qualify for an automatic extension of time to file without filing Form 4868.","['U.S. citizens', 'resident aliens', 'live outside the United States and Puerto Rico', 'main place of business or post of duty', 'military or naval service', 'duty outside the United States and Puerto Rico']",IRS_Document_2
Can I use a private delivery service to mail my tax return?,"Yes, you can use certain private delivery services designated by the IRS to meet the “time-ly mailing treated as timely filing/paying” rule for tax returns and payments.",['Yes'],IRS_Document_2
Can I use a private delivery service to file my tax return?,"Yes, you can use certain private delivery services designated by the IRS to file your tax return.",['Yes'],IRS_Document_2
"Do I need to file a tax return if I am 65 or older and my gross income was less than $27,700?","No, you do not need to file a tax return if you are 65 or older and your gross income was less than $27,700.",['No'],IRS_Document_2
What is the maximum amount of unearned income that a single dependent can have and still be required to file a tax return?,"The maximum amount of unearned income that a single dependent can have and still be required to file a tax return is $1,250.","['$1,250']",IRS_Document_2
What is the minimum amount of earned income that requires filing a tax return in 2023?,"The minimum amount of earned income that requires filing a tax return in 2023 is $13,850.","['$13,850']",IRS_Document_2
"Must I file a tax return if I received health savings account, Archer MSA, or Medicare Advantage MSA distributions in 2023?","Yes, you must file a tax return if you received health savings account, Archer MSA, or Medicare Advantage MSA distributions in 2023.",['Yes'],IRS_Document_2
Must I file a tax return if I received wages from a church or qualified church-controlled organization that is exempt from employer social security and Medicare taxes?,"Yes, you must file a tax return if you received wages from a church or qualified church-controlled organization that is exempt from employer social security and Medicare taxes and the wages were $108.28 or more.",['Yes'],IRS_Document_2
How do I report estimated tax payments made in 2023 on Form 1040?,Estimated tax payments made in 2023 should be reported on Line 26 of Form 1040.,"['Estimated', 'tax', 'payments', 'made', 'in', '2023', 'should', 'be', 'reported', 'on', 'Line', '26', 'of', 'Form', '1040']",IRS_Document_2
How can I get a social security number (SSN)?,"You can get an SSN by applying for one at your local SSA office, by calling the SSA at 800-772-1213, or by downloading and mailing in Form SS-5. It usually takes 2 weeks to receive your SSN once the SSA has all the necessary information.","['SSN', 'apply', 'local SSA office', 'calling', 'SSA', 'downloading', 'mailing', 'Form SS-5', '2 weeks']",IRS_Document_2
Can I use an Individual Taxpayer Identification Number (ITIN) instead of an SSN?,"If you are a nonresident or resident alien and you don't have and aren't eligible to get an SSN, you must apply for an ITIN. You can use your ITIN wherever your SSN is requested on your tax return. Some ITINs must be renewed.","['If', 'you', 'are', 'a', 'nonresident', 'or', 'resident', 'alien', 'and', 'you', ""don't"", 'have', 'and', ""aren't"", 'eligible', 'to', 'get', 'an', 'SSN', 'you', 'must', 'apply', 'for', 'an', 'ITIN', '.', 'You', 'can', 'use', 'your', 'ITIN', 'wherever', 'your', 'SSN', 'is', 'requested', 'on', 'your', 'tax', 'return', '.', 'Some', 'ITINs', 'must', 'be', 'renewed']",IRS_Document_2
Can I use my ITIN to work in the United States?,"No, an ITIN does not entitle you to work in the United States or change your immigration status. It is only for tax purposes.",['No'],IRS_Document_2
What is the deadline for renewing my ITIN?,"The deadline for renewing your ITIN is January 31, 2024. If you haven't used your ITIN on a federal tax return at least once for tax years 2020, 2021, or 2022, it will expire on January 31, 2024, and must be renewed if you need to file a federal tax return.","['January 31, 2024']",IRS_Document_2
What are the different filing statuses available for taxpayers?,"The different filing statuses available for taxpayers are Single, Married Filing Jointly, Married Filing Separately, Head of Household, and Qualifying Surviving Spouse.","['Single', 'Married Filing Jointly', 'Married Filing Separately', 'Head of Household', 'Qualifying Surviving Spouse']",IRS_Document_2
Why might a couple want to file separately?,"A couple might want to file separately if they believe their spouse isn't reporting all of their income, or they don't want to be responsible for any taxes due if their spouse doesn't have enough tax withheld or doesn't pay enough estimated tax.","['they', 'their', 'spouse', 'income', 'tax', 'withheld', 'estimated']",IRS_Document_2
Can a nonresident alien or dual-status alien file a joint return with their spouse?,"Generally, a nonresident alien or dual-status alien can't file a joint return with their spouse. However, if you were a nonresident alien or a dual-status alien and were married to a U.S. citizen or resident alien at the end of 2023, you can elect to be treated as a resident alien and file a joint return.","['Generally', 'nonresident alien', 'dual-status alien', ""can't file"", 'joint return', 'U.S. citizen', 'resident alien', 'elect to be treated', 'file a joint return']",IRS_Document_2
Can I file a joint return if my spouse doesn't have an SSN or ITIN?,"If your spouse doesn't have an SSN or ITIN, you can still file a joint return. Enter ""NRA"" in the entry space below the filing status checkboxes for your spouse's SSN or ITIN.",['NRA'],IRS_Document_2