question,answer,tokens_present,document
What is the role of the public in financial management and record-keeping?,"The public has an interest in ensuring that public money is accounted for and spent wisely. Citizens rarely have direct access to public sector financial records except in the form of published government accounts, which are seldom read by the general public. However, citizens are kept informed about government financial management through the press and national political debate.","['public', 'money', 'accounted', 'spent', 'wisely', 'citizens', 'government', 'financial', 'management', 'press', 'political', 'debate']",Financial_Records_Management.pdf
What is the role of international and bilateral aid agencies in financial management and record-keeping?,"Although international and bilateral aid agencies are not part of the formal constitutional arrangements for public sector financial management, they are de facto stakeholders in many developing countries. They provide funding in the form of grants or loans for a large proportion of public sector projects in many countries, and the recipient country is expected to follow their rules for financial reporting on the projects they fund.","['international', 'bilateral', 'aid', 'agencies', 'financial', 'management', 'record-keeping']",Financial_Records_Management.pdf
What is the purpose of the conceptual framework for the budget function?,"The purpose of the conceptual framework for the budget function is to illustrate the relationship between some of the key stakeholders involved in financial management and record-keeping, and to show how they interact with each other.","['illustrate', 'relationship', 'stakeholders', 'financial', 'management', 'record-keeping', 'interact']",Financial_Records_Management.pdf
What is the significance of the delegation of authority in financial management and record-keeping?,The delegation of authority is significant in financial management and record-keeping because it allows for the efficient management of financial resources and ensures that there are checks and balances in place to provide control.,"['delegation', 'authority', 'financial', 'management', 'record-keeping', 'efficient', 'checks', 'balances', 'control']",Financial_Records_Management.pdf
What is the role of the cabinet in financial management and record-keeping?,"The cabinet is responsible for overseeing the financial management and record-keeping of the government, and ensuring that the financial plan or budget is implemented in accordance with the laws, rules, and regulations of the country.","['The', 'cabinet', 'is', 'responsible', 'for', 'overseeing', 'financial', 'management', 'and', 'record-keeping', 'of', 'the', 'government', 'and', 'ensuring', 'that', 'the', 'financial', 'plan', 'or', 'budget', 'is', 'implemented', 'in', 'accordance', 'with', 'the', 'laws', 'rules', 'and', 'regulations', 'of', 'the', 'country']",Financial_Records_Management.pdf
What is the role of the civil service in financial management and record-keeping?,"The civil service is responsible for implementing the financial plan or budget, and for ensuring that financial resources are used efficiently and effectively.","['responsible', 'financial', 'plan', 'budget', 'resources', 'efficiently', 'effectively']",Financial_Records_Management.pdf
What is the role of separate departments in financial management and record-keeping?,"Separate departments within the government are responsible for managing their own financial resources and ensuring that they are used in accordance with the laws, rules, and regulations of the country.","['separate', 'departments', 'financial', 'resources', 'laws', 'rules', 'regulations', 'country']",Financial_Records_Management.pdf
What is the purpose of financial reporting in financial management and record-keeping?,"Financial reporting is used to provide information on the financial performance and position of the government, and to ensure that the government is accountable for the management of financial affairs and the use of financial resources. Financial reporting includes the annual budget, the fiscal policy statement, budget estimates and projections, and Public Accounts Committee reports.","['financial reporting', 'financial performance', 'financial position', 'government', 'accountable', 'management', 'financial affairs', 'use', 'financial resources', 'annual budget', 'fiscal policy statement', 'budget estimates', 'projections', 'Public Accounts Committee reports']",Financial_Records_Management.pdf
What are the different financial reporting rules that recipient countries must follow when receiving funding from international organizations?,"The text states that each international organization has its own rules for financial reporting on the projects it funds, and the recipient country will be expected to follow these rules.","['The', 'text', 'states', 'that', 'each', 'international', 'organization', 'has', 'its', 'own', 'rules', 'for', 'financial', 'reporting', 'on', 'the', 'projects', 'it', 'funds', 'and', 'the', 'recipient', 'country', 'will', 'be', 'expected', 'to', 'follow', 'these', 'rules']",Financial_Records_Management.pdf
How are the financial records generated by the projects funded by international organizations kept?,"The text states that the records this generates are often kept separately from the government’s other financial records, and their treatment may not be consistent with the government’s financial instructions.","['kept', 'separately', 'government', 'financial', 'records', 'instructions']",Financial_Records_Management.pdf
What is the result of the fragmented financial management system caused by the separate keeping of financial records?,"The text states that this can fragment the financial management system, with information in several locations.","['fragmented', 'financial', 'management', 'system', 'separate', 'keeping', 'information', 'locations']",Financial_Records_Management.pdf
What is the role of the central bank in the financial system of a country?,"The text states that the central bank is responsible for maintaining the country’s monetary policy, issuing bank notes, regulating and supporting the country’s principal systems for clearing and settling payments, and acting as fiscal agent for federal government debt.","['maintaining', 'issuing', 'regulating', 'supporting', 'acting']",Financial_Records_Management.pdf
What is the significance of the records of the central bank?,The text states that the records of the central bank are highly sensitive and are often managed entirely separately from other public sector financial records.,"['highly sensitive', 'managed', 'separately']",Financial_Records_Management.pdf
What is the role of the ministry or department in charge of finance and economic planning in a country?,The text states that the ministry or department in charge of finance and economic planning plays a major role in translating the political objectives of the government into financial policies and workable instructions to departments and budgetary units.,"['financial', 'policies', 'departments', 'budgetary', 'units']",Financial_Records_Management.pdf
What is the responsibility of the finance ministry’s treasury function?,The text states that the finance ministry’s treasury function comprises two activities: setting policy and physically handling funds.,"['setting', 'policy', 'physically', 'handling', 'funds']",Financial_Records_Management.pdf
What is the role of the Accountant General in a country’s financial system?,"The text states that the Accountant General, as the government’s principal accounting officer and adviser on accounting policy, is responsible for regulating the receipt and disbursement of funds, overseeing accounting policies and procedures, and introducing changes as appropriate.","['Accountant General', 'government', 'principal', 'adviser', 'accounting', 'policy', 'regulating', 'receipt', 'disbursement', 'funds', 'overseeing', 'procedures', 'introducing', 'changes']",Financial_Records_Management.pdf
What is the role of the Supreme Audit Institution in a country’s financial system?,"The text states that the Supreme Audit Institution, such as the Auditor General’s department or a National Audit Office, is responsible for auditing the financial statements of the government.","['Supreme Audit Institution', 'Auditor General', 'National Audit Office', 'financial statements', 'government']",Financial_Records_Management.pdf
How does the payment of civil servants work in a centralized accounting system?,"The text states that there will be a separate payroll unit to handle the payment of civil servants, which is often computerized.","['separate payroll unit', 'computerized']",Financial_Records_Management.pdf