question,answer,tokens_present,document
What is the name of the organization that produced the training program for managing public sector records?,The International Records Management Trust produced the training program for managing public sector records.,['International Records Management Trust'],Financial_Records_Management.pdf
Who is the General Editor of the training program?,Michael Roper is the General Editor of the training program.,['Michael Roper'],Financial_Records_Management.pdf
Who is the Managing Editor of the training program?,Laura Millar is the Managing Editor of the training program.,['Laura Millar'],Financial_Records_Management.pdf
What is the name of the book written by Laura Millar that focuses on archival management?,"Laura Millar wrote a book called ""A Handbook for Records Management and College Archives in British Columbia"" that focuses on archival management.",['A Handbook for Records Management and College Archives in British Columbia'],Financial_Records_Management.pdf
What is the name of the organization that Anne Thurston founded to support the development of records management?,Anne Thurston founded the International Records Management Trust to support the development of records management.,['International Records Management Trust'],Financial_Records_Management.pdf
What was the title of the study led by Anne Thurston that surveyed record-keeping systems in the Commonwealth?,"The study led by Anne Thurston that surveyed record-keeping systems in the Commonwealth was called ""Managing Public Sector Records: A Study Programme"".",['Managing Public Sector Records: A Study Programme'],Financial_Records_Management.pdf
Who is the Project Director of the MPSR Project?,Anne Thurston is the Project Director of the MPSR Project.,['Anne Thurston'],Financial_Records_Management.pdf
What is the name of the course developed by Michael Roper that focuses on records and archives management?,"Michael Roper developed a course called ""Records and Archives Management (International)"" that focuses on records and archives management.","['Records', 'Archives', 'Management', 'International']",Financial_Records_Management.pdf
What is the name of the association that Michael Roper served as Secretary General for?,Michael Roper served as Secretary General for the International Council on Archives.,['International Council on Archives'],Financial_Records_Management.pdf
What is the name of the university where Laura Millar received her PhD in archival studies?,Laura Millar received her PhD in archival studies from the University of London.,['University of London'],Financial_Records_Management.pdf
"Who is the author of the book ""A Manual for Small Archives""?","The author of the book ""A Manual for Small Archives"" is Piers Cain.",['Piers Cain'],Financial_Records_Management.pdf
"What is the name of the organization that Piers Cain is the Director of Research, Development and Education for?","Piers Cain is the Director of Research, Development and Education for the International Records Management Trust.",['International Records Management Trust'],Financial_Records_Management.pdf
What is the name of the consultancy company that Don Brech established in 1994?,Don Brech established Records Management International Limited in 1994.,['Records Management International Limited'],Financial_Records_Management.pdf
Who is the Principal Consultant of Records Management International Limited?,Don Brech is the Principal Consultant of Records Management International Limited.,['Don Brech'],Financial_Records_Management.pdf
What is the name of the book that Don Brech co-authored with Piers Cain?,"Don Brech co-authored the book ""Managing Financial Records"" with Piers Cain.",,Financial_Records_Management.pdf
Who is the Director of the International Records Management Trust?,Piers Cain is the Director of the International Records Management Trust.,['Piers Cain'],Financial_Records_Management.pdf
What is the name of the university where Don Brech held a foundation appointment?,"Don Brech held a foundation appointment at the Riverina College of Advanced Education, Wagga Wagga.","['Riverina College of Advanced Education', 'Wagga Wagga']",Financial_Records_Management.pdf
"What is the name of the organization that Don Brech worked with on the development of records strategies, the design and implementation of records systems and records training programs?","Don Brech worked with clients in Africa, Asia and Europe on the development of records strategies, the design and implementation of records systems and records training programs.","['Africa', 'Asia', 'Europe']",Financial_Records_Management.pdf
"Who is the author of the book ""Archival Gold: Managing and Preserving Publishers’ Records""?","The author of the book ""Archival Gold: Managing and Preserving Publishers’ Records"" is Piers Cain.",['Piers Cain'],Financial_Records_Management.pdf
What is the name of the Project Steering Group that Piers Cain and Don Brech were a part of?,Piers Cain and Don Brech were members of the Project Steering Group for the International Records Management Trust.,"['Project Steering Group', 'International Records Management Trust']",Financial_Records_Management.pdf
Who was appointed as the first Government Records Service Director in the Hong Kong Government in 1989?,The first Government Records Service Director in the Hong Kong Government was appointed in 1989.,"['The', 'first', 'Government', 'Records', 'Service', 'Director', 'in', 'the', 'Hong', 'Kong', 'Government', 'was', 'appointed', 'in', '1989']",Financial_Records_Management.pdf
What is the purpose of the Managing Financial Records module?,"The purpose of the Managing Financial Records module is to provide a management framework for the control of financial records as a vital resource for public sector financial management, economic policy development, and planning.","['provide', 'control', 'financial', 'records', 'public', 'sector', 'financial', 'management', 'economic', 'policy', 'development', 'planning']",Financial_Records_Management.pdf
What is the focus of the Managing Financial Records module?,"The Managing Financial Records module focuses primarily on the management of financial records in the public sector, with a particular emphasis on records created by central government agencies.","['financial records', 'public sector', 'central government agencies']",Financial_Records_Management.pdf
Why is it important for records managers to be involved in managing financial records?,It is important for records managers to be involved in managing financial records because they have the skills and knowledge to ensure that financial records are properly kept and preserved.,"['because', 'they', 'have', 'the', 'skills', 'and', 'knowledge', 'to', 'ensure', 'that', 'financial', 'records', 'are', 'properly', 'kept', 'and', 'preserved']",Financial_Records_Management.pdf
What are the main functions and processes of financial management?,"The main functions and processes of financial management include the financial accountability cycle, budgeting, financial reporting, and financial management systems.","['financial accountability cycle', 'budgeting', 'financial reporting', 'financial management systems']",Financial_Records_Management.pdf
What is the importance of record keeping for financial management?,"Record keeping is essential for financial management because it allows for the accurate tracking and reporting of financial transactions, ensures compliance with laws and regulations, and supports decision-making.","['essential', 'financial', 'management', 'tracking', 'reporting', 'transactions', 'compliance', 'laws', 'regulations', 'supports', 'decision-making']",Financial_Records_Management.pdf
What is the role of stakeholders in financial management?,Stakeholders play a crucial role in financial management as they are the individuals or organizations that are impacted by financial decisions and outcomes.,"['stakeholders', 'financial', 'management', 'decisions', 'outcomes']",Financial_Records_Management.pdf
What is the relationship between financial management and accountability?,"Financial management and accountability are closely linked, as financial management is responsible for ensuring that financial resources are used efficiently and effectively, while accountability ensures that financial decisions and actions are transparent and subject to oversight.","['financial management', 'accountability', 'transparent', 'oversight']",Financial_Records_Management.pdf
What is the purpose of an Accounting Records Retention Schedule?,"The purpose of an Accounting Records Retention Schedule is to ensure that financial records are kept for the appropriate length of time, allowing for the efficient and effective management of financial resources.","['financial records', 'retention schedule', 'management', 'resources']",Financial_Records_Management.pdf
What is the difference between a financial management system and an accounting system?,"A financial management system is a broader system that encompasses all aspects of financial management, including budgeting, financial reporting, and accounting. An accounting system, on the other hand, is a subsystem of financial management that focuses specifically on the recording, classification, and reporting of financial transactions.","['financial management system', 'accounting system', 'broader', 'subsystem', 'budgeting', 'financial reporting', 'recording', 'classification', 'reporting']",Financial_Records_Management.pdf
What is the purpose of the module discussed in the text?,The purpose of the module is to help records managers understand the functions and tasks involved in managing financial records.,"['help', 'records', 'manage', 'financial', 'records']",Financial_Records_Management.pdf
Why is it important for records managers to understand financial management?,"It is important for records managers to understand financial management because financial systems are complex and there is no easy way for records managers to obtain the necessary information. Additionally, financial management and records management operate in a dynamic and changing environment, and records managers need to be able to speak the language of accountants and auditors to make an effective contribution.","['financial management', 'records managers', 'accountants', 'auditors']",Financial_Records_Management.pdf
What are the two reasons for including a high level of financial information in the module?,"The two reasons for including a high level of financial information in the module are: 1) to equip records managers to analyze the various components of financial systems and apply records management principles, and 2) to provide records managers with the necessary information to make an effective contribution in a field where there is no easy way to obtain it.","['equip', 'analyze', 'apply', 'provide', 'effective', 'contribution']",Financial_Records_Management.pdf
What is the definition of financial management?,"Financial management is the planning, controlling, implementation, and monitoring of fiscal policies and activities, including the accounting and audit of revenue, expenditure, assets, and liabilities.","['planning', 'controlling', 'implementation', 'monitoring', 'fiscal', 'policies', 'activities', 'accounting', 'audit', 'revenue', 'expenditure', 'assets', 'liabilities']",Financial_Records_Management.pdf
What is the definition of records management?,"Records management is that area of general administrative management concerned with achieving economy and efficiency in the creation, maintenance, use, and disposal of the records of an organization throughout their entire life cycle and in making the information they contain available in support of the business of that organization.","['records management', 'organization', 'economy', 'efficiency', 'creation', 'maintenance', 'use', 'disposal', 'life cycle', 'information', 'business']",Financial_Records_Management.pdf
What is the importance of record keeping for financial management?,"Good record keeping is essential for efficient and effective financial management. It allows for the accurate tracking of financial transactions, the monitoring of financial performance, and the ability to make informed decisions.","['Good', 'record', 'keeping', 'essential', 'efficient', 'effective', 'financial', 'management', 'accurate', 'tracking', 'financial', 'transactions', 'monitoring', 'performance', 'informed', 'decisions']",Financial_Records_Management.pdf
Who are stakeholders in financial records management?,"Stakeholders in financial records management include anyone who has an interest in the financial records of an organization, such as shareholders, management, employees, customers, suppliers, regulatory agencies, and auditors.","['shareholders', 'management', 'employees', 'customers', 'suppliers', 'regulatory agencies', 'auditors']",Financial_Records_Management.pdf
What are the business functions and processes of financial management?,"The business functions and processes of financial management include financial planning, financial control, financial reporting, and financial decision-making.","['financial planning', 'financial control', 'financial reporting', 'financial decision-making']",Financial_Records_Management.pdf
How should financial records be managed in a mixed paper/electronic environment?,"Financial records in a mixed paper/electronic environment should be managed using a combination of physical and electronic storage methods, with appropriate security measures in place to protect sensitive information.","['physical', 'electronic', 'storage', 'methods', 'security', 'measures', 'protect', 'sensitive', 'information']",Financial_Records_Management.pdf
What are integrated financial management systems?,"Integrated financial management systems are computer-based systems that integrate all aspects of financial management, including financial planning, financial control, financial reporting, and financial decision-making.","['financial planning', 'financial control', 'financial reporting', 'financial decision-making']",Financial_Records_Management.pdf
What is the purpose of the module described in the text?,The purpose of the module is to introduce the concepts involved with integrated financial management systems and to explain where to go for more information.,"['introduce', 'concepts', 'involved', 'integrated', 'financial', 'management', 'systems', 'explain', 'where', 'go', 'information']",Financial_Records_Management.pdf
What are the seven lessons in the module?,"The seven lessons in the module are:

1. The Importance of Record Keeping for Efficient and Effective Financial Management
2. Appreciating the Role and Importance of Stakeholders in Financial Records Management
3. Understanding the Business Functions and Processes of Financial Management
4. Understanding the Information Systems and Records Created by Financial Management
5. Managing Financial Records in a Mixed Paper/Electronic Records Environment
6. Understanding the Basic Concepts Involved with Integrated Financial Management Systems
7. Knowing Where to Go for More Information",,Financial_Records_Management.pdf
How many hours are recommended for each lesson in the module?,"The recommended hours for each lesson in the module are:

1. Lesson 1: 10 hours
2. Lesson 2: 10 hours
3. Lesson 3: 12 hours
4. Lesson 4: 20 hours
5. Lesson 5: 20 hours
6. Lesson 6: 15 hours
7. Lesson 7: 8 hours",,Financial_Records_Management.pdf
What is the importance of record keeping in financial management?,"Record keeping is essential in financial management as it helps in planning, controlling, implementing, and monitoring fiscal policies and activities, including accounting and auditing revenue, expenditure, assets, and liabilities.","['record', 'keeping', 'financial', 'management']",Financial_Records_Management.pdf
What is the role of stakeholders in financial records management?,"Stakeholders play a crucial role in financial records management as they are responsible for the creation, maintenance, and preservation of financial records.","['stakeholders', 'financial', 'records', 'management']",Financial_Records_Management.pdf
What are the business functions and processes of financial management?,"Financial management involves various business functions and processes, including accounting and auditing, revenue, expenditure, assets, and liabilities.","['accounting', 'auditing', 'revenue', 'expenditure', 'assets', 'liabilities']",Financial_Records_Management.pdf
What is the purpose of the glossary of specific financial terms included in the module?,The purpose of the glossary of specific financial terms is to provide a comprehensive list of financial terms and their meanings to help students understand the concepts presented in the module.,"['glossary', 'financial', 'terms', 'meanings', 'students', 'module']",Financial_Records_Management.pdf
What is the importance of integrated financial management systems?,Integrated financial management systems are crucial in modern organizations as they help in managing financial records in a mixed paper/electronic records environment.,"['crucial', 'modern', 'organizations', 'managing', 'financial', 'records', 'mixed', 'paper', 'electronic', 'environment']",Financial_Records_Management.pdf
What are the self-study questions designed to do?,The self-study questions are designed to help students review the material in this module and understand the concepts presented.,"['help', 'students', 'review', 'material', 'module', 'understand', 'concepts']",Financial_Records_Management.pdf
What is the case study provided in the module?,"The case study provided in the module is ""Pino Akotia, Ghana, ‘Management of Financial Records: The Ghana Case Study’"".","['Pino Akotia', 'Ghana', 'Management', 'Financial', 'Records', 'Ghana', 'Case', 'Study']",Financial_Records_Management.pdf
What is the main focus of financial management in the public sector?,"The main focus of financial management in the public sector is to ensure that resources are matched to objectives, efficiency is improved, and economic stability is maintained.","['resources', 'objectives', 'efficiency', 'economic stability']",Financial_Records_Management.pdf
What is the relationship between financial management and records management?,"Financial management and records management are closely intertwined, as financial records are produced in every area of financial management, and effective records management is critical to ensuring the integrity and accuracy of financial information.","['financial management', 'records management', 'integrity', 'accuracy', 'financial information']",Financial_Records_Management.pdf
What is the purpose of financial accountability in government?,"Financial accountability in government is critical to ensuring that the government is transparent and accountable to its citizens. It involves managing financial records, controlling expenditure, and ensuring that resources are used efficiently and effectively.","['transparent', 'accountable', 'efficiently', 'effectively']",Financial_Records_Management.pdf
What is the role of the National Audit Office in ensuring financial accountability in government?,"The National Audit Office (NAO) plays a crucial role in ensuring financial accountability in government by carrying out 'value for money' audits, which examine whether the government is getting an economic, efficient, and effective service from the resources it spends.","['National Audit Office', 'value for money', 'audits', 'government', 'resources', 'spends']",Financial_Records_Management.pdf
What is the importance of senior management support in financial records management?,"Senior management support is essential in financial records management, as it ensures that records managers have the necessary resources and support to effectively manage financial records and ensure their integrity and accuracy.","['Senior', 'management', 'support', 'financial', 'records', 'integrity', 'accuracy']",Financial_Records_Management.pdf
How can governments improve their capacity to manage the economy?,"Governments can improve their capacity to manage the economy by introducing reforms of the treasury, budget preparation and approval procedures, tax administration, accounting and audit mechanisms, central bank operations, and the preparation of official statistics.","['introducing', 'reforms', 'treasury', 'budget', 'preparation', 'approval', 'procedures', 'tax', 'administration', 'accounting', 'audit', 'mechanisms', 'central', 'bank', 'operations', 'official', 'statistics']",Financial_Records_Management.pdf
What is the impact of public sector borrowing and expenditure on the stability of the overall economy?,"Public sector borrowing and expenditure can have a significant impact on the stability of the overall economy, and governments must carefully manage their fiscal policies, interest rates, and regulatory environment to ensure economic stability.","['public sector', 'borrowing', 'expenditure', 'economic stability']",Financial_Records_Management.pdf
What is the role of financial management in ensuring efficiency in government?,"Financial management plays a crucial role in ensuring efficiency in government by controlling expenditure, improving financial analysis, and ensuring that resources are used effectively and efficiently.","['financial management', 'ensuring efficiency', 'government', 'resources', 'expenditure', 'financial analysis']",Financial_Records_Management.pdf
How have private sector financial management techniques been imported into the public sector?,"Private sector financial management techniques have been imported into the public sector through the use of 'value for money' audits, financial analysis, and performance measurement, which aim to improve efficiency and ensure that resources are used effectively.","['private sector', 'financial management', 'public sector', 'value for money', 'financial analysis', 'performance measurement']",Financial_Records_Management.pdf
"What are the weaknesses in financial accountability that are generally linked to weaknesses in public accounting, expenditure control, cash management, auditing, and financial records management?","Weaknesses in financial accountability are generally linked to weaknesses in public accounting, expenditure control, cash management, auditing, and financial records management, which can result in inefficient use of resources, waste, and corruption.","['weaknesses', 'public accounting', 'expenditure control', 'cash management', 'auditing', 'financial records management']",Financial_Records_Management.pdf
What is the relationship between government and financial management?,"Government itself is a major component of a nation's economy, and public sector borrowing and expenditure have an impact on the stability of the overall economy.","['government', 'economy', 'borrowing', 'expenditure', 'stability']",Financial_Records_Management.pdf
How can governments improve their capacity to manage the economy?,"Governments can improve their capacity to manage the economy by introducing reforms of the treasury, budget preparation and approval procedures, tax administration, accounting and audit mechanisms, central bank operations, and the preparation of official statistics.","['introducing', 'reforms', 'treasury', 'budget', 'preparation', 'approval', 'procedures', 'tax', 'administration', 'accounting', 'audit', 'mechanisms', 'central', 'bank', 'operations', 'official', 'statistics']",Financial_Records_Management.pdf
What is the recent trend in financial management?,"The recent trend is to move the focus away from measuring inputs toward measuring outputs, that is, to focus less on how much money has been spent on what product and more on whether the work performed has been useful.","['measuring', 'inputs', 'outputs', 'useful']",Financial_Records_Management.pdf
What are the different methods of budgeting?,"The different methods of budgeting include line item budgeting, performance budgeting, programme budgeting, and zero-based budgeting.","['line item budgeting', 'performance budgeting', 'programme budgeting', 'zero-based budgeting']",Financial_Records_Management.pdf
What is cash accounting?,"Cash accounting includes only the transactions that actually take place within the period covered by the account, regardless of whether the account has actually been paid during that time.","['Cash', 'accounting', 'transactions', 'period', 'paid', 'time']",Financial_Records_Management.pdf
What is accruals accounting?,"Accruals accounting reflects all the financial transactions proper to the period of the account, regardless of whether the account has actually been paid during that time.","['Accruals', 'accounting', 'reflects', 'financial', 'transactions', 'period', 'account', 'regardless', 'paid', 'time']",Financial_Records_Management.pdf
What are the benefits of accruals accounting?,"Accruals accounting provides a more accurate picture of a government's financial position and performance, as it recognises transactions when they occur, irrespective of when cash is paid or received.","['accruals accounting', 'financial position', 'performance', 'transactions']",Financial_Records_Management.pdf
What is the difference between cash accounting and accruals accounting?,"Cash accounting is traditional in central government, and it recognises receipts and payments only when cash is received or paid. Accruals accounting, on the other hand, recognises transactions when they occur, irrespective of when cash is paid or received.","['cash accounting', 'accruals accounting']",Financial_Records_Management.pdf
