question,answer,tokens_present,document
Why is accruals accounting preferred over cash accounting?,"Accruals accounting is preferred over cash accounting because it provides a more accurate picture of a government's financial position and performance, as it recognises transactions when they occur, irrespective of when cash is paid or received.","['It recognises', 'irrespective', 'provides']",Financial_Records_Management.pdf
How does zero-based budgeting differ from other methods of budgeting?,"Zero-based budgeting arrives at a budget by literally starting from scratch, whereas other methods of budgeting, such as line item budgeting, performance budgeting, and programme budgeting, focus on budgetary choices among competing policies and treat the different budget objectives as variable.","['Zero-based', 'budgeting', 'line', 'item', 'performance', 'programme']",Financial_Records_Management.pdf
What is accruals accounting?,"Accruals accounting recognizes transactions when they occur, regardless of when cash is paid or received.","['accruals accounting', 'transactions', 'occur', 'cash', 'paid', 'received']",Financial_Records_Management.pdf
What is the purpose of financial management systems?,"Financial management systems provide decision makers and public sector managers with the means to control spending, prioritize expenditures, and make better use of budgeted resources to achieve outcomes and produce outputs at the lowest possible cost.","['control', 'prioritize', 'budgeted', 'resources', 'outcomes', 'outputs', 'cost']",Financial_Records_Management.pdf
What role do records play in financial management?,"Records management reinforces financial management controls and supports accountability. Well-managed records provide an unbiased account of responsibility and liability, and can identify abuse, misuse, and non-compliance with financial instructions.","['Records', 'management', 'financial', 'accountability', 'responsibility', 'liability', 'abuse', 'misuse', 'non-compliance', 'financial instructions']",Financial_Records_Management.pdf
What is the importance of internal controls in financial management?,"Financial management depends upon a system of internal controls that make it possible to carry out business in an orderly and efficient manner, ensure adherence to management policies, and safeguard assets.","['internal controls', 'financial management', 'business', 'management policies', 'assets']",Financial_Records_Management.pdf
Who is responsible for issuing regulations for the control of financial management systems?,"In countries operating the Exchequer system of financial management, the Permanent Secretary to the Treasury is usually responsible for issuing general regulations where needed.","['Permanent Secretary', 'Treasury']",Financial_Records_Management.pdf
What is the aim of a records management programme in financial management?,The aim of a records management programme should be to ensure that those records that provide evidence of financial management activity are systematically controlled throughout the organisation.,"['systematically', 'controlled', 'organisation']",Financial_Records_Management.pdf
How do records support the accounting function?,Financial record keeping provides the basis or foundation for accounting and introduces controls that protect essential audit trails.,"['financial', 'record', 'keeping', 'accounting', 'control', 'audit', 'trails']",Financial_Records_Management.pdf
How do records help in auditing?,"Well-managed records provide an unambiguous link between the authorisation to carry out a transaction, the particular individual concerned, and the date, making it easier for auditors to locate needed documents and identify fraud.","['Well-managed', 'records', 'provide', 'unambiguous', 'link', 'authorisation', 'carry', 'out', 'transaction', 'particular', 'individual', 'concerned', 'date', 'making', 'easier', 'auditors', 'locate', 'needed', 'documents', 'identify', 'fraud']",Financial_Records_Management.pdf
What can be done to ensure that financial records are properly controlled?,"Financial records must be controlled to ensure their completeness and accuracy, and to guarantee that they are available for reference, decision making, and risk assessment.","['financial records', 'completeness', 'accuracy', 'reference', 'decision making', 'risk assessment']",Financial_Records_Management.pdf
What is the significance of accountability in financial management?,"Accountability is a critical component of financial management, as it ensures that individuals are responsible for their actions and decisions, and that fraud and corruption are deterred.","['accountability', 'financial', 'management', 'responsible', 'actions', 'decisions', 'fraud', 'corruption', 'deterred']",Financial_Records_Management.pdf
What is the significance of well-organized and well-managed financial records?,"Well-organized and well-managed financial records are essential to combat economic crime and protect the innocent. They provide a layer of security and reassurance that operations are functioning at the required level, and contribute to ensuring transparency, probity, and integrity in financial management systems.","['well-organized', 'well-managed', 'financial records', 'economic crime', 'transparency', 'probity', 'integrity']",Financial_Records_Management.pdf
Why do individuals guilty of embezzlement deliberately allow financial records to become disorganized or be stored in unsuitable conditions?,Individuals guilty of embezzlement may deliberately allow financial records to become disorganized or be stored in unsuitable conditions because this makes it harder for auditors to identify fraud.,"['because', 'fraud']",Financial_Records_Management.pdf
"What is the relationship between records management, accounting, and auditing in financial management systems?","Records management, accounting, and auditing provide the layers of control that are essential to ensuring transparency, probity, and integrity in financial management systems. They are integrally connected, with records management providing the foundation for accounting and auditing.","['records', 'accounting', 'auditing', 'transparency', 'probity', 'integrity', 'financial', 'management', 'systems']",Financial_Records_Management.pdf
What is the role of internal control and internal audit procedures in financial management systems?,"Internal control and internal audit procedures are essential components of financial management systems. They provide a framework for ensuring that financial records are accurate, complete, and reliable, and that financial transactions are properly authorized and recorded.","['internal control', 'internal audit', 'financial management systems', 'accurate', 'complete', 'reliable', 'financial records', 'financial transactions', 'properly authorized', 'recorded']",Financial_Records_Management.pdf
How do financial records management systems contribute to the prevention of fraud and corruption?,"Financial records management systems contribute to the prevention of fraud and corruption by providing a layer of security and reassurance that operations are functioning at the required level. They also enable the physical and logical control of records, preventing unauthorized access, tampering, loss, or destruction, whether intentional or accidental.","['physical', 'logical', 'control', 'records', 'preventing', 'unauthorized', 'access', 'tampering', 'loss', 'destruction', 'intentional', 'accidental']",Financial_Records_Management.pdf
What are some of the special features of financial records that affect their management?,"Financial records have several special features that affect their management, including their volume, scope, and complexity, as well as the need for strict control and security to prevent fraud and corruption.","['volume', 'scope', 'complexity', 'strict', 'control', 'security', 'fraud', 'corruption']",Financial_Records_Management.pdf
How can records managers gain the support of senior managers and other stakeholders for improved financial records management?,Records managers can gain the support of senior managers and other stakeholders for improved financial records management by understanding the unique qualities of financial records and the effect of good or poor financial records management on the government or organization. They must articulate the case for efficient records management in terms that senior management can understand.,"['understanding', 'articulate', 'efficient']",Financial_Records_Management.pdf
What is the benefit of managing financial records in terms of office space?,"Managing financial records can translate into large savings in office space, as the records of financial transactions are one of the largest categories of records found in government.","['savings', 'office space']",Financial_Records_Management.pdf
"How long do financial records need to be kept, and what is the significance of identifying records with archival value?","Financial records need to be kept for relatively short periods of time, often only 6 or 7 years, depending on the relevant legislation. However, records related to financial policy are smaller in volume and can be of considerable historical significance, and need to be identified by as having archival value.","['financial records', 'archival value']",Financial_Records_Management.pdf
Why is it important to manage financial records across the entire spectrum of government?,"Financial records are found everywhere in government, and every aspect of government involves expenditure and thus requires financial management, which in turn generates records. Therefore, it is important to manage financial records across the entire spectrum of government to ensure transparency, probity, and integrity in financial management systems.","['transparency', 'probity', 'integrity', 'financial management systems']",Financial_Records_Management.pdf
What is the significance of financial records in government?,"Financial records are essential for financial accountability and provide a reliable, legally verifiable source of evidence of decisions and actions about the management of government finance. They are the basis for determining responsibility and are a powerful tool in constraining individuals from engaging in corruption.","['financial records', 'financial accountability', 'government finance', 'responsibility', 'corruption']",Financial_Records_Management.pdf
Why are financial records important for accountability?,Financial records provide a clear audit trail that can be used to hold public servants accountable for their decisions and actions. They are also useful in protecting the innocent from false accusations.,"['financial records', 'accountability', 'public servants', 'decisions', 'actions', 'innocent', 'false accusations']",Financial_Records_Management.pdf
What are some of the challenges in managing financial records in government?,"Financial records are often outside the jurisdiction of the organisation’s records manager, and the management of records is not adequately controlled or managed. This can lead to the build-up of unwanted records, overcrowding, and disorganisation, making it difficult to retrieve and use financial records efficiently and to carry out the audit process.","['financial', 'records', 'management', 'jurisdiction', 'organisation', 'records manager', 'unwanted', 'overcrowding', 'disorganisation', 'retrieve', 'use', 'audit']",Financial_Records_Management.pdf
What is the role of auditors in ensuring compliance with financial record-keeping requirements?,"Auditors can comment on cases where record-keeping is inadequate and insist that management implements sanctions against persistent offenders. They can also ensure that financial records are subject to tight regulation and control, as required by legislation.","['inadequate', 'legislation']",Financial_Records_Management.pdf
What is the legal framework for financial records management in government?,"The legal framework affecting financial records comprises the constitution, which may provide for the supervision and audit of public accounts, and laws relating to finance, audit, and government records. These laws generally require ministries, departments, and agencies to ensure that financial and accounting records are adequately kept and managed.","['constitution', 'laws', 'finance', 'audit', 'government records', 'ministries', 'departments', 'agencies']",Financial_Records_Management.pdf
What is the minimum period for the retention of revenue files?,"The minimum period for the retention of revenue files is established by revenue laws, which may indicate a time limit on the recovery of tax or duties.","['minimum', 'period', 'revenue', 'files']",Financial_Records_Management.pdf
What is the importance of financial management in government?,"Financial management is critical in government as it involves the management of public funds, which are used to provide services and infrastructure to citizens. Effective financial management ensures that resources are used efficiently and effectively, and that financial accountability is maintained.","['financial management', 'public funds', 'services', 'infrastructure', 'citizens', 'efficiently', 'effectively', 'financial accountability']",Financial_Records_Management.pdf
How do financial records provide a check on corruption?,"Financial records provide a check on corruption by providing a clear audit trail that can be used to hold public servants accountable for their decisions and actions. They also act as a deterrent to corrupt activities, as public servants are less likely to engage in corrupt practices if they know that their actions are being recorded and monitored.","['financial records', 'corruption', 'audit trail', 'public servants', 'accountable', 'decisions', 'actions', 'deterrent', 'corrupt activities', 'recorded', 'monitored']",Financial_Records_Management.pdf
What is the role of internal audit in financial records management?,"Internal audit plays a crucial role in financial records management by ensuring that financial records are accurate, complete, and reliable. Internal auditors can also identify weaknesses in financial management systems and recommend improvements to ensure compliance with regulatory requirements.","['internal audit', 'financial records', 'accurate', 'complete', 'reliable', 'weaknesses', 'financial management', 'improvements', 'compliance', 'regulatory requirements']",Financial_Records_Management.pdf
How can financial records be used to protect the innocent from false accusations?,Financial records can be used to protect the innocent from false accusations by providing a clear audit trail that can be used to verify the accuracy of financial transactions and activities. This can help to clear the names of individuals who have been wrongly accused of financial misconduct.,"['financial records', 'false accusations', 'audit trail', 'financial transactions', 'activities', 'individuals', 'wrongly accused', 'financial misconduct']",Financial_Records_Management.pdf
What legislation empowers the audit body to obtain access to all financial records?,"Other legislation enacted in support of government functions may also give rise to financial records or specify conditions for their maintenance, use or disposal, such as pensions legislation and revenue laws.",['revenue laws'],Financial_Records_Management.pdf
What is the purpose of accounting instructions and financial regulations?,"Accounting instructions and financial regulations lay down more detailed conditions and requirements for accounting and financial records, including their creation, filing, storage, production and disposal.","['accounting', 'instructions', 'financial', 'regulations', 'conditions', 'requirements', 'records', 'creation', 'filing', 'storage', 'production', 'disposal']",Financial_Records_Management.pdf
How are financial records increasingly being created?,"Financial records are increasingly created using computers, with many countries automating payroll systems, budget and accounting systems, and some countries incorporating the entire financial management function into a single automated integrated financial management system.","['financial', 'records', 'computers', 'automating', 'payroll', 'budget', 'accounting', 'management', 'systems']",Financial_Records_Management.pdf
What are the implications of computerisation for audit evidence?,"Computerisation has implications for audit evidence, as computer records in the form of data on magnetic disks or optical disks still provide the auditor with audit assurance, but the admissibility of computer records in a court of law is still a topic of debate.","['computerisation', 'audit', 'evidence', 'computer', 'records', 'admissibility', 'court', 'law', 'debate']",Financial_Records_Management.pdf
What is important for ensuring the authenticity and integrity of computer data held by a system?,"It is important that both the electronic records and the paper records that document the control environment are managed properly, and that institutions promote an environment which will encourage the better maintenance and use of records systems.","['properly', 'records', 'systems']",Financial_Records_Management.pdf
What is the role of senior management in promoting records management?,"Senior management should support an agenda for the future that includes developing a culture for creating, maintaining and using records, strengthening the role of records management and records managers within an institution, identifying and strengthening records legislation, defining and implementing records-related standards, developing tools to assess the vulnerability of records systems to corruption and fraud, and imposing disciplinary action for poor record keeping and providing incentives for better records management.","['developing', 'strengthening', 'records', 'management', 'legislation', 'standards', 'tools', 'assess', 'corruption', 'fraud', 'disciplinary', 'incentives', 'better']",Financial_Records_Management.pdf
Why are financial records often excluded from the records management process?,"Financial records tend to be excluded from the records management process because they are covered under broad legislation governing the management of government records and archives, and are often stored separately from other records and even excluded from the jurisdiction of the records manager.","['financial records', 'records management process', 'legislation', 'government records', 'archives', 'records manager']",Financial_Records_Management.pdf
What are the consequences of poor records management in financial systems?,"The breakdown of financial systems are often related to the breakdown in records management, resulting in uncontrolled growth of records, breakdown of systems to control and retrieve records, and increased vulnerability to corruption and fraud.","['breakdown', 'records', 'systems', 'corruption', 'fraud']",Financial_Records_Management.pdf
What is the importance of creating an enabling environment for records management?,"Creating an enabling environment will enhance the success of records management programmes, and institutions need to promote an environment which will encourage the better maintenance and use of records systems.","['enabling environment', 'records management', 'programmes', 'institutions', 'promote', 'environment', 'better maintenance', 'use', 'records systems']",Financial_Records_Management.pdf
What is the role of records managers in promoting records management?,"Records managers should be strengthened within an institution, and their role should be recognized as essential to the effective management of records, including financial records.","['Records', 'managers', 'strengthened', 'institution', 'role', 'essential', 'management', 'records', 'financial', 'records']",Financial_Records_Management.pdf
What happens when the volume of records grows uncontrolled?,"When the volume of records grows uncontrolled, it can exceed the space available to store them, causing the systems to control and retrieve the records to break down.","['uncontrolled', 'break down']",Financial_Records_Management.pdf
What is the relationship between financial systems and records management?,Records management is essential to financial management as records are the source of all the information used in financial management systems.,"['Records', 'management', 'financial', 'systems']",Financial_Records_Management.pdf
What are some typical symptoms of a breakdown in financial management?,"Typical symptoms of a breakdown in financial management include inadequate monitoring systems, improperly kept vote ledgers, delayed accounts, and an ineffective audit process.","['inadequate', 'improperly', 'delayed', 'ineffective']",Financial_Records_Management.pdf
Why is it important to ensure that records systems remain appropriate and effective?,"It is important to ensure that records systems remain appropriate and effective because reliable information is ultimately derived from accurate and complete records, which are essential for financial management.","['accurate', 'complete', 'financial management']",Financial_Records_Management.pdf
What are some factors that can improve the chances of success of a records management program?,"Factors that can improve the chances of success of a records management program include senior management support, an understanding of the functions and processes that the records document, and the use of appropriate technology.","['senior', 'management', 'support', 'understanding', 'functions', 'processes', 'records', 'document', 'technology']",Financial_Records_Management.pdf
Who are some of the stakeholders in public sector financial management?,"Stakeholders in public sector financial management include the public, the head of state, the legislature, the government, ministers outside the cabinet, the civil service, and separate departments.","['public', 'head of state', 'legislature', 'government', 'ministers', 'civil service', 'separate departments']",Financial_Records_Management.pdf
What is the difference between cash accounting and accrual accounting?,"Cash accounting recognizes revenue and expenses when payment is received or made, while accrual accounting recognizes revenue and expenses when they are earned or incurred, regardless of payment.","['cash accounting', 'accrual accounting', 'revenue', 'expenses', 'payment', 'earned', 'incurred']",Financial_Records_Management.pdf
Why do accounting and auditing rely on accurate records?,Accounting and auditing rely on accurate records because they provide the information needed to prepare financial statements and ensure that financial transactions are properly recorded and accounted for.,"['accurate', 'records', 'financial', 'statements', 'transactions', 'accounted', 'properly']",Financial_Records_Management.pdf
What does a records manager need to know about the impact of computers on financial records?,"A records manager needs to understand how computers can impact financial records, including the benefits and risks of electronic record-keeping, and how to ensure that electronic records are reliable and accessible.","['impact', 'computers', 'financial', 'records', 'electronic', 'reliable', 'accessible']",Financial_Records_Management.pdf
What are some of the challenges associated with managing financial records?,"Challenges associated with managing financial records include the volume, scope, and complexity of financial records, regulatory requirements, and the need for accurate and complete records.","['volume', 'scope', 'complexity', 'regulatory', 'requirements', 'accurate', 'complete']",Financial_Records_Management.pdf
Who are the stakeholders involved in financial management and record-keeping in a parliamentary system of government?,"The stakeholders involved in financial management and record-keeping in a parliamentary system of government include the legislature, the executive, the public, and international and bilateral aid agencies.","['legislature', 'executive', 'public', 'international', 'bilateral']",Financial_Records_Management.pdf
What is the role of the legislature in financial management and record-keeping?,"The legislature is responsible for acquiring and using financial resources, overseeing their administration, sanctioning the financial plan or budget, and authorizing the executive to make expenditures, invest, raise revenue, and administer programs. The legislature is also responsible for the management of the whole of government financial reporting and has the right and responsibility to hold the government and its units accountable for the management of financial affairs and the use of financial resources.","['legislature', 'financial', 'resources', 'budget', 'expenditures', 'invest', 'revenue', 'programs', 'financial reporting', 'government', 'units', 'accountable']",Financial_Records_Management.pdf
What is the role of the executive in financial management and record-keeping?,"The executive has responsibility for the management of financial resources, including planning, directing, and controlling operations, and reporting on financial administration.","['executive', 'financial', 'resources', 'planning', 'directing', 'controlling', 'operations', 'reporting', 'administration']",Financial_Records_Management.pdf
